{"set": "A252", "decision": "REVERT", "edit": "HTF slope held 30m", "reason": "REVERT med 1.584->1.228 max 37.87->16.89; missed 2023-01 runner", "before": {"hits": 0, "med": 1.5841660451404709, "ge2": 22}, "after": {"hits": 0, "med": 1.228, "ge2": null, "max": 16.88588875485958}}
{"set": "A253", "decision": "REVERT", "edit": "leftover trail *1.25 after first partial", "reason": "REVERT med 1.584->1.569 max 37.87->37.48", "before": {"hits": 0, "med": 1.5841660451404709, "ge2": 22}, "after": {"hits": 0, "med": 1.569, "ge2": null, "max": 37.48284746751405}}
{"set": "A254", "decision": "REVERT", "edit": "slow Donchian 420", "reason": "REVERT med 1.584->1.550 max 37.87->34.50", "before": {"hits": 0, "med": 1.5841660451404709, "ge2": 22}, "after": {"hits": 0, "med": 1.55, "ge2": null, "max": 34.50459794638524}}
{"set": "A255", "decision": "REVERT", "edit": "ATR SMA cap 150", "reason": "REVERT 0 up 2 dn; expand_med already covers most", "before": {"hits": 0, "med": 1.5841660451404709, "ge2": 22}, "after": {"hits": 0, "med": 1.5841660451404709, "ge2": 22, "max": 37.86914178909338}}
{"set": "A256", "decision": "REVERT", "edit": "45-bar pause after full loss", "reason": "REVERT max-only 37.87->61.40 med 1.584->1.466", "before": {"hits": 0, "med": 1.5841660451404709, "ge2": 22}, "after": {"hits": 0, "med": 1.466, "ge2": null, "max": 61.39510386761903}}
{"set": "A257", "decision": "KEEP", "edit": "range_ok bar range>=0.8 ATR", "reason": "KEEP ge2 22->23; 3 up 0 dn; med/hits/min held; new ge2 2024-07 1.945->2.019", "before": {"hits": 0, "med": 1.5841660451404709, "ge2": 22}, "after": {"hits": 0, "med": 1.5841660451404709, "ge2": 23, "max": 37.86914178909338}}
{"set": "A258", "decision": "REVERT", "edit": "grace take SL instead of liq", "reason": "REVERT keep-metrics flat; 1 up 0 dn (2023-12 2.15->2.63)", "before": {"hits": 0, "med": 1.5841660451404709, "ge2": 23}, "after": {"hits": 0, "med": 1.5841660451404709, "ge2": 23, "max": 37.86914178909338}}
{"set": "A259", "decision": "REVERT", "edit": "day-path skip first 60m UTC on A257", "reason": "REVERT max-only 2024-01 26.3->37.4; med/ge2 flat", "before": {"hits": 0, "med": 1.5841660451404709, "ge2": 23}, "after": {"hits": 0, "med": 1.5841660451404709, "ge2": 23, "max": 37.86914178909338}}
{"set": "A260", "decision": "REVERT", "edit": "range_ok 0.9 ATR", "reason": "REVERT med 1.584->1.545; 0.8 is the KEEP sweet spot", "before": {"hits": 0, "med": 1.5841660451404709, "ge2": 23}, "after": {"hits": 0, "med": 1.545, "ge2": null, "max": 37.86914178909338}}
{"set": "A261", "decision": "REVERT", "edit": "close in top/bottom 40% of bar", "reason": "REVERT max-only 37.87->65.96 med 1.584->1.466", "before": {"hits": 0, "med": 1.5841660451404709, "ge2": 23}, "after": {"hits": 0, "med": 1.466, "ge2": null, "max": 65.95615710589813}}
{"set": "A262", "decision": "REVERT", "edit": "range >= 20-bar median", "reason": "REVERT med 1.584->1.466 max 37.87->38.55", "before": {"hits": 0, "med": 1.5841660451404709, "ge2": 23}, "after": {"hits": 0, "med": 1.466, "ge2": null, "max": 38.54541863423455}}
{"set": "A263", "decision": "REVERT", "edit": "fast Donchian buf*1.2", "reason": "REVERT keep-metrics flat; 1 up 0 dn", "before": {"hits": 0, "med": 1.5841660451404709, "ge2": 23}, "after": {"hits": 0, "med": 1.5841660451404709, "ge2": 23, "max": 37.86914178909338}}
{"set": "A264", "decision": "REVERT", "edit": "body >= 50% of bar range", "reason": "REVERT med 1.584->1.466 max 37.87->21.48; wick breaks load-bearing", "before": {"hits": 0, "med": 1.5841660451404709, "ge2": 23}, "after": {"hits": 0, "med": 1.466, "ge2": null, "max": 21.476498276201824}}
{"set": "A265", "decision": "REVERT", "edit": "trail_arm_r 0.5", "reason": "REVERT med 1.584->1.531", "before": {"hits": 0, "med": 1.5841660451404709, "ge2": 23}, "after": {"hits": 0, "med": 1.531, "ge2": null, "max": 37.86914178909338}}
{"set": "A266", "decision": "REVERT", "edit": "ROC20 strongly-against veto", "reason": "REVERT med 1.584->1.545 max 37.87->33.56", "before": {"hits": 0, "med": 1.5841660451404709, "ge2": 23}, "after": {"hits": 0, "med": 1.545, "ge2": null, "max": 33.559904916154885}}
{"set": "A267", "decision": "REVERT", "edit": "HTF slope floor 0.008% ema", "reason": "REVERT med 1.584->1.545", "before": {"hits": 0, "med": 1.5841660451404709, "ge2": 23}, "after": {"hits": 0, "med": 1.545, "ge2": null, "max": 37.86914178909338}}
{"set": "A268", "decision": "REVERT", "edit": "same-side-only cooldown", "reason": "REVERT identical peaks/trades; HTF+daily already block opposite within 180m", "before": {"hits": 0, "med": 1.5841660451404709, "ge2": 23}, "after": {"hits": 0, "med": 1.5841660451404709, "ge2": 23}}
{"set": "A269", "decision": "KEEP", "edit": "size_boost 1.15 on range>=1.2ATR + risk-parity", "reason": "KEEP med 1.584->1.637; 31 up 6 dn; 1.58 cluster lifted; ge2 23->22 (2024-07 2.02->1.85) but median-first", "before": {"hits": 0, "med": 1.5841660451404709, "ge2": 23}, "after": {"hits": 0, "med": 1.637192903031723, "ge2": 22, "max": 40.06111777849278}}
{"set": "A270", "decision": "REVERT", "edit": "size_boost 1.10", "reason": "REVERT med 1.637->1.620 ge2 still 22; 30 dn", "before": {"hits": 0, "med": 1.637192903031723, "ge2": 22}, "after": {"hits": 0, "med": 1.6203826897337914, "ge2": 22, "max": 39.407979756035836}}
{"set": "A271", "decision": "REVERT", "edit": "boost gate range>=1.35 ATR", "reason": "REVERT med/ge2 flat; 7 up 3 dn max-only", "before": {"hits": 0, "med": 1.637192903031723, "ge2": 22}, "after": {"hits": 0, "med": 1.637192903031723, "ge2": 22, "max": 41.55967259048131}}
{"set": "A272", "decision": "REVERT", "edit": "boost only if expand_sma AND wide", "reason": "REVERT 3 dn 1 up; 2024-07 unchanged; med/ge2 flat", "before": {"hits": 0, "med": 1.637192903031723, "ge2": 22}, "after": {"hits": 0, "med": 1.637192903031723, "ge2": 22, "max": 40.06111777849278}}
{"set": "A273", "decision": "REVERT", "edit": "wide-bar boost only if equity>start", "reason": "REVERT med 1.637->1.584; median cluster needed boost from the first runner", "before": {"hits": 0, "med": 1.637192903031723, "ge2": 22}, "after": {"hits": 0, "med": 1.584, "ge2": null, "max": 42.85411317942911}}
{"set": "A274", "decision": "REVERT", "edit": "trail_unlock_mult 1.65", "reason": "REVERT med 1.637->1.486; wider unlock gave back median runners", "before": {"hits": 0, "med": 1.637192903031723, "ge2": 22}, "after": {"hits": 0, "med": 1.486, "ge2": null, "max": 38.439097010092745}}
{"set": "A275", "decision": "REVERT", "edit": "win_size_mult 1.85", "reason": "REVERT med 1.637->1.626 surv 23.7->18.6", "before": {"hits": 0, "med": 1.637192903031723, "ge2": 22}, "after": {"hits": 0, "med": 1.626, "ge2": null, "max": 41.625276304477666}}
{"set": "A276", "decision": "REVERT", "edit": "second close_frac 0.25", "reason": "REVERT med 1.63719->1.63684; 2025-07 slightly down, ge2 flat", "before": {"hits": 0, "med": 1.637192903031723, "ge2": 22}, "after": {"hits": 0, "med": 1.6368358685478546, "ge2": 22, "max": 40.06890418192494}}
{"set": "A277", "decision": "KEEP", "edit": "tiered boost 1.25 at range>=1.5ATR, 1.15 at >=1.2", "reason": "KEEP med 1.637->1.679 ge2 22->23; 27 up 9 dn; 2025-07 1.64->1.71; new ge2 2026-01", "before": {"hits": 0, "med": 1.637192903031723, "ge2": 22}, "after": {"hits": 0, "med": 1.679043821810285, "ge2": 23, "max": 41.53640094391709}}
{"set": "A278", "decision": "KEEP", "edit": "boost 1.35 at range>=1.8ATR", "reason": "KEEP med 1.679->1.725 ge2 23 held; 2025-07 1.71->1.78; n1 19->20", "before": {"hits": 0, "med": 1.679043821810285, "ge2": 23}, "after": {"hits": 0, "med": 1.725313227054653, "ge2": 23, "max": 42.77857892979925}}
{"set": "A279", "decision": "REVERT", "edit": "top-tier boost 1.45 at 1.8ATR", "reason": "REVERT max-only 42.78->43.80 med 1.725->1.679", "before": {"hits": 0, "med": 1.725313227054653, "ge2": 23}, "after": {"hits": 0, "med": 1.679, "ge2": null, "max": 43.79644266802517}}
{"set": "A280", "decision": "REVERT", "edit": "1.20 boost at 1.35ATR gap", "reason": "REVERT med 1.725->1.693 max 42.78->43.12; extra mid bars hurt median", "before": {"hits": 0, "med": 1.725313227054653, "ge2": 23}, "after": {"hits": 0, "med": 1.693, "ge2": null, "max": 43.11730882861284}}
{"set": "A281", "decision": "REVERT", "edit": "1.5ATR tier 1.25\u21921.30", "reason": "REVERT med 1.725->1.692; 1.25 is KEEP", "before": {"hits": 0, "med": 1.725313227054653, "ge2": 23}, "after": {"hits": 0, "med": 1.692, "ge2": null, "max": 42.77857892979925}}
{"set": "A282", "decision": "REVERT", "edit": "grace take SL instead of liq on A278", "reason": "REVERT keep-metrics flat; 1 up 0 dn (2023-12 2.15->2.28)", "before": {"hits": 0, "med": 1.725313227054653, "ge2": 23}, "after": {"hits": 0, "med": 1.725313227054653, "ge2": 23, "max": 42.77857892979925}}
{"set": "A283", "decision": "REVERT", "edit": "trail *= entry size_boost", "reason": "REVERT med 1.725->1.638 max 42.78->21.94; fat-bar wider trail clipped 2023-01", "before": {"hits": 0, "med": 1.725313227054653, "ge2": 23}, "after": {"hits": 0, "med": 1.638, "ge2": null, "max": 21.944983557002306}}
{"set": "A284", "decision": "REVERT", "edit": "daily EMA gap>=0.4%", "reason": "REVERT med 1.725->1.679", "before": {"hits": 0, "med": 1.725313227054653, "ge2": 23}, "after": {"hits": 0, "med": 1.679, "ge2": null, "max": 42.77857892979925}}
{"set": "A285", "decision": "REVERT", "edit": "sl_grace 7", "reason": "REVERT med 1.725->1.679", "before": {"hits": 0, "med": 1.725313227054653, "ge2": 23}, "after": {"hits": 0, "med": 1.679, "ge2": null, "max": 42.77857892979925}}
{"set": "A286", "decision": "REVERT", "edit": "slow Donchian 330", "reason": "REVERT max-only 42.78->45.49 med 1.725->1.684", "before": {"hits": 0, "med": 1.725313227054653, "ge2": 23}, "after": {"hits": 0, "med": 1.684, "ge2": null, "max": 45.49249899272322}}
{"set": "A287", "decision": "REVERT", "edit": "1.15 boost if |ROC120|>=0.5%", "reason": "REVERT max-only 42.78->47.45 med 1.725->1.662 surv 22->16.9", "before": {"hits": 0, "med": 1.725313227054653, "ge2": 23}, "after": {"hits": 0, "med": 1.662, "ge2": null, "max": 47.4521538593288}}
{"set": "A288", "decision": "KEEP", "edit": "1.2ATR tier 1.15\u21921.10", "reason": "KEEP med 1.725->1.735 ge2 23; 10 up 5 dn; 2025-07 1.78->1.80; 2024-07 1.73->1.78", "before": {"hits": 0, "med": 1.725313227054653, "ge2": 23}, "after": {"hits": 0, "med": 1.7353513285713849, "ge2": 23, "max": 42.969027475590394}}
{"set": "A289", "decision": "REVERT", "edit": "1.5ATR tier 1.25\u21921.28", "reason": "REVERT med 1.735->1.719; 1.25 is KEEP on calmer bottom too", "before": {"hits": 0, "med": 1.7353513285713849, "ge2": 23}, "after": {"hits": 0, "med": 1.719, "ge2": null, "max": 42.969027475590394}}
{"set": "A290", "decision": "REVERT", "edit": "1.2ATR tier 1.10\u21921.08", "reason": "REVERT med identical 1.735351; ge2 23; 2025-01 (the median) unchanged", "before": {"hits": 0, "med": 1.7353513285713849, "ge2": 23}, "after": {"hits": 0, "med": 1.7353513285713849, "ge2": 23, "max": 43.04284168299191}}
{"set": "A291", "decision": "REVERT", "edit": "cooldown cap 200", "reason": "REVERT ge2 23->22 (2023-10 3.56->1.80); med flat", "before": {"hits": 0, "med": 1.7353513285713849, "ge2": 23}, "after": {"hits": 0, "med": 1.7353513285713849, "ge2": 22, "max": 42.969027475590394}}
{"set": "A292", "decision": "REVERT", "edit": "90m pause after loss if equity<0.85*eq_peak", "reason": "REVERT med 1.735->1.453 max 43->52; pause-after-loss skips recovery trades that make the peak", "before": {"hits": 0, "med": 1.7353513285713849, "ge2": 23}, "after": {"hits": 0, "med": 1.4526147290359, "ge2": null, "max": 51.81553544034146}}
{"set": "A293", "decision": "REVERT", "edit": "size_mult from cumulative position PnL", "reason": "REVERT med/ge2 identical; only 2023-10 3.55->3.21", "before": {"hits": 0, "med": 1.7353513285713849, "ge2": 23}, "after": {"hits": 0, "med": 1.7353513285713849, "ge2": 23, "max": 42.969027475590394}}
{"set": "A294", "decision": "KEEP", "edit": "fat-bar (boost>=1.25) first partial 0.68->0.50", "reason": "KEEP med 1.735->1.736 ge2 23; 25 up 8 dn; 2025-01 1.735->1.736; 2023-08 1.83->1.93", "before": {"hits": 0, "med": 1.7353513285713849, "ge2": 23}, "after": {"hits": 0, "med": 1.736443675323941, "ge2": 23, "max": 43.046290422397284}}
{"set": "A295", "decision": "KEEP", "edit": "fat-bar first partial 0.50->0.40", "reason": "KEEP med 1.736->1.737 ge2 23; 25 up 8 dn; 2023-08 1.934->1.992", "before": {"hits": 0, "med": 1.736443675323941, "ge2": 23}, "after": {"hits": 0, "med": 1.7370505346309162, "ge2": 23, "max": 43.08921428173445}}
{"set": "A296", "decision": "KEEP", "edit": "fat-bar first partial 0.40->0.30", "reason": "KEEP ge2 23->24 (2023-08 1.99->2.05) med 1.737->1.738", "before": {"hits": 0, "med": 1.7370505346309162, "ge2": 23}, "after": {"hits": 0, "med": 1.7376573939378914, "ge2": 24, "max": 43.13213814107161}}
{"set": "A297", "decision": "REVERT", "edit": "first partial 0.30 at boost>=1.10", "reason": "REVERT med/ge2 identical; max 43.13->43.01; 1.10-tier is chop", "before": {"hits": 0, "med": 1.7376573939378914, "ge2": 24}, "after": {"hits": 0, "med": 1.7376573939378914, "ge2": 24, "max": 43.01249126121064}}
{"set": "A298", "decision": "KEEP", "edit": "fat-bar first partial 0.30->0.20", "reason": "KEEP med 1.738->1.738 ge2 24; 25 up 8 dn; 2023-08 2.05->2.11; 2023-03 1.86->1.87", "before": {"hits": 0, "med": 1.7376573939378914, "ge2": 24}, "after": {"hits": 0, "med": 1.7382642532448673, "ge2": 24, "max": 43.17506200040876}}
{"set": "A299", "decision": "KEEP", "edit": "fat-bar first partial 0.20->0.12", "reason": "KEEP med 1.738->1.739 ge2 24; 25 up 8 dn; 2023-08 2.11->2.15; 2023-03 1.87->1.88", "before": {"hits": 0, "med": 1.7382642532448673, "ge2": 24}, "after": {"hits": 0, "med": 1.7387497406904473, "ge2": 24, "max": 43.209401087878504}}
{"set": "A300", "decision": "KEEP", "edit": "fat-bar second scale 0.28->0.16", "reason": "KEEP med 1.739->1.740 ge2 24; 20 up 13 dn; 2023-03 1.88->1.91", "before": {"hits": 0, "med": 1.7387497406904473, "ge2": 24}, "after": {"hits": 0, "med": 1.7395652544231093, "ge2": 24, "max": 43.247130895166755}}
{"set": "A301", "decision": "KEEP", "edit": "fat-bar second scale 0.16->0.10", "reason": "KEEP med 1.740->1.740 ge2 24; 20 up 13 dn; 2023-03 1.91->1.92", "before": {"hits": 0, "med": 1.7395652544231093, "ge2": 24}, "after": {"hits": 0, "med": 1.7399730112894405, "ge2": 24, "max": 43.26599579881087}}
{"set": "A302", "decision": "REVERT", "edit": "fat-bar trail *1.20 after first scale", "reason": "REVERT med 1.740->1.726 max 43.27->42.74; realized peak delayed", "before": {"hits": 0, "med": 1.7399730112894405, "ge2": 24}, "after": {"hits": 0, "med": 1.726, "ge2": null, "max": 42.7369314546516}}
{"set": "A303", "decision": "KEEP", "edit": "fat-bar trail *0.85 after first scale", "reason": "KEEP med 1.740->1.799 ge2 24->25; 29 up 3 dn; gained 2025-07/08 lost 2023-08", "before": {"hits": 0, "med": 1.7399730112894405, "ge2": 24}, "after": {"hits": 0, "med": 1.798597386260696, "ge2": 25, "max": 44.15846914769765}}
{"set": "A304", "decision": "REVERT", "edit": "fat-bar trail *0.90 after first scale", "reason": "REVERT med 1.799->1.742; 2023-08 1.80->1.74 prefers 0.85", "before": {"hits": 0, "med": 1.798597386260696, "ge2": 25}, "after": {"hits": 0, "med": 1.742006579823088, "ge2": 25, "max": 43.821435422212325}}
{"set": "A305", "decision": "REVERT", "edit": "trail *0.85 after first scale on ALL entries", "reason": "REVERT max-only 44.16->46.15; med/ge2 identical", "before": {"hits": 0, "med": 1.798597386260696, "ge2": 25}, "after": {"hits": 0, "med": 1.798597386260696, "ge2": 25, "max": 46.14943883027364}}
{"set": "A306", "decision": "KEEP", "edit": "fat-bar trail *0.80 after first scale", "reason": "KEEP med 1.799->1.829 ge2 25; 33 up 1 dn; n1 20->19; 2023-08 1.80->1.86", "before": {"hits": 0, "med": 1.798597386260696, "ge2": 25}, "after": {"hits": 0, "med": 1.8288013368524465, "ge2": 25, "max": 44.495502873183014}}
{"set": "A307", "decision": "KEEP", "edit": "fat-bar trail *0.75 after first scale", "reason": "KEEP med 1.829->1.851 ge2 25; 33 up 1 dn; 2023-08 1.86->1.91; 2023-03 1.96->1.99", "before": {"hits": 0, "med": 1.8288013368524465, "ge2": 25}, "after": {"hits": 0, "med": 1.8510084182432058, "ge2": 25, "max": 44.83253659866834}}
{"set": "A308", "decision": "KEEP", "edit": "fat-bar trail *0.70 after first scale", "reason": "KEEP med 1.851->1.873 ge2 25->27 (+2023-03,+2024-07); 34 up 0 dn", "before": {"hits": 0, "med": 1.8510084182432058, "ge2": 25}, "after": {"hits": 0, "med": 1.8732154996339576, "ge2": 27, "max": 45.16957032415369}}
{"set": "A309", "decision": "KEEP", "edit": "fat-bar trail *0.65 after first scale", "reason": "KEEP med 1.873->1.895 ge2 27->29 (+2023-08,+2024-10); n1 19->18; 34 up 1 dn", "before": {"hits": 0, "med": 1.8732154996339576, "ge2": 27}, "after": {"hits": 0, "med": 1.8954225810247087, "ge2": 29, "max": 45.506604049639}}
{"set": "A310", "decision": "KEEP", "edit": "fat-bar trail *0.60 after first scale", "reason": "KEEP med 1.895->1.918 ge2 29; 34 up 1 dn", "before": {"hits": 0, "med": 1.8954225810247087, "ge2": 29}, "after": {"hits": 0, "med": 1.9176296624154594, "ge2": 29, "max": 45.843637775124336}}
{"set": "A311", "decision": "KEEP", "edit": "fat-bar trail *0.55 after first scale", "reason": "KEEP med 1.918->1.940 ge2 29; 35 up 0 dn", "before": {"hits": 0, "med": 1.9176296624154594, "ge2": 29}, "after": {"hits": 0, "med": 1.9398367438062103, "ge2": 29, "max": 46.18067150060964}}
{"set": "A312", "decision": "KEEP", "edit": "fat-bar trail *0.50 after first scale", "reason": "KEEP med 1.940->1.962 ge2 29; 35 up 0 dn", "before": {"hits": 0, "med": 1.9398367438062103, "ge2": 29}, "after": {"hits": 0, "med": 1.9620438251969627, "ge2": 29, "max": 46.517705226095}}
{"set": "A313", "decision": "KEEP", "edit": "fat-bar trail *0.45 after first scale", "reason": "KEEP med 1.962->1.984 ge2 29; 35 up 0 dn; 2025-01 near ge2", "before": {"hits": 0, "med": 1.9620438251969627, "ge2": 29}, "after": {"hits": 0, "med": 1.984250906587723, "ge2": 29, "max": 46.85473895158033}}
{"set": "A314", "decision": "KEEP", "edit": "fat-bar trail *0.40 after first scale", "reason": "KEEP med 1.984->2.006 ge2 29->30 (+2025-01); 35 up 0 dn", "before": {"hits": 0, "med": 1.984250906587723, "ge2": 29}, "after": {"hits": 0, "med": 2.006457987978465, "ge2": 30, "max": 47.19177267706566}}
{"set": "A315", "decision": "KEEP", "edit": "fat-bar trail *0.35 after first scale", "reason": "KEEP med 2.006->2.029 ge2 30; 35 up 0 dn", "before": {"hits": 0, "med": 2.006457987978465, "ge2": 30}, "after": {"hits": 0, "med": 2.0286650693692247, "ge2": 30, "max": 47.52880640255093}}
{"set": "A316", "decision": "KEEP", "edit": "fat-bar trail *0.30 after first scale", "reason": "KEEP med 2.029->2.051 ge2 30; 35 up 0 dn", "before": {"hits": 0, "med": 2.0286650693692247, "ge2": 30}, "after": {"hits": 0, "med": 2.050872150759977, "ge2": 30, "max": 47.86584012803629}}
{"set": "A317", "decision": "KEEP", "edit": "fat-bar trail *0.25 after first scale", "reason": "KEEP med 2.051->2.073 ge2 30; 35 up 0 dn", "before": {"hits": 0, "med": 2.050872150759977, "ge2": 30}, "after": {"hits": 0, "med": 2.0730792321507283, "ge2": 30, "max": 48.202873853521616}}
{"set": "A318", "decision": "KEEP", "edit": "fat-bar trail *0.20 after first scale", "reason": "KEEP med 2.073->2.095 ge2 30->31 (+2022-03); 35 up 0 dn", "before": {"hits": 0, "med": 2.0730792321507283, "ge2": 30}, "after": {"hits": 0, "med": 2.0952863135414868, "ge2": 31, "max": 48.53990757900698}}
{"set": "A319", "decision": "KEEP", "edit": "fat-bar trail *0.15 after first scale", "reason": "KEEP med 2.095->2.148 ge2 31; 35 up 0 dn; median window now 2023-12", "before": {"hits": 0, "med": 2.0952863135414868, "ge2": 31}, "after": {"hits": 0, "med": 2.148182857392974, "ge2": 31, "max": 48.87694130449233}}
{"set": "A320", "decision": "REVERT", "edit": "fat-bar trail *0.10 after first scale", "reason": "REVERT med/ge2 identical; max-only 48.88->49.21", "before": {"hits": 0, "med": 2.148182857392974, "ge2": 31}, "after": {"hits": 0, "med": 2.148182857392974, "ge2": 31, "max": 49.21397502997761}}
{"set": "A321", "decision": "REVERT", "edit": "trail *0.15 after first scale at boost>=1.10", "reason": "REVERT med/ge2 identical; max-only 48.9->55.7; stuck windows flat", "before": {"hits": 0, "med": 2.148182857392974, "ge2": 31}, "after": {"hits": 0, "med": 2.148182857392974, "ge2": 31, "max": 55.68256121890814}}
{"set": "A322", "decision": "REVERT", "edit": "extra trail*0.70 after second fat-bar scale", "reason": "REVERT med/ge2 identical; max-only", "before": {"hits": 0, "med": 2.148182857392974, "ge2": 31}, "after": {"hits": 0, "med": 2.148182857392974, "ge2": 31, "max": 49.148772737843686}}
{"set": "A323", "decision": "REVERT", "edit": "trail_unlock_r 4.0->3.0", "reason": "REVERT med 2.148->2.119", "before": {"hits": 0, "med": 2.148182857392974, "ge2": 31}, "after": {"hits": 0, "med": 2.119, "ge2": null, "max": 57.29820326491526}}
{"set": "A324", "decision": "REVERT", "edit": "range_ok 0.8->0.7 ATR", "reason": "REVERT med identical; 2024-12 14->12 peak hurt", "before": {"hits": 0, "med": 2.148182857392974, "ge2": 31}, "after": {"hits": 0, "med": 2.148182857392974, "ge2": 31}}
{"set": "A325", "decision": "KEEP", "edit": "trail *0.15 after first scale on ALL entries", "reason": "KEEP med 2.148->2.180 ge2 31->32 (+2023-06) n1 18->16; 26 up 1 dn", "before": {"hits": 0, "med": 2.148182857392974, "ge2": 31}, "after": {"hits": 0, "med": 2.1800314711928075, "ge2": 32, "max": 62.00056479852725}}
{"set": "A326", "decision": "KEEP", "edit": "all-entry trail *0.15->0.12 after first scale", "reason": "KEEP med 2.180->2.244 ge2 32; 43 up 0 dn", "before": {"hits": 0, "med": 2.1800314711928075, "ge2": 32}, "after": {"hits": 0, "med": 2.244479127569361, "ge2": 32, "max": 62.75051759108408}}
