{"set": "A50", "decision": "REVERT", "edit": "4h first-cross OR", "reason": "REVERT med 1.203->1.096 ge2 15->12", "before": {"hits": 0, "med": 1.2028676426304201, "max": 29.12052142388664, "mean": 2.4367548038213043, "ge2": 15, "surv": 0.3050847457627119}, "after": {"hits": 0, "med": 1.0961009871928333, "max": 26.951621666927913, "mean": 2.1917731701245553, "ge2": 12, "surv": 0.2542372881355932}}
{"set": "A51", "decision": "KEEP", "edit": "trail_unlock 3R x1.25", "reason": "KEEP median", "before": {"hits": 0, "med": 1.2028676426304201, "max": 29.12052142388664, "mean": 2.4367548038213043, "ge2": 15, "ge10": 2, "surv": 0.3050847457627119}, "after": {"hits": 0, "med": 1.23314142123704, "max": 25.507244897425416, "mean": 2.3387369103710736, "ge2": 16, "ge10": 2, "surv": 0.3389830508474576}}
{"set": "A52", "decision": "REVERT", "edit": "win_size_max=8", "reason": "REVERT noop/down", "before": {"hits": 0, "med": 1.23314142123704, "max": 25.507244897425416, "mean": 2.3387369103710736, "ge2": 16}, "after": {"hits": 0, "med": 1.23314142123704, "max": 25.507244897425416, "mean": 2.3387369103710736, "ge2": 16}}
{"set": "A53", "decision": "REVERT", "edit": "win_size_mult=2", "reason": "REVERT med 1.233->1.212 ge2 16->17 mean 2.339->2.883", "before": {"hits": 0, "med": 1.23314142123704, "max": 25.507244897425416, "mean": 2.3387369103710736, "ge2": 16, "surv": 0.3389830508474576}, "after": {"hits": 0, "med": 1.212444931775003, "max": 44.5816768114952, "mean": 2.8834431293601366, "ge2": 17, "surv": 0.2711864406779661}}
{"set": "A54", "decision": "REVERT", "edit": "range>=ATR", "reason": "REVERT med 1.233->1.130 ge2 16->14", "before": {"hits": 0, "med": 1.23314142123704, "max": 25.507244897425416, "mean": 2.3387369103710736, "ge2": 16, "surv": 0.3389830508474576}, "after": {"hits": 0, "med": 1.1300862580940016, "max": 15.245483951871988, "mean": 2.1246124899547585, "ge2": 14, "surv": 0.3559322033898305}}
{"set": "A55", "decision": "KEEP", "edit": "ema_slope diff 180", "reason": "KEEP median", "before": {"hits": 0, "med": 1.23314142123704, "max": 25.507244897425416, "mean": 2.3387369103710736, "ge2": 16, "surv": 0.3389830508474576}, "after": {"hits": 0, "med": 1.2477505713306543, "max": 23.96219893690547, "mean": 2.410668366494819, "ge2": 17, "surv": 0.3220338983050847}}
{"set": "A56", "decision": "KEEP", "edit": "unlock_mult 1.25->1.5", "reason": "KEEP median", "before": {"hits": 0, "med": 1.2477505713306543, "max": 23.96219893690547, "mean": 2.410668366494819, "ge2": 17, "ge10": 3, "surv": 0.3220338983050847}, "after": {"hits": 0, "med": 1.2856925007638942, "max": 26.983423510120428, "mean": 2.7172626996653886, "ge2": 16, "ge10": 2, "surv": 0.3220338983050847}}
{"set": "A57", "decision": "REVERT", "edit": "daily EMA slope", "reason": "REVERT med 1.286->1.151 ge2 16->10", "before": {"hits": 0, "med": 1.2856925007638942, "max": 26.983423510120428, "mean": 2.7172626996653886, "ge2": 16}, "after": {"hits": 0, "med": 1.1505829406954462, "max": 26.983423510120428, "mean": 2.4269799618823433, "ge2": 10}}
{"set": "A58", "decision": "KEEP", "edit": "ROC120 side agree", "reason": "KEEP ge2", "before": {"hits": 0, "med": 1.2856925007638942, "max": 26.983423510120428, "mean": 2.7172626996653886, "ge2": 16, "ge10": 2, "surv": 0.3220338983050847}, "after": {"hits": 0, "med": 1.2856925007638942, "max": 30.762924284592465, "mean": 3.1370046230654354, "ge2": 17, "ge10": 3, "surv": 0.3559322033898305}}
{"set": "A59", "decision": "REVERT", "edit": "partial 0.5->0.33", "reason": "REVERT med 1.285693->1.285242 ge2 17->17 mean 3.137->3.179", "before": {"hits": 0, "med": 1.2856925007638942, "max": 30.762924284592465, "mean": 3.1370046230654354, "ge2": 17, "surv": 0.3559322033898305}, "after": {"hits": 0, "med": 1.2852421670203662, "max": 33.14375724763607, "mean": 3.178858392625146, "ge2": 17, "surv": 0.3559322033898305}}
{"set": "A60", "decision": "KEEP", "edit": "steeper time risk 0.10-0.30", "reason": "KEEP median", "before": {"hits": 0, "med": 1.2856925007638942, "max": 30.762924284592465, "mean": 3.1370046230654354, "ge2": 17, "ge10": 3, "surv": 0.3559322033898305}, "after": {"hits": 0, "med": 1.3534231340097076, "max": 35.65807331465976, "mean": 3.3167316057417953, "ge2": 18, "ge10": 3, "surv": 0.3389830508474576}}
{"set": "A61", "decision": "REVERT", "edit": "width_tr 0.35", "reason": "REVERT med 1.353->1.325 ge2 18->17", "before": {"hits": 0, "med": 1.3534231340097076, "max": 35.65807331465976, "mean": 3.3167316057417953, "ge2": 18}, "after": {"hits": 0, "med": 1.3245647653987636, "max": 27.769443444189072, "mean": 2.6593290423016813, "ge2": 17}}
{"set": "A62", "decision": "REVERT", "edit": "sl_grace 5->8", "reason": "REVERT med 1.353423->1.353423 ge2 18->17 mean 3.317->3.533", "before": {"hits": 0, "med": 1.3534231340097076, "max": 35.65807331465976, "mean": 3.3167316057417953, "ge2": 18, "ge10": 3, "surv": 0.3389830508474576}, "after": {"hits": 0, "med": 1.3534231340097076, "max": 39.28132374052348, "mean": 3.532602292407243, "ge2": 17, "ge10": 3, "surv": 0.3050847457627119}}
{"set": "A63", "decision": "REVERT", "edit": "ROC |mag|>=0.3%", "reason": "REVERT med 1.353->1.246 ge2 18->19", "before": {"hits": 0, "med": 1.3534231340097076, "max": 35.65807331465976, "mean": 3.3167316057417953, "ge2": 18}, "after": {"hits": 0, "med": 1.2456061442382045, "max": 35.65807331465976, "mean": 3.434490268707028, "ge2": 19}}
{"set": "A64", "decision": "REVERT", "edit": "ROC240", "reason": "REVERT med 1.353->1.215 ge2 18->18", "before": {"hits": 0, "med": 1.3534231340097076, "max": 35.65807331465976, "mean": 3.3167316057417953, "ge2": 18}, "after": {"hits": 0, "med": 1.2151397243272994, "max": 35.65807331465976, "mean": 3.2517215163471143, "ge2": 18}}
{"set": "A65", "decision": "REVERT", "edit": "opp quarantine 2x cd", "reason": "REVERT noop/down", "before": {"hits": 0, "med": 1.3534231340097076, "max": 35.65807331465976, "mean": 3.3167316057417953, "ge2": 18}, "after": {"hits": 0, "med": 1.3534231340097076, "max": 35.65807331465976, "mean": 3.3167316057417953, "ge2": 18}}
{"set": "A66", "decision": "KEEP", "edit": "win_size_mult=1.75", "reason": "KEEP mean", "before": {"hits": 0, "med": 1.3534231340097076, "max": 35.65807331465976, "mean": 3.3167316057417953, "ge2": 18, "ge10": 3, "surv": 0.3389830508474576}, "after": {"hits": 0, "med": 1.3534231340097076, "max": 40.10575596763641, "mean": 3.565496243277341, "ge2": 18, "ge10": 4, "surv": 0.3220338983050847}}
{"set": "A67", "decision": "KEEP", "edit": "risk 0.12-0.35", "reason": "KEEP median", "before": {"hits": 0, "med": 1.3534231340097076, "max": 40.10575596763641, "mean": 3.565496243277341, "ge2": 18, "ge10": 4, "surv": 0.3220338983050847}, "after": {"hits": 0, "med": 1.4109526233150005, "max": 50.14485254881414, "mean": 3.7251598330289686, "ge2": 18, "ge10": 5, "surv": 0.2542372881355932}}
{"set": "A68", "decision": "REVERT", "edit": "mid+/-0.5ATR conv", "reason": "REVERT med 1.411->1.294 ge2 18->17", "before": {"hits": 0, "med": 1.4109526233150005, "max": 50.14485254881414, "mean": 3.7251598330289686, "ge2": 18}, "after": {"hits": 0, "med": 1.2939481232059642, "max": 50.14485254881414, "mean": 4.160480504626506, "ge2": 17}}
{"set": "A69", "decision": "REVERT", "edit": "risk 0.14-0.40", "reason": "REVERT med 1.411->1.342 ge2 18->19", "before": {"hits": 0, "med": 1.4109526233150005, "max": 50.14485254881414, "mean": 3.7251598330289686, "ge2": 18, "surv": 0.2542372881355932}, "after": {"hits": 0, "med": 1.3422901021737246, "max": 57.497835097606746, "mean": 3.847416681070497, "ge2": 19, "surv": 0.23728813559322035}}
{"set": "A70", "decision": "KEEP", "edit": "no BE after partial", "reason": "KEEP median", "before": {"hits": 0, "med": 1.4109526233150005, "max": 50.14485254881414, "mean": 3.7251598330289686, "ge2": 18, "ge10": 5, "surv": 0.2542372881355932}, "after": {"hits": 0, "med": 1.4211537672555212, "max": 50.14485254881414, "mean": 3.7260614669565366, "ge2": 19, "ge10": 4, "surv": 0.2542372881355932}}
{"set": "A71", "decision": "KEEP", "edit": "expand OR atr% median", "reason": "KEEP median", "before": {"hits": 0, "med": 1.4211537672555212, "max": 50.14485254881414, "mean": 3.7260614669565366, "ge2": 19, "ge10": 4, "surv": 0.2542372881355932}, "after": {"hits": 0, "med": 1.4603306312197901, "max": 50.14485254881414, "mean": 3.92936069758173, "ge2": 20, "ge10": 5, "surv": 0.23728813559322035}}
{"set": "A72", "decision": "REVERT", "edit": "halve cooldown", "reason": "REVERT ge2 20->20 mean 3.929->3.829", "before": {"hits": 0, "med": 1.4603306312197901, "max": 50.14485254881414, "mean": 3.92936069758173, "ge2": 20, "surv": 0.23728813559322035, "trades": 27.0}, "after": {"hits": 0, "med": 1.4603306312197901, "max": 50.14485254881414, "mean": 3.8290040490033164, "ge2": 20, "surv": 0.23728813559322035, "trades": 28.0}}
{"set": "A73", "decision": "REVERT", "edit": "unlock_r 2.5", "reason": "REVERT med flat ge2 20->20 mean 3.929->3.657 max 50.1->34.2", "before": {"hits": 0, "med": 1.4603306312197901, "max": 50.14485254881414, "mean": 3.92936069758173, "ge2": 20, "surv": 0.23728813559322035}, "after": {"hits": 0, "med": 1.4603306312197901, "max": 34.24027255154113, "mean": 3.6573144822032533, "ge2": 20, "surv": 0.23728813559322035}}
{"set": "A74", "decision": "REVERT", "edit": "reentry>=cooldown", "reason": "REVERT ge2 20->20 mean 3.9294->3.8290", "before": {"hits": 0, "med": 1.4603306312197901, "max": 50.14485254881414, "mean": 3.92936069758173, "ge2": 20, "surv": 0.23728813559322035}, "after": {"hits": 0, "med": 1.4603306312197901, "max": 50.14485254881414, "mean": 3.8290040490033164, "ge2": 20, "surv": 0.23728813559322035}}
{"set": "A75", "decision": "KEEP", "edit": "dual Donchian n//3", "reason": "KEEP median", "before": {"hits": 0, "med": 1.4603306312197901, "max": 50.14485254881414, "mean": 3.92936069758173, "ge2": 20, "ge10": 5, "surv": 0.23728813559322035}, "after": {"hits": 0, "med": 1.513646729954865, "max": 50.14485254881414, "mean": 3.976889413181639, "ge2": 20, "ge10": 5, "surv": 0.23728813559322035}}
{"set": "A76", "decision": "REVERT", "edit": "fast Donchian local ATR gate", "reason": "REVERT med 1.5136->1.5136 ge2 20->20 mean 3.9769->3.9777", "before": {"hits": 0, "med": 1.513646729954865, "max": 50.14485254881414, "mean": 3.976889413181639, "ge2": 20, "ge10": 5, "surv": 0.23728813559322035}, "after": {"hits": 0, "med": 1.513646729954865, "max": 50.14485254881414, "mean": 3.9776753139631404, "ge2": 20, "ge10": 5, "surv": 0.23728813559322035}}
{"set": "A77", "decision": "REVERT", "edit": "Donchian outer quartile", "reason": "REVERT med 1.514->1.413 ge2 20->20", "before": {"hits": 0, "med": 1.513646729954865, "max": 50.14485254881414, "mean": 3.976889413181639, "ge2": 20, "surv": 0.23728813559322035}, "after": {"hits": 0, "med": 1.4133189010018719, "max": 62.198975435992104, "mean": 4.69438747114667, "ge2": 20, "surv": 0.23728813559322035}}
{"set": "A78", "decision": "REVERT", "edit": "skip UTC 3-6", "reason": "REVERT med 1.514->1.373 ge2 20->19", "before": {"hits": 0, "med": 1.513646729954865, "max": 50.14485254881414, "mean": 3.976889413181639, "ge2": 20, "surv": 0.23728813559322035}, "after": {"hits": 0, "med": 1.3725675374197166, "max": 50.14485254881414, "mean": 3.8218559380082167, "ge2": 19, "surv": 0.23728813559322035}}
{"set": "A79", "decision": "REVERT", "edit": "win_size_mult=2.0", "reason": "REVERT med 1.514->1.489 ge2 20->18", "before": {"hits": 0, "med": 1.513646729954865, "max": 50.14485254881414, "mean": 3.976889413181639, "ge2": 20, "surv": 0.23728813559322035}, "after": {"hits": 0, "med": 1.488511341387314, "max": 55.15574620495799, "mean": 4.256305190129819, "ge2": 18, "surv": 0.2033898305084746}}
{"set": "A80", "decision": "REVERT", "edit": "slope 60 OR 180", "reason": "REVERT med 1.5136->1.5136 ge2 20->19 mean 3.977->3.076", "before": {"hits": 0, "med": 1.513646729954865, "max": 50.14485254881414, "mean": 3.976889413181639, "ge2": 20, "ge10": 5, "surv": 0.23728813559322035}, "after": {"hits": 0, "med": 1.513646729954865, "max": 27.763681349968838, "mean": 3.076163713003787, "ge2": 19, "ge10": 3, "surv": 0.22033898305084745}}
{"set": "A81", "decision": "REVERT", "edit": "day path skip expand", "reason": "REVERT ge2 20->20 mean 3.9769->3.9644", "before": {"hits": 0, "med": 1.513646729954865, "max": 50.14485254881414, "mean": 3.976889413181639, "ge2": 20, "surv": 0.23728813559322035}, "after": {"hits": 0, "med": 1.513646729954865, "max": 50.14485254881414, "mean": 3.9644168157976933, "ge2": 20, "surv": 0.23728813559322035}}
{"set": "A82", "decision": "REVERT", "edit": "late cap 0.40 same floor", "reason": "REVERT med 1.514->1.484 ge2 20->19", "before": {"hits": 0, "med": 1.513646729954865, "max": 50.14485254881414, "mean": 3.976889413181639, "ge2": 20, "surv": 0.23728813559322035}, "after": {"hits": 0, "med": 1.4837818575296617, "max": 55.73450443465334, "mean": 4.119943569723171, "ge2": 19, "surv": 0.22033898305084745}}
{"set": "A83", "decision": "REVERT", "edit": "min trail 8 ATR", "reason": "REVERT med 1.514->1.474 ge2 20->18", "before": {"hits": 0, "med": 1.513646729954865, "max": 50.14485254881414, "mean": 3.976889413181639, "ge2": 20}, "after": {"hits": 0, "med": 1.4744815541826912, "max": 34.24027255154113, "mean": 3.5692024456428695, "ge2": 18}}
{"set": "A84", "decision": "REVERT", "edit": "fast buf 0.5x", "reason": "REVERT med 1.514->1.402 ge2 20->17", "before": {"hits": 0, "med": 1.513646729954865, "max": 50.14485254881414, "mean": 3.976889413181639, "ge2": 20, "surv": 0.23728813559322035}, "after": {"hits": 0, "med": 1.4015679177416487, "max": 50.14485254881414, "mean": 3.7304197023486765, "ge2": 17, "surv": 0.22033898305084745}}
{"set": "A85", "decision": "REVERT", "edit": "expand OR p25 ATR%", "reason": "REVERT med 1.514->1.514 ge2 20->20", "before": {"hits": 0, "med": 1.513646729954865, "max": 50.14485254881414, "mean": 3.976889413181639, "ge2": 20, "surv": 0.23728813559322035}, "after": {"hits": 0, "med": 1.513646729954865, "max": 50.14485254881414, "mean": 3.9644168157976933, "ge2": 20, "surv": 0.23728813559322035}}
{"set": "A86", "decision": "REVERT", "edit": "n_fast n//6", "reason": "REVERT med 1.514->1.460 ge2 20->22 max 50.1->328.3", "before": {"hits": 0, "med": 1.513646729954865, "max": 50.14485254881414, "mean": 3.976889413181639, "ge2": 20, "surv": 0.23728813559322035}, "after": {"hits": 0, "med": 1.4603306312197901, "max": 328.2697562599757, "mean": 8.382541809069158, "ge2": 22, "surv": 0.23728813559322035}}
{"set": "A87", "decision": "KEEP", "edit": "partial 0.5->0.67", "reason": "KEEP median", "before": {"hits": 0, "med": 1.513646729954865, "max": 50.14485254881414, "mean": 3.976889413181639, "ge2": 20, "ge10": 5, "surv": 0.23728813559322035}, "after": {"hits": 0, "med": 1.5361683837644278, "max": 50.39363521423793, "mean": 3.9311380220037035, "ge2": 19, "ge10": 5, "surv": 0.23728813559322035}}
{"set": "A88", "decision": "REVERT", "edit": "ROC60 AND ROC120", "reason": "REVERT med 1.536->1.463 ge2 19->20", "before": {"hits": 0, "med": 1.5361683837644278, "max": 50.39363521423793, "mean": 3.9311380220037035, "ge2": 19, "surv": 0.23728813559322035}, "after": {"hits": 0, "med": 1.462964959519212, "max": 50.39363521423793, "mean": 4.054862819500964, "ge2": 20, "surv": 0.23728813559322035}}
{"set": "A89", "decision": "KEEP", "edit": "unlock_r 4.0", "reason": "KEEP median", "before": {"hits": 0, "med": 1.5361683837644278, "max": 50.39363521423793, "mean": 3.9311380220037035, "ge2": 19, "surv": 0.23728813559322035}, "after": {"hits": 0, "med": 1.5385040943359949, "max": 43.90265554248108, "mean": 3.8697473131258278, "ge2": 19, "surv": 0.2542372881355932}}
{"set": "A90", "decision": "REVERT", "edit": "unlock_mult 1.75", "reason": "REVERT med 1.539->1.382 ge2 19->18", "before": {"hits": 0, "med": 1.5385040943359949, "max": 43.90265554248108, "mean": 3.8697473131258278, "ge2": 19, "surv": 0.2542372881355932}, "after": {"hits": 0, "med": 1.3815473345549194, "max": 40.09205786065258, "mean": 3.896197580949641, "ge2": 18, "surv": 0.2711864406779661}}
{"set": "A91", "decision": "REVERT", "edit": "partial 0.75", "reason": "REVERT med 1.539->1.530 ge2 19->19", "before": {"hits": 0, "med": 1.5385040943359949, "mn": 1.0, "max": 43.90265554248108, "mean": 3.8697473131258278, "ge2": 19, "surv": 0.2542372881355932}, "after": {"hits": 0, "med": 1.530415038513691, "mn": 1.0, "max": 44.02534697324879, "mean": 3.850066111629636, "ge2": 19, "surv": 0.2542372881355932}}
{"set": "A92", "decision": "REVERT", "edit": "daily EMA min_periods 50 + fillna True", "reason": "REVERT med 1.539->1.463 ge2 19->18 surv 0.254->0.169", "before": {"hits": 0, "med": 1.5385040943359949, "mn": 1.0, "max": 43.90265554248108, "mean": 3.8697473131258278, "ge2": 19, "surv": 0.2542372881355932, "t0": 5, "n1": 21}, "after": {"hits": 0, "med": 1.462964959519212, "mn": 1.0, "max": 43.90265554248108, "mean": 3.553155788538147, "ge2": 18, "surv": 0.1694915254237288, "t0": 0, "n1": 22}}
{"set": "A93", "decision": "REVERT", "edit": "cold risk cap 0.08", "reason": "REVERT med 1.539->1.340 ge2 19->13", "before": {"hits": 0, "med": 1.5385040943359949, "mn": 1.0, "max": 43.90265554248108, "mean": 3.8697473131258278, "ge2": 19, "surv": 0.2542372881355932}, "after": {"hits": 0, "med": 1.3395031745383983, "mn": 1.0, "max": 46.40458489399273, "mean": 3.581083696307423, "ge2": 13, "surv": 0.288135593220339}}
{"set": "A94", "decision": "REVERT", "edit": "trail_arm_r 1.0", "reason": "REVERT med 1.539->1.463 ge2 19->19", "before": {"hits": 0, "med": 1.5385040943359949, "max": 43.90265554248108, "mean": 3.8697473131258278, "ge2": 19, "surv": 0.2542372881355932}, "after": {"hits": 0, "med": 1.462964959519212, "max": 43.90265554248108, "mean": 3.7768218610875626, "ge2": 19, "surv": 0.2542372881355932}}
{"set": "A95", "decision": "REVERT", "edit": "size_mult bump on partial", "reason": "REVERT med flat ge2 flat mean 3.870->3.867 (1 window)", "before": {"hits": 0, "med": 1.5385040943359949, "max": 43.90265554248108, "mean": 3.8697473131258278, "ge2": 19}, "after": {"hits": 0, "med": 1.5385040943359949, "max": 43.90265554248108, "mean": 3.8674607028886707, "ge2": 19}}
{"set": "A96", "decision": "REVERT", "edit": "day path expand_sma only", "reason": "REVERT med/ge2/min flat (1 window 5.5->10, mean-only not keep)", "before": {"hits": 0, "med": 1.5385040943359949, "max": 43.90265554248108, "mean": 3.8697473131258278, "ge2": 19}, "after": {"hits": 0, "med": 1.5385040943359949, "max": 43.90265554248108, "mean": 3.9469366278901825, "ge2": 19}}
{"set": "A97", "decision": "REVERT", "edit": "floor risk_frac at cap", "reason": "REVERT med 1.539->1.444 ge2 19->18", "before": {"hits": 0, "med": 1.5385040943359949, "max": 43.90265554248108, "mean": 3.8697473131258278, "ge2": 19, "surv": 0.2542372881355932, "n1": 21}, "after": {"hits": 0, "med": 1.444499325287885, "max": 29.727230590929135, "mean": 2.8437370271733786, "ge2": 18, "surv": 0.2711864406779661, "n1": 20}}
{"set": "A98", "decision": "REVERT", "edit": "lev_cap 1.0x", "reason": "REVERT med 1.539->1.463 ge2 19->19", "before": {"hits": 0, "med": 1.5385040943359949, "max": 43.90265554248108, "mean": 3.8697473131258278, "ge2": 19, "surv": 0.2542372881355932}, "after": {"hits": 0, "med": 1.462964959519212, "max": 27.248559929884742, "mean": 3.3084507565818293, "ge2": 19, "surv": 0.2711864406779661}}
{"set": "A99", "decision": "REVERT", "edit": "loss cooldown 720", "reason": "REVERT med 1.539->1.213 ge2 19->18 max-only 79.9", "before": {"hits": 0, "med": 1.5385040943359949, "max": 43.90265554248108, "mean": 3.8697473131258278, "ge2": 19, "surv": 0.2542372881355932}, "after": {"hits": 0, "med": 1.2132344241548114, "max": 79.85982458046436, "mean": 5.347418774716183, "ge2": 18, "surv": 0.3220338983050847}}
{"set": "A100", "decision": "KEEP", "edit": "body_min floor 0.3 ATR", "reason": "KEEP ge2 19->20 (med flat min flat)", "before": {"hits": 0, "med": 1.5385040943359949, "max": 43.90265554248108, "mean": 3.8697473131258278, "ge2": 19, "surv": 0.2542372881355932}, "after": {"hits": 0, "med": 1.5385040943359949, "max": 37.21480693041065, "mean": 3.7699607867337086, "ge2": 20, "surv": 0.2542372881355932}}
{"set": "A101", "decision": "REVERT", "edit": "directional close filter", "reason": "REVERT noop identical to A100", "before": {"hits": 0, "med": 1.5385040943359949, "ge2": 20, "max": 37.21480693041065}, "after": {"hits": 0, "med": 1.5385040943359949, "ge2": 20, "max": 37.21480693041065}}
{"set": "A102", "decision": "REVERT", "edit": "ROC 90", "reason": "REVERT med 1.539->1.463 ge2 20->20", "before": {"hits": 0, "med": 1.5385040943359949, "max": 37.21480693041065, "mean": 3.7699607867337086, "ge2": 20}, "after": {"hits": 0, "med": 1.462964959519212, "max": 37.21480693041065, "mean": 3.874718859602382, "ge2": 20}}
{"set": "A103", "decision": "REVERT", "edit": "n_fast n//2", "reason": "REVERT med/ge2 flat mean 3.77->3.59", "before": {"hits": 0, "med": 1.5385040943359949, "ge2": 20, "mean": 3.7699607867337086, "max": 37.21480693041065}, "after": {"hits": 0, "med": 1.5385040943359949, "ge2": 20, "mean": 3.5884562491834346, "max": 37.21480693041065}}
{"set": "A104", "decision": "KEEP", "edit": "body_min 0.45", "reason": "KEEP med 1.539->1.547", "before": {"hits": 0, "med": 1.5385040943359949, "ge2": 20, "mean": 3.7699607867337086, "max": 37.21480693041065}, "after": {"hits": 0, "med": 1.5469101277995154, "ge2": 19, "mean": 3.637258927041448, "max": 37.21480693041065}}
{"set": "A105", "decision": "REVERT", "edit": "HTF slope 120", "reason": "REVERT med 1.547->1.369 ge2 19->19", "before": {"hits": 0, "med": 1.5469101277995154, "max": 37.21480693041065, "mean": 3.637258927041448, "ge2": 19}, "after": {"hits": 0, "med": 1.369394580343501, "max": 37.21480693041065, "mean": 3.5571504986986313, "ge2": 19}}
