{"set": "A1", "decision": "REVERT", "edit": "HTF EMA slope filter structural", "before": {"hits": 0, "median": 1.0, "min": 1.0, "max": 106.14473904732338, "mean": 5.072547292791444, "surv": 0.15254237288135594, "ge2": 15, "ge10": 2, "dead": 38, "wipe": 50, "med_trades": 30.0, "liq": 44}, "after": {"hits": 0, "median": 1.0, "min": 1.0, "max": 21.034538698389447, "mean": 2.19626216245293, "surv": 0.15254237288135594, "ge2": 14, "ge10": 2, "dead": 38, "wipe": 50, "med_trades": 23.0, "liq": 30}, "reason": "no improvement"}
{"set": "A2", "decision": "REVERT", "edit": "4h Donchian structural", "before": {"hits": 0, "median": 1.0, "min": 1.0, "max": 98.80098190439544, "mean": 4.8507719799077185, "surv": 0.15254237288135594, "ge2": 16, "ge10": 2, "dead": 38, "wipe": 50, "med_trades": 28.0}, "after": {"hits": 0, "median": 1.0, "min": 1.0, "max": 5.418237525262912, "mean": 1.355963767693408, "surv": 0.13559322033898305, "ge2": 9, "ge10": 0, "dead": 44, "wipe": 51, "med_trades": 43.0}, "reason": "worse max/ge2/surv"}
{"set": "A3", "decision": "REVERT", "edit": "breakout body direction", "before": {"hits": 0, "median": 1.0, "min": 1.0, "max": 98.80098190439544, "mean": 4.8507719799077185, "surv": 0.15254237288135594, "ge2": 16, "dead": 38, "wipe": 50, "med_trades": 28.0, "liq": 34}, "after": {"hits": 0, "median": 1.0, "min": 1.0, "max": 98.80098190439544, "mean": 4.8507719799077185, "surv": 0.15254237288135594, "ge2": 16, "dead": 38, "wipe": 50, "med_trades": 28.0, "liq": 34}, "reason": "identical/no primary improve"}
{"set": "A4", "decision": "REVERT", "edit": "opposite-side lockout 720", "before": {"hits": 0, "median": 1.0, "min": 1.0, "max": 98.80098190439544, "mean": 4.8507719799077185, "surv": 0.15254237288135594, "ge2": 16, "ge10": 2, "dead": 38, "wipe": 50, "med_trades": 28.0, "liq": 34}, "after": {"hits": 0, "median": 1.0, "min": 1.0, "max": 106.14473904732338, "mean": 5.072547292791444, "surv": 0.15254237288135594, "ge2": 15, "ge10": 2, "dead": 38, "wipe": 50, "med_trades": 30.0, "liq": 44}, "reason": "no primary improve"}
{"set": "A5", "decision": "REVERT", "edit": "volume>SMA60 participation", "before": {"hits": 0, "median": 1.0, "min": 1.0, "max": 106.14473904732338, "mean": 5.072547292791444, "surv": 0.15254237288135594, "ge2": 15, "dead": 38, "wipe": 50, "med_trades": 30.0, "liq": 44, "trades": 1982}, "after": {"hits": 0, "median": 1.0, "min": 1.0, "max": 106.14473904732338, "mean": 5.072547292791444, "surv": 0.15254237288135594, "ge2": 15, "dead": 38, "wipe": 50, "med_trades": 30.0, "liq": 44, "trades": 1980}, "reason": "no primary improve / identical"}
{"set": "A6", "decision": "REVERT", "edit": "SL wick+/-0.5ATR", "before": {"hits": 0, "median": 1.0, "min": 1.0, "max": 106.14473904732338, "mean": 5.072547292791444, "surv": 0.15254237288135594, "ge2": 15, "dead": 38, "wipe": 50, "med_trades": 30.0, "liq": 44}, "after": {"hits": 0, "median": 1.0, "min": 1.0, "max": 106.14473904732338, "mean": 5.092919056535241, "surv": 0.15254237288135594, "ge2": 15, "dead": 36, "wipe": 50, "med_trades": 29.0, "liq": 44}, "reason": "risk_cap likely nullifies wider SL"}
{"set": "A7", "decision": "REVERT", "edit": "momentum |ret60|>=0.3% gate", "before": {"hits": 0, "median": 1.0, "min": 1.0, "max": 106.14473904732338, "mean": 5.072547292791444, "surv": 0.15254237288135594, "ge2": 15, "ge10": 2, "dead": 38, "wipe": 50, "med_trades": 30.0, "liq": 44}, "after": {"hits": 0, "median": 1.0, "min": 1.0, "max": 450.8697073690119, "mean": 16.75418443763198, "surv": 0.15254237288135594, "ge2": 15, "ge10": 2, "dead": 39, "wipe": 50, "med_trades": 36.0, "liq": 42}, "reason": "no primary"}
{"set": "A8", "decision": "REVERT", "edit": "daily_ema force 50", "before": {"hits": 0, "median": 1.0, "min": 1.0, "max": 106.14473904732338, "mean": 5.072547292791444, "surv": 0.15254237288135594, "ge2": 15, "dead": 38, "wipe": 50, "med_trades": 30.0}, "after": {"hits": 0, "median": 1.0, "min": 1.0, "max": 22.255947658460276, "mean": 2.16487146821212, "surv": 0.01694915254237288, "ge2": 15, "dead": 36, "wipe": 58, "med_trades": 41.0}, "reason": "surv/ge2/max collapse"}
{"set": "A9", "decision": "REVERT", "edit": "prior-day Hi/Lo break confirm", "before": {"hits": 0, "median": 1.0, "min": 1.0, "max": 106.14473904732338, "mean": 5.072547292791444, "surv": 0.15254237288135594, "ge2": 15, "dead": 38, "wipe": 50, "med_trades": 30.0}, "after": {"hits": 0, "median": 1.0, "min": 1.0, "max": 7.563012239211319, "mean": 1.6195352085624921, "surv": 0.15254237288135594, "ge2": 12, "dead": 39, "wipe": 50, "med_trades": 20.0}, "reason": "max/mean collapse"}
{"set": "A10", "decision": "REVERT", "edit": "2-bar persistence breakout", "before": {"hits": 0, "median": 1.0, "min": 1.0, "max": 106.14473904732338, "mean": 5.072547292791444, "surv": 0.15254237288135594, "ge2": 15, "ge10": 2, "dead": 38, "wipe": 50, "med_trades": 30.0}, "after": {"hits": 0, "median": 1.0, "min": 1.0, "max": 12.237293710925682, "mean": 1.8369557007010962, "surv": 0.559322033898305, "ge2": 12, "ge10": 1, "dead": 41, "wipe": 26, "med_trades": 11.0}, "reason": "no primary; surv 0.153->0.559"}
{"set": "A11", "decision": "REVERT", "edit": "disable ATR expand gate", "before": {"hits": 0, "median": 1.0, "min": 1.0, "max": 106.14473904732338, "mean": 5.072547292791444, "surv": 0.15254237288135594, "ge2": 15, "ge10": 2, "dead": 38, "wipe": 50, "med_trades": 30.0, "zero": 5}, "after": {"hits": 0, "median": 1.0, "min": 1.0, "max": 450.8697073690119, "mean": 16.75418443763198, "surv": 0.15254237288135594, "ge2": 15, "ge10": 2, "dead": 39, "wipe": 50, "med_trades": 36.0, "zero": 5}, "reason": "no primary"}
{"set": "A12", "decision": "REVERT", "edit": "ht_rule force 4h", "before": {"hits": 0, "median": 1.0, "min": 1.0, "max": 106.14473904732338, "mean": 5.072547292791444, "surv": 0.15254237288135594, "ge2": 15, "dead": 38, "wipe": 50, "med_trades": 30.0}, "after": {"hits": 0, "median": 1.0, "min": 1.0, "max": 9.422979038303668, "mean": 1.787947018635778, "surv": 0.13559322033898305, "ge2": 13, "dead": 38, "wipe": 51, "med_trades": 28.0}, "reason": "max/ge2 collapse"}
{"set": "A13", "decision": "REVERT", "edit": "disable daily EMA filter", "before": {"hits": 0, "median": 1.0, "min": 1.0, "max": 106.14473904732338, "mean": 5.072547292791444, "surv": 0.15254237288135594, "ge2": 15, "dead": 38, "wipe": 50}, "after": {"hits": 0, "median": 1.0, "min": 1.0, "max": 22.255947658460276, "mean": 2.4096324407207224, "surv": 0.0, "ge2": 13, "dead": 37, "wipe": 59}, "reason": "surv 15%->0%"}
{"set": "A14", "decision": "REVERT", "edit": "reentry=0", "before": {"hits": 0, "median": 1.0, "min": 1.0, "max": 106.14473904732338, "mean": 5.072547292791444, "surv": 0.15254237288135594, "ge2": 15, "dead": 38, "wipe": 50, "med_trades": 30.0}, "after": {"hits": 0, "median": 1.0, "min": 1.0, "max": 52.45921497724362, "mean": 3.238917641590938, "surv": 0.1864406779661017, "ge2": 15, "dead": 40, "wipe": 48, "med_trades": 24.0}, "reason": "surv up but ge2/mean/max down"}
{"set": "A15", "decision": "REVERT", "reason": "REVERT surv 15.3->42.4 but ge2 15->14 mean 5.073->5.215 med flat max flat", "before": {"hits": 0, "med": 1.0, "max": 106.14473904732338, "mean": 5.072547292791444, "ge2": 15, "surv": 0.15254237288135594, "wipe": 50}, "after": {"hits": 0, "med": 1.0, "max": 106.14473904732338, "mean": 5.214974050644053, "ge2": 14, "surv": 0.423728813559322, "wipe": 34}}
{"set": "A16", "decision": "REVERT", "edit": "first-cross breakout", "reason": "REVERT no primary lift ge2 15->15 mean 5.073->5.073", "before": {"hits": 0, "med": 1.0, "max": 106.14473904732338, "mean": 5.072547292791444, "ge2": 15, "ge10": 2, "surv": 0.15254237288135594, "wipe": 50, "dead": 44}, "after": {"hits": 0, "med": 1.0, "max": 106.14473904732338, "mean": 5.072547292791444, "ge2": 15, "ge10": 2, "surv": 0.15254237288135594, "wipe": 50, "dead": 44}}
{"set": "A17", "decision": "REVERT", "edit": "dual Donchian n//3 OR", "reason": "REVERT max-only 106.1->305.7 ge2 15->15", "before": {"hits": 0, "med": 1.0, "minp": 1.0, "max": 106.14473904732338, "mean": 5.072547292791444, "ge2": 15, "ge10": 2, "surv": 0.15254237288135594, "wipe": 50, "zero": 5, "dead": 44}, "after": {"hits": 0, "med": 1.0, "minp": 1.0, "max": 305.7448526777311, "mean": 12.011579858723763, "ge2": 15, "ge10": 2, "surv": 0.15254237288135594, "wipe": 50, "zero": 5, "dead": 44}}
{"set": "A18", "decision": "REVERT", "edit": "ATR% <= rolling90th", "reason": "REVERT surv↑ but primary down ge2 15->11 max 106.1->9.4 mean 5.07->1.72", "before": {"hits": 0, "med": 1.0, "minp": 1.0, "max": 106.14473904732338, "mean": 5.072547292791444, "ge2": 15, "ge10": 2, "surv": 0.15254237288135594, "wipe": 50, "zero": 5}, "after": {"hits": 0, "med": 1.0, "minp": 1.0, "max": 9.37375764200787, "mean": 1.7191270409609014, "ge2": 11, "ge10": 0, "surv": 0.6610169491525424, "wipe": 20, "zero": 15}}
{"set": "A19", "decision": "REVERT", "edit": "Donchian width>=2%", "reason": "REVERT no primary ge2 15->14 mean 5.073->3.369 max 106.1->51.5", "before": {"hits": 0, "med": 1.0, "minp": 1.0, "max": 106.14473904732338, "mean": 5.072547292791444, "ge2": 15, "ge10": 2, "surv": 0.15254237288135594, "wipe": 50, "zero": 5}, "after": {"hits": 0, "med": 1.0, "minp": 1.0, "max": 51.54333619020092, "mean": 3.3693610659563134, "ge2": 14, "ge10": 2, "surv": 0.2033898305084746, "wipe": 47, "zero": 5}}
{"set": "A20", "decision": "REVERT", "edit": "long skip expand", "reason": "REVERT ge2 15->15 mean 5.073->5.069", "before": {"hits": 0, "med": 1.0, "max": 106.14473904732338, "mean": 5.072547292791444, "ge2": 15, "ge10": 2, "surv": 0.15254237288135594, "wipe": 50, "zero": 5}, "after": {"hits": 0, "med": 1.0, "max": 106.14473904732338, "mean": 5.068592291134067, "ge2": 15, "ge10": 2, "surv": 0.15254237288135594, "wipe": 50, "zero": 5}}
{"set": "A21", "decision": "REVERT", "edit": "expand->size_boost tier", "reason": "REVERT max-only 106.1->697.2 ge2 15->15", "before": {"hits": 0, "med": 1.0, "minp": 1.0, "max": 106.14473904732338, "mean": 5.072547292791444, "ge2": 15, "ge10": 2, "surv": 0.15254237288135594, "wipe": 50, "zero": 5}, "after": {"hits": 0, "med": 1.0, "minp": 1.0, "max": 697.2348222824846, "mean": 25.105544265207328, "ge2": 15, "ge10": 2, "surv": 0.15254237288135594, "wipe": 50, "zero": 5}}
{"set": "A22", "decision": "REVERT", "edit": "UTC session 12-21", "reason": "REVERT ge2 15->13 max 106.1->7.5 mean 5.07->1.61", "before": {"hits": 0, "med": 1.0, "max": 106.14473904732338, "mean": 5.072547292791444, "ge2": 15, "ge10": 2, "surv": 0.15254237288135594, "wipe": 50, "zero": 5}, "after": {"hits": 0, "med": 1.0, "max": 7.534480985773506, "mean": 1.6077359697038855, "ge2": 13, "ge10": 0, "surv": 0.22033898305084745, "wipe": 46, "zero": 5}}
{"set": "A23", "decision": "REVERT", "edit": "breakout pullback retest", "reason": "REVERT ge2 15->12 med flat max 106.1->12.4 mean 5.07->1.62 surv 15->68", "before": {"hits": 0, "med": 1.0, "minp": 1.0, "max": 106.14473904732338, "mean": 5.072547292791444, "ge2": 15, "ge10": 2, "surv": 0.15254237288135594, "wipe": 50, "zero": 5}, "after": {"hits": 0, "med": 1.0, "minp": 1.0, "max": 12.39398227913876, "mean": 1.6164813061184207, "ge2": 12, "ge10": 1, "surv": 0.6779661016949152, "wipe": 19, "zero": 10}}
{"set": "A24", "decision": "REVERT", "edit": "risk_cap=0 wick SL", "reason": "REVERT ge2 15->14 max 106.1->9.4 mean 5.07->1.80", "before": {"hits": 0, "med": 1.0, "max": 106.14473904732338, "mean": 5.072547292791444, "ge2": 15, "ge10": 2, "surv": 0.15254237288135594, "wipe": 50}, "after": {"hits": 0, "med": 1.0, "max": 9.422979038303668, "mean": 1.8037302088781755, "ge2": 14, "ge10": 0, "surv": 0.13559322033898305, "wipe": 51}}
{"set": "A25", "decision": "REVERT", "edit": "per-side cooldown", "reason": "REVERT ge2 15->15 mean 5.0725->5.0725 trades 30->30", "before": {"hits": 0, "med": 1.0, "max": 106.14473904732338, "mean": 5.072547292791444, "ge2": 15, "ge10": 2, "surv": 0.15254237288135594, "wipe": 50, "trades": 30.0}, "after": {"hits": 0, "med": 1.0, "max": 106.14473904732338, "mean": 5.072547292791444, "ge2": 15, "ge10": 2, "surv": 0.15254237288135594, "wipe": 50, "trades": 30.0}}
{"set": "A26", "decision": "KEEP", "edit": "OR prior-day Hi/Lo", "reason": "KEEP", "before": {"hits": 0, "med": 1.0, "max": 106.14473904732338, "mean": 5.072547292791444, "ge2": 15, "surv": 0.15254237288135594, "wipe": 50}, "after": {"hits": 0, "med": 1.0, "max": 6.76746374936898, "mean": 1.7139538099388059, "ge2": 16, "surv": 0.1016949152542373, "wipe": 53}}
{"set": "A27", "decision": "REVERT", "edit": "day-only size 0.4", "reason": "REVERT ge2 16->13 max 6.77->4.77 mean 1.714->1.529", "before": {"hits": 0, "med": 1.0, "max": 6.76746374936898, "mean": 1.7139538099388059, "ge2": 16, "ge10": 0, "surv": 0.1016949152542373, "wipe": 53}, "after": {"hits": 0, "med": 1.0, "max": 4.769549752988724, "mean": 1.5291136009823851, "ge2": 13, "ge10": 0, "surv": 0.13559322033898305, "wipe": 51}}
{"set": "A28", "decision": "KEEP", "edit": "day first-cross+buf", "reason": "KEEP ge2", "before": {"hits": 0, "med": 1.0, "max": 6.76746374936898, "mean": 1.7139538099388059, "ge2": 16, "ge10": 0, "surv": 0.1016949152542373, "wipe": 53}, "after": {"hits": 0, "med": 1.0, "max": 9.422979038303668, "mean": 2.0443941781797133, "ge2": 19, "ge10": 0, "surv": 0.15254237288135594, "wipe": 50}}
{"set": "A29", "decision": "REVERT", "edit": "dual HTF 1h OR 15m", "reason": "REVERT ge2 19->14 mean 2.044->1.892 surv 15.3->13.6", "before": {"hits": 0, "med": 1.0, "max": 9.422979038303668, "mean": 2.0443941781797133, "ge2": 19, "surv": 0.15254237288135594, "wipe": 50}, "after": {"hits": 0, "med": 1.0, "max": 9.422979038303668, "mean": 1.8921466648958303, "ge2": 14, "surv": 0.13559322033898305, "wipe": 51}}
{"set": "A30", "decision": "REVERT", "edit": "body direction", "reason": "REVERT ge2 19->19 mean 2.0444->2.0444", "before": {"hits": 0, "med": 1.0, "max": 9.422979038303668, "mean": 2.0443941781797133, "ge2": 19, "surv": 0.15254237288135594, "wipe": 50}, "after": {"hits": 0, "med": 1.0, "max": 9.422979038303668, "mean": 2.0443941781797133, "ge2": 19, "surv": 0.15254237288135594, "wipe": 50}}
{"set": "A31", "decision": "KEEP", "edit": "trail max(6atr,0.25 width)", "reason": "KEEP mean@same ge2", "before": {"hits": 0, "med": 1.0, "max": 9.422979038303668, "mean": 2.0443941781797133, "ge2": 19, "ge10": 0, "surv": 0.15254237288135594, "wipe": 50}, "after": {"hits": 0, "med": 1.0, "max": 14.677028678626094, "mean": 2.3551845504337976, "ge2": 19, "ge10": 3, "surv": 0.15254237288135594, "wipe": 50}}
{"set": "A32", "decision": "REVERT", "edit": "weekly first-cross OR", "reason": "REVERT ge2 19->18 mean 2.3552->2.1827", "before": {"hits": 0, "med": 1.0, "max": 14.677028678626094, "mean": 2.3551845504337976, "ge2": 19, "ge10": 3, "surv": 0.15254237288135594}, "after": {"hits": 0, "med": 1.0, "max": 14.677028678626094, "mean": 2.182739931129493, "ge2": 18, "ge10": 2, "surv": 0.15254237288135594}}
{"set": "A33", "decision": "KEEP", "edit": "risk-parity 8% equity", "reason": "KEEP median", "before": {"hits": 0, "med": 1.0, "minp": 1.0, "max": 14.677028678626094, "mean": 2.3551845504337976, "ge2": 19, "ge10": 3, "surv": 0.15254237288135594, "wipe": 50}, "after": {"hits": 0, "med": 1.1410565989753496, "minp": 1.0, "max": 5.094992230652627, "mean": 1.4834671906292973, "ge2": 7, "ge10": 0, "surv": 0.6101694915254238, "wipe": 23}}
{"set": "A34", "decision": "KEEP", "edit": "equity-scaled risk 8->25", "reason": "KEEP ge2", "before": {"hits": 0, "med": 1.1410565989753496, "minp": 1.0, "max": 5.094992230652627, "mean": 1.4834671906292973, "ge2": 7, "surv": 0.6101694915254238, "wipe": 23}, "after": {"hits": 0, "med": 1.1410565989753496, "minp": 1.0, "max": 4.351325189896179, "mean": 1.5184172786605126, "ge2": 8, "surv": 0.6101694915254238, "wipe": 23}}
{"set": "A35", "decision": "KEEP", "edit": "HTF EMA slope 60", "reason": "KEEP median", "before": {"hits": 0, "med": 1.1410565989753496, "max": 4.351325189896179, "mean": 1.5184172786605126, "ge2": 8, "ge10": 0, "surv": 0.6101694915254238, "wipe": 23}, "after": {"hits": 0, "med": 1.1611404999480426, "max": 13.859184245414419, "mean": 1.6481860958249792, "ge2": 7, "ge10": 1, "surv": 0.6610169491525424, "wipe": 20}}
{"set": "A36", "decision": "REVERT", "edit": "soft expand mid+/-ATR", "reason": "REVERT med 1.161->1.148 ge2 7->6", "before": {"hits": 0, "med": 1.1611404999480426, "max": 13.859184245414419, "mean": 1.6481860958249792, "ge2": 7, "surv": 0.6610169491525424}, "after": {"hits": 0, "med": 1.1480096226388594, "max": 13.859184245414419, "mean": 1.600197572596998, "ge2": 6, "surv": 0.5932203389830508}}
{"set": "A37", "decision": "REVERT", "edit": "be_at_r=1", "reason": "REVERT med 1.161->1.000 ge2 7->3", "before": {"hits": 0, "med": 1.1611404999480426, "max": 13.859184245414419, "mean": 1.6481860958249792, "ge2": 7, "surv": 0.6610169491525424}, "after": {"hits": 0, "med": 1.0, "max": 3.2257640745280414, "mean": 1.1394891907642306, "ge2": 3, "surv": 0.5423728813559322}}
{"set": "A38", "decision": "REVERT", "edit": "win_size_mult=1.5", "reason": "REVERT med/ge2/mean flat or down ge2 7->7 mean 1.6482->1.6482", "before": {"hits": 0, "med": 1.1611404999480426, "max": 13.859184245414419, "mean": 1.6481860958249792, "ge2": 7, "surv": 0.6610169491525424}, "after": {"hits": 0, "med": 1.1611404999480426, "max": 13.859184245414419, "mean": 1.6481860958249792, "ge2": 7, "surv": 0.6610169491525424}}
{"set": "A39", "decision": "KEEP", "edit": "risk_tgt*size_mult + win 1.5", "reason": "KEEP mean@same med/ge2", "before": {"hits": 0, "med": 1.1611404999480426, "max": 13.859184245414419, "mean": 1.6481860958249792, "ge2": 7, "ge10": 1, "surv": 0.6610169491525424}, "after": {"hits": 0, "med": 1.1611404999480426, "max": 33.37969636162517, "mean": 2.138645425290026, "ge2": 7, "ge10": 1, "surv": 0.6440677966101694}}
{"set": "A40", "decision": "REVERT", "edit": "trail_arm_r=1", "reason": "REVERT med 1.1611->1.1590 ge2 7->7 mean 2.139->2.127", "before": {"hits": 0, "med": 1.1611404999480426, "max": 33.37969636162517, "mean": 2.138645425290026, "ge2": 7, "surv": 0.6440677966101694}, "after": {"hits": 0, "med": 1.158975320407572, "max": 33.37969636162517, "mean": 2.1266568560217345, "ge2": 7, "surv": 0.6440677966101694}}
{"set": "A41", "decision": "REVERT", "edit": "trail_unlock 2R x1.5", "reason": "REVERT med 1.161->1.080 ge2 7->11 max 33.4->41.2", "before": {"hits": 0, "med": 1.1611404999480426, "max": 33.37969636162517, "mean": 2.138645425290026, "ge2": 7, "surv": 0.6440677966101694}, "after": {"hits": 0, "med": 1.079983958386138, "max": 41.197284708914054, "mean": 2.2904478591373905, "ge2": 11, "surv": 0.5932203389830508}}
{"set": "A42", "decision": "KEEP", "edit": "sl_grace_bars=5", "reason": "KEEP median", "before": {"hits": 0, "med": 1.1611404999480426, "max": 33.37969636162517, "mean": 2.138645425290026, "ge2": 7, "ge10": 1, "surv": 0.6440677966101694, "wipe": 21}, "after": {"hits": 0, "med": 1.1861715858124022, "max": 45.010462479796026, "mean": 2.3784581082346214, "ge2": 8, "ge10": 1, "surv": 0.3559322033898305, "wipe": 38}}
{"set": "A43", "decision": "KEEP", "edit": "partial_trail_frac=0.5", "reason": "KEEP median", "before": {"hits": 0, "med": 1.1861715858124022, "max": 45.010462479796026, "mean": 2.3784581082346214, "ge2": 8, "surv": 0.3559322033898305, "wipe": 38}, "after": {"hits": 0, "med": 1.1915664654104456, "max": 46.39407815599263, "mean": 2.447928579360068, "ge2": 8, "surv": 0.3728813559322034, "wipe": 37}}
{"set": "A44", "decision": "REVERT", "edit": "loss size_mult=0.5", "reason": "REVERT med 1.192->1.113 ge2 8->7", "before": {"hits": 0, "med": 1.1915664654104456, "max": 46.39407815599263, "mean": 2.447928579360068, "ge2": 8, "surv": 0.3728813559322034}, "after": {"hits": 0, "med": 1.1134497829437688, "max": 12.325460556809285, "mean": 1.7099050127403788, "ge2": 7, "surv": 0.3728813559322034}}
{"set": "A45", "decision": "REVERT", "edit": "pyramid 1R 0.5", "reason": "REVERT med 1.192->1.000 ge2 8->9", "before": {"hits": 0, "med": 1.1915664654104456, "max": 46.39407815599263, "mean": 2.447928579360068, "ge2": 8}, "after": {"hits": 0, "med": 1.0, "max": 11.15391846576462, "mean": 1.599894210179718, "ge2": 9}}
{"set": "A46", "decision": "REVERT", "edit": "EMA sep 0.5ATR", "reason": "REVERT noop/down ge2 8->8 mean 2.4479->2.4479", "before": {"hits": 0, "med": 1.1915664654104456, "max": 46.39407815599263, "mean": 2.447928579360068, "ge2": 8, "surv": 0.3728813559322034}, "after": {"hits": 0, "med": 1.1915664654104456, "max": 46.39407815599263, "mean": 2.447928579360068, "ge2": 8, "surv": 0.3728813559322034}}
{"set": "A47", "decision": "KEEP", "edit": "time-progress risk_tgt", "reason": "KEEP median", "before": {"hits": 0, "med": 1.1915664654104456, "max": 46.39407815599263, "mean": 2.447928579360068, "ge2": 8, "surv": 0.3728813559322034}, "after": {"hits": 0, "med": 1.2028676426304201, "max": 29.12052142388664, "mean": 2.4367548038213043, "ge2": 15, "surv": 0.3050847457627119}}
{"set": "A48", "decision": "REVERT", "edit": "max(time,equity) risk", "reason": "REVERT ge2 15->14 mean 2.437->2.883", "before": {"hits": 0, "med": 1.2028676426304201, "max": 29.12052142388664, "mean": 2.4367548038213043, "ge2": 15, "ge10": 2, "surv": 0.3050847457627119}, "after": {"hits": 0, "med": 1.2028676426304201, "max": 50.06446379034973, "mean": 2.883038645032208, "ge2": 14, "ge10": 3, "surv": 0.3050847457627119}}
{"set": "A49", "decision": "REVERT", "edit": "convex time risk", "reason": "REVERT med 1.203->1.192 ge2 15->14", "before": {"hits": 0, "med": 1.2028676426304201, "max": 29.12052142388664, "mean": 2.4367548038213043, "ge2": 15}, "after": {"hits": 0, "med": 1.1916141495103183, "max": 22.223315712532102, "mean": 2.3492692008987, "ge2": 14}}
