{"set": "A327", "decision": "KEEP", "edit": "all-entry trail *0.12->0.10 after first scale", "reason": "KEEP med 2.244->2.248 ge2 32; 43 up 0 dn; 2023-04 1.89", "before": {"hits": 0, "med": 2.244479127569361, "ge2": 32}, "after": {"hits": 0, "med": 2.24773086083911, "ge2": 32, "max": 63.253821271276614}}
{"set": "A328", "decision": "KEEP", "edit": "all-entry trail *0.10->0.08 after first scale", "reason": "KEEP med 2.248->2.251 ge2 32; 43 up 0 dn", "before": {"hits": 0, "med": 2.24773086083911, "ge2": 32}, "after": {"hits": 0, "med": 2.2509825941088595, "ge2": 32, "max": 63.75980132718028}}
{"set": "A329", "decision": "KEEP", "edit": "all-entry trail *0.08->0.05 after first scale", "reason": "KEEP med 2.251->2.256 ge2 32; 43 up 0 dn; 2023-04 1.91->1.93", "before": {"hits": 0, "med": 2.2509825941088595, "ge2": 32}, "after": {"hits": 0, "med": 2.255860194013488, "ge2": 32, "max": 64.52380509222263}}
{"set": "A330", "decision": "KEEP", "edit": "all-entry trail *0.05->0.03 after first scale", "reason": "KEEP med 2.256->2.259 ge2 32; 43 up 0 dn; 2023-04 1.93->1.95", "before": {"hits": 0, "med": 2.255860194013488, "ge2": 32}, "after": {"hits": 0, "med": 2.2591119272832367, "ge2": 32, "max": 65.03650704086029}}
{"set": "A331", "decision": "KEEP", "edit": "all-entry trail *0.03->0.01 after first scale", "reason": "KEEP med 2.259->2.267 ge2 32; 43 up 0 dn; 2023-04 1.95->1.97", "before": {"hits": 0, "med": 2.2591119272832367, "ge2": 32}, "after": {"hits": 0, "med": 2.267140226066155, "ge2": 32, "max": 65.55191012797384}}
{"set": "A332", "decision": "KEEP", "edit": "all-entry trail *0.01->0.005 after first scale", "reason": "KEEP med 2.267->2.276 ge2 32; 43 up 0 dn; 2023-04 1.97", "before": {"hits": 0, "med": 2.267140226066155, "ge2": 32}, "after": {"hits": 0, "med": 2.275861352102749, "ge2": 32, "max": 65.68118378174965}}
{"set": "A333", "decision": "REVERT", "edit": "trail *0 after first scale (lock peak)", "reason": "REVERT med 2.276->1.679 ge2 collapse; noise exits", "before": {"hits": 0, "med": 2.275861352102749, "ge2": 32}, "after": {"hits": 0, "med": 1.679, "ge2": null, "max": 42.46122669714889}}
{"set": "A334", "decision": "REVERT", "edit": "body floor 0.45->0.40 ATR", "reason": "REVERT med 2.276->2.263", "before": {"hits": 0, "med": 2.275861352102749, "ge2": 32}, "after": {"hits": 0, "med": 2.263, "ge2": null}}
{"set": "A335", "decision": "REVERT", "edit": "body floor 0.45->0.50 ATR", "reason": "REVERT med 2.276->2.263 surv down", "before": {"hits": 0, "med": 2.275861352102749, "ge2": 32}, "after": {"hits": 0, "med": 2.263, "ge2": null}}
{"set": "A336", "decision": "REVERT", "edit": "ROC period 120->90", "reason": "REVERT med 2.276->2.263 n1 16->17", "before": {"hits": 0, "med": 2.275861352102749, "ge2": 32}, "after": {"hits": 0, "med": 2.263176593870423, "ge2": 32}}
{"set": "A337", "decision": "KEEP", "edit": "non-fat first partial 0.68->0.40", "reason": "KEEP med 2.276->2.402 ge2 32 n1 16->15; 29 up 0 dn; max 66->81", "before": {"hits": 0, "med": 2.275861352102749, "ge2": 32}, "after": {"hits": 0, "med": 2.401953342062319, "ge2": 32, "max": 81.4681145223706}}
{"set": "A338", "decision": "KEEP", "edit": "non-fat first partial 0.40->0.30", "reason": "KEEP med 2.402->2.437 ge2 32; 29 up 0 dn; 2025-12 1.86->1.89", "before": {"hits": 0, "med": 2.401953342062319, "ge2": 32}, "after": {"hits": 0, "med": 2.436933919943811, "ge2": 32, "max": 87.51649969162762}}
{"set": "A339", "decision": "KEEP", "edit": "non-fat first partial 0.30->0.20", "reason": "KEEP ge2 32->34 (+2026-02,+2026-03) med flat; 29 up 0 dn", "before": {"hits": 0, "med": 2.436933919943811, "ge2": 32}, "after": {"hits": 0, "med": 2.436933919943811, "ge2": 34, "max": 93.78077729195584}}
{"set": "A340", "decision": "KEEP", "edit": "first partial unify 0.12 all entries", "reason": "KEEP med 2.437->2.541 ge2 34->35 (+2023-04); 31 up 0 dn", "before": {"hits": 0, "med": 2.436933919943811, "ge2": 34}, "after": {"hits": 0, "med": 2.540730090254215, "ge2": 35, "max": 98.9476419225897}}
{"set": "A341", "decision": "KEEP", "edit": "first partial 0.12->0.08 all", "reason": "KEEP med 2.541->2.561 ge2 35; 44 up 0 dn; 2022-09 1.93->1.99", "before": {"hits": 0, "med": 2.540730090254215, "ge2": 35}, "after": {"hits": 0, "med": 2.560555339995915, "ge2": 35, "max": 102.23331315767274}}
{"set": "A342", "decision": "KEEP", "edit": "first partial 0.08->0.05 all", "reason": "KEEP med 2.561->2.575 ge2 35->36 (+2022-09); 44 up 0 dn", "before": {"hits": 0, "med": 2.560555339995915, "ge2": 35}, "after": {"hits": 0, "med": 2.5754242773021896, "ge2": 36, "max": 104.74263538307865}}
{"set": "A343", "decision": "KEEP", "edit": "first partial 0.05->0.03 all", "reason": "KEEP med 2.575->2.606 ge2 36; 45 up 0 dn", "before": {"hits": 0, "med": 2.5754242773021896, "ge2": 36}, "after": {"hits": 0, "med": 2.6057588260510895, "ge2": 36, "max": 106.43713371248843}}
{"set": "A344", "decision": "KEEP", "edit": "first partial 0.03->0.01 all", "reason": "KEEP med 2.606->2.675 ge2 36; 45 up 0 dn", "before": {"hits": 0, "med": 2.6057588260510895, "ge2": 36}, "after": {"hits": 0, "med": 2.6752233876031473, "ge2": 36, "max": 108.14902228212742}}
{"set": "A345", "decision": "REVERT", "edit": "second scale 0.10 all entries", "reason": "REVERT med 2.675->2.667", "before": {"hits": 0, "med": 2.6752233876031473, "ge2": 36}, "after": {"hits": 0, "med": 2.667, "ge2": null}}
{"set": "A346", "decision": "REVERT", "edit": "non-fat second scale 0.28->0.20", "reason": "REVERT med 2.675->2.672", "before": {"hits": 0, "med": 2.6752233876031473, "ge2": 36}, "after": {"hits": 0, "med": 2.672, "ge2": null}}
{"set": "A347", "decision": "REVERT", "edit": "later scale-out 0.12->0.08", "reason": "REVERT med 2.675->2.662", "before": {"hits": 0, "med": 2.6752233876031473, "ge2": 36}, "after": {"hits": 0, "med": 2.662, "ge2": null}}
{"set": "A348", "decision": "KEEP", "edit": "risk_tgt max 0.40 slope 0.28", "reason": "KEEP med 2.675->2.734 ge2 36; 33 up 12 dn; 2025-12 1.97->1.99", "before": {"hits": 0, "med": 2.6752233876031473, "ge2": 36}, "after": {"hits": 0, "med": 2.7339550534573056, "ge2": 36, "max": 121.2526494759279}}
{"set": "A349", "decision": "KEEP", "edit": "risk_tgt max 0.45 slope 0.33", "reason": "KEEP med 2.734->2.779 ge2 36->37 (+2025-12); 33 up 11 dn", "before": {"hits": 0, "med": 2.7339550534573056, "ge2": 36}, "after": {"hits": 0, "med": 2.7790441054048847, "ge2": 37, "max": 131.91639098175807}}
{"set": "A350", "decision": "KEEP", "edit": "risk_tgt max 0.50 slope 0.38", "reason": "KEEP med 2.779->2.866 ge2 37; 32 up 12 dn", "before": {"hits": 0, "med": 2.7790441054048847, "ge2": 37}, "after": {"hits": 0, "med": 2.865921366081888, "ge2": 37, "max": 135.72317477002198}}
{"set": "A351", "decision": "REVERT", "edit": "risk_tgt max 0.55 floor 0.14 slope 0.41", "reason": "REVERT med 2.866->2.522", "before": {"hits": 0, "med": 2.865921366081888, "ge2": 37}, "after": {"hits": 0, "med": 2.522, "ge2": null, "max": 139.04533639467337}}
{"set": "A352", "decision": "REVERT", "edit": "win_size_mult 1.75->2.0", "reason": "REVERT med 2.866->2.421 max-only", "before": {"hits": 0, "med": 2.865921366081888, "ge2": 37}, "after": {"hits": 0, "med": 2.421, "ge2": null, "max": 145.36696147811676}}
{"set": "A353", "decision": "REVERT", "edit": "HTF slope diff 180->120", "reason": "REVERT med 2.866->2.778", "before": {"hits": 0, "med": 2.865921366081888, "ge2": 37}, "after": {"hits": 0, "med": 2.778, "ge2": null}}
{"set": "A354", "decision": "REVERT", "edit": "vol_ok atr_pct 0.0015->0.0013", "reason": "REVERT med 2.866->2.548 max collapse", "before": {"hits": 0, "med": 2.865921366081888, "ge2": 37}, "after": {"hits": 0, "med": 2.548, "ge2": null, "max": 47.647793086501764}}
{"set": "A355", "decision": "REVERT", "edit": "cooldown cap 180->150", "reason": "REVERT identical results (no-op)", "before": {"hits": 0, "med": 2.865921366081888, "ge2": 37}, "after": {"hits": 0, "med": 2.865921366081888, "ge2": 37}}
{"set": "A356", "decision": "REVERT", "edit": "expand_mult cap 1.15->1.10", "reason": "REVERT med identical; hurt 2024-03 10.7->8.5", "before": {"hits": 0, "med": 2.865921366081888, "ge2": 37}, "after": {"hits": 0, "med": 2.865921366081888, "ge2": 37}}
{"set": "A357", "decision": "REVERT", "edit": "breakout_buffer cap 0.25", "reason": "REVERT med 2.866->2.349", "before": {"hits": 0, "med": 2.865921366081888, "ge2": 37}, "after": {"hits": 0, "med": 2.349, "ge2": null}}
{"set": "A358", "decision": "REVERT", "edit": "risk_tgt floor 0.15 slope 0.35", "reason": "REVERT med 2.866->2.553", "before": {"hits": 0, "med": 2.865921366081888, "ge2": 37}, "after": {"hits": 0, "med": 2.553, "ge2": null}}
{"set": "A359", "decision": "KEEP", "edit": "trail_unlock_mult 1.5->1.3", "reason": "KEEP med 2.866->2.893; ge2 37->36 (lost 2025-01); 33 up 9 dn", "before": {"hits": 0, "med": 2.865921366081888, "ge2": 37}, "after": {"hits": 0, "med": 2.893387090431188, "ge2": 36, "max": 261.3401608514909}}
{"set": "A360", "decision": "REVERT", "edit": "trail_unlock_mult 1.3->1.2", "reason": "REVERT med 2.893->2.808 max-only", "before": {"hits": 0, "med": 2.893387090431188, "ge2": 36}, "after": {"hits": 0, "med": 2.808, "ge2": null, "max": 5867.52822293354}}
{"set": "A361", "decision": "KEEP", "edit": "n_fast max(45,n//4)", "reason": "KEEP med 2.893->3.068 ge2 36->37; +2024-04,+2024-11 -2026-02", "before": {"hits": 0, "med": 2.893387090431188, "ge2": 36}, "after": {"hits": 0, "med": 3.067688745395056, "ge2": 37, "max": 261.3401608514909}}
{"set": "A362", "decision": "KEEP", "edit": "n_fast max(30,n//5)", "reason": "KEEP ge2 37->38 (+2025-01) med flat; max 261->4164", "before": {"hits": 0, "med": 3.067688745395056, "ge2": 37}, "after": {"hits": 0, "med": 3.067688745395056, "ge2": 38, "max": 4164.210555185075}}
{"set": "A363", "decision": "REVERT", "edit": "n_fast max(20,n//6)", "reason": "REVERT med 3.068->2.701", "before": {"hits": 0, "med": 3.067688745395056, "ge2": 38}, "after": {"hits": 0, "med": 2.701, "ge2": null, "max": 4164.210555185075}}
{"set": "A364", "decision": "REVERT", "edit": "size_boost 1.8ATR tier 1.35->1.45", "reason": "REVERT med 3.068->2.948", "before": {"hits": 0, "med": 3.067688745395056, "ge2": 38}, "after": {"hits": 0, "med": 2.948, "ge2": null, "max": 4618.6481278362535}}
{"set": "A365", "decision": "KEEP", "edit": "trail_atr cap 6->5", "reason": "KEEP hits 0->1 (2023-01 227690x) med 3.068->3.089; ge2 38->36", "before": {"hits": 0, "med": 3.067688745395056, "ge2": 38}, "after": {"hits": 1, "med": 3.0894756945523496, "ge2": 36, "max": 227690.6546897333}}
{"set": "A366", "decision": "KEEP", "edit": "trail_atr cap 5->4", "reason": "KEEP hits 1 med 3.089->3.229; 2022-12 227->727", "before": {"hits": 1, "med": 3.0894756945523496, "ge2": 36}, "after": {"hits": 1, "med": 3.229348644895211, "ge2": 35, "max": 228436.52036947024}}
{"set": "A367", "decision": "KEEP", "edit": "trail_atr cap 4->3", "reason": "KEEP hits 1 med 3.229->3.577 ge2 35->37", "before": {"hits": 1, "med": 3.229348644895211, "ge2": 35}, "after": {"hits": 1, "med": 3.576708209495311, "ge2": 37, "max": 251963.37341085434}}
{"set": "A368", "decision": "REVERT", "edit": "trail_atr cap 3->2.5", "reason": "REVERT med 3.577->3.335", "before": {"hits": 1, "med": 3.576708209495311, "ge2": 37}, "after": {"hits": 1, "med": 3.335, "ge2": null, "max": 265333.47599587025}}
{"set": "A369", "decision": "REVERT", "edit": "width trail 0.25->0.20", "reason": "REVERT med 3.577->2.197", "before": {"hits": 1, "med": 3.576708209495311, "ge2": 37}, "after": {"hits": 1, "med": 2.197, "ge2": null}}
{"set": "A370", "decision": "REVERT", "edit": "trail_unlock_r 4.0->3.5", "reason": "REVERT med 3.577->3.312", "before": {"hits": 1, "med": 3.576708209495311, "ge2": 37}, "after": {"hits": 1, "med": 3.312, "ge2": null, "max": 41374.917199389885}}
{"set": "A371", "decision": "REVERT", "edit": "sl_grace_bars 5->7", "reason": "REVERT med 3.577->3.325", "before": {"hits": 1, "med": 3.576708209495311, "ge2": 37}, "after": {"hits": 1, "med": 3.325, "ge2": null}}
{"set": "A372", "decision": "REVERT", "edit": "ht_ema span cap 40->30", "reason": "REVERT med 3.577->2.875", "before": {"hits": 1, "med": 3.576708209495311, "ge2": 37}, "after": {"hits": 1, "med": 2.875, "ge2": null, "max": 947469.7862897712}}
{"set": "A373", "decision": "REVERT", "edit": "lookback cap 360->300", "reason": "REVERT med 3.577->3.192", "before": {"hits": 1, "med": 3.576708209495311, "ge2": 37}, "after": {"hits": 1, "med": 3.192, "ge2": null}}
{"set": "A374", "decision": "KEEP", "edit": "risk_cap_pct 0.0033->0.0028", "reason": "KEEP hits 1 med 3.577->3.676 ge2 37->38; 26 up 15 dn", "before": {"hits": 1, "med": 3.576708209495311, "ge2": 37}, "after": {"hits": 1, "med": 3.6762562123678553, "ge2": 38, "max": 58518.105515147625}}
{"set": "A375", "decision": "KEEP", "edit": "risk_cap_pct 0.0028->0.0025", "reason": "KEEP hits 1 med 3.676->3.811 ge2 38->39; 34 up 4 dn", "before": {"hits": 1, "med": 3.6762562123678553, "ge2": 38}, "after": {"hits": 1, "med": 3.811319354201181, "ge2": 39, "max": 75677.2995076853}}
{"set": "A376", "decision": "REVERT", "edit": "risk_cap_pct 0.0025->0.0022", "reason": "REVERT med 3.811->2.994", "before": {"hits": 1, "med": 3.811319354201181, "ge2": 39}, "after": {"hits": 1, "med": 2.994, "ge2": null, "max": 101175.25341663042}}
{"set": "A377", "decision": "REVERT", "edit": "risk_tgt max 0.52 slope 0.40", "reason": "REVERT med 3.811->3.679", "before": {"hits": 1, "med": 3.811319354201181, "ge2": 39}, "after": {"hits": 1, "med": 3.679, "ge2": null}}
{"set": "A378", "decision": "KEEP", "edit": "trail_scale_max 8->10", "reason": "KEEP hits 1 med 3.811->3.913 ge2 39; 43 up 0 dn; 2024-01 804x", "before": {"hits": 1, "med": 3.811319354201181, "ge2": 39}, "after": {"hits": 1, "med": 3.9128958001869876, "ge2": 39, "max": 76160.84831902198}}
{"set": "A379", "decision": "REVERT", "edit": "trail_scale_max 10->12", "reason": "REVERT med 3.913->3.798", "before": {"hits": 1, "med": 3.9128958001869876, "ge2": 39}, "after": {"hits": 1, "med": 3.798, "ge2": null}}
{"set": "A380", "decision": "KEEP", "edit": "later scale-out 0.12->0.08 @scale_max10", "reason": "KEEP hits 1 med 3.913->4.044 ge2 39->40", "before": {"hits": 1, "med": 3.9128958001869876, "ge2": 39}, "after": {"hits": 1, "med": 4.044461846669178, "ge2": 40, "max": 75457.67366850498}}
{"set": "A381", "decision": "KEEP", "edit": "later scale-out 0.08->0.05", "reason": "KEEP hits 1 med 4.044->4.121 ge2 40", "before": {"hits": 1, "med": 4.044461846669178, "ge2": 40}, "after": {"hits": 1, "med": 4.121250111399543, "ge2": 40, "max": 74774.74122108197}}
{"set": "A382", "decision": "REVERT", "edit": "later scale-out 0.05->0.03", "reason": "REVERT med 4.121->4.112", "before": {"hits": 1, "med": 4.121250111399543, "ge2": 40}, "after": {"hits": 1, "med": 4.112, "ge2": null}}
{"set": "A383", "decision": "KEEP", "edit": "1.5ATR boost 1.25->1.30", "reason": "KEEP hits 1 med 4.121->4.156 ge2 40", "before": {"hits": 1, "med": 4.121250111399543, "ge2": 40}, "after": {"hits": 1, "med": 4.156255047340446, "ge2": 40, "max": 74774.74122108197}}
{"set": "A384", "decision": "REVERT", "edit": "1.5ATR boost 1.30->1.32", "reason": "REVERT med/ge2/hits identical", "before": {"hits": 1, "med": 4.156255047340446, "ge2": 40}, "after": {"hits": 1, "med": 4.156255047340446, "ge2": 40}}
{"set": "A385", "decision": "REVERT", "edit": "1.2ATR boost 1.10->1.12", "reason": "REVERT med/ge2 identical", "before": {"hits": 1, "med": 4.156255047340446, "ge2": 40}, "after": {"hits": 1, "med": 4.156255047340446, "ge2": 40}}
{"set": "A386", "decision": "KEEP", "edit": "post-scale trail *0.005->0.004", "reason": "KEEP hits 1 med 4.156->4.160 ge2 40; 43 up 0 dn", "before": {"hits": 1, "med": 4.156255047340446, "ge2": 40}, "after": {"hits": 1, "med": 4.1600831873190804, "ge2": 40, "max": 74961.7685667321}}
{"set": "A387", "decision": "KEEP", "edit": "post-scale trail *0.004->0.003", "reason": "KEEP hits 1 med 4.160->4.164 ge2 40", "before": {"hits": 1, "med": 4.1600831873190804, "ge2": 40}, "after": {"hits": 1, "med": 4.164, "ge2": 40}}
{"set": "A388", "decision": "KEEP", "edit": "post-scale trail *0.003->0.002", "reason": "KEEP hits 1 med 4.164->4.168 ge2 40", "before": {"hits": 1, "med": 4.163912997865882, "ge2": 40}, "after": {"hits": 1, "med": 4.167744478980851, "ge2": 40, "max": 75336.86917627104}}
{"set": "A389", "decision": "KEEP", "edit": "second scale fat0.08 nonfat0.20", "reason": "KEEP hits 1 med 4.168->4.188 ge2 40", "before": {"hits": 1, "med": 4.167744478980882, "ge2": 40}, "after": {"hits": 1, "med": 4.188113556673663, "ge2": 40}}
{"set": "A390", "decision": "KEEP", "edit": "second scale fat0.06 nonfat0.16", "reason": "KEEP hits 1 med 4.188->4.210 ge2 40", "before": {"hits": 1, "med": 4.188113556673663, "ge2": 40}, "after": {"hits": 1, "med": 4.209945025097388, "ge2": 40}}
{"set": "A391", "decision": "KEEP", "edit": "second scale fat0.04 nonfat0.12", "reason": "KEEP hits 1 med 4.210->4.232", "before": {"hits": 1, "med": 4.209945025097388}, "after": {"hits": 1, "med": 4.231759926215989}}
{"set": "A392", "decision": "KEEP", "edit": "second scale fat0.02 nonfat0.08", "reason": "KEEP hits 1 med 4.232->4.254", "before": {"hits": 1, "med": 4.231759926215989}, "after": {"hits": 1, "med": 4.253558260029464}}
{"set": "A393", "decision": "REVERT", "edit": "second scale unify 0.05 all", "reason": "REVERT med 4.254->4.217", "before": {"hits": 1, "med": 4.253558260029464}, "after": {"hits": 1, "med": 4.217}}
{"set": "A394", "decision": "KEEP", "edit": "first partial 0.01->0.005", "reason": "KEEP hits 1 med 4.254->4.276", "before": {"hits": 1, "med": 4.253558260029464}, "after": {"hits": 1, "med": 4.275583095336883}}
{"set": "A395", "decision": "KEEP", "edit": "first partial 0.005->0.002", "reason": "KEEP hits 1 med 4.276->4.289", "before": {"hits": 1, "med": 4.275583095336883}, "after": {"hits": 1, "med": 4.288822892007318}}
{"set": "A396", "decision": "KEEP", "edit": "first partial 0.002->0.001", "reason": "KEEP hits 1 med 4.289->4.293", "before": {"hits": 1, "med": 4.288822892007318}, "after": {"hits": 1, "med": 4.293240306811791}}
{"set": "A397", "decision": "KEEP", "edit": "win_size_max 4->5", "reason": "KEEP hits 1 med 4.293->4.346", "before": {"hits": 1, "med": 4.293240306811791}, "after": {"hits": 1, "med": 4.34595322413416}}
{"set": "A398", "decision": "REVERT", "edit": "win_size_max 5->6", "reason": "REVERT med identical; 2024-01 max-only 1217->1554", "before": {"hits": 1, "med": 4.34595322413416, "ge2": 40}, "after": {"hits": 1, "med": 4.34595322413416, "ge2": 40, "max": 148231.88677302745}}
{"set": "A399", "decision": "REVERT", "edit": "lev_cap mult 1.5->1.6", "reason": "REVERT med/ge2 identical", "before": {"hits": 1, "med": 4.34595322413416, "ge2": 40}, "after": {"hits": 1, "med": 4.34595322413416, "ge2": 40}}
{"set": "A400", "decision": "REVERT", "edit": "expand_med rolling 500->300", "reason": "REVERT med 4.346->4.293", "before": {"hits": 1, "med": 4.34595322413416, "ge2": 40}, "after": {"hits": 1, "med": 4.293, "ge2": null}}
{"set": "A401", "decision": "REVERT", "edit": "daily EMA min_periods half", "reason": "REVERT med 4.346->3.226", "before": {"hits": 1, "med": 4.34595322413416, "ge2": 40}, "after": {"hits": 1, "med": 3.226, "ge2": null}}
{"set": "A402", "decision": "REVERT", "edit": "win_size_mult 1.75->1.85", "reason": "REVERT med 4.346->3.294", "before": {"hits": 1, "med": 4.34595322413416, "ge2": 40}, "after": {"hits": 1, "med": 3.294, "ge2": null}}
{"set": "A403", "decision": "REVERT", "edit": "size_boost 1.40@2.0ATR", "reason": "REVERT med 4.346->4.235", "before": {"hits": 1, "med": 4.34595322413416, "ge2": 40}, "after": {"hits": 1, "med": 4.235, "ge2": null}}
{"set": "A404", "decision": "REVERT", "edit": "trail_unlock_mult 1.3->1.25", "reason": "REVERT med 4.346->3.227", "before": {"hits": 1, "med": 4.34595322413416, "ge2": 40}, "after": {"hits": 1, "med": 3.227, "ge2": null}}
{"set": "A405", "decision": "REVERT", "edit": "n_fast max(35,n//5)", "reason": "REVERT no-op identical (still 72)", "before": {"hits": 1, "med": 4.34595322413416, "ge2": 40}, "after": {"hits": 1, "med": 4.34595322413416, "ge2": 40}}
{"set": "A406", "decision": "REVERT", "edit": "n_fast max(30,n//4)", "reason": "REVERT hits 1->0 (lost 2023-01); med flat", "before": {"hits": 1, "med": 4.34595322413416, "ge2": 40}, "after": {"hits": 0, "med": 4.346, "ge2": null, "max": 1217.0617213643063}}
{"set": "A407", "decision": "REVERT", "edit": "trail_atr cap 3.0->2.8", "reason": "REVERT med 4.346->3.226", "before": {"hits": 1, "med": 4.34595322413416, "ge2": 40}, "after": {"hits": 1, "med": 3.226, "ge2": null}}
{"set": "A408", "decision": "KEEP", "edit": "risk_cap 0.0025->0.0024", "reason": "KEEP hits 1 med 4.346->4.351 ge2 40", "before": {"hits": 1, "med": 4.34595322413416, "ge2": 40}, "after": {"hits": 1, "med": 4.351493959306939, "ge2": 41}}
{"set": "A409", "decision": "REVERT", "edit": "risk_cap 0.0024->0.00235", "reason": "REVERT med 4.351->3.403", "before": {"hits": 1, "med": 4.351493959306939, "ge2": 41}, "after": {"hits": 1, "med": 3.403, "ge2": null}}
{"tag": "A410", "decision": "REVERT", "reason": "hits 1->0; med same; max collapsed"}
{"set": "A411", "decision": "KEEP", "edit": "later scale close_frac 0.05->0.04", "reason": "KEEP hits 1 med 4.351->4.396", "before": {"hits": 1, "med": 4.351493959306939, "ge2": 41}, "after": {"hits": 1, "med": 4.395573057514664, "ge2": 41, "max": 127600.72544017991}}
{"set": "A412", "decision": "KEEP", "edit": "later scale close_frac 0.04->0.035", "reason": "KEEP hits 1 med 4.396->4.418", "before": {"hits": 1, "med": 4.395573057514664, "ge2": 41}, "after": {"hits": 1, "med": 4.4181883094220185, "ge2": 41, "max": 127320.51525883791}}
{"set": "A413", "decision": "KEEP", "edit": "later scale close_frac 0.035->0.03", "reason": "KEEP hits 1 med 4.418->4.441", "before": {"hits": 1, "med": 4.4181883094220185, "ge2": 41}, "after": {"hits": 1, "med": 4.441194988481845, "ge2": 41, "max": 127030.44428365843}}
