{"set": "A106", "decision": "REVERT", "edit": "width trail 0.30", "reason": "REVERT med 1.547->1.367 ge2 19->19", "before": {"hits": 0, "med": 1.5469101277995154, "max": 37.21480693041065, "mean": 3.637258927041448, "ge2": 19}, "after": {"hits": 0, "med": 1.367013355350075, "max": 35.23992622624054, "mean": 3.5735560905060635, "ge2": 19}}
{"set": "A107", "decision": "REVERT", "edit": "width trail 0.20", "reason": "REVERT med 1.547->1.437 ge2 19->17", "before": {"hits": 0, "med": 1.5469101277995154, "max": 37.21480693041065, "mean": 3.637258927041448, "ge2": 19}, "after": {"hits": 0, "med": 1.4370635829765406, "max": 44.06176430354623, "mean": 3.3862695605639606, "ge2": 17}}
{"set": "A108", "decision": "REVERT", "edit": "sl_grace 8", "reason": "REVERT med 1.547->1.539 ge2 19->18", "before": {"hits": 0, "med": 1.5469101277995154, "ge2": 19, "max": 37.21480693041065}, "after": {"hits": 0, "med": 1.5385040943359949, "ge2": 18, "max": 42.88978039087261}}
{"set": "A109", "decision": "REVERT", "edit": "reentry 0", "reason": "REVERT med 1.547->1.370 ge2 19->17 max-only", "before": {"hits": 0, "med": 1.5469101277995154, "max": 37.21480693041065, "mean": 3.637258927041448, "ge2": 19, "surv": 0.2542372881355932}, "after": {"hits": 0, "med": 1.3703150503608783, "max": 58.86129948840932, "mean": 4.467394650029785, "ge2": 17, "surv": 0.3050847457627119}}
{"set": "A110", "decision": "REVERT", "edit": "day path no buf", "reason": "REVERT med 1.547->1.369 ge2 19->19", "before": {"hits": 0, "med": 1.5469101277995154, "max": 37.21480693041065, "mean": 3.637258927041448, "ge2": 19}, "after": {"hits": 0, "med": 1.369394580343501, "max": 37.21480693041065, "mean": 3.7873818530214374, "ge2": 19}}
{"set": "A111", "decision": "REVERT", "edit": "SL min 0.5ATR", "reason": "REVERT noop (body 0.45 already implies wide wick)", "before": {"hits": 0, "med": 1.5469101277995154, "ge2": 19}, "after": {"hits": 0, "med": 1.5469101277995154, "ge2": 19}}
{"set": "A112", "decision": "REVERT", "edit": "be_at_r 1.5", "reason": "REVERT med 1.547->1.213 ge2 19->22", "before": {"hits": 0, "med": 1.5469101277995154, "max": 37.21480693041065, "mean": 3.637258927041448, "ge2": 19, "surv": 0.2542372881355932}, "after": {"hits": 0, "med": 1.2132344241548114, "max": 40.51131440194008, "mean": 3.3483365149535302, "ge2": 22, "surv": 0.3050847457627119}}
{"set": "A113", "decision": "REVERT", "edit": "body 0.5", "reason": "REVERT med/ge2 flat mean 3.637->3.629", "before": {"hits": 0, "med": 1.5469101277995154, "ge2": 19, "mean": 3.637258927041448}, "after": {"hits": 0, "med": 1.5469101277995154, "ge2": 19, "mean": 3.6289773353705463}}
{"set": "A114", "decision": "REVERT", "edit": "n_fast n//4", "reason": "REVERT med 1.547->1.539 ge2 19->18", "before": {"hits": 0, "med": 1.5469101277995154, "ge2": 19}, "after": {"hits": 0, "med": 1.5385040943359949, "ge2": 18}}
{"set": "A115", "decision": "REVERT", "edit": "skip ATR climax p90", "reason": "REVERT med 1.547->1.000 ge2 19->5", "before": {"hits": 0, "med": 1.5469101277995154, "max": 37.21480693041065, "mean": 3.637258927041448, "ge2": 19, "surv": 0.2542372881355932}, "after": {"hits": 0, "med": 1.0, "max": 18.337100514458406, "mean": 1.5308155763982694, "ge2": 5, "surv": 0.559322033898305}}
{"set": "A116", "decision": "KEEP", "edit": "cooldown cap 180", "reason": "KEEP ge2 19->21 (med flat)", "before": {"hits": 0, "med": 1.5469101277995154, "ge2": 19, "mean": 3.637258927041448, "max": 37.21480693041065}, "after": {"hits": 0, "med": 1.5469101277995154, "ge2": 21, "mean": 3.511727561782988, "max": 37.21480693041065}}
{"set": "A117", "decision": "KEEP", "edit": "ht_ema cap 40", "reason": "KEEP ge2 21->22 (med flat, mean 3.51->3.63)", "before": {"hits": 0, "med": 1.5469101277995154, "ge2": 21, "mean": 3.511727561782988}, "after": {"hits": 0, "med": 1.5469101277995154, "ge2": 22, "mean": 3.627047504768815, "max": 37.21480693041065}}
{"set": "A118", "decision": "REVERT", "edit": "expand cap 1.10", "reason": "REVERT med/ge2 flat mean 3.627->3.611 (2 windows down)", "before": {"hits": 0, "med": 1.5469101277995154, "ge2": 22, "mean": 3.627047504768815}, "after": {"hits": 0, "med": 1.5469101277995154, "ge2": 22, "mean": 3.611451129196678}}
{"set": "A119", "decision": "REVERT", "edit": "unlock_r 3.5", "reason": "REVERT med 1.547->1.539 ge2 22->22", "before": {"hits": 0, "med": 1.5469101277995154, "ge2": 22, "mean": 3.627047504768815, "max": 37.21480693041065}, "after": {"hits": 0, "med": 1.5385040943359949, "ge2": 22, "mean": 3.6878103508984914, "max": 42.71699244262672}}
{"set": "A120", "decision": "REVERT", "edit": "ht_ema 34", "reason": "REVERT med 1.547->1.463 ge2 22->21", "before": {"hits": 0, "med": 1.5469101277995154, "max": 37.21480693041065, "mean": 3.627047504768815, "ge2": 22}, "after": {"hits": 0, "med": 1.462964959519212, "max": 30.033625643392778, "mean": 2.8529266865675673, "ge2": 21}}
{"set": "A121", "decision": "REVERT", "edit": "buffer cap 0.30", "reason": "REVERT med 1.547->1.422 ge2 22->21", "before": {"hits": 0, "med": 1.5469101277995154, "max": 37.21480693041065, "mean": 3.627047504768815, "ge2": 22}, "after": {"hits": 0, "med": 1.4218176270071845, "max": 37.21480693041065, "mean": 3.755817995576371, "ge2": 21}}
{"set": "A122", "decision": "REVERT", "edit": "cooldown cap 150", "reason": "REVERT noop identical to A116 180", "before": {"hits": 0, "med": 1.5469101277995154, "ge2": 22}, "after": {"hits": 0, "med": 1.5469101277995154, "ge2": 22}}
{"set": "A123", "decision": "REVERT", "edit": "ROC90 OR ROC120", "reason": "REVERT med/ge2 flat mean 3.627->3.596", "before": {"hits": 0, "med": 1.5469101277995154, "ge2": 22, "mean": 3.627047504768815}, "after": {"hits": 0, "med": 1.5469101277995154, "ge2": 22, "mean": 3.5957483866651496}}
{"set": "A124", "decision": "REVERT", "edit": "risk floor 0.14", "reason": "REVERT med 1.547->1.521 ge2 22->22", "before": {"hits": 0, "med": 1.5469101277995154, "max": 37.21480693041065, "mean": 3.627047504768815, "ge2": 22}, "after": {"hits": 0, "med": 1.520577596255146, "max": 40.0274241107731, "mean": 3.639010335275574, "ge2": 22}}
{"set": "A125", "decision": "REVERT", "edit": "1h ROC12", "reason": "REVERT med 1.547->1.239 ge2 22->21", "before": {"hits": 0, "med": 1.5469101277995154, "max": 37.21480693041065, "mean": 3.627047504768815, "ge2": 22}, "after": {"hits": 0, "med": 1.2388609679356808, "max": 37.21480693041065, "mean": 3.058748862107532, "ge2": 21}}
{"set": "A126", "decision": "REVERT", "edit": "ROC |min| 0.1%", "reason": "REVERT med 1.547->1.463 ge2 22->22", "before": {"hits": 0, "med": 1.5469101277995154, "max": 37.21480693041065, "mean": 3.627047504768815, "ge2": 22}, "after": {"hits": 0, "med": 1.462964959519212, "max": 37.21480693041065, "mean": 3.61389642260961, "ge2": 22}}
{"set": "A127", "decision": "REVERT", "edit": "Donchian first-cross", "reason": "REVERT noop (cooldown already implied first-cross)", "before": {"hits": 0, "med": 1.5469101277995154, "ge2": 22}, "after": {"hits": 0, "med": 1.5469101277995154, "ge2": 22}}
{"set": "A128", "decision": "REVERT", "edit": "2-day day path", "reason": "REVERT med 1.547->1.463 ge2 22->23", "before": {"hits": 0, "med": 1.5469101277995154, "max": 37.21480693041065, "mean": 3.627047504768815, "ge2": 22}, "after": {"hits": 0, "med": 1.462964959519212, "max": 23.95890130790185, "mean": 3.028914948542014, "ge2": 23}}
{"set": "A129", "decision": "REVERT", "edit": "slope 240", "reason": "REVERT med 1.547->1.539 ge2 22->19", "before": {"hits": 0, "med": 1.5469101277995154, "ge2": 22, "max": 37.21480693041065}, "after": {"hits": 0, "med": 1.5385040943359949, "ge2": 19, "max": 30.033625643392778}}
{"set": "A130", "decision": "REVERT", "edit": "expand_sma size_boost 1.15", "reason": "REVERT med 1.547->1.539 ge2 22->22", "before": {"hits": 0, "med": 1.5469101277995154, "ge2": 22, "mean": 3.627047504768815}, "after": {"hits": 0, "med": 1.5385040943359949, "ge2": 22, "mean": 3.711642263713701}}
{"set": "A131", "decision": "KEEP", "edit": "partial 0.70", "reason": "KEEP med 1.54691->1.54711 (ge2 22 flat)", "before": {"hits": 0, "med": 1.5469101277995154, "ge2": 22, "mean": 3.627047504768815, "max": 37.21480693041065}, "after": {"hits": 0, "med": 1.5471118299572124, "ge2": 22, "mean": 3.6197830079219853, "max": 37.2529318739332}}
{"set": "A132", "decision": "REVERT", "edit": "progress-scaled trail", "reason": "REVERT med 1.547->1.321 ge2 22->20 max-only", "before": {"hits": 0, "med": 1.5471118299572124, "max": 37.2529318739332, "mean": 3.6197830079219853, "ge2": 22}, "after": {"hits": 0, "med": 1.3214591375822131, "max": 42.27595801226371, "mean": 3.4225884692498356, "ge2": 20}}
{"set": "A133", "decision": "REVERT", "edit": "close_loc 0.55/0.45", "reason": "REVERT med 1.547->1.463 ge2 22->22", "before": {"hits": 0, "med": 1.5471118299572124, "max": 37.2529318739332, "mean": 3.6197830079219853, "ge2": 22}, "after": {"hits": 0, "med": 1.4634298409838158, "max": 46.37336644623145, "mean": 3.766311748113485, "ge2": 22}}
{"set": "A134", "decision": "REVERT", "edit": "HTF 2h", "reason": "REVERT med 1.547->1.229 ge2 22->18 max-only 85.7", "before": {"hits": 0, "med": 1.5471118299572124, "max": 37.2529318739332, "mean": 3.6197830079219853, "ge2": 22}, "after": {"hits": 0, "med": 1.2287227435008097, "max": 85.69608593115493, "mean": 4.117234426371161, "ge2": 18}}
{"set": "A135", "decision": "REVERT", "edit": "ATR 21", "reason": "REVERT med 1.547->1.301 ge2 22->19", "before": {"hits": 0, "med": 1.5471118299572124, "max": 37.2529318739332, "mean": 3.6197830079219853, "ge2": 22}, "after": {"hits": 0, "med": 1.3008195580754542, "max": 33.134580294288114, "mean": 2.69835668485298, "ge2": 19}}
{"set": "A136", "decision": "REVERT", "edit": "daily EMA 100", "reason": "REVERT med 1.547->1.259 ge2 22->21", "before": {"hits": 0, "med": 1.5471118299572124, "max": 37.2529318739332, "mean": 3.6197830079219853, "ge2": 22}, "after": {"hits": 0, "med": 1.2591361378406354, "max": 37.2529318739332, "mean": 3.108373660787253, "ge2": 21}}
{"set": "A137", "decision": "REVERT", "edit": "sl_grace 6", "reason": "REVERT med 1.547->1.539 ge2 22->21 (one 2.89->1.0)", "before": {"hits": 0, "med": 1.5471118299572124, "ge2": 22}, "after": {"hits": 0, "med": 1.5385040943359949, "ge2": 21}}
{"set": "A138", "decision": "REVERT", "edit": "ROC 100", "reason": "REVERT med 1.547->1.539 ge2 22->22 mean down", "before": {"hits": 0, "med": 1.5471118299572124, "ge2": 22, "mean": 3.6197830079219853}, "after": {"hits": 0, "med": 1.5385040943359949, "ge2": 22, "mean": 3.54769175354827}}
{"set": "A139", "decision": "REVERT", "edit": "win_size_mult 1.85", "reason": "REVERT med 1.547->1.539 ge2 22->22", "before": {"hits": 0, "med": 1.5471118299572124, "max": 37.2529318739332, "mean": 3.6197830079219853, "ge2": 22}, "after": {"hits": 0, "med": 1.5389370136245786, "max": 38.77752977051751, "mean": 3.7189193046199707, "ge2": 22}}
{"set": "A140", "decision": "REVERT", "edit": "size_mult step-down on loss", "reason": "REVERT med/ge2 flat mean 3.620->3.613 (1 window 2.72->2.35)", "before": {"hits": 0, "med": 1.5471118299572124, "ge2": 22, "mean": 3.6197830079219853}, "after": {"hits": 0, "med": 1.5471118299572124, "ge2": 22, "mean": 3.6134957352299}}
{"set": "A141", "decision": "REVERT", "edit": "15m Donchian 4h", "reason": "REVERT med 1.547->1.421 ge2 22->22", "before": {"hits": 0, "med": 1.5471118299572124, "max": 37.2529318739332, "mean": 3.6197830079219853, "ge2": 22}, "after": {"hits": 0, "med": 1.421149442179266, "max": 27.726482845567823, "mean": 3.3703326527699993, "ge2": 22}}
{"set": "A142", "decision": "REVERT", "edit": "expand_med 1440", "reason": "REVERT med/ge2 flat mean 3.620->3.617", "before": {"hits": 0, "med": 1.5471118299572124, "ge2": 22, "mean": 3.6197830079219853}, "after": {"hits": 0, "med": 1.5471118299572124, "ge2": 22, "mean": 3.6167625591998003}}
{"set": "A143", "decision": "REVERT", "edit": "partial only at 1R", "reason": "REVERT med/ge2 flat, 9 windows all down", "before": {"hits": 0, "med": 1.5471118299572124, "ge2": 22, "mean": 3.6197830079219853}, "after": {"hits": 0, "med": 1.5471118299572124, "ge2": 22, "mean": 3.607605136017017}}
{"set": "A144", "decision": "REVERT", "edit": "lookback 300", "reason": "REVERT med 1.547->1.421 ge2 22->22", "before": {"hits": 0, "med": 1.5471118299572124, "max": 37.2529318739332, "mean": 3.6197830079219853, "ge2": 22}, "after": {"hits": 0, "med": 1.4213394246915496, "max": 38.68844753692841, "mean": 3.544784569990322, "ge2": 22}}
{"set": "A145", "decision": "REVERT", "edit": "vol_ok 0.0018", "reason": "REVERT med 1.547->1.155 ge2 22->17", "before": {"hits": 0, "med": 1.5471118299572124, "max": 37.2529318739332, "mean": 3.6197830079219853, "ge2": 22}, "after": {"hits": 0, "med": 1.1552280479955457, "max": 18.76148173746552, "mean": 2.1444942768646675, "ge2": 17}}
{"set": "A146", "decision": "REVERT", "edit": "win_size after 25% progress", "reason": "REVERT med 1.547->1.539 ge2 22->24 (median first)", "before": {"hits": 0, "med": 1.5471118299572124, "ge2": 22, "max": 37.2529318739332, "mean": 3.6197830079219853}, "after": {"hits": 0, "med": 1.5389370136245786, "ge2": 24, "max": 40.57360889558679, "mean": 3.899704806467231}}
{"set": "A147", "decision": "KEEP", "edit": "second scale-out 50%", "reason": "KEEP med 1.547->1.551 (ge2 22, mean 3.620->3.654)", "before": {"hits": 0, "med": 1.5471118299572124, "ge2": 22, "mean": 3.6197830079219853, "max": 37.2529318739332}, "after": {"hits": 0, "med": 1.5508226952566089, "ge2": 22, "mean": 3.6537695368693575, "max": 37.46604453292422}}
{"set": "A148", "decision": "REVERT", "edit": "keep size_mult after partial", "reason": "REVERT noop identical to A147", "before": {"hits": 0, "med": 1.5508226952566089, "ge2": 22}, "after": {"hits": 0, "med": 1.5508226952566089, "ge2": 22}}
{"set": "A149", "decision": "REVERT", "edit": "second scale-out 0.4", "reason": "REVERT med 1.55082->1.55063 ge2 22->22", "before": {"hits": 0, "med": 1.5508226952566089, "ge2": 22, "max": 37.46604453292422}, "after": {"hits": 0, "med": 1.550628871683491, "ge2": 22, "max": 37.42336409626727}}
{"set": "A150", "decision": "KEEP", "edit": "third scale-out 50%", "reason": "KEEP med 1.551->1.559 (ge2 22, 38 windows up)", "before": {"hits": 0, "med": 1.5508226952566089, "ge2": 22, "mean": 3.6537695368693575, "max": 37.46604453292422}, "after": {"hits": 0, "med": 1.5588549382169643, "ge2": 22, "mean": 3.6437304353219147, "max": 37.59140167795285}}
{"set": "A151", "decision": "KEEP", "edit": "fourth scale-out 50%", "reason": "KEEP med 1.559->1.561 (ge2 22, 39/39 up)", "before": {"hits": 0, "med": 1.5588549382169643, "ge2": 22, "mean": 3.6437304353219147}, "after": {"hits": 0, "med": 1.561107628165383, "ge2": 22, "mean": 3.649116442779321, "max": 37.64847359004854}}
{"set": "A152", "decision": "KEEP", "edit": "fifth scale-out 50%", "reason": "KEEP med 1.561->1.562 (ge2 22, 39/39 up)", "before": {"hits": 0, "med": 1.561107628165383, "ge2": 22, "mean": 3.649116442779321}, "after": {"hits": 0, "med": 1.5622978119655455, "ge2": 22, "mean": 3.6519448227140217, "max": 37.691385434580646}}
{"set": "A153", "decision": "KEEP", "edit": "sixth scale-out 50%", "reason": "KEEP med 1.5623->1.5628 ge2 22->22", "before": {"hits": 0, "med": 1.5622978119655455, "ge2": 22, "mean": 3.6519448227140217}, "after": {"hits": 0, "med": 1.5628472278166765, "ge2": 22, "mean": 3.6535615609128276, "max": 37.708983986123314}}
{"set": "A154", "decision": "KEEP", "edit": "trail_scale_max 7", "reason": "KEEP med 1.5628->1.5630 (ge2 22, 39/39 up)", "before": {"hits": 0, "med": 1.5628472278166765, "ge2": 22, "mean": 3.6535615609128276}, "after": {"hits": 0, "med": 1.563033917256881, "ge2": 22, "mean": 3.6542247282648606, "max": 37.71661825687804}}
{"set": "A155", "decision": "REVERT", "edit": "body 0.47", "reason": "REVERT med/ge2 flat (1 window 9.15->9.34 mean-only)", "before": {"hits": 0, "med": 1.563033917256881, "ge2": 22, "mean": 3.6542247282648606}, "after": {"hits": 0, "med": 1.563033917256881, "ge2": 22, "mean": 3.6574384125980632}}
{"set": "A156", "decision": "REVERT", "edit": "HTF slope 160", "reason": "REVERT med/ge2/min flat; 2023-02-25 4.34->3.73", "before": {"hits": 0, "med": 1.563033917256881, "ge2": 22, "max": 37.71661825687804}, "after": {"hits": 0, "med": 1.563033917256881, "ge2": 22, "max": 37.71661825687804}}
{"set": "A157", "decision": "REVERT", "edit": "size_mult on first partial, no reset on tail loss", "reason": "REVERT med/ge2/min flat; 1 window 2.97->2.75", "before": {"hits": 0, "med": 1.563033917256881, "ge2": 22, "mean": 3.6542247282648606}, "after": {"hits": 0, "med": 1.563033917256881, "ge2": 22, "mean": 3.6504568179456665}}
{"set": "A158", "decision": "REVERT", "edit": "Kaufman ER(60)>=0.18", "reason": "REVERT med 1.563->1.372 max 37.7->32.1", "before": {"hits": 0, "med": 1.563033917256881, "ge2": 22, "max": 37.71661825687804}, "after": {"hits": 0, "med": 1.3719302719325437, "ge2": 21, "max": 32.137833967625646, "mean": 3.2587475788238804}}
{"set": "A159", "decision": "REVERT", "edit": "later scale-out frac 0.55", "reason": "REVERT med 1.563->1.561 ge2 22", "before": {"hits": 0, "med": 1.563033917256881, "ge2": 22, "mean": 3.6542247282648606, "max": 37.71661825687804}, "after": {"hits": 0, "med": 1.5608520871650216, "ge2": 22, "mean": 3.651097475777725, "max": 37.70754490469609}}
{"set": "A160", "decision": "REVERT", "edit": "unlock_r 4.5", "reason": "REVERT med 1.563->1.468 ge2 22", "before": {"hits": 0, "med": 1.563033917256881, "ge2": 22}, "after": {"hits": 0, "med": 1.4680060179010102, "ge2": 22, "max": 37.71661825687804}}
{"set": "A161", "decision": "REVERT", "edit": "risk_tgt 0.10+0.25p", "reason": "REVERT med 1.563->1.479 max 37.7->34.6", "before": {"hits": 0, "med": 1.563033917256881, "ge2": 22}, "after": {"hits": 0, "med": 1.478943615115129, "ge2": 21, "max": 34.55953800775659}}
{"set": "A162", "decision": "REVERT", "edit": "vol_ok 0.0014", "reason": "REVERT med 1.563->1.441 ge2 22", "before": {"hits": 0, "med": 1.563033917256881, "ge2": 22}, "after": {"hits": 0, "med": 1.44148271445164, "ge2": 21, "max": 36.672959578285074}}
{"set": "A163", "decision": "REVERT", "edit": "width_tr 0.27", "reason": "REVERT med 1.563->1.460", "before": {"hits": 0, "med": 1.563033917256881, "ge2": 22}, "after": {"hits": 0, "med": 1.460237686058588, "ge2": 22, "max": 35.09771362382227}}
{"set": "A164", "decision": "REVERT", "edit": "yield leftover after 3 scale-outs", "reason": "REVERT identical peaks (6 windows extra trades, leftover too small)", "before": {"hits": 0, "med": 1.563033917256881, "ge2": 22}, "after": {"hits": 0, "med": 1.563033917256881, "ge2": 22}}
{"set": "A165", "decision": "REVERT", "edit": "yield leftover after first scale-out", "reason": "REVERT med/ge2 flat; 2024-01-21 25.2->23.2", "before": {"hits": 0, "med": 1.563033917256881, "ge2": 22}, "after": {"hits": 0, "med": 1.563033917256881, "ge2": 22, "mean": 3.619325243101762}}
{"set": "A166", "decision": "REVERT", "edit": "ht_ema cap 38", "reason": "REVERT med 1.563->1.545", "before": {"hits": 0, "med": 1.563033917256881, "ge2": 22}, "after": {"hits": 0, "med": 1.5450050094337329, "ge2": 21, "max": 37.71661825687804}}
{"set": "A167", "decision": "REVERT", "edit": "expand_med 400/80", "reason": "REVERT med 1.563033917256881->1.563033917256881 ge2 22", "before": {"hits": 0, "med": 1.563033917256881, "ge2": 22}, "after": {"hits": 0, "med": 1.563033917256881, "ge2": 22}}
{"set": "A168", "decision": "REVERT", "edit": "partial_trail_frac 0.72", "reason": "REVERT med 1.563->1.555", "before": {"hits": 0, "med": 1.563033917256881, "ge2": 22}, "after": {"hits": 0, "med": 1.5550740331898028, "ge2": 22, "max": 37.71119574172092}}
{"set": "A169", "decision": "REVERT", "edit": "atr_sma cap 160", "reason": "REVERT med/ge2 flat maxd=0.8507", "before": {"hits": 0, "med": 1.563033917256881, "ge2": 22}, "after": {"hits": 0, "med": 1.563033917256881, "ge2": 22}}
{"set": "A170", "decision": "REVERT", "edit": "reentry cap 120", "reason": "REVERT med 1.5630->1.5450 ge2 22->21", "before": {"hits": 0, "med": 1.563033917256881, "ge2": 22}, "after": {"hits": 0, "med": 1.5450050094337329, "ge2": 21, "max": 37.71661825687804}}
{"set": "A171", "decision": "REVERT", "edit": "HTF EMA min dist 0.1%", "reason": "REVERT identical", "before": {"hits": 0, "med": 1.563033917256881, "ge2": 22}, "after": {"hits": 0, "med": 1.563033917256881, "ge2": 22}}
{"set": "A172", "decision": "REVERT", "edit": "HTF EMA min dist 0.4%", "reason": "REVERT identical", "before": {"hits": 0, "med": 1.563033917256881, "ge2": 22}, "after": {"hits": 0, "med": 1.563033917256881, "ge2": 22}}
{"set": "A173", "decision": "REVERT", "edit": "daily EMA 5d slope agree", "reason": "REVERT med 1.563->1.144", "before": {"hits": 0, "med": 1.563033917256881, "ge2": 22}, "after": {"hits": 0, "med": 1.1437384855237829, "ge2": 16, "max": 37.71661825687804}}
{"set": "A174", "decision": "REVERT", "edit": "lookback floor 390", "reason": "REVERT med 1.5630->1.5552 ge2 22", "before": {"hits": 0, "med": 1.563033917256881, "ge2": 22}, "after": {"hits": 0, "med": 1.5551929498125108, "ge2": 22, "max": 36.68573680835159}}
{"set": "A175", "decision": "REVERT", "edit": "trail_atr floor 7", "reason": "REVERT med 1.563->1.492 max 37.7->29.7", "before": {"hits": 0, "med": 1.563033917256881, "ge2": 22}, "after": {"hits": 0, "med": 1.4920918757715365, "ge2": 20, "max": 29.73425280532509}}
{"set": "A176", "decision": "REVERT", "edit": "buffer floor 0.40", "reason": "REVERT med 1.5630 ge2 22 max 37.7->17.6", "before": {"hits": 0, "med": 1.563033917256881, "ge2": 22, "max": 37.71661825687804}, "after": {"hits": 0, "med": 1.563033917256881, "ge2": 22, "max": 17.594894455654405}}
{"set": "A177", "decision": "REVERT", "edit": "win_size_mult 1.65", "reason": "REVERT med 1.563->1.551", "before": {"hits": 0, "med": 1.563033917256881, "ge2": 22}, "after": {"hits": 0, "med": 1.551106178566105, "ge2": 22, "max": 36.124798603026285}}
