{"set": "A178", "decision": "REVERT", "edit": "skip next signal after full loss", "reason": "REVERT med 1.563->1.262 max 37.7->13.6", "before": {"hits": 0, "med": 1.563033917256881, "ge2": 22}, "after": {"hits": 0, "med": 1.2618149776724623, "ge2": 18, "max": 13.574097015999468}}
{"set": "A179", "decision": "REVERT", "edit": "ROC 150", "reason": "REVERT med 1.563->1.468", "before": {"hits": 0, "med": 1.563033917256881, "ge2": 22}, "after": {"hits": 0, "med": 1.4680060179010102, "ge2": 23, "max": 37.71661825687804}}
{"set": "A180", "decision": "REVERT", "edit": "n_fast +20", "reason": "REVERT med 1.5630->1.5630 ge2 22", "before": {"hits": 0, "med": 1.563033917256881, "ge2": 22}, "after": {"hits": 0, "med": 1.563033917256881, "ge2": 22}}
{"set": "A181", "decision": "REVERT", "edit": "skip hour-open minute 0-4", "reason": "REVERT med 1.563->1.233", "before": {"hits": 0, "med": 1.563033917256881, "ge2": 22}, "after": {"hits": 0, "med": 1.2330302997271354, "ge2": 19, "max": 37.71661825687804}}
{"set": "A182", "decision": "REVERT", "edit": "risk_cap 0.0038", "reason": "REVERT med 1.563->1.468 max-only 38.1", "before": {"hits": 0, "med": 1.563033917256881, "ge2": 22}, "after": {"hits": 0, "med": 1.4680060179010102, "ge2": 22, "max": 38.12822464608742}}
{"set": "A183", "decision": "REVERT", "edit": "n_fast +30", "reason": "REVERT med 1.563034->1.563034 ge2 22 up4/dn2", "before": {"hits": 0, "med": 1.563033917256881, "ge2": 22, "mean": 3.6542247282648606}, "after": {"hits": 0, "med": 1.563033917256881, "ge2": 22, "mean": 3.6071115218879957, "max": 37.71661825687804}}
{"set": "A184", "decision": "REVERT", "edit": "directional body 0.45", "reason": "REVERT identical", "before": {"hits": 0, "med": 1.563033917256881, "ge2": 22}, "after": {"hits": 0, "med": 1.563033917256881, "ge2": 22}}
{"set": "A185", "decision": "KEEP", "edit": "later scale-out frac 0.48", "reason": "KEEP med 1.56303->1.56348 (ge2 22, 24 up / 15 tiny dn)", "before": {"hits": 0, "med": 1.563033917256881, "ge2": 22, "mean": 3.6542247282648606, "max": 37.71661825687804}, "after": {"hits": 0, "med": 1.5634760236584253, "ge2": 22, "mean": 3.655523395004627, "max": 37.72070549760372}}
{"set": "A186", "decision": "KEEP", "edit": "later scale-out frac 0.46", "reason": "KEEP med 1.563476->1.563943 ge2 22 up24/dn15", "before": {"hits": 0, "med": 1.5634760236584253, "ge2": 22, "mean": 3.655523395004627, "max": 37.72070549760372}, "after": {"hits": 0, "med": 1.5639432941649898, "ge2": 22, "mean": 3.6568497960332413, "max": 37.7250507244386}}
{"set": "A187", "decision": "KEEP", "edit": "later scale-out frac 0.44", "reason": "KEEP med 1.563943->1.564437 ge2 22", "before": {"hits": 0, "med": 1.5639432941649898, "ge2": 22, "mean": 3.6568497960332413}, "after": {"hits": 0, "med": 1.5644368771155597, "ge2": 22, "mean": 3.658203957993842, "max": 37.72964692592832}}
{"set": "A188", "decision": "KEEP", "edit": "later scale-out frac 0.42", "reason": "KEEP med 1.564437->1.564958 ge2 22 up23/dn16", "before": {"hits": 0, "med": 1.5644368771155597, "ge2": 22, "mean": 3.658203957993842}, "after": {"hits": 0, "med": 1.5649579208238025, "ge2": 22, "mean": 3.6595856803366473, "max": 37.73448324920659}}
{"set": "A189", "decision": "KEEP", "edit": "later scale-out frac 0.40", "reason": "KEEP med 1.564958->1.565508 ge2 22 up23/dn16", "before": {"hits": 0, "med": 1.5649579208238025, "ge2": 22, "mean": 3.6595856803366473}, "after": {"hits": 0, "med": 1.5655075676256138, "ge2": 22, "mean": 3.660994508019747, "max": 37.73954457539427}}
{"set": "A190", "decision": "KEEP", "edit": "later scale-out frac 0.38", "reason": "KEEP med 1.565508->1.566087 ge2 22 up23/dn16", "before": {"hits": 0, "med": 1.5655075676256138, "ge2": 22, "mean": 3.660994508019747}, "after": {"hits": 0, "med": 1.566086947597933, "ge2": 22, "mean": 3.662429702948034, "max": 37.74481107634463}}
{"set": "A191", "decision": "KEEP", "edit": "later scale-out frac 0.36", "reason": "KEEP med 1.566087->1.566697 ge2 22 up23/dn16", "before": {"hits": 0, "med": 1.566086947597933, "ge2": 22, "mean": 3.662429702948034}, "after": {"hits": 0, "med": 1.566697171948835, "ge2": 22, "mean": 3.663890214149997, "max": 37.75025775254316}}
{"set": "A192", "decision": "KEEP", "edit": "later scale-out frac 0.34", "reason": "KEEP med 1.566697->1.567339 ge2 22 up22/dn17", "before": {"hits": 0, "med": 1.566697171948835, "ge2": 22, "mean": 3.663890214149997}, "after": {"hits": 0, "med": 1.5673393260788944, "ge2": 22, "mean": 3.6653746466935053, "max": 37.75585395196421}}
{"set": "A193", "decision": "KEEP", "edit": "later scale-out frac 0.32", "reason": "KEEP med 1.567339->1.568014 ge2 22 up21/dn18", "before": {"hits": 0, "med": 1.5673393260788944, "ge2": 22, "mean": 3.6653746466935053}, "after": {"hits": 0, "med": 1.568014462313828, "ge2": 22, "mean": 3.6668812293434656, "max": 37.76156286968343}}
{"set": "A194", "decision": "KEEP", "edit": "later scale-out frac 0.30", "reason": "KEEP med 1.568014->1.568724 ge2 22 up19/dn20", "before": {"hits": 0, "med": 1.568014462313828, "ge2": 22, "mean": 3.6668812293434656}, "after": {"hits": 0, "med": 1.568723592308412, "ge2": 22, "mean": 3.668407780966373, "max": 37.76734102804482}}
{"set": "A195", "decision": "KEEP", "edit": "later scale-out frac 0.28", "reason": "KEEP med 1.568724->1.569468 ge2 22 up18/dn21", "before": {"hits": 0, "med": 1.568723592308412, "ge2": 22, "mean": 3.668407780966373}, "after": {"hits": 0, "med": 1.569467679121665, "ge2": 22, "mean": 3.6699516756893886, "max": 37.77313773718316}}
{"set": "A196", "decision": "KEEP", "edit": "later scale-out frac 0.26", "reason": "KEEP med 1.569468->1.570248 ge2 22 up18/dn21", "before": {"hits": 0, "med": 1.569467679121665, "ge2": 22, "mean": 3.6699516756893886}, "after": {"hits": 0, "med": 1.5702476289633207, "ge2": 22, "mean": 3.671509806824721, "max": 37.77889453571133}}
{"set": "A197", "decision": "KEEP", "edit": "later scale-out frac 0.24", "reason": "KEEP med 1.570248->1.571064 ge2 22 up18/dn21", "before": {"hits": 0, "med": 1.5702476289633207, "ge2": 22, "mean": 3.671509806824721}, "after": {"hits": 0, "med": 1.5710642826115595, "ge2": 22, "mean": 3.6730785495737486, "max": 37.78454461139317}}
{"set": "A198", "decision": "KEEP", "edit": "later scale-out frac 0.22", "reason": "KEEP med 1.571064->1.571918 ge2 22 up18/dn21", "before": {"hits": 0, "med": 1.5710642826115595, "ge2": 22, "mean": 3.6730785495737486}, "after": {"hits": 0, "med": 1.5719184065020286, "ge2": 22, "mean": 3.6746537225296594, "max": 37.790012201641126}}
{"set": "A199", "decision": "KEEP", "edit": "later scale-out frac 0.20", "reason": "KEEP med 1.571918->1.572811 ge2 22 up17/dn22", "before": {"hits": 0, "med": 1.5719184065020286, "ge2": 22, "mean": 3.6746537225296594}, "after": {"hits": 0, "med": 1.5728106834881204, "ge2": 22, "mean": 3.6762305480023354, "max": 37.79521197370191}}
{"set": "A200", "decision": "KEEP", "edit": "later scale-out frac 0.18", "reason": "KEEP med 1.572811->1.573742 ge2 22 up16/dn23", "before": {"hits": 0, "med": 1.5728106834881204, "ge2": 22, "mean": 3.6762305480023354}, "after": {"hits": 0, "med": 1.5737417032725458, "ge2": 22, "mean": 3.677803611194921, "max": 37.80004838442563}}
{"set": "A201", "decision": "KEEP", "edit": "later scale-out frac 0.16", "reason": "KEEP med 1.573742->1.574712 ge2 22 up15/dn24", "before": {"hits": 0, "med": 1.5737417032725458, "ge2": 22, "mean": 3.677803611194921}, "after": {"hits": 0, "med": 1.5747119525101627, "ge2": 22, "mean": 3.679366818268, "max": 37.80441501955349}}
{"set": "A202", "decision": "KEEP", "edit": "later scale-out frac 0.14", "reason": "KEEP med 1.574712->1.575722 ge2 22 up15/dn24", "before": {"hits": 0, "med": 1.5747119525101627, "ge2": 22, "mean": 3.679366818268}, "after": {"hits": 0, "med": 1.575721804582092, "ge2": 22, "mean": 3.680913353334599, "max": 37.8081939125088}}
{"set": "A203", "decision": "KEEP", "edit": "later scale-out frac 0.12", "reason": "KEEP med 1.575722->1.576772 ge2 22 up15/dn24", "before": {"hits": 0, "med": 1.575721804582092, "ge2": 22, "mean": 3.680913353334599}, "after": {"hits": 0, "med": 1.576771509041102, "ge2": 22, "mean": 3.6824356344373737, "max": 37.81125484273579}}
{"set": "A204", "decision": "REVERT", "edit": "later scale-out frac 0.10", "reason": "REVERT med 1.576772->1.576396 ge2 22 up15/dn24", "before": {"hits": 0, "med": 1.576771509041102, "ge2": 22, "mean": 3.6824356344373737}, "after": {"hits": 0, "med": 1.5763959429121164, "ge2": 22, "mean": 3.6839252685684616, "max": 37.81345461370165}}
{"set": "A205", "decision": "KEEP", "edit": "first partial 0.68", "reason": "KEEP med 1.576772->1.578681 ge2 22 up25/dn14", "before": {"hits": 0, "med": 1.576771509041102, "ge2": 22, "mean": 3.6824356344373737}, "after": {"hits": 0, "med": 1.5786812049622272, "ge2": 22, "mean": 3.6933158682750222, "max": 37.822965341482025}}
{"set": "A206", "decision": "REVERT", "edit": "first partial 0.66", "reason": "REVERT med 1.578681->1.578403 ge2 22 up25/dn14", "before": {"hits": 0, "med": 1.5786812049622272, "ge2": 22, "mean": 3.6933158682750222}, "after": {"hits": 0, "med": 1.5784028165538413, "ge2": 22, "mean": 3.704223949342666, "max": 37.83467338284766}}
{"set": "A207", "decision": "REVERT", "edit": "n_fast +20", "reason": "REVERT med 1.578681->1.578681 ge2 22 up4/dn0", "before": {"hits": 0, "med": 1.5786812049622272, "ge2": 22}, "after": {"hits": 0, "med": 1.5786812049622272, "ge2": 22, "mean": 3.801264578960041, "max": 37.822965341482025}}
{"set": "A208", "decision": "KEEP", "edit": "trail_scale_max 8", "reason": "KEEP med 1.578681->1.582478 ge2 22 up37/dn2", "before": {"hits": 0, "med": 1.5786812049622272, "ge2": 22, "mean": 3.6933158682750222}, "after": {"hits": 0, "med": 1.5824779666714257, "ge2": 22, "mean": 3.6694907842421274, "max": 37.91048296231893}}
{"set": "A209", "decision": "REVERT", "edit": "trail_scale_max 9", "reason": "REVERT med 1.582->1.545 max-only 38.0", "before": {"hits": 0, "med": 1.582478, "ge2": 22}, "after": {"hits": 0, "med": 1.545229947739606, "ge2": 21, "max": 37.982707728130606}}
{"set": "A210", "decision": "KEEP", "edit": "second scale-out 0.20", "reason": "KEEP med 1.582478->1.583322 ge2 22 up15/dn24", "before": {"hits": 0, "med": 1.5824779666714257, "ge2": 22, "mean": 3.6694907842421274}, "after": {"hits": 0, "med": 1.5833221389954255, "ge2": 22, "mean": 3.6663621578514833, "max": 37.889814944874985}}
{"set": "A211", "decision": "KEEP", "edit": "second scale-out 0.24", "reason": "KEEP med 1.583322->1.583744 ge2 22 up15/dn24", "before": {"hits": 0, "med": 1.5833221389954255, "ge2": 22, "mean": 3.6663621578514833}, "after": {"hits": 0, "med": 1.5837441253403175, "ge2": 22, "mean": 3.664802187273754, "max": 37.87947900886553}}
{"set": "A212", "decision": "KEEP", "edit": "second scale-out 0.28", "reason": "KEEP med 1.583744->1.584166 ge2 22 up15/dn24", "before": {"hits": 0, "med": 1.5837441253403175, "ge2": 22, "mean": 3.664802187273754}, "after": {"hits": 0, "med": 1.5841660451404709, "ge2": 22, "mean": 3.663245112583802, "max": 37.86914178909338}}
{"set": "A213", "decision": "REVERT", "edit": "second scale-out 0.32", "reason": "REVERT med 1.584166->1.583358 ge2 22 up15/dn24", "before": {"hits": 0, "med": 1.5841660451404709, "ge2": 22}, "after": {"hits": 0, "med": 1.5833584074179996, "ge2": 22, "mean": 3.6616909343884347, "max": 37.85880328638024}}
{"set": "A214", "decision": "REVERT", "edit": "third scale-out 0.18", "reason": "REVERT med 1.584166->1.583373 ge2 22 up20/dn19", "before": {"hits": 0, "med": 1.5841660451404709, "ge2": 22}, "after": {"hits": 0, "med": 1.5833731529681174, "ge2": 22}}
{"set": "A215", "decision": "REVERT", "edit": "later scale-out 0.13", "reason": "REVERT med 1.584166->1.584043 ge2 22 up24/dn15", "before": {"hits": 0, "med": 1.5841660451404709, "ge2": 22}, "after": {"hits": 0, "med": 1.5840433257552928, "ge2": 22}}
{"set": "A216", "decision": "REVERT", "edit": "HTF slope 170", "reason": "REVERT med 1.584166->1.584166 ge2 22 up0/dn2", "before": {"hits": 0, "med": 1.5841660451404709, "ge2": 22}, "after": {"hits": 0, "med": 1.5841660451404709, "ge2": 22}}
{"set": "A217", "decision": "REVERT", "edit": "ROC 135", "reason": "REVERT med 1.584->1.545", "before": {"hits": 0, "med": 1.5841660451404709, "ge2": 22}, "after": {"hits": 0, "med": 1.5447046878306552, "ge2": 22, "max": 37.86914178909338}}
{"set": "A218", "decision": "REVERT", "edit": "width_tr 0.26", "reason": "REVERT med 1.584->1.523", "before": {"hits": 0, "med": 1.5841660451404709, "ge2": 22}, "after": {"hits": 0, "med": 1.523040373549444, "ge2": 22, "max": 36.51635362682062}}
{"set": "A219", "decision": "REVERT", "edit": "ht_ema cap 39", "reason": "REVERT med 1.584->1.545", "before": {"hits": 0, "med": 1.5841660451404709, "ge2": 22}, "after": {"hits": 0, "med": 1.5447046878306552, "ge2": 21, "max": 37.86914178909338}}
{"set": "A220", "decision": "REVERT", "edit": "win_size_mult 1.70", "reason": "REVERT med 1.584->1.563", "before": {"hits": 0, "med": 1.5841660451404709, "ge2": 22}, "after": {"hits": 0, "med": 1.5628322178324598, "ge2": 22, "max": 37.07592951800374}}
{"set": "A221", "decision": "REVERT", "edit": "leftover trail *1.15 after 2 scale-outs", "reason": "REVERT med 1.584->1.577", "before": {"hits": 0, "med": 1.5841660451404709, "ge2": 22}, "after": {"hits": 0, "med": 1.5773010972958736, "ge2": 22, "max": 37.53023384576464}}
{"set": "A222", "decision": "REVERT", "edit": "n_fast +10", "reason": "REVERT med 1.584166->1.584166 ge2 22 up0/dn0", "before": {"hits": 0, "med": 1.5841660451404709, "ge2": 22}, "after": {"hits": 0, "med": 1.5841660451404709, "ge2": 22}}
{"set": "A223", "decision": "REVERT", "edit": "reentry cap 160", "reason": "REVERT med 1.584166->1.584166 ge2 22 up0/dn0", "before": {"hits": 0, "med": 1.5841660451404709, "ge2": 22}, "after": {"hits": 0, "med": 1.5841660451404709, "ge2": 22}}
{"set": "A224", "decision": "REVERT", "edit": "day path buf*1.2", "reason": "REVERT med 1.584->1.545 ge2 22->21 max 37.87->31.15 ups0/dn3; 2023-11-22 6.37->1.0", "before": {"hits": 0, "med": 1.5841660451404709, "ge2": 22}, "after": {"hits": 0, "med": 1.5447046878306552, "ge2": 21, "max": 31.14592474915673}}
{"set": "A225", "decision": "REVERT", "edit": "daily fillna(bull) no-op", "reason": "REVERT identical peaks; pandas close>NaN is False so fillna never fires", "before": {"hits": 0, "med": 1.5841660451404709, "ge2": 22}, "after": {"hits": 0, "med": 1.5841660451404709, "ge2": 22}}
{"set": "A226", "decision": "REVERT", "edit": "daily warmup where+fillna(bull)", "reason": "REVERT ge2 22->21; 2022-01-01 12.4->1.0; warmup 300+ trades all die; med +0.0003 noise", "before": {"hits": 0, "med": 1.5841660451404709, "ge2": 22}, "after": {"hits": 0, "med": 1.5844447671896011, "ge2": 21, "max": 37.86914178909338}}
{"set": "A227", "decision": "REVERT", "edit": "daily ewm min_periods=60", "reason": "REVERT med 1.584->1.545 ge2 22->21; 2022-01-01 12.4->1.0", "before": {"hits": 0, "med": 1.5841660451404709, "ge2": 22}, "after": {"hits": 0, "med": 1.5447046878306552, "ge2": 21, "max": 37.86914178909338}}
{"set": "A228", "decision": "REVERT", "edit": "grace take SL instead of liq", "reason": "REVERT peaks identical (1 up 0 dn) med/ge2/min/hits unchanged; liq down but keep-metrics flat", "before": {"hits": 0, "med": 1.5841660451404709, "ge2": 22}, "after": {"hits": 0, "med": 1.5841660451404709, "ge2": 22, "max": 37.86914178909338}}
{"set": "A229", "decision": "REVERT", "edit": "HTF |slope|>=0.02% ema", "reason": "REVERT max-only 37.87->45.49 med 1.584->1.545; 2024-01-21 26.3->1.61", "before": {"hits": 0, "med": 1.5841660451404709, "ge2": 22}, "after": {"hits": 0, "med": 1.5447046878306552, "ge2": 22, "max": 45.49491374944621}}
{"set": "A230", "decision": "REVERT", "edit": "underwater size_mult*0.5", "reason": "REVERT med 1.584->1.245 max 37.87->21.86; shrink killed compounding", "before": {"hits": 0, "med": 1.5841660451404709, "ge2": 22}, "after": {"hits": 0, "med": 1.245, "ge2": null, "max": 21.86345854656388}}
{"set": "A231", "decision": "REVERT", "edit": "day path requires expand_sma", "reason": "REVERT 1 window down 4.386->4.01, rest peak-identical; 1.0x still 1.0", "before": {"hits": 0, "med": 1.5841660451404709, "ge2": 22}, "after": {"hits": 0, "med": 1.5841660451404709, "ge2": 22, "max": 37.86914178909338}}
{"set": "A232", "decision": "REVERT", "edit": "risk_frac floor 0.20%", "reason": "REVERT med 1.584->1.576 though ge2 22->23; 2023-01-26 37.9->23.3", "before": {"hits": 0, "med": 1.5841660451404709, "ge2": 22}, "after": {"hits": 0, "med": 1.575547133106724, "ge2": 23, "max": 34.58650267128796}}
{"set": "A233", "decision": "REVERT", "edit": "risk_frac floor 0.12%", "reason": "REVERT 0 up 1 dn; floor rarely binds", "before": {"hits": 0, "med": 1.5841660451404709, "ge2": 22}, "after": {"hits": 0, "med": 1.5841660451404709, "ge2": 22, "max": 37.86914178909338}}
{"set": "A234", "decision": "REVERT", "edit": "risk_frac floor 0.17%", "reason": "REVERT med/ge2/hits/min flat, 6 up 7 dn, max 37.87->36.65", "before": {"hits": 0, "med": 1.5841660451404709, "ge2": 22}, "after": {"hits": 0, "med": 1.5841660451404709, "ge2": 22, "max": 36.65076864542629}}
{"set": "A235", "decision": "REVERT", "edit": "Donchian 2-bar confirm", "reason": "REVERT med 1.584->1.189 max 37.87->23.86; late entries missed runners", "before": {"hits": 0, "med": 1.5841660451404709, "ge2": 22}, "after": {"hits": 0, "med": 1.189, "ge2": null, "max": 23.8576729198077}}
{"set": "A236", "decision": "REVERT", "edit": "day-path skip first 60m UTC", "reason": "REVERT keep-metrics flat; 1 up (2024-01-21 26.3->37.4) 0 dn \u2014 max-only", "before": {"hits": 0, "med": 1.5841660451404709, "ge2": 22}, "after": {"hits": 0, "med": 1.5841660451404709, "ge2": 22, "max": 37.86914178909338}}
{"set": "A237", "decision": "REVERT", "edit": "n_fast max(60,n//4)=90", "reason": "REVERT 0 up 6 dn; extra fast breaks hurt ge2, 1.0x still 1.0", "before": {"hits": 0, "med": 1.5841660451404709, "ge2": 22}, "after": {"hits": 0, "med": 1.5841660451404709, "ge2": 22, "max": 37.86914178909338}}
{"set": "A238", "decision": "REVERT", "edit": "trail_unlock_r 3.0", "reason": "REVERT max-only 37.87->43.90 med 1.584->1.566", "before": {"hits": 0, "med": 1.5841660451404709, "ge2": 22}, "after": {"hits": 0, "med": 1.566, "ge2": null, "max": 43.89688064036007}}
{"set": "A239", "decision": "REVERT", "edit": "risk_tgt start 0.15", "reason": "REVERT max-only 37.87->42.07 med 1.584->1.509", "before": {"hits": 0, "med": 1.5841660451404709, "ge2": 22}, "after": {"hits": 0, "med": 1.509, "ge2": null, "max": 42.07412959322934}}
{"set": "A240", "decision": "REVERT", "edit": "size_boost 0.65 if not expand_sma (lev_cap only)", "reason": "REVERT keep-metrics flat; 2 up 0 dn but boost rarely binds lev_cap", "before": {"hits": 0, "med": 1.5841660451404709, "ge2": 22}, "after": {"hits": 0, "med": 1.5841660451404709, "ge2": 22, "max": 37.86914178909338}}
{"set": "A241", "decision": "REVERT", "edit": "chop size_boost 0.65 on risk-parity", "reason": "REVERT ge2 22->21 (2022-08 2.31->1.96); 1.0x unlifted", "before": {"hits": 0, "med": 1.5841660451404709, "ge2": 22}, "after": {"hits": 0, "med": 1.5841660451404709, "ge2": 21, "max": 37.86914178909338}}
{"set": "A242", "decision": "REVERT", "edit": "scale-out only after unlock_r", "reason": "REVERT med 1.584->1.545 max 37.87->37.19; full-exit before 4R worse than early partial", "before": {"hits": 0, "med": 1.5841660451404709, "ge2": 22}, "after": {"hits": 0, "med": 1.545, "ge2": null, "max": 37.18708328850698}}
{"set": "A243", "decision": "REVERT", "edit": "daily EMA200 fillna EMA50 warmup", "reason": "REVERT ge2 22->21; 2022-01-01 12.4->1.0 same as A226/A227", "before": {"hits": 0, "med": 1.5841660451404709, "ge2": 22}, "after": {"hits": 0, "med": 1.5841660451404709, "ge2": 21, "max": 37.86914178909338}}
{"set": "A244", "decision": "REVERT", "edit": "win_size_mult 2.0", "reason": "REVERT max-only 37.87->41.66 med 1.584->1.545", "before": {"hits": 0, "med": 1.5841660451404709, "ge2": 22}, "after": {"hits": 0, "med": 1.545, "ge2": null, "max": 41.65474415651648}}
{"set": "A245", "decision": "REVERT", "edit": "expand_med rolling 800", "reason": "REVERT keep-metrics flat; 1 tiny up 0 dn", "before": {"hits": 0, "med": 1.5841660451404709, "ge2": 22}, "after": {"hits": 0, "med": 1.5841660451404709, "ge2": 22, "max": 37.86914178909338}}
{"set": "A246", "decision": "REVERT", "edit": "directional close vs open", "reason": "REVERT identical peaks/trades; already implied by 1m breakout", "before": {"hits": 0, "med": 1.5841660451404709, "ge2": 22}, "after": {"hits": 0, "med": 1.5841660451404709, "ge2": 22}}
{"set": "A247", "decision": "REVERT", "edit": "SL=close\u00b10.8ATR (drop wick)", "reason": "REVERT med 1.584->1.211 max 37.87->30.44; wick SL is load-bearing", "before": {"hits": 0, "med": 1.5841660451404709, "ge2": 22}, "after": {"hits": 0, "med": 1.211, "ge2": null, "max": 30.443648021621293}}
{"set": "A248", "decision": "REVERT", "edit": "Donchian slow AND fast", "reason": "REVERT med 1.584->1.545; AND starved the 1.58 band", "before": {"hits": 0, "med": 1.5841660451404709, "ge2": 22}, "after": {"hits": 0, "med": 1.545, "ge2": null, "max": 37.86914178909338}}
{"set": "A249", "decision": "REVERT", "edit": "ROC60 extra sign filter", "reason": "REVERT med 1.584->1.545", "before": {"hits": 0, "med": 1.5841660451404709, "ge2": 22}, "after": {"hits": 0, "med": 1.545, "ge2": null, "max": 37.86914178909338}}
{"set": "A250", "decision": "REVERT", "edit": "partial only after +1.5R", "reason": "REVERT 15 dn 3 up; med/ge2 flat max 37.87->37.19", "before": {"hits": 0, "med": 1.5841660451404709, "ge2": 22}, "after": {"hits": 0, "med": 1.5841660451404709, "ge2": 22, "max": 37.18708328850698}}
{"set": "A251", "decision": "REVERT", "edit": "win_size_mult only if equity>start", "reason": "REVERT med 1.584->1.569; 2025-07 1.58->1.26; 2024-01 26.3->6.7 though ge2 22->23", "before": {"hits": 0, "med": 1.5841660451404709, "ge2": 22}, "after": {"hits": 0, "med": 1.5692681238714885, "ge2": 23, "max": 37.86914178909338}}
