{"set": "A414", "decision": "KEEP", "edit": "later scale close_frac 0.03->0.025", "reason": "KEEP hits 1 med 4.441->4.464", "before": {"hits": 1, "med": 4.441194988481845, "ge2": 41}, "after": {"hits": 1, "med": 4.463779793913153, "ge2": 41, "max": 126730.24052758442}}
{"set": "A415", "decision": "REVERT", "edit": "later scale 0.025->0.02", "reason": "REVERT med 4.464->4.463; 38 windows worse"}
{"set": "A416", "decision": "KEEP", "edit": "post-scale trail mult 0.002->0.0015", "reason": "KEEP hits 1 med 4.464->4.465; 43 windows up", "before": {"hits": 1, "med": 4.463779793913153, "ge2": 41}, "after": {"hits": 1, "med": 4.464669355644273, "ge2": 41, "max": 126891.16764088914}}
{"set": "A417", "decision": "KEEP", "edit": "post-scale trail 0.0015->0.001", "reason": "KEEP hits 1 med 4.4647->4.4656", "before": {"hits": 1, "med": 4.464669355644273, "ge2": 41}, "after": {"hits": 1, "med": 4.465558917375386, "ge2": 41, "max": 127052.24691378733}}
{"set": "A418", "decision": "KEEP", "edit": "post-scale trail 0.001->0.0005", "reason": "KEEP med 4.4656->4.4664", "before": {"hits": 1, "med": 4.465558917375386}, "after": {"hits": 1, "med": 4.466448479106507, "max": 127213.47844481473}}
{"set": "A419", "decision": "REVERT", "edit": "second-scale nonfat 0.08->0.06", "reason": "REVERT med 4.466448->4.466448"}
{"set": "A419", "decision": "REVERT", "edit": "second-scale nonfat 0.08->0.06", "reason": "REVERT med 4.466448->4.466448"}
{"set": "A420", "decision": "REVERT", "edit": "fat second-scale 0.02->0.015", "reason": "REVERT med flat/down; up=6 down=30"}
{"set": "A421", "decision": "KEEP", "edit": "first partial 0.001->0.0005", "reason": "KEEP med 4.466448->4.467327", "before": {"hits": 1, "med": 4.466448479106507, "ge2": 41}, "after": {"hits": 1, "med": 4.467326729686643, "ge2": 41}}
{"set": "A422", "decision": "KEEP", "edit": "first partial 0.0005->0.0002", "reason": "KEEP med 4.467327->4.467854"}
{"set": "A423", "decision": "KEEP", "edit": "first partial 0.0002->0.0001", "reason": "KEEP med 4.467854->4.468029"}
{"set": "A424", "decision": "REVERT", "edit": "mid boost 1.30->1.31", "reason": "REVERT identical/no improve up=8 down=10"}
{"set": "A425", "decision": "REVERT", "edit": "risk_tgt cap 0.50->0.51", "reason": "REVERT med 4.46802933015075->4.46802933015075 up=0 down=0"}
{"set": "A426", "decision": "REVERT", "edit": "trail_scale_max 10->11", "reason": "REVERT med 4.468->4.009"}
{"set": "A427", "decision": "REVERT", "edit": "trail_unlock_mult 1.3->1.35", "reason": "REVERT med 4.468->4.011"}
{"set": "A428", "decision": "REVERT", "edit": "later 0.025->0.022", "reason": "REVERT med 4.468029->4.467444"}
{"set": "A429", "decision": "KEEP", "edit": "post-scale trail 0.0005->0.00025", "reason": "KEEP med 4.468029->4.468475"}
{"set": "A430", "decision": "REVERT", "edit": "top boost 1.35->1.36", "reason": "REVERT med 4.4685->4.4376 (max-only)"}
{"set": "A431", "decision": "KEEP", "edit": "first partial 0.0001->0", "reason": "KEEP med 4.468475->4.468650"}
{"set": "A432", "decision": "REVERT", "edit": "risk_cap 0.0024->0.00242", "reason": "REVERT med 4.4687->4.4436"}
{"set": "A433", "decision": "REVERT", "edit": "win_size_mult 1.75->1.70", "reason": "REVERT med 4.469->4.379"}
{"set": "A434", "decision": "KEEP", "edit": "post-scale trail 0.00025->0.0001", "reason": "KEEP med 4.468650->4.468917"}
{"set": "A435", "decision": "REVERT", "edit": "trail soft-cap 3.0->3.2", "reason": "REVERT med 4.469->3.145"}
{"set": "A436", "decision": "REVERT", "edit": "risk_tgt early 0.13+0.37p", "reason": "REVERT med 4.469->3.751 (max-only)"}
{"set": "A437", "decision": "REVERT", "edit": "range_ok 0.8->0.85", "reason": "REVERT med 4.469->3.356"}
{"set": "A438", "decision": "REVERT", "edit": "range_ok 0.8->0.75", "reason": "REVERT no improve / identical-ish"}
{"set": "A439", "decision": "REVERT", "edit": "body floor 0.45->0.40", "reason": "REVERT med 4.4689173420134205->4.4689173420134205 up=0 down=1"}
{"set": "A440", "decision": "REVERT", "edit": "lev_cap mult 1.5->1.55", "reason": "REVERT med flat; max-only 127607->131806"}
{"set": "A441", "decision": "REVERT", "edit": "fat second 0.02->0.01", "reason": "REVERT med 4.468917->4.468677 up=6 down=30"}
{"set": "A442", "decision": "REVERT", "edit": "post-scale trail *0", "reason": "REVERT hits 1->0 med collapse"}
{"set": "A443", "decision": "REVERT", "edit": "mid boost thresh 1.5->1.45", "reason": "REVERT med flat; down=3 surv down"}
{"set": "A444", "decision": "REVERT", "edit": "trail_unlock_r 4->3.5", "reason": "REVERT med 4.469->3.356"}
{"set": "A445", "decision": "REVERT", "edit": "trail_unlock_r 4->4.5", "reason": "REVERT no med/ge2 improve"}
{"set": "A446", "decision": "REVERT", "edit": "ema_slope diff 180->160", "reason": "REVERT med 4.469->3.438"}
{"set": "A447", "decision": "KEEP", "edit": "ema_slope diff 180->200", "reason": "KEEP med 4.4689173420134205->4.4689173420134205"}
{"set": "A448", "decision": "REVERT", "edit": "ROC 120->100", "reason": "REVERT hits 1->0"}
{"set": "A449", "decision": "REVERT", "edit": "slope 200->210", "reason": "REVERT med 4.469->4.197"}
{"set": "A450", "decision": "REVERT", "edit": "later 0.025->0.024", "reason": "REVERT med 4.468917->4.468724"}
{"set": "A451", "decision": "REVERT", "edit": "vol_ok 0.0015->0.0014", "reason": "REVERT hits 1->0 collapse"}
{"set": "A452", "decision": "REVERT", "edit": "expand cap 1.15->1.12", "reason": "REVERT no improve up=0 down=0"}
{"set": "A453", "decision": "REVERT", "edit": "cooldown cap 180->160", "reason": "REVERT identical/no improve"}
{"set": "A454", "decision": "REVERT", "edit": "risk_cap 0.0024->0.00245", "reason": "REVERT med 4.469->4.407"}
{"set": "A455", "decision": "REVERT", "edit": "nonfat second 0.08->0.07", "reason": "REVERT med 4.468917->4.468917"}
{"set": "A456", "decision": "REVERT", "edit": "mid boost 1.30->1.28", "reason": "REVERT up=10 down=8"}
{"set": "A457", "decision": "KEEP", "edit": "post-scale trail 1e-4->5e-5", "reason": "KEEP med 4.468917->4.469006"}
{"set": "A458", "decision": "REVERT", "edit": "low boost 1.10->1.12", "reason": "REVERT med 4.4690->4.3949"}
{"set": "A459", "decision": "KEEP", "edit": "trail 5e-5->2.5e-5", "reason": "KEEP med 4.469006->4.469051"}
{"set": "A460", "decision": "REVERT", "edit": "win_size_max 5->5.5", "reason": "REVERT med flat; max-only (like A398)"}
{"set": "A461", "decision": "KEEP", "edit": "trail 2.5e-5->1e-5", "reason": "KEEP med 4.469051->4.469078"}
{"set": "A462", "decision": "REVERT", "edit": "top boost thresh 1.8->1.75", "reason": "REVERT med 4.469->4.437"}
{"set": "A463", "decision": "KEEP", "edit": "trail 1e-5->5e-6", "reason": "KEEP med 4.469078->4.469087"}
{"set": "A464", "decision": "REVERT", "edit": "ROC 120->130", "reason": "REVERT no improve"}
{"set": "A465", "decision": "REVERT", "edit": "slope 200->190", "reason": "REVERT up=0 down=1"}
{"set": "A466", "decision": "REVERT", "edit": "later 0.025->0.023", "reason": "REVERT med 4.469087->4.468698 up=5 down=38"}
{"set": "A467", "decision": "REVERT", "edit": "low boost 1.10->1.08", "reason": "REVERT med 4.469087->4.469087"}
