{"set": "B917", "decision": "REVERT", "edit": "post-scale trail 6.1653697404852474e-12->5.2405642794124606e-12", "before": {"hits": 1, "med": 4.654285684120027, "min": 1.0, "max": 125970.93162556336, "ge2": 40, "liq": 32}, "after": {"hits": 1, "med": 4.654285684120957, "min": 1.0, "max": 125970.9316258614, "ge2": 40, "liq": 32}, "mode": "agent_bg_loop", "ts": "2026-08-12T13:05:26.301501+00:00"}
{"set": "B918", "decision": "REVERT", "edit": "later scale 0.0028->0.0026 runner chain", "before": {"hits": 1, "med": 4.654285684120027, "min": 1.0, "max": 125970.93162556336, "ge2": 40, "liq": 32}, "after": {"hits": 1, "med": 4.654248846350058, "min": 1.0, "max": 125956.34955370188, "ge2": 40, "liq": 32}, "mode": "agent_bg_loop", "ts": "2026-08-12T13:05:46.278046+00:00"}
{"set": "B919", "decision": "REVERT", "edit": "second scale 0.011/0.045->0.0105/0.043", "before": {"hits": 1, "med": 4.654285684120027, "min": 1.0, "max": 125970.93162556336, "ge2": 40, "liq": 32}, "after": {"hits": 1, "med": 4.654237635892896, "min": 1.0, "max": 125959.81106431429, "ge2": 40, "liq": 32}, "mode": "agent_bg_loop", "ts": "2026-08-12T13:06:06.249187+00:00"}
{"set": "B920", "decision": "REVERT", "edit": "post-scale trail 6.1653697404852474e-12->5.2405642794124606e-12", "before": {"hits": 1, "med": 4.654285684120027, "min": 1.0, "max": 125970.93162556336, "ge2": 40, "liq": 32}, "after": {"hits": 1, "med": 4.654285684120957, "min": 1.0, "max": 125970.9316258614, "ge2": 40, "liq": 32}, "mode": "agent_bg_loop", "ts": "2026-08-12T13:06:26.319601+00:00"}
{"set": "B921", "decision": "REVERT", "edit": "later scale 0.0028->0.0026 runner chain", "before": {"hits": 1, "med": 4.654285684120027, "min": 1.0, "max": 125970.93162556336, "ge2": 40, "liq": 32}, "after": {"hits": 1, "med": 4.654248846350058, "min": 1.0, "max": 125956.34955370188, "ge2": 40, "liq": 32}, "mode": "agent_bg_loop", "ts": "2026-08-12T13:06:46.350115+00:00"}
{"set": "B922", "decision": "REVERT", "edit": "second scale 0.011/0.045->0.0105/0.043", "before": {"hits": 1, "med": 4.654285684120027, "min": 1.0, "max": 125970.93162556336, "ge2": 40, "liq": 32}, "after": {"hits": 1, "med": 4.654237635892896, "min": 1.0, "max": 125959.81106431429, "ge2": 40, "liq": 32}, "mode": "agent_bg_loop", "ts": "2026-08-12T13:07:06.343680+00:00"}
{"set": "B923", "decision": "REVERT", "edit": "post-scale trail 6.1653697404852474e-12->5.2405642794124606e-12", "before": {"hits": 1, "med": 4.654285684120027, "min": 1.0, "max": 125970.93162556336, "ge2": 40, "liq": 32}, "after": {"hits": 1, "med": 4.654285684120957, "min": 1.0, "max": 125970.9316258614, "ge2": 40, "liq": 32}, "mode": "agent_bg_loop", "ts": "2026-08-12T13:07:26.277428+00:00"}
{"set": "B924", "decision": "REVERT", "edit": "later scale 0.0028->0.0026 runner chain", "before": {"hits": 1, "med": 4.654285684120027, "min": 1.0, "max": 125970.93162556336, "ge2": 40, "liq": 32}, "after": {"hits": 1, "med": 4.654248846350058, "min": 1.0, "max": 125956.34955370188, "ge2": 40, "liq": 32}, "mode": "agent_bg_loop", "ts": "2026-08-12T13:07:46.143115+00:00"}
{"set": "B925", "decision": "REVERT", "edit": "second scale 0.011/0.045->0.0105/0.043", "before": {"hits": 1, "med": 4.654285684120027, "min": 1.0, "max": 125970.93162556336, "ge2": 40, "liq": 32}, "after": {"hits": 1, "med": 4.654237635892896, "min": 1.0, "max": 125959.81106431429, "ge2": 40, "liq": 32}, "mode": "agent_bg_loop", "ts": "2026-08-12T13:08:06.179631+00:00"}
{"set": "B926", "decision": "REVERT", "edit": "post-scale trail 6.1653697404852474e-12->5.2405642794124606e-12", "before": {"hits": 1, "med": 4.654285684120027, "min": 1.0, "max": 125970.93162556336, "ge2": 40, "liq": 32}, "after": {"hits": 1, "med": 4.654285684120957, "min": 1.0, "max": 125970.9316258614, "ge2": 40, "liq": 32}, "mode": "agent_bg_loop", "ts": "2026-08-12T13:08:26.327850+00:00"}
{"set": "B927", "decision": "REVERT", "edit": "later scale 0.0028->0.0026 runner chain", "before": {"hits": 1, "med": 4.654285684120027, "min": 1.0, "max": 125970.93162556336, "ge2": 40, "liq": 32}, "after": {"hits": 1, "med": 4.654248846350058, "min": 1.0, "max": 125956.34955370188, "ge2": 40, "liq": 32}, "mode": "agent_bg_loop", "ts": "2026-08-12T13:08:46.340520+00:00"}
{"set": "B928", "decision": "REVERT", "edit": "second scale 0.011/0.045->0.0105/0.043", "before": {"hits": 1, "med": 4.654285684120027, "min": 1.0, "max": 125970.93162556336, "ge2": 40, "liq": 32}, "after": {"hits": 1, "med": 4.654237635892896, "min": 1.0, "max": 125959.81106431429, "ge2": 40, "liq": 32}, "mode": "agent_bg_loop", "ts": "2026-08-12T13:09:06.526095+00:00"}
{"set": "B929", "decision": "REVERT", "edit": "post-scale trail 6.1653697404852474e-12->5.2405642794124606e-12", "before": {"hits": 1, "med": 4.654285684120027, "min": 1.0, "max": 125970.93162556336, "ge2": 40, "liq": 32}, "after": {"hits": 1, "med": 4.654285684120957, "min": 1.0, "max": 125970.9316258614, "ge2": 40, "liq": 32}, "mode": "agent_bg_loop", "ts": "2026-08-12T13:09:26.539897+00:00"}
{"set": "B930", "decision": "REVERT", "edit": "later scale 0.0028->0.0026 runner chain", "before": {"hits": 1, "med": 4.654285684120027, "min": 1.0, "max": 125970.93162556336, "ge2": 40, "liq": 32}, "after": {"hits": 1, "med": 4.654248846350058, "min": 1.0, "max": 125956.34955370188, "ge2": 40, "liq": 32}, "mode": "agent_bg_loop", "ts": "2026-08-12T13:09:46.552731+00:00"}
{"set": "B931", "decision": "REVERT", "edit": "second scale 0.011/0.045->0.0105/0.043", "before": {"hits": 1, "med": 4.654285684120027, "min": 1.0, "max": 125970.93162556336, "ge2": 40, "liq": 32}, "after": {"hits": 1, "med": 4.654237635892896, "min": 1.0, "max": 125959.81106431429, "ge2": 40, "liq": 32}, "mode": "agent_bg_loop", "ts": "2026-08-12T13:10:06.621973+00:00"}
{"set": "B932", "decision": "REVERT", "edit": "post-scale trail 6.1653697404852474e-12->5.2405642794124606e-12", "before": {"hits": 1, "med": 4.654285684120027, "min": 1.0, "max": 125970.93162556336, "ge2": 40, "liq": 32}, "after": {"hits": 1, "med": 4.654285684120957, "min": 1.0, "max": 125970.9316258614, "ge2": 40, "liq": 32}, "mode": "agent_bg_loop", "ts": "2026-08-12T13:10:26.545665+00:00"}
{"set": "B933", "decision": "REVERT", "edit": "later scale 0.0028->0.0026 runner chain", "before": {"hits": 1, "med": 4.654285684120027, "min": 1.0, "max": 125970.93162556336, "ge2": 40, "liq": 32}, "after": {"hits": 1, "med": 4.654248846350058, "min": 1.0, "max": 125956.34955370188, "ge2": 40, "liq": 32}, "mode": "agent_bg_loop", "ts": "2026-08-12T13:10:46.662741+00:00"}
{"set": "B934", "decision": "REVERT", "edit": "second scale 0.011/0.045->0.0105/0.043", "before": {"hits": 1, "med": 4.654285684120027, "min": 1.0, "max": 125970.93162556336, "ge2": 40, "liq": 32}, "after": {"hits": 1, "med": 4.654237635892896, "min": 1.0, "max": 125959.81106431429, "ge2": 40, "liq": 32}, "mode": "agent_bg_loop", "ts": "2026-08-12T13:11:06.668467+00:00"}
{"set": "B935", "decision": "REVERT", "edit": "post-scale trail 6.1653697404852474e-12->5.2405642794124606e-12", "before": {"hits": 1, "med": 4.654285684120027, "min": 1.0, "max": 125970.93162556336, "ge2": 40, "liq": 32}, "after": {"hits": 1, "med": 4.654285684120957, "min": 1.0, "max": 125970.9316258614, "ge2": 40, "liq": 32}, "mode": "agent_bg_loop", "ts": "2026-08-12T13:11:26.684795+00:00"}
{"set": "B936", "decision": "REVERT", "edit": "later scale 0.0028->0.0026 runner chain", "before": {"hits": 1, "med": 4.654285684120027, "min": 1.0, "max": 125970.93162556336, "ge2": 40, "liq": 32}, "after": {"hits": 1, "med": 4.654248846350058, "min": 1.0, "max": 125956.34955370188, "ge2": 40, "liq": 32}, "mode": "agent_bg_loop", "ts": "2026-08-12T13:11:46.629949+00:00"}
{"set": "B937", "decision": "REVERT", "edit": "second scale 0.011/0.045->0.0105/0.043", "before": {"hits": 1, "med": 4.654285684120027, "min": 1.0, "max": 125970.93162556336, "ge2": 40, "liq": 32}, "after": {"hits": 1, "med": 4.654237635892896, "min": 1.0, "max": 125959.81106431429, "ge2": 40, "liq": 32}, "mode": "agent_bg_loop", "ts": "2026-08-12T13:12:06.730510+00:00"}
{"set": "B938", "decision": "REVERT", "edit": "post-scale trail 6.1653697404852474e-12->5.2405642794124606e-12", "before": {"hits": 1, "med": 4.654285684120027, "min": 1.0, "max": 125970.93162556336, "ge2": 40, "liq": 32}, "after": {"hits": 1, "med": 4.654285684120957, "min": 1.0, "max": 125970.9316258614, "ge2": 40, "liq": 32}, "mode": "agent_bg_loop", "ts": "2026-08-12T13:12:26.884247+00:00"}
{"set": "B939", "decision": "REVERT", "edit": "later scale 0.0028->0.0026 runner chain", "before": {"hits": 1, "med": 4.654285684120027, "min": 1.0, "max": 125970.93162556336, "ge2": 40, "liq": 32}, "after": {"hits": 1, "med": 4.654248846350058, "min": 1.0, "max": 125956.34955370188, "ge2": 40, "liq": 32}, "mode": "agent_bg_loop", "ts": "2026-08-12T13:12:46.907062+00:00"}
{"set": "B940", "decision": "REVERT", "edit": "second scale 0.011/0.045->0.0105/0.043", "before": {"hits": 1, "med": 4.654285684120027, "min": 1.0, "max": 125970.93162556336, "ge2": 40, "liq": 32}, "after": {"hits": 1, "med": 4.654237635892896, "min": 1.0, "max": 125959.81106431429, "ge2": 40, "liq": 32}, "mode": "agent_bg_loop", "ts": "2026-08-12T13:13:07.081558+00:00"}
{"set": "B941", "decision": "REVERT", "edit": "post-scale trail 6.1653697404852474e-12->5.2405642794124606e-12", "before": {"hits": 1, "med": 4.654285684120027, "min": 1.0, "max": 125970.93162556336, "ge2": 40, "liq": 32}, "after": {"hits": 1, "med": 4.654285684120957, "min": 1.0, "max": 125970.9316258614, "ge2": 40, "liq": 32}, "mode": "agent_bg_loop", "ts": "2026-08-12T13:13:27.227296+00:00"}
{"set": "B942", "decision": "REVERT", "edit": "later scale 0.0028->0.0026 runner chain", "before": {"hits": 1, "med": 4.654285684120027, "min": 1.0, "max": 125970.93162556336, "ge2": 40, "liq": 32}, "after": {"hits": 1, "med": 4.654248846350058, "min": 1.0, "max": 125956.34955370188, "ge2": 40, "liq": 32}, "mode": "agent_bg_loop", "ts": "2026-08-12T13:13:47.271461+00:00"}
{"set": "B943", "decision": "REVERT", "edit": "second scale 0.011/0.045->0.0105/0.043", "before": {"hits": 1, "med": 4.654285684120027, "min": 1.0, "max": 125970.93162556336, "ge2": 40, "liq": 32}, "after": {"hits": 1, "med": 4.654237635892896, "min": 1.0, "max": 125959.81106431429, "ge2": 40, "liq": 32}, "mode": "agent_bg_loop", "ts": "2026-08-12T13:14:07.503635+00:00"}
{"set": "B944", "decision": "REVERT", "edit": "post-scale trail 6.1653697404852474e-12->5.2405642794124606e-12", "before": {"hits": 1, "med": 4.654285684120027, "min": 1.0, "max": 125970.93162556336, "ge2": 40, "liq": 32}, "after": {"hits": 1, "med": 4.654285684120957, "min": 1.0, "max": 125970.9316258614, "ge2": 40, "liq": 32}, "mode": "agent_bg_loop", "ts": "2026-08-12T13:14:27.645887+00:00"}
{"set": "B945", "decision": "REVERT", "edit": "later scale 0.0028->0.0026 runner chain", "before": {"hits": 1, "med": 4.654285684120027, "min": 1.0, "max": 125970.93162556336, "ge2": 40, "liq": 32}, "after": {"hits": 1, "med": 4.654248846350058, "min": 1.0, "max": 125956.34955370188, "ge2": 40, "liq": 32}, "mode": "agent_bg_loop", "ts": "2026-08-12T13:14:47.579937+00:00"}
{"set": "B946", "decision": "REVERT", "edit": "second scale 0.011/0.045->0.0105/0.043", "before": {"hits": 1, "med": 4.654285684120027, "min": 1.0, "max": 125970.93162556336, "ge2": 40, "liq": 32}, "after": {"hits": 1, "med": 4.654237635892896, "min": 1.0, "max": 125959.81106431429, "ge2": 40, "liq": 32}, "mode": "agent_bg_loop", "ts": "2026-08-12T13:15:07.528407+00:00"}
{"set": "B947", "decision": "REVERT", "edit": "post-scale trail 6.1653697404852474e-12->5.2405642794124606e-12", "before": {"hits": 1, "med": 4.654285684120027, "min": 1.0, "max": 125970.93162556336, "ge2": 40, "liq": 32}, "after": {"hits": 1, "med": 4.654285684120957, "min": 1.0, "max": 125970.9316258614, "ge2": 40, "liq": 32}, "mode": "agent_bg_loop", "ts": "2026-08-12T13:15:27.413009+00:00"}
{"set": "B948", "decision": "REVERT", "edit": "later scale 0.0028->0.0026 runner chain", "before": {"hits": 1, "med": 4.654285684120027, "min": 1.0, "max": 125970.93162556336, "ge2": 40, "liq": 32}, "after": {"hits": 1, "med": 4.654248846350058, "min": 1.0, "max": 125956.34955370188, "ge2": 40, "liq": 32}, "mode": "agent_bg_loop", "ts": "2026-08-12T13:15:47.367370+00:00"}
{"set": "B949", "decision": "REVERT", "edit": "second scale 0.011/0.045->0.0105/0.043", "before": {"hits": 1, "med": 4.654285684120027, "min": 1.0, "max": 125970.93162556336, "ge2": 40, "liq": 32}, "after": {"hits": 1, "med": 4.654237635892896, "min": 1.0, "max": 125959.81106431429, "ge2": 40, "liq": 32}, "mode": "agent_bg_loop", "ts": "2026-08-12T13:16:07.383383+00:00"}
{"set": "B950", "decision": "REVERT", "edit": "post-scale trail 6.1653697404852474e-12->5.2405642794124606e-12", "before": {"hits": 1, "med": 4.654285684120027, "min": 1.0, "max": 125970.93162556336, "ge2": 40, "liq": 32}, "after": {"hits": 1, "med": 4.654285684120957, "min": 1.0, "max": 125970.9316258614, "ge2": 40, "liq": 32}, "mode": "agent_bg_loop", "ts": "2026-08-12T13:16:27.389595+00:00"}
{"set": "B951", "decision": "REVERT", "edit": "later scale 0.0028->0.0026 runner chain", "before": {"hits": 1, "med": 4.654285684120027, "min": 1.0, "max": 125970.93162556336, "ge2": 40, "liq": 32}, "after": {"hits": 1, "med": 4.654248846350058, "min": 1.0, "max": 125956.34955370188, "ge2": 40, "liq": 32}, "mode": "agent_bg_loop", "ts": "2026-08-12T13:16:47.459168+00:00"}
{"set": "B952", "decision": "REVERT", "edit": "second scale 0.011/0.045->0.0105/0.043", "before": {"hits": 1, "med": 4.654285684120027, "min": 1.0, "max": 125970.93162556336, "ge2": 40, "liq": 32}, "after": {"hits": 1, "med": 4.654237635892896, "min": 1.0, "max": 125959.81106431429, "ge2": 40, "liq": 32}, "mode": "agent_bg_loop", "ts": "2026-08-12T13:17:07.487901+00:00"}
{"set": "B953", "decision": "REVERT", "edit": "post-scale trail 6.1653697404852474e-12->5.2405642794124606e-12", "before": {"hits": 1, "med": 4.654285684120027, "min": 1.0, "max": 125970.93162556336, "ge2": 40, "liq": 32}, "after": {"hits": 1, "med": 4.654285684120957, "min": 1.0, "max": 125970.9316258614, "ge2": 40, "liq": 32}, "mode": "agent_bg_loop", "ts": "2026-08-12T13:17:27.422566+00:00"}
{"set": "B954", "decision": "REVERT", "edit": "later scale 0.0028->0.0026 runner chain", "before": {"hits": 1, "med": 4.654285684120027, "min": 1.0, "max": 125970.93162556336, "ge2": 40, "liq": 32}, "after": {"hits": 1, "med": 4.654248846350058, "min": 1.0, "max": 125956.34955370188, "ge2": 40, "liq": 32}, "mode": "agent_bg_loop", "ts": "2026-08-12T13:17:47.388311+00:00"}
{"set": "B955", "decision": "REVERT", "edit": "second scale 0.011/0.045->0.0105/0.043", "before": {"hits": 1, "med": 4.654285684120027, "min": 1.0, "max": 125970.93162556336, "ge2": 40, "liq": 32}, "after": {"hits": 1, "med": 4.654237635892896, "min": 1.0, "max": 125959.81106431429, "ge2": 40, "liq": 32}, "mode": "agent_bg_loop", "ts": "2026-08-12T13:18:07.636855+00:00"}
{"set": "B956", "decision": "REVERT", "edit": "post-scale trail 6.1653697404852474e-12->5.2405642794124606e-12", "before": {"hits": 1, "med": 4.654285684120027, "min": 1.0, "max": 125970.93162556336, "ge2": 40, "liq": 32}, "after": {"hits": 1, "med": 4.654285684120957, "min": 1.0, "max": 125970.9316258614, "ge2": 40, "liq": 32}, "mode": "agent_bg_loop", "ts": "2026-08-12T13:18:27.737036+00:00"}
{"set": "B957", "decision": "REVERT", "edit": "later scale 0.0028->0.0026 runner chain", "before": {"hits": 1, "med": 4.654285684120027, "min": 1.0, "max": 125970.93162556336, "ge2": 40, "liq": 32}, "after": {"hits": 1, "med": 4.654248846350058, "min": 1.0, "max": 125956.34955370188, "ge2": 40, "liq": 32}, "mode": "agent_bg_loop", "ts": "2026-08-12T13:18:47.760656+00:00"}
{"set": "B958", "decision": "REVERT", "edit": "second scale 0.011/0.045->0.0105/0.043", "before": {"hits": 1, "med": 4.654285684120027, "min": 1.0, "max": 125970.93162556336, "ge2": 40, "liq": 32}, "after": {"hits": 1, "med": 4.654237635892896, "min": 1.0, "max": 125959.81106431429, "ge2": 40, "liq": 32}, "mode": "agent_bg_loop", "ts": "2026-08-12T13:19:07.861407+00:00"}
{"set": "B959", "decision": "REVERT", "edit": "post-scale trail 6.1653697404852474e-12->5.2405642794124606e-12", "before": {"hits": 1, "med": 4.654285684120027, "min": 1.0, "max": 125970.93162556336, "ge2": 40, "liq": 32}, "after": {"hits": 1, "med": 4.654285684120957, "min": 1.0, "max": 125970.9316258614, "ge2": 40, "liq": 32}, "mode": "agent_bg_loop", "ts": "2026-08-12T13:19:27.914321+00:00"}
{"set": "B960", "decision": "REVERT", "edit": "later scale 0.0028->0.0026 runner chain", "before": {"hits": 1, "med": 4.654285684120027, "min": 1.0, "max": 125970.93162556336, "ge2": 40, "liq": 32}, "after": {"hits": 1, "med": 4.654248846350058, "min": 1.0, "max": 125956.34955370188, "ge2": 40, "liq": 32}, "mode": "agent_bg_loop", "ts": "2026-08-12T13:19:47.971811+00:00"}
{"set": "B961", "decision": "REVERT", "edit": "second scale 0.011/0.045->0.0105/0.043", "before": {"hits": 1, "med": 4.654285684120027, "min": 1.0, "max": 125970.93162556336, "ge2": 40, "liq": 32}, "after": {"hits": 1, "med": 4.654237635892896, "min": 1.0, "max": 125959.81106431429, "ge2": 40, "liq": 32}, "mode": "agent_bg_loop", "ts": "2026-08-12T13:20:07.928562+00:00"}
{"set": "B962", "decision": "REVERT", "edit": "post-scale trail 6.1653697404852474e-12->5.2405642794124606e-12", "before": {"hits": 1, "med": 4.654285684120027, "min": 1.0, "max": 125970.93162556336, "ge2": 40, "liq": 32}, "after": {"hits": 1, "med": 4.654285684120957, "min": 1.0, "max": 125970.9316258614, "ge2": 40, "liq": 32}, "mode": "agent_bg_loop", "ts": "2026-08-12T13:20:27.926274+00:00"}
{"set": "B963", "decision": "REVERT", "edit": "later scale 0.0028->0.0026 runner chain", "before": {"hits": 1, "med": 4.654285684120027, "min": 1.0, "max": 125970.93162556336, "ge2": 40, "liq": 32}, "after": {"hits": 1, "med": 4.654248846350058, "min": 1.0, "max": 125956.34955370188, "ge2": 40, "liq": 32}, "mode": "agent_bg_loop", "ts": "2026-08-12T13:20:48.000269+00:00"}
{"set": "B964", "decision": "REVERT", "edit": "second scale 0.011/0.045->0.0105/0.043", "before": {"hits": 1, "med": 4.654285684120027, "min": 1.0, "max": 125970.93162556336, "ge2": 40, "liq": 32}, "after": {"hits": 1, "med": 4.654237635892896, "min": 1.0, "max": 125959.81106431429, "ge2": 40, "liq": 32}, "mode": "agent_bg_loop", "ts": "2026-08-12T13:21:07.982688+00:00"}
{"set": "B965", "decision": "REVERT", "edit": "post-scale trail 6.1653697404852474e-12->5.2405642794124606e-12", "before": {"hits": 1, "med": 4.654285684120027, "min": 1.0, "max": 125970.93162556336, "ge2": 40, "liq": 32}, "after": {"hits": 1, "med": 4.654285684120957, "min": 1.0, "max": 125970.9316258614, "ge2": 40, "liq": 32}, "mode": "agent_bg_loop", "ts": "2026-08-12T13:21:28.134461+00:00"}
{"set": "B966", "decision": "REVERT", "edit": "later scale 0.0028->0.0026 runner chain", "before": {"hits": 1, "med": 4.654285684120027, "min": 1.0, "max": 125970.93162556336, "ge2": 40, "liq": 32}, "after": {"hits": 1, "med": 4.654248846350058, "min": 1.0, "max": 125956.34955370188, "ge2": 40, "liq": 32}, "mode": "agent_bg_loop", "ts": "2026-08-12T13:21:48.118937+00:00"}
{"set": "B967", "decision": "REVERT", "edit": "second scale 0.011/0.045->0.0105/0.043", "before": {"hits": 1, "med": 4.654285684120027, "min": 1.0, "max": 125970.93162556336, "ge2": 40, "liq": 32}, "after": {"hits": 1, "med": 4.654237635892896, "min": 1.0, "max": 125959.81106431429, "ge2": 40, "liq": 32}, "mode": "agent_bg_loop", "ts": "2026-08-12T13:22:08.067736+00:00"}
{"set": "B968", "decision": "REVERT", "edit": "post-scale trail 6.1653697404852474e-12->5.2405642794124606e-12", "before": {"hits": 1, "med": 4.654285684120027, "min": 1.0, "max": 125970.93162556336, "ge2": 40, "liq": 32}, "after": {"hits": 1, "med": 4.654285684120957, "min": 1.0, "max": 125970.9316258614, "ge2": 40, "liq": 32}, "mode": "agent_bg_loop", "ts": "2026-08-12T13:22:28.107317+00:00"}
{"set": "B969", "decision": "REVERT", "edit": "later scale 0.0028->0.0026 runner chain", "before": {"hits": 1, "med": 4.654285684120027, "min": 1.0, "max": 125970.93162556336, "ge2": 40, "liq": 32}, "after": {"hits": 1, "med": 4.654248846350058, "min": 1.0, "max": 125956.34955370188, "ge2": 40, "liq": 32}, "mode": "agent_bg_loop", "ts": "2026-08-12T13:22:48.102271+00:00"}
{"set": "B970", "decision": "REVERT", "edit": "second scale 0.011/0.045->0.0105/0.043", "before": {"hits": 1, "med": 4.654285684120027, "min": 1.0, "max": 125970.93162556336, "ge2": 40, "liq": 32}, "after": {"hits": 1, "med": 4.654237635892896, "min": 1.0, "max": 125959.81106431429, "ge2": 40, "liq": 32}, "mode": "agent_bg_loop", "ts": "2026-08-12T13:23:08.439759+00:00"}
{"set": "B971", "decision": "REVERT", "edit": "post-scale trail 6.1653697404852474e-12->5.2405642794124606e-12", "before": {"hits": 1, "med": 4.654285684120027, "min": 1.0, "max": 125970.93162556336, "ge2": 40, "liq": 32}, "after": {"hits": 1, "med": 4.654285684120957, "min": 1.0, "max": 125970.9316258614, "ge2": 40, "liq": 32}, "mode": "agent_bg_loop", "ts": "2026-08-12T13:23:28.463780+00:00"}
{"set": "B972", "decision": "REVERT", "edit": "later scale 0.0028->0.0026 runner chain", "before": {"hits": 1, "med": 4.654285684120027, "min": 1.0, "max": 125970.93162556336, "ge2": 40, "liq": 32}, "after": {"hits": 1, "med": 4.654248846350058, "min": 1.0, "max": 125956.34955370188, "ge2": 40, "liq": 32}, "mode": "agent_bg_loop", "ts": "2026-08-12T13:23:48.448322+00:00"}
{"set": "B973", "decision": "REVERT", "edit": "second scale 0.011/0.045->0.0105/0.043", "before": {"hits": 1, "med": 4.654285684120027, "min": 1.0, "max": 125970.93162556336, "ge2": 40, "liq": 32}, "after": {"hits": 1, "med": 4.654237635892896, "min": 1.0, "max": 125959.81106431429, "ge2": 40, "liq": 32}, "mode": "agent_bg_loop", "ts": "2026-08-12T13:24:08.668229+00:00"}
