{"set": "C018", "decision": "REVERT", "edit": "body_min floor 0.45->0.46 fewer weak entries", "before": {"hits": 1, "med": 4.654442398179108, "min": 1.0, "ge2": 40, "liq": 32, "max": 126017.02215307923}, "after": {"hits": 1, "med": 4.654442398179108, "min": 1.0, "ge2": 40, "liq": 32, "max": 126017.02215307923}, "mode": "agent_manual"}
{"set": "C019", "decision": "KEEP", "edit": "later 0.003->0.0032 continue runner scale chain", "before": {"hits": 1, "med": 4.654442398179108, "min": 1.0, "ge2": 40, "liq": 32, "max": 126017.02215307923}, "after": {"hits": 1, "med": 4.654478940321371, "min": 1.0, "ge2": 40, "liq": 32, "max": 126031.51796382754}, "mode": "agent_manual"}
{"set": "C020", "decision": "REVERT", "edit": "win_size_mult 1.75->1.78 faster anti-martingale", "before": {"hits": 1, "med": 4.654478940321371, "min": 1.0, "ge2": 40, "liq": 32, "max": 126031.51796382754}, "after": {"hits": 1, "med": 4.549389864985138, "min": 1.0, "ge2": 40, "liq": 32, "max": 131418.48876159696}, "mode": "agent_manual"}
{"set": "C021", "decision": "KEEP", "edit": "later 0.0032->0.0034 continue C019 chain", "before": {"hits": 1, "med": 4.654478940321371, "min": 1.0, "ge2": 40, "liq": 32, "max": 126031.51796382754}, "after": {"hits": 1, "med": 4.654515431176431, "min": 1.0, "ge2": 40, "liq": 32, "max": 126045.9946785968}, "mode": "agent_manual"}
{"set": "C022", "decision": "KEEP", "edit": "second scale 0.013/0.05->0.014/0.052 continue C012", "before": {"hits": 1, "med": 4.654515431176431, "min": 1.0, "ge2": 40, "liq": 32, "max": 126045.9946785968}, "after": {"hits": 1, "med": 4.654563248610955, "min": 1.0, "ge2": 40, "liq": 32, "max": 126059.57021017389}, "mode": "agent_manual"}
{"set": "C023", "decision": "REVERT", "edit": "size_boost 1.5ATR 1.325->1.33 mild", "before": {"hits": 1, "med": 4.654563248610955, "min": 1.0, "ge2": 40, "liq": 32, "max": 126059.57021017389}, "after": {"hits": 1, "med": 4.654563248610955, "min": 1.0, "ge2": 40, "liq": 32, "max": 126059.57021017389}, "mode": "agent_manual"}
{"set": "C024", "decision": "REVERT", "edit": "first partial 0.0->0.005 tiny first scale", "before": {"hits": 1, "med": 4.654563248610955, "min": 1.0, "ge2": 40, "liq": 32, "max": 126059.57021017389}, "after": {"hits": 1, "med": 4.649452902985072, "min": 1.0, "ge2": 40, "liq": 32, "max": 124759.97489859186}, "mode": "agent_manual"}
{"set": "C025", "decision": "REVERT", "edit": "cooldown 220->218 slightly more entries", "before": {"hits": 1, "med": 4.654563248610955, "min": 1.0, "ge2": 40, "liq": 32, "max": 126059.57021017389}, "after": {"hits": 1, "med": 4.654563248610955, "min": 1.0, "ge2": 40, "liq": 39, "max": 126059.57021017389}, "mode": "agent_manual"}
{"set": "C026", "decision": "REVERT", "edit": "reentry 170->172 slight widen", "before": {"hits": 1, "med": 4.654563248610955, "min": 1.0, "ge2": 40, "liq": 32, "max": 126059.57021017389}, "after": {"hits": 1, "med": 4.654563248610955, "min": 1.0, "ge2": 40, "liq": 32, "max": 126059.57021017389}, "mode": "agent_manual"}
{"set": "C027", "decision": "KEEP", "edit": "later 0.0034->0.0036", "before": {"hits": 1, "med": 4.654563248610955, "min": 1.0, "ge2": 40, "liq": 32, "max": 126059.57021017389}, "after": {"hits": 1, "med": 4.654599611525503, "min": 1.0, "ge2": 40, "liq": 32, "max": 126074.0072162707}, "mode": "agent_manual"}
{"set": "C028", "decision": "KEEP", "edit": "second 0.014/0.052->0.015/0.055", "before": {"hits": 1, "med": 4.654599611525503, "min": 1.0, "ge2": 40, "liq": 32, "max": 126074.0072162707}, "after": {"hits": 1, "med": 4.654671222604778, "min": 1.0, "ge2": 40, "liq": 32, "max": 126091.84166406776}, "mode": "agent_manual"}
{"set": "C029", "decision": "REVERT", "edit": "trail_scale_max 10->9 fewer scales", "before": {"hits": 1, "med": 4.654671222604778, "min": 1.0, "ge2": 40, "liq": 32, "max": 126091.84166406776}, "after": {"hits": 1, "med": 4.654589722239479, "min": 1.0, "ge2": 40, "liq": 31, "max": 126059.44401678734}, "mode": "agent_manual"}
{"set": "C030", "decision": "REVERT", "edit": "risk_cap 0.0024->0.00238 slightly tighter", "before": {"hits": 1, "med": 4.654671222604778, "min": 1.0, "ge2": 40, "liq": 32, "max": 126091.84166406776}, "after": {"hits": 1, "med": 4.600975185640214, "min": 1.0, "ge2": 40, "liq": 32, "max": 128527.86649944467}, "mode": "agent_manual"}
{"set": "C031", "decision": "KEEP", "edit": "later 0.0036->0.0038 continue C027 chain", "before": {"hits": 1, "med": 4.654671222604778, "min": 1.0, "ge2": 40, "liq": 32, "max": 126091.84166406776}, "after": {"hits": 1, "med": 4.65470741955225, "min": 1.0, "ge2": 40, "liq": 32, "max": 126106.23251129416}, "mode": "agent_manual"}
{"set": "C032", "decision": "KEEP", "edit": "second 0.015/0.055->0.016/0.058 continue C028", "before": {"hits": 1, "med": 4.65470741955225, "min": 1.0, "ge2": 40, "liq": 32, "max": 126106.23251129416}, "after": {"hits": 1, "med": 4.654778915720581, "min": 1.0, "ge2": 40, "liq": 32, "max": 126124.04144422663}, "mode": "agent_manual"}
{"set": "C033", "decision": "REVERT", "edit": "ht_ema cap 40->38 faster HTF filter", "before": {"hits": 1, "med": 4.654778915720581, "min": 1.0, "ge2": 40, "liq": 32, "max": 126124.04144422663}, "after": {"hits": 1, "med": 4.148787854417537, "min": 1.0, "ge2": 39, "liq": 32, "max": 126124.04144422663}, "mode": "agent_manual"}
{"set": "C034", "decision": "REVERT", "edit": "n_fast max(30,n//5)->max(32,n//5) slightly slower fast Donchian", "before": {"hits": 1, "med": 4.654778915720581, "min": 1.0, "ge2": 40, "liq": 32, "max": 126124.04144422663}, "after": {"hits": 1, "med": 4.654778915720581, "min": 1.0, "ge2": 40, "liq": 32, "max": 126124.04144422663}, "mode": "agent_manual"}
{"set": "C035", "decision": "REVERT", "edit": "trail soft-cap 3.0->3.05 slightly wider base trail", "before": {"hits": 1, "med": 4.654778915720581, "min": 1.0, "ge2": 40, "liq": 32, "max": 126124.04144422663}, "after": {"hits": 1, "med": 4.609516612662578, "min": 1.0, "ge2": 40, "liq": 31, "max": 124792.13775030572}, "mode": "agent_manual"}
{"set": "C036", "decision": "REVERT", "edit": "lev_cap *1.5->*1.52 mild more notional on winners", "before": {"hits": 1, "med": 4.654778915720581, "min": 1.0, "ge2": 40, "liq": 32, "max": 126124.04144422663}, "after": {"hits": 1, "med": 4.654778915720581, "min": 1.0, "ge2": 40, "liq": 32, "max": 127783.98417749316}, "mode": "agent_manual"}
{"set": "C037", "decision": "KEEP", "edit": "later 0.0038->0.0040", "before": {"hits": 1, "med": 4.654778915720581, "min": 1.0, "ge2": 40, "liq": 32, "max": 126124.04144422663}, "after": {"hits": 1, "med": 4.654814947085183, "min": 1.0, "ge2": 40, "liq": 32, "max": 126138.38621356436}, "mode": "agent_manual"}
{"set": "C038", "decision": "KEEP", "edit": "second 0.016/0.058->0.017/0.06", "before": {"hits": 1, "med": 4.654814947085183, "min": 1.0, "ge2": 40, "liq": 32, "max": 126138.38621356436}, "after": {"hits": 1, "med": 4.654862534697692, "min": 1.0, "ge2": 40, "liq": 32, "max": 126151.90348826296}, "mode": "agent_manual"}
{"set": "C039", "decision": "REVERT", "edit": "ema_slope diff 200->195 slightly faster slope agree", "before": {"hits": 1, "med": 4.654862534697692, "min": 1.0, "ge2": 40, "liq": 32, "max": 126151.90348826296}, "after": {"hits": 1, "med": 4.654862534697692, "min": 1.0, "ge2": 40, "liq": 32, "max": 126151.90348826296}, "mode": "agent_manual"}
{"set": "C040", "decision": "REVERT", "edit": "partial_trail_frac 0.68->0.70 enable gate only (frac unused if staged)", "before": {"hits": 1, "med": 4.654862534697692, "min": 1.0, "ge2": 40, "liq": 32, "max": 126151.90348826296}, "after": {"hits": 1, "med": 4.654862534697692, "min": 1.0, "ge2": 40, "liq": 32, "max": 126151.90348826296}, "mode": "agent_manual"}
{"set": "C041", "decision": "KEEP", "edit": "later 0.0040->0.0042 continue scale chain for weak-window bankroll", "before": {"hits": 1, "med": 4.654862534697692, "min": 1.0, "ge2": 40, "liq": 32, "max": 126151.90348826296}, "after": {"hits": 1, "med": 4.65489843905912, "min": 1.0, "ge2": 40, "liq": 32, "max": 126166.20876362755}, "mode": "agent_manual"}
{"set": "C042", "decision": "KEEP", "edit": "second 0.017/0.06->0.018/0.062 continue C038 chain", "before": {"hits": 1, "med": 4.65489843905912, "min": 1.0, "ge2": 40, "liq": 32, "max": 126166.20876362755}, "after": {"hits": 1, "med": 4.654945950279367, "min": 1.0, "ge2": 40, "liq": 32, "max": 126179.70647266136}, "mode": "agent_manual"}
{"set": "C043", "decision": "REVERT", "edit": "width_tr 0.25->0.24 slightly less floor trail (dead windows over-trail)", "before": {"hits": 1, "med": 4.654945950279367, "min": 1.0, "ge2": 40, "liq": 32, "max": 126179.70647266136}, "after": {"hits": 1, "med": 4.464713019643993, "min": 1.0, "ge2": 38, "liq": 32, "max": 126179.70647271664}, "mode": "agent_manual"}
{"set": "C044", "decision": "REVERT", "edit": "range_ok 0.8->0.78 admit slightly thinner bars in dead windows", "before": {"hits": 1, "med": 4.654945950279367, "min": 1.0, "ge2": 40, "liq": 32, "max": 126179.70647266136}, "after": {"hits": 1, "med": 4.654945950279367, "min": 1.0, "ge2": 40, "liq": 32, "max": 126179.70647266136}, "mode": "agent_manual"}
{"set": "C045", "decision": "REVERT", "edit": "body floor 0.45->0.43 more entries on weak regimes", "before": {"hits": 1, "med": 4.654945950279367, "min": 1.0, "ge2": 40, "liq": 32, "max": 126179.70647266136}, "after": {"hits": 1, "med": 4.654945950279367, "min": 1.0, "ge2": 40, "liq": 32, "max": 126179.70647266136}, "mode": "agent_manual"}
{"set": "C046", "decision": "REVERT", "edit": "trail_unlock_mult 1.3->1.28 lock more after unlock", "before": {"hits": 1, "med": 4.654945950279367, "min": 1.0, "ge2": 40, "liq": 32, "max": 126179.70647266136}, "after": {"hits": 1, "med": 4.5812938121461855, "min": 1.0, "ge2": 39, "liq": 33, "max": 126179.70647269295}, "mode": "agent_manual"}
{"set": "C047", "decision": "KEEP", "edit": "later 0.0042->0.0044 continue scale chain", "before": {"hits": 1, "med": 4.654945950279367, "min": 1.0, "ge2": 40, "liq": 32, "max": 126179.70647266136}, "after": {"hits": 1, "med": 4.654981727913216, "min": 1.0, "ge2": 40, "liq": 32, "max": 126193.97232074186}, "mode": "agent_manual"}
{"set": "C048", "decision": "KEEP", "edit": "second 0.018/0.062->0.019/0.064 continue C042 chain", "before": {"hits": 1, "med": 4.654981727913216, "min": 1.0, "ge2": 40, "liq": 32, "max": 126193.97232074186}, "after": {"hits": 1, "med": 4.655029162848532, "min": 1.0, "ge2": 40, "liq": 32, "max": 126207.45048317888}, "mode": "agent_manual"}
{"set": "C049", "decision": "REVERT", "edit": "roc lookback 120->118 milder momentum agree for dead windows", "before": {"hits": 1, "med": 4.655029162848532, "min": 1.0, "ge2": 40, "liq": 32, "max": 126207.45048317888}, "after": {"hits": 0, "med": 4.578970747227169, "min": 1.0, "ge2": 38, "liq": 33, "max": 2041.47715094698}, "mode": "agent_manual"}
{"set": "C050", "decision": "REVERT", "edit": "risk_cap_pct 0.0024->0.00235 slightly tighter early risk", "before": {"hits": 1, "med": 4.655029162848532, "min": 1.0, "ge2": 40, "liq": 32, "max": 126207.45048317888}, "after": {"hits": 1, "med": 4.611175170957102, "min": 1.0, "ge2": 40, "liq": 32, "max": 132431.72370372835}, "mode": "agent_manual"}
{"set": "C051", "decision": "KEEP", "edit": "later 0.0044->0.0046", "before": {"hits": 1, "med": 4.655029162848532, "min": 1.0, "ge2": 40, "liq": 32, "max": 126207.45048317888}, "after": {"hits": 1, "med": 4.655064814029944, "min": 1.0, "ge2": 40, "liq": 32, "max": 126221.67697062138}, "mode": "agent_manual"}
{"set": "C052", "decision": "REVERT", "edit": "second 0.019/0.064->0.020/0.066", "before": {"hits": 1, "med": 4.655112172787522, "min": 1.0, "ge2": 40, "liq": 32, "max": 126235.1356055368}, "after": {"hits": 1, "med": 4.655112172787522, "min": 1.0, "ge2": 40, "liq": 32, "max": 126235.1356055368}, "mode": "agent_manual"}
{"set": "C052", "decision": "KEEP", "edit": "second 0.019/0.064->0.020/0.066", "before": {"hits": 1, "med": 4.655064814029944, "min": 1.0, "ge2": 40, "liq": 32, "max": 126221.67697062138}, "after": {"hits": 1, "med": 4.655112172787522, "min": 1.0, "ge2": 40, "liq": 32, "max": 126235.1356055368}, "mode": "agent_manual", "note": "rerun_correct_order"}
{"set": "C053", "decision": "REVERT", "edit": "vol_ok 0.0015->0.0014", "before": {"hits": 1, "med": 4.655112172787522, "min": 1.0, "ge2": 40, "liq": 32, "max": 126235.1356055368, "dead0": 5, "dead": 17}, "after": {"hits": 0, "med": 2.5698605976833964, "min": 1.0, "ge2": 33, "liq": 34, "max": 251.3706584977596, "dead0": 5, "dead": 21}, "mode": "agent_manual"}
{"set": "C054", "decision": "KEEP", "edit": "later 0.0046->0.0048", "before": {"hits": 1, "med": 4.655112172787522, "min": 1.0, "ge2": 40, "liq": 32, "max": 126235.1356055368}, "after": {"hits": 1, "med": 4.6551476977912, "min": 1.0, "ge2": 40, "liq": 32, "max": 126249.32279894657}, "mode": "agent_manual"}
{"set": "C055", "decision": "KEEP", "edit": "second 0.020/0.066->0.021/0.068", "before": {"hits": 1, "med": 4.6551476977912, "min": 1.0, "ge2": 40, "liq": 32, "max": 126249.32279894657}, "after": {"hits": 1, "med": 4.655194980478106, "min": 1.0, "ge2": 40, "liq": 32, "max": 126262.76192542214}, "mode": "agent_manual"}
{"set": "C056", "decision": "REVERT", "edit": "size_boost top 1.35->1.34", "before": {"hits": 1, "med": 4.655194980478106, "min": 1.0, "ge2": 40, "liq": 32, "max": 126262.76192542214}, "after": {"hits": 1, "med": 4.655194980478106, "min": 1.0, "ge2": 39, "liq": 32, "max": 123971.63690513647}, "mode": "agent_manual"}
{"set": "C057", "decision": "KEEP", "edit": "later 0.0048->0.0050", "before": {"hits": 1, "med": 4.655194980478106, "min": 1.0, "ge2": 40, "liq": 32, "max": 126262.76192542214}, "after": {"hits": 1, "med": 4.655230379578304, "min": 1.0, "ge2": 40, "liq": 32, "max": 126276.90989135996}, "mode": "agent_manual"}
{"set": "C058", "decision": "KEEP", "edit": "second 0.021/0.068->0.022/0.070", "before": {"hits": 1, "med": 4.655230379578304, "min": 1.0, "ge2": 40, "liq": 32, "max": 126276.90989135996}, "after": {"hits": 1, "med": 4.655277586301477, "min": 1.0, "ge2": 40, "liq": 32, "max": 126290.32952848416}, "mode": "agent_manual"}
{"set": "C059", "decision": "REVERT", "edit": "expand_mult cap 1.15->1.16", "before": {"hits": 1, "med": 4.655277586301477, "min": 1.0, "ge2": 40, "liq": 32, "max": 126290.32952848416}, "after": {"hits": 1, "med": 4.655277586301477, "min": 1.0, "ge2": 40, "liq": 32, "max": 126290.32952848416}, "mode": "agent_manual"}
{"set": "C060", "decision": "KEEP", "edit": "later 0.0050->0.0052", "before": {"hits": 1, "med": 4.655277586301477, "min": 1.0, "ge2": 40, "liq": 32, "max": 126290.32952848416}, "after": {"hits": 1, "med": 4.6553128597719935, "min": 1.0, "ge2": 40, "liq": 32, "max": 126304.43833346853}, "mode": "agent_manual"}
{"set": "C061", "decision": "KEEP", "edit": "second 0.022/0.070->0.023/0.072", "before": {"hits": 1, "med": 4.6553128597719935, "min": 1.0, "ge2": 40, "liq": 32, "max": 126304.43833346853}, "after": {"hits": 1, "med": 4.65535999063824, "min": 1.0, "ge2": 40, "liq": 32, "max": 126317.83850033648}, "mode": "agent_manual"}
{"set": "C062", "decision": "REVERT", "edit": "trail_unlock_r 4.0->4.1", "before": {"hits": 1, "med": 4.65535999063824, "min": 1.0, "ge2": 40, "liq": 32, "max": 126317.83850033648}, "after": {"hits": 1, "med": 4.65535999063824, "min": 1.0, "ge2": 40, "liq": 32, "max": 126317.83850033648}, "mode": "agent_manual"}
{"set": "C063", "decision": "KEEP", "edit": "later 0.0052->0.0054", "before": {"hits": 1, "med": 4.65535999063824, "min": 1.0, "ge2": 40, "liq": 32, "max": 126317.83850033648}, "after": {"hits": 1, "med": 4.655395138752436, "min": 1.0, "ge2": 40, "liq": 32, "max": 126331.9082108427}, "mode": "agent_manual"}
{"set": "C064", "decision": "KEEP", "edit": "second 0.023/0.072->0.024/0.074", "before": {"hits": 1, "med": 4.655395138752436, "min": 1.0, "ge2": 40, "liq": 32, "max": 126331.9082108427}, "after": {"hits": 1, "med": 4.655442193868434, "min": 1.0, "ge2": 40, "liq": 32, "max": 126345.28892655572}, "mode": "agent_manual"}
{"set": "C065", "decision": "REVERT", "edit": "breakout_buffer +0.01ATR", "before": {"hits": 1, "med": 4.655442193868434, "min": 1.0, "ge2": 40, "liq": 32, "max": 126345.28892655572}, "after": {"hits": 1, "med": 4.655442193868434, "min": 1.0, "ge2": 40, "liq": 31, "max": 126345.28892655572}, "mode": "agent_manual"}
{"set": "C066", "decision": "KEEP", "edit": "later 0.0054->0.0056", "before": {"hits": 1, "med": 4.655442193868434, "min": 1.0, "ge2": 40, "liq": 32, "max": 126345.28892655572}, "after": {"hits": 1, "med": 4.655477216899214, "min": 1.0, "ge2": 40, "liq": 32, "max": 126359.31960901571}, "mode": "agent_manual"}
{"set": "C067", "decision": "KEEP", "edit": "second 0.024/0.074->0.025/0.076", "before": {"hits": 1, "med": 4.655477216899214, "min": 1.0, "ge2": 40, "liq": 32, "max": 126359.31960901571}, "after": {"hits": 1, "med": 4.655524196371518, "min": 1.0, "ge2": 40, "liq": 32, "max": 126372.68089268151}, "mode": "agent_manual"}
{"set": "C068", "decision": "REVERT", "edit": "size_boost mid 1.325->1.33", "before": {"hits": 1, "med": 4.655524196371518, "min": 1.0, "ge2": 40, "liq": 32, "max": 126372.68089268151}, "after": {"hits": 1, "med": 4.655524196371518, "min": 1.0, "ge2": 40, "liq": 32, "max": 126372.68089268151}, "mode": "agent_manual"}
{"set": "C069", "decision": "KEEP", "edit": "later 0.0056->0.0058", "before": {"hits": 1, "med": 4.655524196371518, "min": 1.0, "ge2": 40, "liq": 32, "max": 126372.68089268151}, "after": {"hits": 1, "med": 4.655559094591351, "min": 1.0, "ge2": 40, "liq": 32, "max": 126386.67261348476}, "mode": "agent_manual"}
{"set": "C070", "decision": "KEEP", "edit": "second 0.025/0.076->0.026/0.078", "before": {"hits": 1, "med": 4.655559094591351, "min": 1.0, "ge2": 40, "liq": 32, "max": 126386.67261348476}, "after": {"hits": 1, "med": 4.655605998526384, "min": 1.0, "ge2": 40, "liq": 32, "max": 126400.01448421768}, "mode": "agent_manual"}
{"set": "C071", "decision": "KEEP", "edit": "later 0.0058->0.0060", "before": {"hits": 1, "med": 4.655605998526384, "min": 1.0, "ge2": 40, "liq": 32, "max": 126400.01448421768}, "after": {"hits": 1, "med": 4.655640772207291, "min": 1.0, "ge2": 40, "liq": 32, "max": 126413.9673097087}, "mode": "agent_manual"}
{"set": "C072", "decision": "KEEP", "edit": "second 0.026/0.078->0.027/0.080", "before": {"hits": 1, "med": 4.655640772207291, "min": 1.0, "ge2": 40, "liq": 32, "max": 126413.9673097087}, "after": {"hits": 1, "med": 4.655687600711344, "min": 1.0, "ge2": 40, "liq": 32, "max": 126427.28978662858}, "mode": "agent_manual"}
{"set": "C073", "decision": "REVERT", "edit": "body_min floor 0.45->0.47", "before": {"hits": 1, "med": 4.655687600711344, "min": 1.0, "ge2": 40, "liq": 32, "max": 126427.28978662858}, "after": {"hits": 1, "med": 4.655687600711344, "min": 1.0, "ge2": 40, "liq": 32, "max": 126427.28978662858}, "mode": "agent_manual"}
{"set": "C074", "decision": "KEEP", "edit": "later 0.0060->0.0062", "before": {"hits": 1, "med": 4.655687600711344, "min": 1.0, "ge2": 40, "liq": 32, "max": 126427.28978662858}, "after": {"hits": 1, "med": 4.6557222501248985, "min": 1.0, "ge2": 40, "liq": 32, "max": 126441.20378310856}, "mode": "agent_manual"}
{"set": "C075", "decision": "KEEP", "edit": "second 0.027/0.080->0.028/0.082", "before": {"hits": 1, "med": 4.6557222501248985, "min": 1.0, "ge2": 40, "liq": 32, "max": 126441.20378310856}, "after": {"hits": 1, "med": 4.655769003304141, "min": 1.0, "ge2": 40, "liq": 32, "max": 126454.50688534178}, "mode": "agent_manual"}
{"set": "C076", "decision": "REVERT", "edit": "win_size_mult 1.75->1.76", "before": {"hits": 1, "med": 4.655769003304141, "min": 1.0, "ge2": 40, "liq": 32, "max": 126454.50688534178}, "after": {"hits": 1, "med": 4.578107717905841, "min": 1.0, "ge2": 40, "liq": 32, "max": 128238.64882331665}, "mode": "agent_manual"}
{"set": "C077", "decision": "KEEP", "edit": "later 0.0062->0.0064", "before": {"hits": 1, "med": 4.655769003304141, "min": 1.0, "ge2": 40, "liq": 32, "max": 126454.50688534178}, "after": {"hits": 1, "med": 4.655803528721476, "min": 1.0, "ge2": 40, "liq": 32, "max": 126468.38211906792}, "mode": "agent_manual"}
{"set": "C078", "decision": "KEEP", "edit": "second 0.028/0.082->0.029/0.084", "before": {"hits": 1, "med": 4.655803528721476, "min": 1.0, "ge2": 40, "liq": 32, "max": 126468.38211906792}, "after": {"hits": 1, "med": 4.655850206681943, "min": 1.0, "ge2": 40, "liq": 32, "max": 126481.66586574662}, "mode": "agent_manual"}
{"set": "C079", "decision": "REVERT", "edit": "range_ok 0.8->0.82", "before": {"hits": 1, "med": 4.655850206681943, "min": 1.0, "ge2": 40, "liq": 32, "max": 126481.66586574662}, "after": {"hits": 1, "med": 4.555869260144877, "min": 1.0, "ge2": 39, "liq": 32, "max": 126481.66586574662}, "mode": "agent_manual"}
{"set": "C080", "decision": "KEEP", "edit": "later 0.0064->0.0066", "before": {"hits": 1, "med": 4.655850206681943, "min": 1.0, "ge2": 40, "liq": 32, "max": 126481.66586574662}, "after": {"hits": 1, "med": 4.655884608373742, "min": 1.0, "ge2": 40, "liq": 32, "max": 126495.5024029316}, "mode": "agent_manual"}
{"set": "C081", "decision": "KEEP", "edit": "second 0.029/0.084->0.030/0.086", "before": {"hits": 1, "med": 4.655884608373742, "min": 1.0, "ge2": 40, "liq": 32, "max": 126495.5024029316}, "after": {"hits": 1, "med": 4.655931211221347, "min": 1.0, "ge2": 40, "liq": 32, "max": 126508.76681319364}, "mode": "agent_manual"}
{"set": "C082", "decision": "KEEP", "edit": "later 0.0066->0.0068", "before": {"hits": 1, "med": 4.655931211221347, "min": 1.0, "ge2": 40, "liq": 32, "max": 126508.76681319364}, "after": {"hits": 1, "med": 4.655965489457864, "min": 1.0, "ge2": 40, "liq": 32, "max": 126522.56472000688}, "mode": "agent_manual"}
{"set": "C083", "decision": "REVERT", "edit": "trail soft-cap 3.0->2.95", "before": {"hits": 1, "med": 4.655965489457864, "min": 1.0, "ge2": 40, "liq": 32, "max": 126522.56472000688}, "after": {"hits": 1, "med": 4.668756014460526, "min": 1.0, "ge2": 40, "liq": 33, "max": 127858.67692657048}, "mode": "agent_manual"}
