{"set": "B233", "decision": "KEEP", "edit": "post-scale trail 6.682597761245753e-09->5.68020809705889e-09", "before": {"hits": 1, "med": 4.6542856773896855, "min": 1.0, "max": 125970.92948831143, "ge2": 40, "liq": 32}, "after": {"hits": 1, "med": 4.654285678400166, "min": 1.0, "max": 125970.92980919336, "ge2": 40, "liq": 32}, "mode": "agent_bg_loop", "ts": "2026-08-12T09:18:25.880820+00:00"}
{"set": "B234", "decision": "REVERT", "edit": "later scale 0.0028->0.0026 runner chain", "before": {"hits": 1, "med": 4.654285678400166, "min": 1.0, "max": 125970.92980919336, "ge2": 40, "liq": 32}, "after": {"hits": 1, "med": 4.654248840630505, "min": 1.0, "max": 125956.34773751369, "ge2": 40, "liq": 32}, "mode": "agent_bg_loop", "ts": "2026-08-12T09:18:45.575502+00:00"}
{"set": "B235", "decision": "REVERT", "edit": "second scale 0.011/0.045->0.0105/0.043", "before": {"hits": 1, "med": 4.654285678400166, "min": 1.0, "max": 125970.92980919336, "ge2": 40, "liq": 32}, "after": {"hits": 1, "med": 4.65423763017347, "min": 1.0, "max": 125959.80924807038, "ge2": 40, "liq": 32}, "mode": "agent_bg_loop", "ts": "2026-08-12T09:19:05.516722+00:00"}
{"set": "B236", "decision": "KEEP", "edit": "post-scale trail 5.68020809705889e-09->4.8281768825000565e-09", "before": {"hits": 1, "med": 4.654285678400166, "min": 1.0, "max": 125970.92980919336, "ge2": 40, "liq": 32}, "after": {"hits": 1, "med": 4.654285679259077, "min": 1.0, "max": 125970.93008194731, "ge2": 40, "liq": 32}, "mode": "agent_bg_loop", "ts": "2026-08-12T09:19:25.214353+00:00"}
{"set": "B237", "decision": "REVERT", "edit": "later scale 0.0028->0.0026 runner chain", "before": {"hits": 1, "med": 4.654285679259077, "min": 1.0, "max": 125970.93008194731, "ge2": 40, "liq": 32}, "after": {"hits": 1, "med": 4.65424884148937, "min": 1.0, "max": 125956.34801024036, "ge2": 40, "liq": 32}, "mode": "agent_bg_loop", "ts": "2026-08-12T09:19:44.893005+00:00"}
{"set": "B238", "decision": "REVERT", "edit": "second scale 0.011/0.045->0.0105/0.043", "before": {"hits": 1, "med": 4.654285679259077, "min": 1.0, "max": 125970.93008194731, "ge2": 40, "liq": 32}, "after": {"hits": 1, "med": 4.654237631032316, "min": 1.0, "max": 125959.8095208056, "ge2": 40, "liq": 32}, "mode": "agent_bg_loop", "ts": "2026-08-12T09:20:04.647173+00:00"}
{"set": "B239", "decision": "KEEP", "edit": "post-scale trail 4.8281768825000565e-09->4.103950350125048e-09", "before": {"hits": 1, "med": 4.654285679259077, "min": 1.0, "max": 125970.93008194731, "ge2": 40, "liq": 32}, "after": {"hits": 1, "med": 4.654285679989147, "min": 1.0, "max": 125970.93031378552, "ge2": 40, "liq": 32}, "mode": "agent_bg_loop", "ts": "2026-08-12T09:20:24.295906+00:00"}
{"set": "B240", "decision": "REVERT", "edit": "later scale 0.0028->0.0026 runner chain", "before": {"hits": 1, "med": 4.654285679989147, "min": 1.0, "max": 125970.93031378552, "ge2": 40, "liq": 32}, "after": {"hits": 1, "med": 4.654248842219402, "min": 1.0, "max": 125956.34824205538, "ge2": 40, "liq": 32}, "mode": "agent_bg_loop", "ts": "2026-08-12T09:20:43.944328+00:00"}
{"set": "B241", "decision": "REVERT", "edit": "second scale 0.011/0.045->0.0105/0.043", "before": {"hits": 1, "med": 4.654285679989147, "min": 1.0, "max": 125970.93031378552, "ge2": 40, "liq": 32}, "after": {"hits": 1, "med": 4.654237631762331, "min": 1.0, "max": 125959.80975262757, "ge2": 40, "liq": 32}, "mode": "agent_bg_loop", "ts": "2026-08-12T09:21:03.714517+00:00"}
{"set": "B242", "decision": "KEEP", "edit": "post-scale trail 4.103950350125048e-09->3.4883577976062905e-09", "before": {"hits": 1, "med": 4.654285679989147, "min": 1.0, "max": 125970.93031378552, "ge2": 40, "liq": 32}, "after": {"hits": 1, "med": 4.654285680609712, "min": 1.0, "max": 125970.93051084576, "ge2": 40, "liq": 32}, "mode": "agent_bg_loop", "ts": "2026-08-12T09:21:23.677845+00:00"}
{"set": "B243", "decision": "REVERT", "edit": "later scale 0.0028->0.0026 runner chain", "before": {"hits": 1, "med": 4.654285680609712, "min": 1.0, "max": 125970.93051084576, "ge2": 40, "liq": 32}, "after": {"hits": 1, "med": 4.654248842839933, "min": 1.0, "max": 125956.34843909592, "ge2": 40, "liq": 32}, "mode": "agent_bg_loop", "ts": "2026-08-12T09:21:43.352530+00:00"}
{"set": "B244", "decision": "REVERT", "edit": "second scale 0.011/0.045->0.0105/0.043", "before": {"hits": 1, "med": 4.654285680609712, "min": 1.0, "max": 125970.93051084576, "ge2": 40, "liq": 32}, "after": {"hits": 1, "med": 4.6542376323828485, "min": 1.0, "max": 125959.8099496742, "ge2": 40, "liq": 32}, "mode": "agent_bg_loop", "ts": "2026-08-12T09:22:03.030740+00:00"}
{"set": "B245", "decision": "KEEP", "edit": "post-scale trail 3.4883577976062905e-09->2.965104127965347e-09", "before": {"hits": 1, "med": 4.654285680609712, "min": 1.0, "max": 125970.93051084576, "ge2": 40, "liq": 32}, "after": {"hits": 1, "med": 4.654285681137197, "min": 1.0, "max": 125970.93067835136, "ge2": 40, "liq": 32}, "mode": "agent_bg_loop", "ts": "2026-08-12T09:22:22.632718+00:00"}
{"set": "B246", "decision": "REVERT", "edit": "later scale 0.0028->0.0026 runner chain", "before": {"hits": 1, "med": 4.654285681137197, "min": 1.0, "max": 125970.93067835136, "ge2": 40, "liq": 32}, "after": {"hits": 1, "med": 4.654248843367389, "min": 1.0, "max": 125956.34860658468, "ge2": 40, "liq": 32}, "mode": "agent_bg_loop", "ts": "2026-08-12T09:22:42.295464+00:00"}
{"set": "B247", "decision": "REVERT", "edit": "second scale 0.011/0.045->0.0105/0.043", "before": {"hits": 1, "med": 4.654285681137197, "min": 1.0, "max": 125970.93067835136, "ge2": 40, "liq": 32}, "after": {"hits": 1, "med": 4.654237632910293, "min": 1.0, "max": 125959.81011716808, "ge2": 40, "liq": 32}, "mode": "agent_bg_loop", "ts": "2026-08-12T09:23:02.115700+00:00"}
{"set": "B248", "decision": "KEEP", "edit": "post-scale trail 2.965104127965347e-09->2.520338508770545e-09", "before": {"hits": 1, "med": 4.654285681137197, "min": 1.0, "max": 125970.93067835136, "ge2": 40, "liq": 32}, "after": {"hits": 1, "med": 4.654285681585552, "min": 1.0, "max": 125970.9308207303, "ge2": 40, "liq": 32}, "mode": "agent_bg_loop", "ts": "2026-08-12T09:23:21.798770+00:00"}
{"set": "B249", "decision": "REVERT", "edit": "later scale 0.0028->0.0026 runner chain", "before": {"hits": 1, "med": 4.654285681585552, "min": 1.0, "max": 125970.9308207303, "ge2": 40, "liq": 32}, "after": {"hits": 1, "med": 4.65424884381572, "min": 1.0, "max": 125956.34874894936, "ge2": 40, "liq": 32}, "mode": "agent_bg_loop", "ts": "2026-08-12T09:23:41.547814+00:00"}
{"set": "B250", "decision": "REVERT", "edit": "second scale 0.011/0.045->0.0105/0.043", "before": {"hits": 1, "med": 4.654285681585552, "min": 1.0, "max": 125970.9308207303, "ge2": 40, "liq": 32}, "after": {"hits": 1, "med": 4.654237633358614, "min": 1.0, "max": 125959.81025953712, "ge2": 40, "liq": 32}, "mode": "agent_bg_loop", "ts": "2026-08-12T09:24:01.391146+00:00"}
{"set": "B251", "decision": "KEEP", "edit": "post-scale trail 2.520338508770545e-09->2.1422877324549634e-09", "before": {"hits": 1, "med": 4.654285681585552, "min": 1.0, "max": 125970.9308207303, "ge2": 40, "liq": 32}, "after": {"hits": 1, "med": 4.654285681966656, "min": 1.0, "max": 125970.93094174858, "ge2": 40, "liq": 32}, "mode": "agent_bg_loop", "ts": "2026-08-12T09:24:21.032368+00:00"}
{"set": "B252", "decision": "REVERT", "edit": "later scale 0.0028->0.0026 runner chain", "before": {"hits": 1, "med": 4.654285681966656, "min": 1.0, "max": 125970.93094174858, "ge2": 40, "liq": 32}, "after": {"hits": 1, "med": 4.654248844196804, "min": 1.0, "max": 125956.34886995556, "ge2": 40, "liq": 32}, "mode": "agent_bg_loop", "ts": "2026-08-12T09:24:40.664297+00:00"}
{"set": "B253", "decision": "REVERT", "edit": "second scale 0.011/0.045->0.0105/0.043", "before": {"hits": 1, "med": 4.654285681966656, "min": 1.0, "max": 125970.93094174858, "ge2": 40, "liq": 32}, "after": {"hits": 1, "med": 4.654237633739689, "min": 1.0, "max": 125959.81038054705, "ge2": 40, "liq": 32}, "mode": "agent_bg_loop", "ts": "2026-08-12T09:25:00.425041+00:00"}
{"set": "B254", "decision": "KEEP", "edit": "post-scale trail 2.1422877324549634e-09->1.8209445725867189e-09", "before": {"hits": 1, "med": 4.654285681966656, "min": 1.0, "max": 125970.93094174858, "ge2": 40, "liq": 32}, "after": {"hits": 1, "med": 4.654285682290601, "min": 1.0, "max": 125970.93104461933, "ge2": 40, "liq": 32}, "mode": "agent_bg_loop", "ts": "2026-08-12T09:25:20.114304+00:00"}
{"set": "B255", "decision": "REVERT", "edit": "later scale 0.0028->0.0026 runner chain", "before": {"hits": 1, "med": 4.654285682290601, "min": 1.0, "max": 125970.93104461933, "ge2": 40, "liq": 32}, "after": {"hits": 1, "med": 4.654248844520731, "min": 1.0, "max": 125956.34897281592, "ge2": 40, "liq": 32}, "mode": "agent_bg_loop", "ts": "2026-08-12T09:25:39.794650+00:00"}
{"set": "B256", "decision": "REVERT", "edit": "second scale 0.011/0.045->0.0105/0.043", "before": {"hits": 1, "med": 4.654285682290601, "min": 1.0, "max": 125970.93104461933, "ge2": 40, "liq": 32}, "after": {"hits": 1, "med": 4.654237634063609, "min": 1.0, "max": 125959.81048341063, "ge2": 40, "liq": 32}, "mode": "agent_bg_loop", "ts": "2026-08-12T09:25:59.481965+00:00"}
{"set": "B257", "decision": "KEEP", "edit": "post-scale trail 1.8209445725867189e-09->1.547802886698711e-09", "before": {"hits": 1, "med": 4.654285682290601, "min": 1.0, "max": 125970.93104461933, "ge2": 40, "liq": 32}, "after": {"hits": 1, "med": 4.654285682565953, "min": 1.0, "max": 125970.931132056, "ge2": 40, "liq": 32}, "mode": "agent_bg_loop", "ts": "2026-08-12T09:26:19.134099+00:00"}
{"set": "B258", "decision": "REVERT", "edit": "later scale 0.0028->0.0026 runner chain", "before": {"hits": 1, "med": 4.654285682565953, "min": 1.0, "max": 125970.931132056, "ge2": 40, "liq": 32}, "after": {"hits": 1, "med": 4.654248844796067, "min": 1.0, "max": 125956.349060244, "ge2": 40, "liq": 32}, "mode": "agent_bg_loop", "ts": "2026-08-12T09:26:38.917947+00:00"}
{"set": "B259", "decision": "REVERT", "edit": "second scale 0.011/0.045->0.0105/0.043", "before": {"hits": 1, "med": 4.654285682565953, "min": 1.0, "max": 125970.931132056, "ge2": 40, "liq": 32}, "after": {"hits": 1, "med": 4.654237634338939, "min": 1.0, "max": 125959.8105708412, "ge2": 40, "liq": 32}, "mode": "agent_bg_loop", "ts": "2026-08-12T09:26:58.704105+00:00"}
{"set": "B260", "decision": "KEEP", "edit": "post-scale trail 1.547802886698711e-09->1.3156324536939044e-09", "before": {"hits": 1, "med": 4.654285682565953, "min": 1.0, "max": 125970.931132056, "ge2": 40, "liq": 32}, "after": {"hits": 1, "med": 4.654285682799998, "min": 1.0, "max": 125970.93120637845, "ge2": 40, "liq": 32}, "mode": "agent_bg_loop", "ts": "2026-08-12T09:27:18.514600+00:00"}
{"set": "B261", "decision": "REVERT", "edit": "later scale 0.0028->0.0026 runner chain", "before": {"hits": 1, "med": 4.654285682799998, "min": 1.0, "max": 125970.93120637845, "ge2": 40, "liq": 32}, "after": {"hits": 1, "med": 4.654248845030099, "min": 1.0, "max": 125956.34913455888, "ge2": 40, "liq": 32}, "mode": "agent_bg_loop", "ts": "2026-08-12T09:27:38.194096+00:00"}
{"set": "B262", "decision": "REVERT", "edit": "second scale 0.011/0.045->0.0105/0.043", "before": {"hits": 1, "med": 4.654285682799998, "min": 1.0, "max": 125970.93120637845, "ge2": 40, "liq": 32}, "after": {"hits": 1, "med": 4.654237634572967, "min": 1.0, "max": 125959.81064515846, "ge2": 40, "liq": 32}, "mode": "agent_bg_loop", "ts": "2026-08-12T09:27:57.989046+00:00"}
{"set": "B263", "decision": "KEEP", "edit": "post-scale trail 1.3156324536939044e-09->1.1182875856398186e-09", "before": {"hits": 1, "med": 4.654285682799998, "min": 1.0, "max": 125970.93120637845, "ge2": 40, "liq": 32}, "after": {"hits": 1, "med": 4.654285682998939, "min": 1.0, "max": 125970.93126955372, "ge2": 40, "liq": 32}, "mode": "agent_bg_loop", "ts": "2026-08-12T09:28:17.738072+00:00"}
{"set": "B264", "decision": "REVERT", "edit": "later scale 0.0028->0.0026 runner chain", "before": {"hits": 1, "med": 4.654285682998939, "min": 1.0, "max": 125970.93126955372, "ge2": 40, "liq": 32}, "after": {"hits": 1, "med": 4.65424884522903, "min": 1.0, "max": 125956.34919772785, "ge2": 40, "liq": 32}, "mode": "agent_bg_loop", "ts": "2026-08-12T09:28:37.516092+00:00"}
{"set": "B265", "decision": "REVERT", "edit": "second scale 0.011/0.045->0.0105/0.043", "before": {"hits": 1, "med": 4.654285682998939, "min": 1.0, "max": 125970.93126955372, "ge2": 40, "liq": 32}, "after": {"hits": 1, "med": 4.654237634771892, "min": 1.0, "max": 125959.8107083293, "ge2": 40, "liq": 32}, "mode": "agent_bg_loop", "ts": "2026-08-12T09:28:57.673936+00:00"}
{"set": "B266", "decision": "KEEP", "edit": "post-scale trail 1.1182875856398186e-09->9.505444477938457e-10", "before": {"hits": 1, "med": 4.654285682998939, "min": 1.0, "max": 125970.93126955372, "ge2": 40, "liq": 32}, "after": {"hits": 1, "med": 4.654285683168032, "min": 1.0, "max": 125970.93132324876, "ge2": 40, "liq": 32}, "mode": "agent_bg_loop", "ts": "2026-08-12T09:29:17.949168+00:00"}
{"set": "B267", "decision": "REVERT", "edit": "later scale 0.0028->0.0026 runner chain", "before": {"hits": 1, "med": 4.654285683168032, "min": 1.0, "max": 125970.93132324876, "ge2": 40, "liq": 32}, "after": {"hits": 1, "med": 4.654248845398114, "min": 1.0, "max": 125956.34925141752, "ge2": 40, "liq": 32}, "mode": "agent_bg_loop", "ts": "2026-08-12T09:29:37.720315+00:00"}
{"set": "B268", "decision": "REVERT", "edit": "second scale 0.011/0.045->0.0105/0.043", "before": {"hits": 1, "med": 4.654285683168032, "min": 1.0, "max": 125970.93132324876, "ge2": 40, "liq": 32}, "after": {"hits": 1, "med": 4.654237634940973, "min": 1.0, "max": 125959.81076202064, "ge2": 40, "liq": 32}, "mode": "agent_bg_loop", "ts": "2026-08-12T09:29:57.446637+00:00"}
{"set": "B269", "decision": "KEEP", "edit": "post-scale trail 9.505444477938457e-10->8.079627806247688e-10", "before": {"hits": 1, "med": 4.654285683168032, "min": 1.0, "max": 125970.93132324876, "ge2": 40, "liq": 32}, "after": {"hits": 1, "med": 4.654285683311767, "min": 1.0, "max": 125970.93136889554, "ge2": 40, "liq": 32}, "mode": "agent_bg_loop", "ts": "2026-08-12T09:30:17.160262+00:00"}
{"set": "B270", "decision": "REVERT", "edit": "later scale 0.0028->0.0026 runner chain", "before": {"hits": 1, "med": 4.654285683311767, "min": 1.0, "max": 125970.93136889554, "ge2": 40, "liq": 32}, "after": {"hits": 1, "med": 4.654248845541841, "min": 1.0, "max": 125956.34929705982, "ge2": 40, "liq": 32}, "mode": "agent_bg_loop", "ts": "2026-08-12T09:30:36.914446+00:00"}
{"set": "B271", "decision": "REVERT", "edit": "second scale 0.011/0.045->0.0105/0.043", "before": {"hits": 1, "med": 4.654285683311767, "min": 1.0, "max": 125970.93136889554, "ge2": 40, "liq": 32}, "after": {"hits": 1, "med": 4.654237635084697, "min": 1.0, "max": 125959.81080766433, "ge2": 40, "liq": 32}, "mode": "agent_bg_loop", "ts": "2026-08-12T09:30:56.654349+00:00"}
{"set": "B272", "decision": "KEEP", "edit": "post-scale trail 8.079627806247688e-10->6.867683635310535e-10", "before": {"hits": 1, "med": 4.654285683311767, "min": 1.0, "max": 125970.93136889554, "ge2": 40, "liq": 32}, "after": {"hits": 1, "med": 4.654285683433941, "min": 1.0, "max": 125970.93140768986, "ge2": 40, "liq": 32}, "mode": "agent_bg_loop", "ts": "2026-08-12T09:31:16.407839+00:00"}
{"set": "B273", "decision": "REVERT", "edit": "later scale 0.0028->0.0026 runner chain", "before": {"hits": 1, "med": 4.654285683433941, "min": 1.0, "max": 125970.93140768986, "ge2": 40, "liq": 32}, "after": {"hits": 1, "med": 4.654248845664009, "min": 1.0, "max": 125956.34933585022, "ge2": 40, "liq": 32}, "mode": "agent_bg_loop", "ts": "2026-08-12T09:31:36.067734+00:00"}
{"set": "B274", "decision": "REVERT", "edit": "second scale 0.011/0.045->0.0105/0.043", "before": {"hits": 1, "med": 4.654285683433941, "min": 1.0, "max": 125970.93140768986, "ge2": 40, "liq": 32}, "after": {"hits": 1, "med": 4.6542376352068615, "min": 1.0, "max": 125959.81084645588, "ge2": 40, "liq": 32}, "mode": "agent_bg_loop", "ts": "2026-08-12T09:31:55.803049+00:00"}
{"set": "B275", "decision": "KEEP", "edit": "post-scale trail 6.867683635310535e-10->5.837531090013955e-10", "before": {"hits": 1, "med": 4.654285683433941, "min": 1.0, "max": 125970.93140768986, "ge2": 40, "liq": 32}, "after": {"hits": 1, "med": 4.654285683537787, "min": 1.0, "max": 125970.93144066664, "ge2": 40, "liq": 32}, "mode": "agent_bg_loop", "ts": "2026-08-12T09:32:15.481864+00:00"}
{"set": "B276", "decision": "REVERT", "edit": "later scale 0.0028->0.0026 runner chain", "before": {"hits": 1, "med": 4.654285683537787, "min": 1.0, "max": 125970.93144066664, "ge2": 40, "liq": 32}, "after": {"hits": 1, "med": 4.6542488457678495, "min": 1.0, "max": 125956.34936882362, "ge2": 40, "liq": 32}, "mode": "agent_bg_loop", "ts": "2026-08-12T09:32:35.179256+00:00"}
{"set": "B277", "decision": "REVERT", "edit": "second scale 0.011/0.045->0.0105/0.043", "before": {"hits": 1, "med": 4.654285683537787, "min": 1.0, "max": 125970.93144066664, "ge2": 40, "liq": 32}, "after": {"hits": 1, "med": 4.6542376353107, "min": 1.0, "max": 125959.81087943034, "ge2": 40, "liq": 32}, "mode": "agent_bg_loop", "ts": "2026-08-12T09:32:55.031045+00:00"}
{"set": "B278", "decision": "KEEP", "edit": "post-scale trail 5.837531090013955e-10->4.961901426511862e-10", "before": {"hits": 1, "med": 4.654285683537787, "min": 1.0, "max": 125970.93144066664, "ge2": 40, "liq": 32}, "after": {"hits": 1, "med": 4.65428568362606, "min": 1.0, "max": 125970.93146869948, "ge2": 40, "liq": 32}, "mode": "agent_bg_loop", "ts": "2026-08-12T09:33:14.877487+00:00"}
{"set": "B279", "decision": "REVERT", "edit": "later scale 0.0028->0.0026 runner chain", "before": {"hits": 1, "med": 4.65428568362606, "min": 1.0, "max": 125970.93146869948, "ge2": 40, "liq": 32}, "after": {"hits": 1, "med": 4.6542488458561175, "min": 1.0, "max": 125956.3493968537, "ge2": 40, "liq": 32}, "mode": "agent_bg_loop", "ts": "2026-08-12T09:33:34.825343+00:00"}
{"set": "B280", "decision": "REVERT", "edit": "second scale 0.011/0.045->0.0105/0.043", "before": {"hits": 1, "med": 4.65428568362606, "min": 1.0, "max": 125970.93146869948, "ge2": 40, "liq": 32}, "after": {"hits": 1, "med": 4.654237635398966, "min": 1.0, "max": 125959.81090746136, "ge2": 40, "liq": 32}, "mode": "agent_bg_loop", "ts": "2026-08-12T09:33:54.509769+00:00"}
{"set": "B281", "decision": "KEEP", "edit": "post-scale trail 4.961901426511862e-10->4.2176162125350824e-10", "before": {"hits": 1, "med": 4.65428568362606, "min": 1.0, "max": 125970.93146869948, "ge2": 40, "liq": 32}, "after": {"hits": 1, "med": 4.654285683701077, "min": 1.0, "max": 125970.9314925224, "ge2": 40, "liq": 32}, "mode": "agent_bg_loop", "ts": "2026-08-12T09:34:14.467828+00:00"}
{"set": "B282", "decision": "REVERT", "edit": "later scale 0.0028->0.0026 runner chain", "before": {"hits": 1, "med": 4.654285683701077, "min": 1.0, "max": 125970.9314925224, "ge2": 40, "liq": 32}, "after": {"hits": 1, "med": 4.65424884593113, "min": 1.0, "max": 125956.34942067428, "ge2": 40, "liq": 32}, "mode": "agent_bg_loop", "ts": "2026-08-12T09:34:34.101130+00:00"}
{"set": "B283", "decision": "REVERT", "edit": "second scale 0.011/0.045->0.0105/0.043", "before": {"hits": 1, "med": 4.654285683701077, "min": 1.0, "max": 125970.9314925224, "ge2": 40, "liq": 32}, "after": {"hits": 1, "med": 4.654237635473977, "min": 1.0, "max": 125959.81093128264, "ge2": 40, "liq": 32}, "mode": "agent_bg_loop", "ts": "2026-08-12T09:34:53.848074+00:00"}
{"set": "B284", "decision": "KEEP", "edit": "post-scale trail 4.2176162125350824e-10->3.5849737806548197e-10", "before": {"hits": 1, "med": 4.654285683701077, "min": 1.0, "max": 125970.9314925224, "ge2": 40, "liq": 32}, "after": {"hits": 1, "med": 4.65428568376486, "min": 1.0, "max": 125970.93151277832, "ge2": 40, "liq": 32}, "mode": "agent_bg_loop", "ts": "2026-08-12T09:35:13.608218+00:00"}
{"set": "B285", "decision": "REVERT", "edit": "later scale 0.0028->0.0026 runner chain", "before": {"hits": 1, "med": 4.65428568376486, "min": 1.0, "max": 125970.93151277832, "ge2": 40, "liq": 32}, "after": {"hits": 1, "med": 4.654248845994911, "min": 1.0, "max": 125956.34944092813, "ge2": 40, "liq": 32}, "mode": "agent_bg_loop", "ts": "2026-08-12T09:35:33.332180+00:00"}
{"set": "B286", "decision": "REVERT", "edit": "second scale 0.011/0.045->0.0105/0.043", "before": {"hits": 1, "med": 4.65428568376486, "min": 1.0, "max": 125970.93151277832, "ge2": 40, "liq": 32}, "after": {"hits": 1, "med": 4.654237635537755, "min": 1.0, "max": 125959.81095153706, "ge2": 40, "liq": 32}, "mode": "agent_bg_loop", "ts": "2026-08-12T09:35:53.144091+00:00"}
{"set": "B287", "decision": "KEEP", "edit": "post-scale trail 3.5849737806548197e-10->3.047227713556597e-10", "before": {"hits": 1, "med": 4.65428568376486, "min": 1.0, "max": 125970.93151277832, "ge2": 40, "liq": 32}, "after": {"hits": 1, "med": 4.654285683819065, "min": 1.0, "max": 125970.93152999038, "ge2": 40, "liq": 32}, "mode": "agent_bg_loop", "ts": "2026-08-12T09:36:12.802360+00:00"}
{"set": "B288", "decision": "REVERT", "edit": "later scale 0.0028->0.0026 runner chain", "before": {"hits": 1, "med": 4.654285683819065, "min": 1.0, "max": 125970.93152999038, "ge2": 40, "liq": 32}, "after": {"hits": 1, "med": 4.654248846049113, "min": 1.0, "max": 125956.34945813847, "ge2": 40, "liq": 32}, "mode": "agent_bg_loop", "ts": "2026-08-12T09:36:32.577999+00:00"}
{"set": "B289", "decision": "REVERT", "edit": "second scale 0.011/0.045->0.0105/0.043", "before": {"hits": 1, "med": 4.654285683819065, "min": 1.0, "max": 125970.93152999038, "ge2": 40, "liq": 32}, "after": {"hits": 1, "med": 4.654237635591958, "min": 1.0, "max": 125959.81096874789, "ge2": 40, "liq": 32}, "mode": "agent_bg_loop", "ts": "2026-08-12T09:36:52.323811+00:00"}
