{"set": "C153", "decision": "REVERT", "edit": "size_boost mid 1.325->1.33", "before": {"hits": 1, "med": 4.6680223763810735, "min": 1.0, "ge2": 40, "liq": 32, "max": 127517.4446190734}, "after": {"hits": 1, "med": 4.6680223763810735, "min": 1.0, "ge2": 40, "liq": 32, "max": 127517.4446190734}, "mode": "agent_manual"}
{"set": "C154", "decision": "KEEP", "edit": "second 0.054/0.134->0.055/0.136", "before": {"hits": 1, "med": 4.6680223763810735, "min": 1.0, "ge2": 40, "liq": 32, "max": 127517.4446190734}, "after": {"hits": 1, "med": 4.668067233225331, "min": 1.0, "ge2": 40, "liq": 32, "max": 127530.26831385892}, "mode": "agent_manual"}
{"set": "C155", "decision": "KEEP", "edit": "later 0.0116->0.0118", "before": {"hits": 1, "med": 4.668067233225331, "min": 1.0, "ge2": 40, "liq": 32, "max": 127530.26831385892}, "after": {"hits": 1, "med": 4.6680985799487065, "min": 1.0, "ge2": 40, "liq": 32, "max": 127543.15848165244}, "mode": "agent_manual"}
{"set": "C156", "decision": "KEEP", "edit": "second 0.055/0.136->0.056/0.138", "before": {"hits": 1, "med": 4.6680985799487065, "min": 1.0, "ge2": 40, "liq": 32, "max": 127543.15848165244}, "after": {"hits": 1, "med": 4.668143364231103, "min": 1.0, "ge2": 40, "liq": 32, "max": 127555.9632856466}, "mode": "agent_manual"}
{"set": "C157", "decision": "KEEP", "edit": "later 0.0118->0.0120", "before": {"hits": 1, "med": 4.668143364231103, "min": 1.0, "ge2": 40, "liq": 32, "max": 127555.9632856466}, "after": {"hits": 1, "med": 4.668174594117345, "min": 1.0, "ge2": 40, "liq": 32, "max": 127568.81642201818}, "mode": "agent_manual"}
{"set": "C158", "decision": "REVERT", "edit": "risk_cap 0.0024->0.00235", "before": {"hits": 1, "med": 4.668174594117345, "min": 1.0, "ge2": 40, "liq": 32, "max": 127568.81642201818}, "after": {"hits": 1, "med": 4.531465500357002, "min": 1.0, "ge2": 40, "liq": 32, "max": 133873.42755550164}, "mode": "agent_manual"}
{"set": "C159", "decision": "KEEP", "edit": "second 0.056/0.138->0.057/0.140", "before": {"hits": 1, "med": 4.668174594117345, "min": 1.0, "ge2": 40, "liq": 32, "max": 127568.81642201818}, "after": {"hits": 1, "med": 4.668219305940611, "min": 1.0, "ge2": 40, "liq": 32, "max": 127581.60235453662}, "mode": "agent_manual"}
{"set": "C160", "decision": "KEEP", "edit": "later 0.0120->0.0122", "before": {"hits": 1, "med": 4.668219305940611, "min": 1.0, "ge2": 40, "liq": 32, "max": 127581.60235453662}, "after": {"hits": 1, "med": 4.668250419248786, "min": 1.0, "ge2": 40, "liq": 32, "max": 127594.41852457708}, "mode": "agent_manual"}
{"set": "C161", "decision": "KEEP", "edit": "second 0.057/0.140->0.058/0.142", "before": {"hits": 1, "med": 4.668250419248786, "min": 1.0, "ge2": 40, "liq": 32, "max": 127594.41852457708}, "after": {"hits": 1, "med": 4.668295058715518, "min": 1.0, "ge2": 40, "liq": 32, "max": 127607.1856049387}, "mode": "agent_manual"}
{"set": "C162", "decision": "KEEP", "edit": "later 0.0122->0.0124", "before": {"hits": 1, "med": 4.668295058715518, "min": 1.0, "ge2": 40, "liq": 32, "max": 127607.1856049387}, "after": {"hits": 1, "med": 4.6683260557042665, "min": 1.0, "ge2": 40, "liq": 32, "max": 127619.96487368915}, "mode": "agent_manual"}
{"set": "C163", "decision": "REVERT", "edit": "reentry cap 170->168", "before": {"hits": 1, "med": 4.6683260557042665, "min": 1.0, "ge2": 40, "liq": 32, "max": 127619.96487368915}, "after": {"hits": 1, "med": 4.6683260557042665, "min": 1.0, "ge2": 40, "liq": 32, "max": 127619.96487368915}, "mode": "agent_manual"}
{"set": "C164", "decision": "KEEP", "edit": "second 0.058/0.142->0.059/0.144", "before": {"hits": 1, "med": 4.6683260557042665, "min": 1.0, "ge2": 40, "liq": 32, "max": 127619.96487368915}, "after": {"hits": 1, "med": 4.668370622916948, "min": 1.0, "ge2": 40, "liq": 32, "max": 127632.71312121626}, "mode": "agent_manual"}
{"set": "C165", "decision": "KEEP", "edit": "later 0.0124->0.0126", "before": {"hits": 1, "med": 4.668370622916948, "min": 1.0, "ge2": 40, "liq": 32, "max": 127632.71312121626}, "after": {"hits": 1, "med": 4.668401503844477, "min": 1.0, "ge2": 40, "liq": 32, "max": 127645.45555366868}, "mode": "agent_manual"}
{"set": "C166", "decision": "KEEP", "edit": "second 0.059/0.144->0.060/0.146", "before": {"hits": 1, "med": 4.668401503844477, "min": 1.0, "ge2": 40, "liq": 32, "max": 127645.45555366868}, "after": {"hits": 1, "med": 4.668445998905458, "min": 1.0, "ge2": 40, "liq": 32, "max": 127658.18498768617}, "mode": "agent_manual"}
{"set": "C167", "decision": "KEEP", "edit": "later 0.0126->0.0128", "before": {"hits": 1, "med": 4.668445998905458, "min": 1.0, "ge2": 40, "liq": 32, "max": 127658.18498768617}, "after": {"hits": 1, "med": 4.668476764029552, "min": 1.0, "ge2": 40, "liq": 32, "max": 127670.8906487825}, "mode": "agent_manual"}
{"set": "C168", "decision": "REVERT", "edit": "width_tr 0.25->0.248", "before": {"hits": 1, "med": 4.668476764029552, "min": 1.0, "ge2": 40, "liq": 32, "max": 127670.8906487825}, "after": {"hits": 1, "med": 4.467696133042298, "min": 1.0, "ge2": 38, "liq": 32, "max": 127670.89064879404}, "mode": "agent_manual"}
{"set": "C169", "decision": "KEEP", "edit": "second 0.060/0.146->0.061/0.148", "before": {"hits": 1, "med": 4.668476764029552, "min": 1.0, "ge2": 40, "liq": 32, "max": 127670.8906487825}, "after": {"hits": 1, "med": 4.668521187041062, "min": 1.0, "ge2": 40, "liq": 32, "max": 127683.6012886188}, "mode": "agent_manual"}
{"set": "C170", "decision": "KEEP", "edit": "later 0.0128->0.0130", "before": {"hits": 1, "med": 4.668521187041062, "min": 1.0, "ge2": 40, "liq": 32, "max": 127683.6012886188}, "after": {"hits": 1, "med": 4.668551836619082, "min": 1.0, "ge2": 40, "liq": 32, "max": 127696.2702432528}, "mode": "agent_manual"}
{"set": "C171", "decision": "KEEP", "edit": "second 0.061/0.148->0.062/0.150", "before": {"hits": 1, "med": 4.668551836619082, "min": 1.0, "ge2": 40, "liq": 32, "max": 127696.2702432528}, "after": {"hits": 1, "med": 4.6685961876832245, "min": 1.0, "ge2": 40, "liq": 32, "max": 127708.96210823898}, "mode": "agent_manual"}
{"set": "C172", "decision": "KEEP", "edit": "later 0.0130->0.0132", "before": {"hits": 1, "med": 4.6685961876832245, "min": 1.0, "ge2": 40, "liq": 32, "max": 127708.96210823898}, "after": {"hits": 1, "med": 4.6686267219721, "min": 1.0, "ge2": 40, "liq": 32, "max": 127721.59442125284}, "mode": "agent_manual"}
{"set": "C173", "decision": "REVERT", "edit": "partial_trail_frac 0.68->0.675", "before": {"hits": 1, "med": 4.6686267219721, "min": 1.0, "ge2": 40, "liq": 32, "max": 127721.59442125284}, "after": {"hits": 1, "med": 4.6686267219721, "min": 1.0, "ge2": 40, "liq": 32, "max": 127721.59442125284}, "mode": "agent_manual"}
{"set": "C174", "decision": "KEEP", "edit": "second 0.062/0.150->0.063/0.152", "before": {"hits": 1, "med": 4.6686267219721, "min": 1.0, "ge2": 40, "liq": 32, "max": 127721.59442125284}, "after": {"hits": 1, "med": 4.668671001190858, "min": 1.0, "ge2": 40, "liq": 32, "max": 127734.26753072297}, "mode": "agent_manual"}
{"set": "C175", "decision": "KEEP", "edit": "later 0.0132->0.0134", "before": {"hits": 1, "med": 4.668671001190858, "min": 1.0, "ge2": 40, "liq": 32, "max": 127734.26753072297}, "after": {"hits": 1, "med": 4.668701420447093, "min": 1.0, "ge2": 40, "liq": 32, "max": 127746.86326690976}, "mode": "agent_manual"}
{"set": "C176", "decision": "KEEP", "edit": "second 0.063/0.152->0.064/0.154", "before": {"hits": 1, "med": 4.668701420447093, "min": 1.0, "ge2": 40, "liq": 32, "max": 127746.86326690976}, "after": {"hits": 1, "med": 4.668745627922322, "min": 1.0, "ge2": 40, "liq": 32, "max": 127759.51764020063}, "mode": "agent_manual"}
{"set": "C177", "decision": "KEEP", "edit": "later 0.0134->0.0136", "before": {"hits": 1, "med": 4.668745627922322, "min": 1.0, "ge2": 40, "liq": 32, "max": 127759.51764020063}, "after": {"hits": 1, "med": 4.668775932401998, "min": 1.0, "ge2": 40, "liq": 32, "max": 127772.07686430316}, "mode": "agent_manual"}
{"set": "C178", "decision": "REVERT", "edit": "sl_grace 5->6", "before": {"hits": 1, "med": 4.668775932401998, "min": 1.0, "ge2": 40, "liq": 32, "max": 127772.07686430316}, "after": {"hits": 1, "med": 4.080471597003953, "min": 1.0, "ge2": 39, "liq": 42, "max": 127772.07686430316}, "mode": "agent_manual"}
{"set": "C179", "decision": "KEEP", "edit": "second 0.064/0.154->0.065/0.156", "before": {"hits": 1, "med": 4.668775932401998, "min": 1.0, "ge2": 40, "liq": 32, "max": 127772.07686430316}, "after": {"hits": 1, "med": 4.668820068235433, "min": 1.0, "ge2": 40, "liq": 32, "max": 127784.71252075415}, "mode": "agent_manual"}
{"set": "C180", "decision": "KEEP", "edit": "later 0.0136->0.0138", "before": {"hits": 1, "med": 4.668820068235433, "min": 1.0, "ge2": 40, "liq": 32, "max": 127784.71252075415}, "after": {"hits": 1, "med": 4.668850258194205, "min": 1.0, "ge2": 40, "liq": 32, "max": 127797.23529746456}, "mode": "agent_manual"}
{"set": "C181", "decision": "KEEP", "edit": "trail soft-cap 3.0->2.99", "before": {"hits": 1, "med": 4.655029162848532, "min": 1.0, "ge2": 40, "liq": 32, "max": 126207.45048317888}, "after": {"hits": 1, "med": 4.6625611524120885, "min": 1.0, "ge2": 40, "liq": 32, "max": 126474.00738632704}, "mode": "agent_manual"}
{"set": "C182", "decision": "KEEP", "edit": "trail soft-cap 2.99->2.988", "before": {"hits": 1, "med": 4.6625611524120885, "min": 1.0, "ge2": 40, "liq": 32, "max": 126474.00738632704}, "after": {"hits": 1, "med": 4.66406755032488, "min": 1.0, "ge2": 40, "liq": 32, "max": 126527.31876695556}, "mode": "agent_manual"}
{"set": "C183", "decision": "KEEP", "edit": "trail soft-cap 2.988->2.987", "before": {"hits": 1, "med": 4.66406755032488, "min": 1.0, "ge2": 40, "liq": 32, "max": 126527.31876695556}, "after": {"hits": 1, "med": 4.664820749281201, "min": 1.0, "ge2": 40, "liq": 32, "max": 126553.97445727071}, "mode": "agent_manual"}
{"set": "C184", "decision": "KEEP", "edit": "trail soft-cap 2.987->2.9865", "before": {"hits": 1, "med": 4.664820749281201, "min": 1.0, "ge2": 40, "liq": 32, "max": 126553.97445727071}, "after": {"hits": 1, "med": 4.665197348759361, "min": 1.0, "ge2": 40, "liq": 32, "max": 126567.30230242744}, "mode": "agent_manual"}
{"set": "C185", "decision": "KEEP", "edit": "second 0.019/0.064->0.020/0.066", "before": {"hits": 1, "med": 4.665197348759361, "min": 1.0, "ge2": 40, "liq": 32, "max": 126567.30230242744}, "after": {"hits": 1, "med": 4.665244887308902, "min": 1.0, "ge2": 40, "liq": 32, "max": 126580.81989610728}, "mode": "agent_manual"}
{"set": "C186", "decision": "KEEP", "edit": "later 0.0044->0.0046", "before": {"hits": 1, "med": 4.665244887308902, "min": 1.0, "ge2": 40, "liq": 32, "max": 126580.81989610728}, "after": {"hits": 1, "med": 4.665280540020628, "min": 1.0, "ge2": 40, "liq": 32, "max": 126595.06636261038}, "mode": "agent_manual"}
{"set": "C187", "decision": "KEEP", "edit": "second 0.020/0.066->0.021/0.068", "before": {"hits": 1, "med": 4.665280540020628, "min": 1.0, "ge2": 40, "liq": 32, "max": 126595.06636261038}, "after": {"hits": 1, "med": 4.665328002226032, "min": 1.0, "ge2": 40, "liq": 32, "max": 126608.56436998471}, "mode": "agent_manual"}
{"set": "C188", "decision": "KEEP", "edit": "later 0.0046->0.0048", "before": {"hits": 1, "med": 4.665328002226032, "min": 1.0, "ge2": 40, "liq": 32, "max": 126608.56436998471}, "after": {"hits": 1, "med": 4.665363528591712, "min": 1.0, "ge2": 40, "liq": 32, "max": 126622.77145265898}, "mode": "agent_manual"}
{"set": "C189", "decision": "REVERT", "edit": "trail soft-cap 2.9865->2.98625", "before": {"hits": 1, "med": 4.665363528591712, "min": 1.0, "ge2": 40, "liq": 32, "max": 126622.77145265898}, "after": {"hits": 1, "med": 4.665551835038277, "min": 1.0, "ge2": 40, "liq": 33, "max": 126629.43829575495}, "mode": "agent_manual"}
{"set": "C190", "decision": "KEEP", "edit": "second 0.021/0.068->0.022/0.070", "before": {"hits": 1, "med": 4.665363528591712, "min": 1.0, "ge2": 40, "liq": 32, "max": 126622.77145265898}, "after": {"hits": 1, "med": 4.6654109145602805, "min": 1.0, "ge2": 40, "liq": 32, "max": 126636.2498928725}, "mode": "agent_manual"}
{"set": "C191", "decision": "KEEP", "edit": "later 0.0048->0.0050", "before": {"hits": 1, "med": 4.6654109145602805, "min": 1.0, "ge2": 40, "liq": 32, "max": 126636.2498928725}, "after": {"hits": 1, "med": 4.665446314854632, "min": 1.0, "ge2": 40, "liq": 32, "max": 126650.41765846648}, "mode": "agent_manual"}
{"set": "C192", "decision": "KEEP", "edit": "second 0.022/0.070->0.023/0.072", "before": {"hits": 1, "med": 4.665446314854632, "min": 1.0, "ge2": 40, "liq": 32, "max": 126650.41765846648}, "after": {"hits": 1, "med": 4.665493624693536, "min": 1.0, "ge2": 40, "liq": 32, "max": 126663.8765506712}, "mode": "agent_manual"}
{"set": "C193", "decision": "KEEP", "edit": "later 0.0050->0.0052", "before": {"hits": 1, "med": 4.665493624693536, "min": 1.0, "ge2": 40, "liq": 32, "max": 126663.8765506712}, "after": {"hits": 1, "med": 4.6655288991908295, "min": 1.0, "ge2": 40, "liq": 32, "max": 126678.0050658908}, "mode": "agent_manual"}
{"set": "C194", "decision": "KEEP", "edit": "second 0.023/0.072->0.024/0.074", "before": {"hits": 1, "med": 4.6655288991908295, "min": 1.0, "ge2": 40, "liq": 32, "max": 126678.0050658908}, "after": {"hits": 1, "med": 4.665576133007108, "min": 1.0, "ge2": 40, "liq": 32, "max": 126691.44442924458}, "mode": "agent_manual"}
{"set": "C195", "decision": "KEEP", "edit": "later 0.0052->0.0054", "before": {"hits": 1, "med": 4.665576133007108, "min": 1.0, "ge2": 40, "liq": 32, "max": 126691.44442924458}, "after": {"hits": 1, "med": 4.665611281981172, "min": 1.0, "ge2": 40, "liq": 32, "max": 126705.53376075251}, "mode": "agent_manual"}
{"set": "C196", "decision": "REVERT", "edit": "size_boost low 1.10->1.11", "before": {"hits": 1, "med": 4.665611281981172, "min": 1.0, "ge2": 40, "liq": 32, "max": 126705.53376075251}, "after": {"hits": 1, "med": 4.655874508733699, "min": 1.0, "ge2": 39, "liq": 32, "max": 127311.3952911648}, "mode": "agent_manual"}
{"set": "C197", "decision": "KEEP", "edit": "second 0.024/0.074->0.025/0.076", "before": {"hits": 1, "med": 4.665611281981172, "min": 1.0, "ge2": 40, "liq": 32, "max": 126705.53376075251}, "after": {"hits": 1, "med": 4.6656584398817404, "min": 1.0, "ge2": 40, "liq": 32, "max": 126718.95361442004}, "mode": "agent_manual"}
{"set": "C198", "decision": "KEEP", "edit": "later 0.0054->0.0056", "before": {"hits": 1, "med": 4.6656584398817404, "min": 1.0, "ge2": 40, "liq": 32, "max": 126718.95361442004}, "after": {"hits": 1, "med": 4.665693463605948, "min": 1.0, "ge2": 40, "liq": 32, "max": 126733.00382883516}, "mode": "agent_manual"}
{"set": "C199", "decision": "KEEP", "edit": "second 0.025/0.076->0.026/0.078", "before": {"hits": 1, "med": 4.665693463605948, "min": 1.0, "ge2": 40, "liq": 32, "max": 126733.00382883516}, "after": {"hits": 1, "med": 4.665740545697589, "min": 1.0, "ge2": 40, "liq": 32, "max": 126746.4041919872}, "mode": "agent_manual"}
{"set": "C200", "decision": "KEEP", "edit": "later 0.0056->0.0058", "before": {"hits": 1, "med": 4.665740545697589, "min": 1.0, "ge2": 40, "liq": 32, "max": 126746.4041919872}, "after": {"hits": 1, "med": 4.665775444444876, "min": 1.0, "ge2": 40, "liq": 32, "max": 126760.41535588609}, "mode": "agent_manual"}
{"set": "C201", "decision": "KEEP", "edit": "second 0.026/0.078->0.027/0.080", "before": {"hits": 1, "med": 4.665775444444876, "min": 1.0, "ge2": 40, "liq": 32, "max": 126760.41535588609}, "after": {"hits": 1, "med": 4.665822450834246, "min": 1.0, "ge2": 40, "liq": 32, "max": 126773.79624769992}, "mode": "agent_manual"}
{"set": "C202", "decision": "KEEP", "edit": "later 0.0058->0.0060", "before": {"hits": 1, "med": 4.665822450834246, "min": 1.0, "ge2": 40, "liq": 32, "max": 126773.79624769992}, "after": {"hits": 1, "med": 4.665857224877095, "min": 1.0, "ge2": 40, "liq": 32, "max": 126787.76842761372}, "mode": "agent_manual"}
{"set": "C203", "decision": "REVERT", "edit": "trail_unlock_r 4.0->3.9", "before": {"hits": 1, "med": 4.665857224877095, "min": 1.0, "ge2": 40, "liq": 32, "max": 126787.76842761372}, "after": {"hits": 1, "med": 4.560470794672126, "min": 1.0, "ge2": 40, "liq": 32, "max": 126787.76842761372}, "mode": "agent_manual"}
{"set": "C204", "decision": "KEEP", "edit": "second 0.027/0.080->0.028/0.082", "before": {"hits": 1, "med": 4.665857224877095, "min": 1.0, "ge2": 40, "liq": 32, "max": 126787.76842761372}, "after": {"hits": 1, "med": 4.665904155670718, "min": 1.0, "ge2": 40, "liq": 32, "max": 126801.12986727274}, "mode": "agent_manual"}
{"set": "C205", "decision": "KEEP", "edit": "later 0.0060->0.0062", "before": {"hits": 1, "med": 4.665904155670718, "min": 1.0, "ge2": 40, "liq": 32, "max": 126801.12986727274}, "after": {"hits": 1, "med": 4.66593880528117, "min": 1.0, "ge2": 40, "liq": 32, "max": 126815.0631296891}, "mode": "agent_manual"}
{"set": "C206", "decision": "KEEP", "edit": "second 0.028/0.082->0.029/0.084", "before": {"hits": 1, "med": 4.66593880528117, "min": 1.0, "ge2": 40, "liq": 32, "max": 126815.0631296891}, "after": {"hits": 1, "med": 4.665985660585449, "min": 1.0, "ge2": 40, "liq": 32, "max": 126828.40513638256}, "mode": "agent_manual"}
{"set": "C207", "decision": "KEEP", "edit": "later 0.0062->0.0064", "before": {"hits": 1, "med": 4.665985660585449, "min": 1.0, "ge2": 40, "liq": 32, "max": 126828.40513638256}, "after": {"hits": 1, "med": 4.666020186035102, "min": 1.0, "ge2": 40, "liq": 32, "max": 126842.29954774505}, "mode": "agent_manual"}
{"set": "C208", "decision": "KEEP", "edit": "second 0.029/0.084->0.030/0.086", "before": {"hits": 1, "med": 4.666020186035102, "min": 1.0, "ge2": 40, "liq": 32, "max": 126842.29954774505}, "after": {"hits": 1, "med": 4.6660669659563005, "min": 1.0, "ge2": 40, "liq": 32, "max": 126855.62214066809}, "mode": "agent_manual"}
{"set": "C209", "decision": "KEEP", "edit": "later 0.0064->0.0066", "before": {"hits": 1, "med": 4.6660669659563005, "min": 1.0, "ge2": 40, "liq": 32, "max": 126855.62214066809}, "after": {"hits": 1, "med": 4.6661013675162994, "min": 1.0, "ge2": 40, "liq": 32, "max": 126869.47776737528}, "mode": "agent_manual"}
{"set": "C210", "decision": "KEEP", "edit": "second 0.030/0.086->0.031/0.088", "before": {"hits": 1, "med": 4.6661013675162994, "min": 1.0, "ge2": 40, "liq": 32, "max": 126869.47776737528}, "after": {"hits": 1, "med": 4.666148072160561, "min": 1.0, "ge2": 40, "liq": 32, "max": 126882.78096572949}, "mode": "agent_manual"}
{"set": "C211", "decision": "KEEP", "edit": "later 0.0066->0.0068", "before": {"hits": 1, "med": 4.666148072160561, "min": 1.0, "ge2": 40, "liq": 32, "max": 126882.78096572949}, "after": {"hits": 1, "med": 4.666182350101622, "min": 1.0, "ge2": 40, "liq": 32, "max": 126896.59787413669}, "mode": "agent_manual"}
{"set": "C212", "decision": "KEEP", "edit": "second 0.031/0.088->0.032/0.090", "before": {"hits": 1, "med": 4.666182350101622, "min": 1.0, "ge2": 40, "liq": 32, "max": 126896.59787413669}, "after": {"hits": 1, "med": 4.666228979574963, "min": 1.0, "ge2": 40, "liq": 32, "max": 126909.8816971287}, "mode": "agent_manual"}
{"set": "C213", "decision": "REVERT", "edit": "win_size_mult 1.75->1.76", "before": {"hits": 1, "med": 4.666228979574963, "min": 1.0, "ge2": 40, "liq": 32, "max": 126909.8816971287}, "after": {"hits": 1, "med": 4.569870472615126, "min": 1.0, "ge2": 40, "liq": 32, "max": 128700.55028360063}, "mode": "agent_manual"}
{"set": "C214", "decision": "KEEP", "edit": "later 0.0068->0.0070", "before": {"hits": 1, "med": 4.666228979574963, "min": 1.0, "ge2": 40, "liq": 32, "max": 126909.8816971287}, "after": {"hits": 1, "med": 4.666263134167344, "min": 1.0, "ge2": 40, "liq": 32, "max": 126923.65995354518}, "mode": "agent_manual"}
{"set": "C215", "decision": "KEEP", "edit": "second 0.032/0.090->0.033/0.092", "before": {"hits": 1, "med": 4.666263134167344, "min": 1.0, "ge2": 40, "liq": 32, "max": 126923.65995354518}, "after": {"hits": 1, "med": 4.666309688575645, "min": 1.0, "ge2": 40, "liq": 32, "max": 126936.92442038762}, "mode": "agent_manual"}
{"set": "C216", "decision": "KEEP", "edit": "later 0.0070->0.0072", "before": {"hits": 1, "med": 4.666309688575645, "min": 1.0, "ge2": 40, "liq": 32, "max": 126936.92442038762}, "after": {"hits": 1, "med": 4.6663437200891735, "min": 1.0, "ge2": 40, "liq": 32, "max": 126950.66409107842}, "mode": "agent_manual"}
{"set": "C217", "decision": "KEEP", "edit": "second 0.033/0.092->0.034/0.094", "before": {"hits": 1, "med": 4.6663437200891735, "min": 1.0, "ge2": 40, "liq": 32, "max": 126950.66409107842}, "after": {"hits": 1, "med": 4.666390199538194, "min": 1.0, "ge2": 40, "liq": 32, "max": 126963.90922098924}, "mode": "agent_manual"}
{"set": "C218", "decision": "KEEP", "edit": "later 0.0072->0.0074", "before": {"hits": 1, "med": 4.666390199538194, "min": 1.0, "ge2": 40, "liq": 32, "max": 126963.90922098924}, "after": {"hits": 1, "med": 4.666424108242247, "min": 1.0, "ge2": 40, "liq": 32, "max": 126977.610372174}, "mode": "agent_manual"}
