{"set": "B156", "decision": "REVERT", "edit": "later scale 0.0028->0.0026 runner chain", "before": {"hits": 1, "med": 4.654285593399388, "min": 1.0, "max": 125970.90281680596, "ge2": 40, "liq": 32}, "after": {"hits": 1, "med": 4.654248755634296, "min": 1.0, "max": 125956.32074782783, "ge2": 40, "liq": 32}, "mode": "agent_bg_loop", "ts": "2026-08-12T08:48:15.448430+00:00"}
{"set": "B157", "decision": "REVERT", "edit": "later scale 0.0028->0.0026 runner chain", "before": {"hits": 1, "med": 4.654285593399388, "min": 1.0, "max": 125970.90281680596, "ge2": 40, "liq": 32}, "after": {"hits": 1, "med": 4.654248755634296, "min": 1.0, "max": 125956.32074782783, "ge2": 40, "liq": 32}, "mode": "agent_bg_loop", "ts": "2026-08-12T08:48:42.652315+00:00"}
{"set": "B158", "decision": "REVERT", "edit": "later scale 0.0028->0.0026 runner chain", "before": {"hits": 1, "med": 4.654285593399388, "min": 1.0, "max": 125970.90281680596, "ge2": 40, "liq": 32}, "after": {"hits": 1, "med": 4.654248755634296, "min": 1.0, "max": 125956.32074782783, "ge2": 40, "liq": 32}, "mode": "agent_bg_loop", "ts": "2026-08-12T08:49:14.876658+00:00"}
{"set": "B159", "decision": "REVERT", "edit": "second scale 0.011/0.045->0.0105/0.043", "before": {"hits": 1, "med": 4.654285593399388, "min": 1.0, "max": 125970.90281680596, "ge2": 40, "liq": 32}, "after": {"hits": 1, "med": 4.654237545179166, "min": 1.0, "max": 125959.7822575586, "ge2": 40, "liq": 32}, "mode": "agent_bg_loop", "ts": "2026-08-12T08:49:40.852934+00:00"}
{"set": "B159", "decision": "REVERT", "edit": "later scale 0.0028->0.0026 runner chain", "before": {"hits": 1, "med": 4.654285593399388, "min": 1.0, "max": 125970.90281680596, "ge2": 40, "liq": 32}, "after": {"hits": 1, "med": 4.6542006302669225, "min": 1.0, "max": 125945.18327358406, "ge2": 40, "liq": 32}, "mode": "agent_bg_loop", "ts": "2026-08-12T08:49:41.728931+00:00"}
{"set": "B160", "decision": "KEEP", "edit": "post-scale trail 9e-08->7.649999999999999e-08", "before": {"hits": 1, "med": 4.654285593399388, "min": 1.0, "max": 125970.90281680596, "ge2": 40, "liq": 32}, "after": {"hits": 1, "med": 4.654285607008427, "min": 1.0, "max": 125970.9071384143, "ge2": 40, "liq": 32}, "mode": "agent_bg_loop", "ts": "2026-08-12T08:50:07.555392+00:00"}
{"set": "B160", "decision": "REVERT", "edit": "later scale 0.0028->0.0026 runner chain", "before": {"hits": 1, "med": 4.654285593399388, "min": 1.0, "max": 125970.90281680596, "ge2": 40, "liq": 32}, "after": {"hits": 1, "med": 4.654248769242605, "min": 1.0, "max": 125956.32506900352, "ge2": 40, "liq": 32}, "mode": "agent_bg_loop", "ts": "2026-08-12T08:50:08.264434+00:00"}
{"set": "B190", "decision": "KEEP", "edit": "size_boost 1.5ATR 1.32->1.325", "before": {"hits": 1, "med": 4.654211866125595, "min": 1.0, "max": 125941.71946596156, "ge2": 40, "liq": 32}, "after": {"hits": 1, "med": 4.654285593399388, "min": 1.0, "max": 125970.90281680596, "ge2": 40, "liq": 32}, "mode": "agent_bg_loop", "ts": "2026-08-12T08:52:11.943210+00:00"}
{"set": "B190", "decision": "REVERT", "edit": "second scale 0.011/0.045->0.0105/0.043", "before": {"hits": 1, "med": 4.654285593399388, "min": 1.0, "max": 125970.90281680596, "ge2": 40, "liq": 32}, "after": {"hits": 1, "med": 4.654237545179166, "min": 1.0, "max": 125959.7822575586, "ge2": 40, "liq": 32}, "mode": "agent_bg_loop", "ts": "2026-08-12T08:52:12.964212+00:00"}
{"set": "B181", "decision": "REVERT", "edit": "later scale 0.0028->0.0026 runner chain", "before": {"hits": 1, "med": 4.654285593399388, "min": 1.0, "max": 125970.90281680596, "ge2": 40, "liq": 32}, "after": {"hits": 1, "med": 4.654248755634296, "min": 1.0, "max": 125956.32074782783, "ge2": 40, "liq": 32}, "mode": "agent_bg_loop", "ts": "2026-08-12T08:55:41.880752+00:00"}
{"set": "B182", "decision": "REVERT", "edit": "second scale 0.011/0.045->0.0105/0.043", "before": {"hits": 1, "med": 4.654285593399388, "min": 1.0, "max": 125970.90281680596, "ge2": 40, "liq": 32}, "after": {"hits": 1, "med": 4.654237545179166, "min": 1.0, "max": 125959.7822575586, "ge2": 40, "liq": 32}, "mode": "agent_bg_loop", "ts": "2026-08-12T08:56:04.867924+00:00"}
{"set": "B183", "decision": "KEEP", "edit": "post-scale trail 9e-08->7.649999999999999e-08", "before": {"hits": 1, "med": 4.654285593399388, "min": 1.0, "max": 125970.90281680596, "ge2": 40, "liq": 32}, "after": {"hits": 1, "med": 4.654285607008427, "min": 1.0, "max": 125970.9071384143, "ge2": 40, "liq": 32}, "mode": "agent_bg_loop", "ts": "2026-08-12T08:56:28.469033+00:00"}
{"set": "B186", "decision": "REVERT", "edit": "second scale 0.011/0.045->0.0105/0.043", "before": {"hits": 1, "med": 4.654285607008427, "min": 1.0, "max": 125970.9071384143, "ge2": 40, "liq": 32}, "after": {"hits": 1, "med": 4.654237558787169, "min": 1.0, "max": 125959.78657886657, "ge2": 40, "liq": 32}, "mode": "agent_bg_loop", "ts": "2026-08-12T08:59:07.741249+00:00"}
{"set": "B187", "decision": "KEEP", "edit": "post-scale trail 7.649999999999999e-08->6.502499999999999e-08", "before": {"hits": 1, "med": 4.654285607008427, "min": 1.0, "max": 125970.9071384143, "ge2": 40, "liq": 32}, "after": {"hits": 1, "med": 4.654285618576094, "min": 1.0, "max": 125970.9108117824, "ge2": 40, "liq": 32}, "mode": "agent_bg_loop", "ts": "2026-08-12T08:59:32.201798+00:00"}
{"set": "B189", "decision": "REVERT", "edit": "later scale 0.0028->0.0026 runner chain", "before": {"hits": 1, "med": 4.654285618576094, "min": 1.0, "max": 125970.9108117824, "ge2": 40, "liq": 32}, "after": {"hits": 1, "med": 4.65424878080965, "min": 1.0, "max": 125956.328742004, "ge2": 40, "liq": 32}, "mode": "agent_bg_loop", "ts": "2026-08-12T09:01:42.271852+00:00"}
{"set": "B190", "decision": "REVERT", "edit": "second scale 0.011/0.045->0.0105/0.043", "before": {"hits": 1, "med": 4.654285618576094, "min": 1.0, "max": 125970.9108117824, "ge2": 40, "liq": 32}, "after": {"hits": 1, "med": 4.654237570353954, "min": 1.0, "max": 125959.79025197956, "ge2": 40, "liq": 32}, "mode": "agent_bg_loop", "ts": "2026-08-12T09:02:08.835284+00:00"}
{"set": "B191", "decision": "KEEP", "edit": "post-scale trail 6.502499999999999e-08->5.5271249999999986e-08", "before": {"hits": 1, "med": 4.654285618576094, "min": 1.0, "max": 125970.9108117824, "ge2": 40, "liq": 32}, "after": {"hits": 1, "med": 4.6542856284086085, "min": 1.0, "max": 125970.91393414546, "ge2": 40, "liq": 32}, "mode": "agent_bg_loop", "ts": "2026-08-12T09:02:37.420162+00:00"}
{"set": "B192", "decision": "REVERT", "edit": "later scale 0.0028->0.0026 runner chain", "before": {"hits": 1, "med": 4.6542856284086085, "min": 1.0, "max": 125970.91393414546, "ge2": 40, "liq": 32}, "after": {"hits": 1, "med": 4.654248790641635, "min": 1.0, "max": 125956.3318640546, "ge2": 40, "liq": 32}, "mode": "agent_bg_loop", "ts": "2026-08-12T09:03:05.912155+00:00"}
{"set": "B193", "decision": "REVERT", "edit": "second scale 0.011/0.045->0.0105/0.043", "before": {"hits": 1, "med": 4.6542856284086085, "min": 1.0, "max": 125970.91393414546, "ge2": 40, "liq": 32}, "after": {"hits": 1, "med": 4.65423758018572, "min": 1.0, "max": 125959.7933741256, "ge2": 40, "liq": 32}, "mode": "agent_bg_loop", "ts": "2026-08-12T09:03:36.876775+00:00"}
{"set": "B194", "decision": "KEEP", "edit": "post-scale trail 5.5271249999999986e-08->4.698056249999999e-08", "before": {"hits": 1, "med": 4.6542856284086085, "min": 1.0, "max": 125970.91393414546, "ge2": 40, "liq": 32}, "after": {"hits": 1, "med": 4.654285636766262, "min": 1.0, "max": 125970.9165881551, "ge2": 40, "liq": 32}, "mode": "agent_bg_loop", "ts": "2026-08-12T09:04:06.015361+00:00"}
{"set": "B195", "decision": "REVERT", "edit": "later scale 0.0028->0.0026 runner chain", "before": {"hits": 1, "med": 4.654285636766262, "min": 1.0, "max": 125970.9165881551, "ge2": 40, "liq": 32}, "after": {"hits": 1, "med": 4.65424879899884, "min": 1.0, "max": 125956.3345177986, "ge2": 40, "liq": 32}, "mode": "agent_bg_loop", "ts": "2026-08-12T09:04:32.813727+00:00"}
{"set": "B196", "decision": "REVERT", "edit": "second scale 0.011/0.045->0.0105/0.043", "before": {"hits": 1, "med": 4.654285636766262, "min": 1.0, "max": 125970.9165881551, "ge2": 40, "liq": 32}, "after": {"hits": 1, "med": 4.654237588542737, "min": 1.0, "max": 125959.79602795084, "ge2": 40, "liq": 32}, "mode": "agent_bg_loop", "ts": "2026-08-12T09:04:59.085032+00:00"}
{"set": "B197", "decision": "KEEP", "edit": "post-scale trail 4.698056249999999e-08->3.993347812499999e-08", "before": {"hits": 1, "med": 4.654285636766262, "min": 1.0, "max": 125970.9165881551, "ge2": 40, "liq": 32}, "after": {"hits": 1, "med": 4.65428564387025, "min": 1.0, "max": 125970.91884406208, "ge2": 40, "liq": 32}, "mode": "agent_bg_loop", "ts": "2026-08-12T09:05:26.239815+00:00"}
{"set": "B198", "decision": "REVERT", "edit": "later scale 0.0028->0.0026 runner chain", "before": {"hits": 1, "med": 4.65428564387025, "min": 1.0, "max": 125970.91884406208, "ge2": 40, "liq": 32}, "after": {"hits": 1, "med": 4.654248806102446, "min": 1.0, "max": 125956.33677347992, "ge2": 40, "liq": 32}, "mode": "agent_bg_loop", "ts": "2026-08-12T09:05:53.528732+00:00"}
{"set": "B199", "decision": "REVERT", "edit": "second scale 0.011/0.045->0.0105/0.043", "before": {"hits": 1, "med": 4.65428564387025, "min": 1.0, "max": 125970.91884406208, "ge2": 40, "liq": 32}, "after": {"hits": 1, "med": 4.654237595646184, "min": 1.0, "max": 125959.79828370117, "ge2": 40, "liq": 32}, "mode": "agent_bg_loop", "ts": "2026-08-12T09:06:21.911918+00:00"}
{"set": "B200", "decision": "KEEP", "edit": "post-scale trail 3.993347812499999e-08->3.394345640624999e-08", "before": {"hits": 1, "med": 4.65428564387025, "min": 1.0, "max": 125970.91884406208, "ge2": 40, "liq": 32}, "after": {"hits": 1, "med": 4.654285649908654, "min": 1.0, "max": 125970.92076158297, "ge2": 40, "liq": 32}, "mode": "agent_bg_loop", "ts": "2026-08-12T09:06:44.256745+00:00"}
{"set": "B201", "decision": "REVERT", "edit": "later scale 0.0028->0.0026 runner chain", "before": {"hits": 1, "med": 4.654285649908654, "min": 1.0, "max": 125970.92076158297, "ge2": 40, "liq": 32}, "after": {"hits": 1, "med": 4.6542488121405245, "min": 1.0, "max": 125956.3386908088, "ge2": 40, "liq": 32}, "mode": "agent_bg_loop", "ts": "2026-08-12T09:07:05.082338+00:00"}
{"set": "B202", "decision": "REVERT", "edit": "second scale 0.011/0.045->0.0105/0.043", "before": {"hits": 1, "med": 4.654285649908654, "min": 1.0, "max": 125970.92076158297, "ge2": 40, "liq": 32}, "after": {"hits": 1, "med": 4.654237601684128, "min": 1.0, "max": 125959.80020108874, "ge2": 40, "liq": 32}, "mode": "agent_bg_loop", "ts": "2026-08-12T09:07:25.496589+00:00"}
{"set": "B203", "decision": "KEEP", "edit": "post-scale trail 3.394345640624999e-08->2.8851937945312492e-08", "before": {"hits": 1, "med": 4.654285649908654, "min": 1.0, "max": 125970.92076158297, "ge2": 40, "liq": 32}, "after": {"hits": 1, "med": 4.654285655041291, "min": 1.0, "max": 125970.92239147672, "ge2": 40, "liq": 32}, "mode": "agent_bg_loop", "ts": "2026-08-12T09:07:46.472616+00:00"}
{"set": "B204", "decision": "REVERT", "edit": "later scale 0.0028->0.0026 runner chain", "before": {"hits": 1, "med": 4.654285655041291, "min": 1.0, "max": 125970.92239147672, "ge2": 40, "liq": 32}, "after": {"hits": 1, "med": 4.654248817272886, "min": 1.0, "max": 125956.34032053944, "ge2": 40, "liq": 32}, "mode": "agent_bg_loop", "ts": "2026-08-12T09:08:09.827299+00:00"}
{"set": "B205", "decision": "REVERT", "edit": "second scale 0.011/0.045->0.0105/0.043", "before": {"hits": 1, "med": 4.654285655041291, "min": 1.0, "max": 125970.92239147672, "ge2": 40, "liq": 32}, "after": {"hits": 1, "med": 4.654237606816374, "min": 1.0, "max": 125959.80183086924, "ge2": 40, "liq": 32}, "mode": "agent_bg_loop", "ts": "2026-08-12T09:08:29.809633+00:00"}
{"set": "B206", "decision": "KEEP", "edit": "post-scale trail 2.8851937945312492e-08->2.4524147253515617e-08", "before": {"hits": 1, "med": 4.654285655041291, "min": 1.0, "max": 125970.92239147672, "ge2": 40, "liq": 32}, "after": {"hits": 1, "med": 4.654285659404042, "min": 1.0, "max": 125970.92377688544, "ge2": 40, "liq": 32}, "mode": "agent_bg_loop", "ts": "2026-08-12T09:08:51.577155+00:00"}
{"set": "B207", "decision": "REVERT", "edit": "later scale 0.0028->0.0026 runner chain", "before": {"hits": 1, "med": 4.654285659404042, "min": 1.0, "max": 125970.92377688544, "ge2": 40, "liq": 32}, "after": {"hits": 1, "med": 4.654248821635403, "min": 1.0, "max": 125956.34170580957, "ge2": 40, "liq": 32}, "mode": "agent_bg_loop", "ts": "2026-08-12T09:09:13.286088+00:00"}
{"set": "B208", "decision": "REVERT", "edit": "second scale 0.011/0.045->0.0105/0.043", "before": {"hits": 1, "med": 4.654285659404042, "min": 1.0, "max": 125970.92377688544, "ge2": 40, "liq": 32}, "after": {"hits": 1, "med": 4.654237611178794, "min": 1.0, "max": 125959.80321618172, "ge2": 40, "liq": 32}, "mode": "agent_bg_loop", "ts": "2026-08-12T09:09:32.851894+00:00"}
{"set": "B209", "decision": "KEEP", "edit": "post-scale trail 2.4524147253515617e-08->2.0845525165488272e-08", "before": {"hits": 1, "med": 4.654285659404042, "min": 1.0, "max": 125970.92377688544, "ge2": 40, "liq": 32}, "after": {"hits": 1, "med": 4.654285663112376, "min": 1.0, "max": 125970.924954485, "ge2": 40, "liq": 32}, "mode": "agent_bg_loop", "ts": "2026-08-12T09:09:56.530881+00:00"}
{"set": "B210", "decision": "REVERT", "edit": "later scale 0.0028->0.0026 runner chain", "before": {"hits": 1, "med": 4.654285663112376, "min": 1.0, "max": 125970.924954485, "ge2": 40, "liq": 32}, "after": {"hits": 1, "med": 4.654248825343537, "min": 1.0, "max": 125956.3428832911, "ge2": 40, "liq": 32}, "mode": "agent_bg_loop", "ts": "2026-08-12T09:10:16.408295+00:00"}
{"set": "B211", "decision": "REVERT", "edit": "second scale 0.011/0.045->0.0105/0.043", "before": {"hits": 1, "med": 4.654285663112376, "min": 1.0, "max": 125970.924954485, "ge2": 40, "liq": 32}, "after": {"hits": 1, "med": 4.654237614886844, "min": 1.0, "max": 125959.80439369936, "ge2": 40, "liq": 32}, "mode": "agent_bg_loop", "ts": "2026-08-12T09:10:37.204034+00:00"}
{"set": "B212", "decision": "KEEP", "edit": "post-scale trail 2.0845525165488272e-08->1.7718696390665032e-08", "before": {"hits": 1, "med": 4.654285663112376, "min": 1.0, "max": 125970.924954485, "ge2": 40, "liq": 32}, "after": {"hits": 1, "med": 4.654285666264454, "min": 1.0, "max": 125970.92595544172, "ge2": 40, "liq": 32}, "mode": "agent_bg_loop", "ts": "2026-08-12T09:10:56.958375+00:00"}
{"set": "B213", "decision": "REVERT", "edit": "later scale 0.0028->0.0026 runner chain", "before": {"hits": 1, "med": 4.654285666264454, "min": 1.0, "max": 125970.92595544172, "ge2": 40, "liq": 32}, "after": {"hits": 1, "med": 4.6542488284954455, "min": 1.0, "max": 125956.34388414776, "ge2": 40, "liq": 32}, "mode": "agent_bg_loop", "ts": "2026-08-12T09:11:17.956935+00:00"}
{"set": "B214", "decision": "REVERT", "edit": "second scale 0.011/0.045->0.0105/0.043", "before": {"hits": 1, "med": 4.654285666264454, "min": 1.0, "max": 125970.92595544172, "ge2": 40, "liq": 32}, "after": {"hits": 1, "med": 4.654237618038682, "min": 1.0, "max": 125959.80539458658, "ge2": 40, "liq": 32}, "mode": "agent_bg_loop", "ts": "2026-08-12T09:11:41.226676+00:00"}
{"set": "B215", "decision": "KEEP", "edit": "post-scale trail 1.7718696390665032e-08->1.5060891932065278e-08", "before": {"hits": 1, "med": 4.654285666264454, "min": 1.0, "max": 125970.92595544172, "ge2": 40, "liq": 32}, "after": {"hits": 1, "med": 4.654285668943718, "min": 1.0, "max": 125970.92680625504, "ge2": 40, "liq": 32}, "mode": "agent_bg_loop", "ts": "2026-08-12T09:12:01.617701+00:00"}
{"set": "B216", "decision": "REVERT", "edit": "later scale 0.0028->0.0026 runner chain", "before": {"hits": 1, "med": 4.654285668943718, "min": 1.0, "max": 125970.92680625504, "ge2": 40, "liq": 32}, "after": {"hits": 1, "med": 4.654248831174565, "min": 1.0, "max": 125956.34473487583, "ge2": 40, "liq": 32}, "mode": "agent_bg_loop", "ts": "2026-08-12T09:12:24.899090+00:00"}
{"set": "B217", "decision": "REVERT", "edit": "second scale 0.011/0.045->0.0105/0.043", "before": {"hits": 1, "med": 4.654285668943718, "min": 1.0, "max": 125970.92680625504, "ge2": 40, "liq": 32}, "after": {"hits": 1, "med": 4.654237620717742, "min": 1.0, "max": 125959.80624534082, "ge2": 40, "liq": 32}, "mode": "agent_bg_loop", "ts": "2026-08-12T09:12:47.815312+00:00"}
{"set": "B218", "decision": "KEEP", "edit": "post-scale trail 1.5060891932065278e-08->1.2801758142255486e-08", "before": {"hits": 1, "med": 4.654285668943718, "min": 1.0, "max": 125970.92680625504, "ge2": 40, "liq": 32}, "after": {"hits": 1, "med": 4.654285671221095, "min": 1.0, "max": 125970.9275294479, "ge2": 40, "liq": 32}, "mode": "agent_bg_loop", "ts": "2026-08-12T09:13:10.830662+00:00"}
{"set": "B219", "decision": "REVERT", "edit": "later scale 0.0028->0.0026 runner chain", "before": {"hits": 1, "med": 4.654285671221095, "min": 1.0, "max": 125970.9275294479, "ge2": 40, "liq": 32}, "after": {"hits": 1, "med": 4.65424883345182, "min": 1.0, "max": 125956.34545799646, "ge2": 40, "liq": 32}, "mode": "agent_bg_loop", "ts": "2026-08-12T09:13:33.706490+00:00"}
{"set": "B220", "decision": "REVERT", "edit": "second scale 0.011/0.045->0.0105/0.043", "before": {"hits": 1, "med": 4.654285671221095, "min": 1.0, "max": 125970.9275294479, "ge2": 40, "liq": 32}, "after": {"hits": 1, "med": 4.6542376229949465, "min": 1.0, "max": 125959.80696848348, "ge2": 40, "liq": 32}, "mode": "agent_bg_loop", "ts": "2026-08-12T09:13:56.398309+00:00"}
{"set": "B221", "decision": "KEEP", "edit": "post-scale trail 1.2801758142255486e-08->1.0881494420917163e-08", "before": {"hits": 1, "med": 4.654285671221095, "min": 1.0, "max": 125970.9275294479, "ge2": 40, "liq": 32}, "after": {"hits": 1, "med": 4.654285673156881, "min": 1.0, "max": 125970.9281441629, "ge2": 40, "liq": 32}, "mode": "agent_bg_loop", "ts": "2026-08-12T09:14:17.323220+00:00"}
{"set": "B222", "decision": "REVERT", "edit": "later scale 0.0028->0.0026 runner chain", "before": {"hits": 1, "med": 4.654285673156881, "min": 1.0, "max": 125970.9281441629, "ge2": 40, "liq": 32}, "after": {"hits": 1, "med": 4.654248835387502, "min": 1.0, "max": 125956.34607265, "ge2": 40, "liq": 32}, "mode": "agent_bg_loop", "ts": "2026-08-12T09:14:37.693779+00:00"}
{"set": "B223", "decision": "REVERT", "edit": "second scale 0.011/0.045->0.0105/0.043", "before": {"hits": 1, "med": 4.654285673156881, "min": 1.0, "max": 125970.9281441629, "ge2": 40, "liq": 32}, "after": {"hits": 1, "med": 4.654237624930585, "min": 1.0, "max": 125959.80758315577, "ge2": 40, "liq": 32}, "mode": "agent_bg_loop", "ts": "2026-08-12T09:15:00.585426+00:00"}
{"set": "B224", "decision": "KEEP", "edit": "post-scale trail 1.0881494420917163e-08->9.249270257779589e-09", "before": {"hits": 1, "med": 4.654285673156881, "min": 1.0, "max": 125970.9281441629, "ge2": 40, "liq": 32}, "after": {"hits": 1, "med": 4.654285674802271, "min": 1.0, "max": 125970.92866666889, "ge2": 40, "liq": 32}, "mode": "agent_bg_loop", "ts": "2026-08-12T09:15:22.284274+00:00"}
{"set": "B225", "decision": "REVERT", "edit": "later scale 0.0028->0.0026 runner chain", "before": {"hits": 1, "med": 4.654285674802271, "min": 1.0, "max": 125970.92866666889, "ge2": 40, "liq": 32}, "after": {"hits": 1, "med": 4.654248837032803, "min": 1.0, "max": 125956.3465951035, "ge2": 40, "liq": 32}, "mode": "agent_bg_loop", "ts": "2026-08-12T09:15:43.613762+00:00"}
{"set": "B226", "decision": "REVERT", "edit": "second scale 0.011/0.045->0.0105/0.043", "before": {"hits": 1, "med": 4.654285674802271, "min": 1.0, "max": 125970.92866666889, "ge2": 40, "liq": 32}, "after": {"hits": 1, "med": 4.654237626575849, "min": 1.0, "max": 125959.80810562546, "ge2": 40, "liq": 32}, "mode": "agent_bg_loop", "ts": "2026-08-12T09:16:05.036657+00:00"}
{"set": "B227", "decision": "KEEP", "edit": "post-scale trail 9.249270257779589e-09->7.861879719112651e-09", "before": {"hits": 1, "med": 4.654285674802271, "min": 1.0, "max": 125970.92866666889, "ge2": 40, "liq": 32}, "after": {"hits": 1, "med": 4.654285676200869, "min": 1.0, "max": 125970.9291108006, "ge2": 40, "liq": 32}, "mode": "agent_bg_loop", "ts": "2026-08-12T09:16:27.304124+00:00"}
{"set": "B228", "decision": "REVERT", "edit": "later scale 0.0028->0.0026 runner chain", "before": {"hits": 1, "med": 4.654285676200869, "min": 1.0, "max": 125970.9291108006, "ge2": 40, "liq": 32}, "after": {"hits": 1, "med": 4.654248838431326, "min": 1.0, "max": 125956.3470391907, "ge2": 40, "liq": 32}, "mode": "agent_bg_loop", "ts": "2026-08-12T09:16:47.195319+00:00"}
{"set": "B229", "decision": "REVERT", "edit": "second scale 0.011/0.045->0.0105/0.043", "before": {"hits": 1, "med": 4.654285676200869, "min": 1.0, "max": 125970.9291108006, "ge2": 40, "liq": 32}, "after": {"hits": 1, "med": 4.654237627974341, "min": 1.0, "max": 125959.80854972618, "ge2": 40, "liq": 32}, "mode": "agent_bg_loop", "ts": "2026-08-12T09:17:06.887925+00:00"}
{"set": "B230", "decision": "KEEP", "edit": "post-scale trail 7.861879719112651e-09->6.682597761245753e-09", "before": {"hits": 1, "med": 4.654285676200869, "min": 1.0, "max": 125970.9291108006, "ge2": 40, "liq": 32}, "after": {"hits": 1, "med": 4.6542856773896855, "min": 1.0, "max": 125970.92948831143, "ge2": 40, "liq": 32}, "mode": "agent_bg_loop", "ts": "2026-08-12T09:17:26.513729+00:00"}
{"set": "B231", "decision": "REVERT", "edit": "later scale 0.0028->0.0026 runner chain", "before": {"hits": 1, "med": 4.6542856773896855, "min": 1.0, "max": 125970.92948831143, "ge2": 40, "liq": 32}, "after": {"hits": 1, "med": 4.654248839620078, "min": 1.0, "max": 125956.3474166638, "ge2": 40, "liq": 32}, "mode": "agent_bg_loop", "ts": "2026-08-12T09:17:46.235389+00:00"}
{"set": "B232", "decision": "REVERT", "edit": "second scale 0.011/0.045->0.0105/0.043", "before": {"hits": 1, "med": 4.6542856773896855, "min": 1.0, "max": 125970.92948831143, "ge2": 40, "liq": 32}, "after": {"hits": 1, "med": 4.654237629163066, "min": 1.0, "max": 125959.80892721083, "ge2": 40, "liq": 32}, "mode": "agent_bg_loop", "ts": "2026-08-12T09:18:05.976078+00:00"}
