{"set": "B1202", "decision": "REVERT", "edit": "post-scale trail 6.1653697404852474e-12->5.2405642794124606e-12", "before": {"hits": 1, "med": 4.654285684120027, "min": 1.0, "max": 125970.93162556336, "ge2": 40, "liq": 32}, "after": {"hits": 1, "med": 4.654285684120957, "min": 1.0, "max": 125970.9316258614, "ge2": 40, "liq": 32}, "mode": "agent_bg_loop", "ts": "2026-08-12T14:40:43.449785+00:00"}
{"set": "B1203", "decision": "REVERT", "edit": "later scale 0.0028->0.0026 runner chain", "before": {"hits": 1, "med": 4.654285684120027, "min": 1.0, "max": 125970.93162556336, "ge2": 40, "liq": 32}, "after": {"hits": 1, "med": 4.654248846350058, "min": 1.0, "max": 125956.34955370188, "ge2": 40, "liq": 32}, "mode": "agent_bg_loop", "ts": "2026-08-12T14:41:03.473760+00:00"}
{"set": "B1204", "decision": "REVERT", "edit": "second scale 0.011/0.045->0.0105/0.043", "before": {"hits": 1, "med": 4.654285684120027, "min": 1.0, "max": 125970.93162556336, "ge2": 40, "liq": 32}, "after": {"hits": 1, "med": 4.654237635892896, "min": 1.0, "max": 125959.81106431429, "ge2": 40, "liq": 32}, "mode": "agent_bg_loop", "ts": "2026-08-12T14:41:23.456517+00:00"}
{"set": "B1205", "decision": "REVERT", "edit": "post-scale trail 6.1653697404852474e-12->5.2405642794124606e-12", "before": {"hits": 1, "med": 4.654285684120027, "min": 1.0, "max": 125970.93162556336, "ge2": 40, "liq": 32}, "after": {"hits": 1, "med": 4.654285684120957, "min": 1.0, "max": 125970.9316258614, "ge2": 40, "liq": 32}, "mode": "agent_bg_loop", "ts": "2026-08-12T14:41:43.510997+00:00"}
{"set": "B1206", "decision": "REVERT", "edit": "later scale 0.0028->0.0026 runner chain", "before": {"hits": 1, "med": 4.654285684120027, "min": 1.0, "max": 125970.93162556336, "ge2": 40, "liq": 32}, "after": {"hits": 1, "med": 4.654248846350058, "min": 1.0, "max": 125956.34955370188, "ge2": 40, "liq": 32}, "mode": "agent_bg_loop", "ts": "2026-08-12T14:42:03.579498+00:00"}
{"set": "B1207", "decision": "REVERT", "edit": "second scale 0.011/0.045->0.0105/0.043", "before": {"hits": 1, "med": 4.654285684120027, "min": 1.0, "max": 125970.93162556336, "ge2": 40, "liq": 32}, "after": {"hits": 1, "med": 4.654237635892896, "min": 1.0, "max": 125959.81106431429, "ge2": 40, "liq": 32}, "mode": "agent_bg_loop", "ts": "2026-08-12T14:42:23.562683+00:00"}
{"set": "B1208", "decision": "REVERT", "edit": "post-scale trail 6.1653697404852474e-12->5.2405642794124606e-12", "before": {"hits": 1, "med": 4.654285684120027, "min": 1.0, "max": 125970.93162556336, "ge2": 40, "liq": 32}, "after": {"hits": 1, "med": 4.654285684120957, "min": 1.0, "max": 125970.9316258614, "ge2": 40, "liq": 32}, "mode": "agent_bg_loop", "ts": "2026-08-12T14:42:43.548377+00:00"}
{"set": "B1209", "decision": "REVERT", "edit": "later scale 0.0028->0.0026 runner chain", "before": {"hits": 1, "med": 4.654285684120027, "min": 1.0, "max": 125970.93162556336, "ge2": 40, "liq": 32}, "after": {"hits": 1, "med": 4.654248846350058, "min": 1.0, "max": 125956.34955370188, "ge2": 40, "liq": 32}, "mode": "agent_bg_loop", "ts": "2026-08-12T14:43:03.720295+00:00"}
{"set": "B1210", "decision": "REVERT", "edit": "second scale 0.011/0.045->0.0105/0.043", "before": {"hits": 1, "med": 4.654285684120027, "min": 1.0, "max": 125970.93162556336, "ge2": 40, "liq": 32}, "after": {"hits": 1, "med": 4.654237635892896, "min": 1.0, "max": 125959.81106431429, "ge2": 40, "liq": 32}, "mode": "agent_bg_loop", "ts": "2026-08-12T14:43:23.805104+00:00"}
{"set": "B1211", "decision": "REVERT", "edit": "post-scale trail 6.1653697404852474e-12->5.2405642794124606e-12", "before": {"hits": 1, "med": 4.654285684120027, "min": 1.0, "max": 125970.93162556336, "ge2": 40, "liq": 32}, "after": {"hits": 1, "med": 4.654285684120957, "min": 1.0, "max": 125970.9316258614, "ge2": 40, "liq": 32}, "mode": "agent_bg_loop", "ts": "2026-08-12T14:43:43.939348+00:00"}
{"set": "B1212", "decision": "REVERT", "edit": "later scale 0.0028->0.0026 runner chain", "before": {"hits": 1, "med": 4.654285684120027, "min": 1.0, "max": 125970.93162556336, "ge2": 40, "liq": 32}, "after": {"hits": 1, "med": 4.654248846350058, "min": 1.0, "max": 125956.34955370188, "ge2": 40, "liq": 32}, "mode": "agent_bg_loop", "ts": "2026-08-12T14:44:04.379127+00:00"}
{"set": "B1213", "decision": "REVERT", "edit": "second scale 0.011/0.045->0.0105/0.043", "before": {"hits": 1, "med": 4.654285684120027, "min": 1.0, "max": 125970.93162556336, "ge2": 40, "liq": 32}, "after": {"hits": 1, "med": 4.654237635892896, "min": 1.0, "max": 125959.81106431429, "ge2": 40, "liq": 32}, "mode": "agent_bg_loop", "ts": "2026-08-12T14:44:24.521995+00:00"}
{"set": "B1214", "decision": "REVERT", "edit": "post-scale trail 6.1653697404852474e-12->5.2405642794124606e-12", "before": {"hits": 1, "med": 4.654285684120027, "min": 1.0, "max": 125970.93162556336, "ge2": 40, "liq": 32}, "after": {"hits": 1, "med": 4.654285684120957, "min": 1.0, "max": 125970.9316258614, "ge2": 40, "liq": 32}, "mode": "agent_bg_loop", "ts": "2026-08-12T14:44:44.677437+00:00"}
{"set": "B1215", "decision": "REVERT", "edit": "later scale 0.0028->0.0026 runner chain", "before": {"hits": 1, "med": 4.654285684120027, "min": 1.0, "max": 125970.93162556336, "ge2": 40, "liq": 32}, "after": {"hits": 1, "med": 4.654248846350058, "min": 1.0, "max": 125956.34955370188, "ge2": 40, "liq": 32}, "mode": "agent_bg_loop", "ts": "2026-08-12T14:45:04.687618+00:00"}
{"set": "B1216", "decision": "REVERT", "edit": "second scale 0.011/0.045->0.0105/0.043", "before": {"hits": 1, "med": 4.654285684120027, "min": 1.0, "max": 125970.93162556336, "ge2": 40, "liq": 32}, "after": {"hits": 1, "med": 4.654237635892896, "min": 1.0, "max": 125959.81106431429, "ge2": 40, "liq": 32}, "mode": "agent_bg_loop", "ts": "2026-08-12T14:45:24.690067+00:00"}
{"set": "B1217", "decision": "REVERT", "edit": "post-scale trail 6.1653697404852474e-12->5.2405642794124606e-12", "before": {"hits": 1, "med": 4.654285684120027, "min": 1.0, "max": 125970.93162556336, "ge2": 40, "liq": 32}, "after": {"hits": 1, "med": 4.654285684120957, "min": 1.0, "max": 125970.9316258614, "ge2": 40, "liq": 32}, "mode": "agent_bg_loop", "ts": "2026-08-12T14:45:44.715284+00:00"}
{"set": "B1218", "decision": "REVERT", "edit": "later scale 0.0028->0.0026 runner chain", "before": {"hits": 1, "med": 4.654285684120027, "min": 1.0, "max": 125970.93162556336, "ge2": 40, "liq": 32}, "after": {"hits": 1, "med": 4.654248846350058, "min": 1.0, "max": 125956.34955370188, "ge2": 40, "liq": 32}, "mode": "agent_bg_loop", "ts": "2026-08-12T14:46:04.734904+00:00"}
{"set": "B1219", "decision": "REVERT", "edit": "second scale 0.011/0.045->0.0105/0.043", "before": {"hits": 1, "med": 4.654285684120027, "min": 1.0, "max": 125970.93162556336, "ge2": 40, "liq": 32}, "after": {"hits": 1, "med": 4.654237635892896, "min": 1.0, "max": 125959.81106431429, "ge2": 40, "liq": 32}, "mode": "agent_bg_loop", "ts": "2026-08-12T14:46:24.840512+00:00"}
{"set": "B1220", "decision": "REVERT", "edit": "post-scale trail 6.1653697404852474e-12->5.2405642794124606e-12", "before": {"hits": 1, "med": 4.654285684120027, "min": 1.0, "max": 125970.93162556336, "ge2": 40, "liq": 32}, "after": {"hits": 1, "med": 4.654285684120957, "min": 1.0, "max": 125970.9316258614, "ge2": 40, "liq": 32}, "mode": "agent_bg_loop", "ts": "2026-08-12T14:46:44.898813+00:00"}
{"set": "B1221", "decision": "REVERT", "edit": "later scale 0.0028->0.0026 runner chain", "before": {"hits": 1, "med": 4.654285684120027, "min": 1.0, "max": 125970.93162556336, "ge2": 40, "liq": 32}, "after": {"hits": 1, "med": 4.654248846350058, "min": 1.0, "max": 125956.34955370188, "ge2": 40, "liq": 32}, "mode": "agent_bg_loop", "ts": "2026-08-12T14:47:04.848910+00:00"}
{"set": "B1222", "decision": "REVERT", "edit": "second scale 0.011/0.045->0.0105/0.043", "before": {"hits": 1, "med": 4.654285684120027, "min": 1.0, "max": 125970.93162556336, "ge2": 40, "liq": 32}, "after": {"hits": 1, "med": 4.654237635892896, "min": 1.0, "max": 125959.81106431429, "ge2": 40, "liq": 32}, "mode": "agent_bg_loop", "ts": "2026-08-12T14:47:24.871028+00:00"}
{"set": "B1223", "decision": "REVERT", "edit": "post-scale trail 6.1653697404852474e-12->5.2405642794124606e-12", "before": {"hits": 1, "med": 4.654285684120027, "min": 1.0, "max": 125970.93162556336, "ge2": 40, "liq": 32}, "after": {"hits": 1, "med": 4.654285684120957, "min": 1.0, "max": 125970.9316258614, "ge2": 40, "liq": 32}, "mode": "agent_bg_loop", "ts": "2026-08-12T14:47:44.935348+00:00"}
{"set": "B1224", "decision": "REVERT", "edit": "later scale 0.0028->0.0026 runner chain", "before": {"hits": 1, "med": 4.654285684120027, "min": 1.0, "max": 125970.93162556336, "ge2": 40, "liq": 32}, "after": {"hits": 1, "med": 4.654248846350058, "min": 1.0, "max": 125956.34955370188, "ge2": 40, "liq": 32}, "mode": "agent_bg_loop", "ts": "2026-08-12T14:48:05.131493+00:00"}
{"set": "B1225", "decision": "REVERT", "edit": "second scale 0.011/0.045->0.0105/0.043", "before": {"hits": 1, "med": 4.654285684120027, "min": 1.0, "max": 125970.93162556336, "ge2": 40, "liq": 32}, "after": {"hits": 1, "med": 4.654237635892896, "min": 1.0, "max": 125959.81106431429, "ge2": 40, "liq": 32}, "mode": "agent_bg_loop", "ts": "2026-08-12T14:48:25.075771+00:00"}
{"set": "B1226", "decision": "REVERT", "edit": "post-scale trail 6.1653697404852474e-12->5.2405642794124606e-12", "before": {"hits": 1, "med": 4.654285684120027, "min": 1.0, "max": 125970.93162556336, "ge2": 40, "liq": 32}, "after": {"hits": 1, "med": 4.654285684120957, "min": 1.0, "max": 125970.9316258614, "ge2": 40, "liq": 32}, "mode": "agent_bg_loop", "ts": "2026-08-12T14:48:45.025325+00:00"}
{"set": "B1227", "decision": "REVERT", "edit": "later scale 0.0028->0.0026 runner chain", "before": {"hits": 1, "med": 4.654285684120027, "min": 1.0, "max": 125970.93162556336, "ge2": 40, "liq": 32}, "after": {"hits": 1, "med": 4.654248846350058, "min": 1.0, "max": 125956.34955370188, "ge2": 40, "liq": 32}, "mode": "agent_bg_loop", "ts": "2026-08-12T14:49:05.595752+00:00"}
{"set": "B1228", "decision": "REVERT", "edit": "second scale 0.011/0.045->0.0105/0.043", "before": {"hits": 1, "med": 4.654285684120027, "min": 1.0, "max": 125970.93162556336, "ge2": 40, "liq": 32}, "after": {"hits": 1, "med": 4.654237635892896, "min": 1.0, "max": 125959.81106431429, "ge2": 40, "liq": 32}, "mode": "agent_bg_loop", "ts": "2026-08-12T14:49:25.616559+00:00"}
{"set": "B1229", "decision": "REVERT", "edit": "post-scale trail 6.1653697404852474e-12->5.2405642794124606e-12", "before": {"hits": 1, "med": 4.654285684120027, "min": 1.0, "max": 125970.93162556336, "ge2": 40, "liq": 32}, "after": {"hits": 1, "med": 4.654285684120957, "min": 1.0, "max": 125970.9316258614, "ge2": 40, "liq": 32}, "mode": "agent_bg_loop", "ts": "2026-08-12T14:49:45.745272+00:00"}
{"set": "B1230", "decision": "REVERT", "edit": "later scale 0.0028->0.0026 runner chain", "before": {"hits": 1, "med": 4.654285684120027, "min": 1.0, "max": 125970.93162556336, "ge2": 40, "liq": 32}, "after": {"hits": 1, "med": 4.654248846350058, "min": 1.0, "max": 125956.34955370188, "ge2": 40, "liq": 32}, "mode": "agent_bg_loop", "ts": "2026-08-12T14:50:05.842104+00:00"}
{"set": "B1231", "decision": "REVERT", "edit": "second scale 0.011/0.045->0.0105/0.043", "before": {"hits": 1, "med": 4.654285684120027, "min": 1.0, "max": 125970.93162556336, "ge2": 40, "liq": 32}, "after": {"hits": 1, "med": 4.654237635892896, "min": 1.0, "max": 125959.81106431429, "ge2": 40, "liq": 32}, "mode": "agent_bg_loop", "ts": "2026-08-12T14:50:25.877481+00:00"}
{"set": "B1232", "decision": "REVERT", "edit": "post-scale trail 6.1653697404852474e-12->5.2405642794124606e-12", "before": {"hits": 1, "med": 4.654285684120027, "min": 1.0, "max": 125970.93162556336, "ge2": 40, "liq": 32}, "after": {"hits": 1, "med": 4.654285684120957, "min": 1.0, "max": 125970.9316258614, "ge2": 40, "liq": 32}, "mode": "agent_bg_loop", "ts": "2026-08-12T14:50:45.881399+00:00"}
{"set": "B1233", "decision": "REVERT", "edit": "later scale 0.0028->0.0026 runner chain", "before": {"hits": 1, "med": 4.654285684120027, "min": 1.0, "max": 125970.93162556336, "ge2": 40, "liq": 32}, "after": {"hits": 1, "med": 4.654248846350058, "min": 1.0, "max": 125956.34955370188, "ge2": 40, "liq": 32}, "mode": "agent_bg_loop", "ts": "2026-08-12T14:51:06.011781+00:00"}
{"set": "B1234", "decision": "REVERT", "edit": "second scale 0.011/0.045->0.0105/0.043", "before": {"hits": 1, "med": 4.654285684120027, "min": 1.0, "max": 125970.93162556336, "ge2": 40, "liq": 32}, "after": {"hits": 1, "med": 4.654237635892896, "min": 1.0, "max": 125959.81106431429, "ge2": 40, "liq": 32}, "mode": "agent_bg_loop", "ts": "2026-08-12T14:51:26.045549+00:00"}
{"set": "B1235", "decision": "REVERT", "edit": "post-scale trail 6.1653697404852474e-12->5.2405642794124606e-12", "before": {"hits": 1, "med": 4.654285684120027, "min": 1.0, "max": 125970.93162556336, "ge2": 40, "liq": 32}, "after": {"hits": 1, "med": 4.654285684120957, "min": 1.0, "max": 125970.9316258614, "ge2": 40, "liq": 32}, "mode": "agent_bg_loop", "ts": "2026-08-12T14:51:46.088839+00:00"}
{"set": "B1236", "decision": "REVERT", "edit": "later scale 0.0028->0.0026 runner chain", "before": {"hits": 1, "med": 4.654285684120027, "min": 1.0, "max": 125970.93162556336, "ge2": 40, "liq": 32}, "after": {"hits": 1, "med": 4.654248846350058, "min": 1.0, "max": 125956.34955370188, "ge2": 40, "liq": 32}, "mode": "agent_bg_loop", "ts": "2026-08-12T14:52:06.181199+00:00"}
{"set": "B1237", "decision": "REVERT", "edit": "second scale 0.011/0.045->0.0105/0.043", "before": {"hits": 1, "med": 4.654285684120027, "min": 1.0, "max": 125970.93162556336, "ge2": 40, "liq": 32}, "after": {"hits": 1, "med": 4.654237635892896, "min": 1.0, "max": 125959.81106431429, "ge2": 40, "liq": 32}, "mode": "agent_bg_loop", "ts": "2026-08-12T14:52:26.350343+00:00"}
{"set": "B1238", "decision": "REVERT", "edit": "post-scale trail 6.1653697404852474e-12->5.2405642794124606e-12", "before": {"hits": 1, "med": 4.654285684120027, "min": 1.0, "max": 125970.93162556336, "ge2": 40, "liq": 32}, "after": {"hits": 1, "med": 4.654285684120957, "min": 1.0, "max": 125970.9316258614, "ge2": 40, "liq": 32}, "mode": "agent_bg_loop", "ts": "2026-08-12T14:52:46.423105+00:00"}
{"set": "B1239", "decision": "REVERT", "edit": "later scale 0.0028->0.0026 runner chain", "before": {"hits": 1, "med": 4.654285684120027, "min": 1.0, "max": 125970.93162556336, "ge2": 40, "liq": 32}, "after": {"hits": 1, "med": 4.654248846350058, "min": 1.0, "max": 125956.34955370188, "ge2": 40, "liq": 32}, "mode": "agent_bg_loop", "ts": "2026-08-12T14:53:06.608808+00:00"}
{"set": "B1240", "decision": "REVERT", "edit": "second scale 0.011/0.045->0.0105/0.043", "before": {"hits": 1, "med": 4.654285684120027, "min": 1.0, "max": 125970.93162556336, "ge2": 40, "liq": 32}, "after": {"hits": 1, "med": 4.654237635892896, "min": 1.0, "max": 125959.81106431429, "ge2": 40, "liq": 32}, "mode": "agent_bg_loop", "ts": "2026-08-12T14:53:26.686769+00:00"}
{"set": "B1241", "decision": "REVERT", "edit": "post-scale trail 6.1653697404852474e-12->5.2405642794124606e-12", "before": {"hits": 1, "med": 4.654285684120027, "min": 1.0, "max": 125970.93162556336, "ge2": 40, "liq": 32}, "after": {"hits": 1, "med": 4.654285684120957, "min": 1.0, "max": 125970.9316258614, "ge2": 40, "liq": 32}, "mode": "agent_bg_loop", "ts": "2026-08-12T14:53:46.813354+00:00"}
{"set": "B1242", "decision": "REVERT", "edit": "later scale 0.0028->0.0026 runner chain", "before": {"hits": 1, "med": 4.654285684120027, "min": 1.0, "max": 125970.93162556336, "ge2": 40, "liq": 32}, "after": {"hits": 1, "med": 4.654248846350058, "min": 1.0, "max": 125956.34955370188, "ge2": 40, "liq": 32}, "mode": "agent_bg_loop", "ts": "2026-08-12T14:54:07.208558+00:00"}
{"set": "B1243", "decision": "REVERT", "edit": "second scale 0.011/0.045->0.0105/0.043", "before": {"hits": 1, "med": 4.654285684120027, "min": 1.0, "max": 125970.93162556336, "ge2": 40, "liq": 32}, "after": {"hits": 1, "med": 4.654237635892896, "min": 1.0, "max": 125959.81106431429, "ge2": 40, "liq": 32}, "mode": "agent_bg_loop", "ts": "2026-08-12T14:54:27.307245+00:00"}
{"set": "B1244", "decision": "REVERT", "edit": "post-scale trail 6.1653697404852474e-12->5.2405642794124606e-12", "before": {"hits": 1, "med": 4.654285684120027, "min": 1.0, "max": 125970.93162556336, "ge2": 40, "liq": 32}, "after": {"hits": 1, "med": 4.654285684120957, "min": 1.0, "max": 125970.9316258614, "ge2": 40, "liq": 32}, "mode": "agent_bg_loop", "ts": "2026-08-12T14:54:47.317922+00:00"}
{"set": "B1245", "decision": "REVERT", "edit": "later scale 0.0028->0.0026 runner chain", "before": {"hits": 1, "med": 4.654285684120027, "min": 1.0, "max": 125970.93162556336, "ge2": 40, "liq": 32}, "after": {"hits": 1, "med": 4.654248846350058, "min": 1.0, "max": 125956.34955370188, "ge2": 40, "liq": 32}, "mode": "agent_bg_loop", "ts": "2026-08-12T14:55:07.302277+00:00"}
{"set": "B1246", "decision": "REVERT", "edit": "second scale 0.011/0.045->0.0105/0.043", "before": {"hits": 1, "med": 4.654285684120027, "min": 1.0, "max": 125970.93162556336, "ge2": 40, "liq": 32}, "after": {"hits": 1, "med": 4.654237635892896, "min": 1.0, "max": 125959.81106431429, "ge2": 40, "liq": 32}, "mode": "agent_bg_loop", "ts": "2026-08-12T14:55:27.356656+00:00"}
{"set": "B1247", "decision": "REVERT", "edit": "post-scale trail 6.1653697404852474e-12->5.2405642794124606e-12", "before": {"hits": 1, "med": 4.654285684120027, "min": 1.0, "max": 125970.93162556336, "ge2": 40, "liq": 32}, "after": {"hits": 1, "med": 4.654285684120957, "min": 1.0, "max": 125970.9316258614, "ge2": 40, "liq": 32}, "mode": "agent_bg_loop", "ts": "2026-08-12T14:55:47.327276+00:00"}
{"set": "B1248", "decision": "REVERT", "edit": "later scale 0.0028->0.0026 runner chain", "before": {"hits": 1, "med": 4.654285684120027, "min": 1.0, "max": 125970.93162556336, "ge2": 40, "liq": 32}, "after": {"hits": 1, "med": 4.654248846350058, "min": 1.0, "max": 125956.34955370188, "ge2": 40, "liq": 32}, "mode": "agent_bg_loop", "ts": "2026-08-12T14:56:07.452051+00:00"}
{"set": "B1249", "decision": "REVERT", "edit": "second scale 0.011/0.045->0.0105/0.043", "before": {"hits": 1, "med": 4.654285684120027, "min": 1.0, "max": 125970.93162556336, "ge2": 40, "liq": 32}, "after": {"hits": 1, "med": 4.654237635892896, "min": 1.0, "max": 125959.81106431429, "ge2": 40, "liq": 32}, "mode": "agent_bg_loop", "ts": "2026-08-12T14:56:27.515275+00:00"}
{"set": "B1250", "decision": "REVERT", "edit": "post-scale trail 6.1653697404852474e-12->5.2405642794124606e-12", "before": {"hits": 1, "med": 4.654285684120027, "min": 1.0, "max": 125970.93162556336, "ge2": 40, "liq": 32}, "after": {"hits": 1, "med": 4.654285684120957, "min": 1.0, "max": 125970.9316258614, "ge2": 40, "liq": 32}, "mode": "agent_bg_loop", "ts": "2026-08-12T14:56:47.500738+00:00"}
{"set": "B1251", "decision": "REVERT", "edit": "later scale 0.0028->0.0026 runner chain", "before": {"hits": 1, "med": 4.654285684120027, "min": 1.0, "max": 125970.93162556336, "ge2": 40, "liq": 32}, "after": {"hits": 1, "med": 4.654248846350058, "min": 1.0, "max": 125956.34955370188, "ge2": 40, "liq": 32}, "mode": "agent_bg_loop", "ts": "2026-08-12T14:57:07.597132+00:00"}
{"set": "B1252", "decision": "REVERT", "edit": "second scale 0.011/0.045->0.0105/0.043", "before": {"hits": 1, "med": 4.654285684120027, "min": 1.0, "max": 125970.93162556336, "ge2": 40, "liq": 32}, "after": {"hits": 1, "med": 4.654237635892896, "min": 1.0, "max": 125959.81106431429, "ge2": 40, "liq": 32}, "mode": "agent_bg_loop", "ts": "2026-08-12T14:57:27.747325+00:00"}
{"set": "B1253", "decision": "REVERT", "edit": "post-scale trail 6.1653697404852474e-12->5.2405642794124606e-12", "before": {"hits": 1, "med": 4.654285684120027, "min": 1.0, "max": 125970.93162556336, "ge2": 40, "liq": 32}, "after": {"hits": 1, "med": 4.654285684120957, "min": 1.0, "max": 125970.9316258614, "ge2": 40, "liq": 32}, "mode": "agent_bg_loop", "ts": "2026-08-12T14:57:47.773966+00:00"}
{"set": "B1254", "decision": "REVERT", "edit": "later scale 0.0028->0.0026 runner chain", "before": {"hits": 1, "med": 4.654285684120027, "min": 1.0, "max": 125970.93162556336, "ge2": 40, "liq": 32}, "after": {"hits": 1, "med": 4.654248846350058, "min": 1.0, "max": 125956.34955370188, "ge2": 40, "liq": 32}, "mode": "agent_bg_loop", "ts": "2026-08-12T14:58:07.976192+00:00"}
{"set": "B1255", "decision": "REVERT", "edit": "second scale 0.011/0.045->0.0105/0.043", "before": {"hits": 1, "med": 4.654285684120027, "min": 1.0, "max": 125970.93162556336, "ge2": 40, "liq": 32}, "after": {"hits": 1, "med": 4.654237635892896, "min": 1.0, "max": 125959.81106431429, "ge2": 40, "liq": 32}, "mode": "agent_bg_loop", "ts": "2026-08-12T14:58:27.951056+00:00"}
{"set": "B1256", "decision": "REVERT", "edit": "post-scale trail 6.1653697404852474e-12->5.2405642794124606e-12", "before": {"hits": 1, "med": 4.654285684120027, "min": 1.0, "max": 125970.93162556336, "ge2": 40, "liq": 32}, "after": {"hits": 1, "med": 4.654285684120957, "min": 1.0, "max": 125970.9316258614, "ge2": 40, "liq": 32}, "mode": "agent_bg_loop", "ts": "2026-08-12T14:58:47.981802+00:00"}
{"set": "B1257", "decision": "REVERT", "edit": "later scale 0.0028->0.0026 runner chain", "before": {"hits": 1, "med": 4.654285684120027, "min": 1.0, "max": 125970.93162556336, "ge2": 40, "liq": 32}, "after": {"hits": 1, "med": 4.654248846350058, "min": 1.0, "max": 125956.34955370188, "ge2": 40, "liq": 32}, "mode": "agent_bg_loop", "ts": "2026-08-12T14:59:08.461057+00:00"}
{"set": "B1258", "decision": "REVERT", "edit": "second scale 0.011/0.045->0.0105/0.043", "before": {"hits": 1, "med": 4.654285684120027, "min": 1.0, "max": 125970.93162556336, "ge2": 40, "liq": 32}, "after": {"hits": 1, "med": 4.654237635892896, "min": 1.0, "max": 125959.81106431429, "ge2": 40, "liq": 32}, "mode": "agent_bg_loop", "ts": "2026-08-12T14:59:28.927620+00:00"}
