{"set": "B290", "decision": "KEEP", "edit": "post-scale trail 3.047227713556597e-10->2.5901435565231073e-10", "before": {"hits": 1, "med": 4.654285683819065, "min": 1.0, "max": 125970.93152999038, "ge2": 40, "liq": 32}, "after": {"hits": 1, "med": 4.654285683865144, "min": 1.0, "max": 125970.93154462222, "ge2": 40, "liq": 32}, "mode": "agent_bg_loop", "ts": "2026-08-12T09:37:12.090632+00:00"}
{"set": "B291", "decision": "REVERT", "edit": "later scale 0.0028->0.0026 runner chain", "before": {"hits": 1, "med": 4.654285683865144, "min": 1.0, "max": 125970.93154462222, "ge2": 40, "liq": 32}, "after": {"hits": 1, "med": 4.654248846095189, "min": 1.0, "max": 125956.34947276882, "ge2": 40, "liq": 32}, "mode": "agent_bg_loop", "ts": "2026-08-12T09:37:31.742299+00:00"}
{"set": "B292", "decision": "REVERT", "edit": "second scale 0.011/0.045->0.0105/0.043", "before": {"hits": 1, "med": 4.654285683865144, "min": 1.0, "max": 125970.93154462222, "ge2": 40, "liq": 32}, "after": {"hits": 1, "med": 4.654237635638032, "min": 1.0, "max": 125959.81098337876, "ge2": 40, "liq": 32}, "mode": "agent_bg_loop", "ts": "2026-08-12T09:37:51.416756+00:00"}
{"set": "B293", "decision": "KEEP", "edit": "post-scale trail 2.5901435565231073e-10->2.2016220230446413e-10", "before": {"hits": 1, "med": 4.654285683865144, "min": 1.0, "max": 125970.93154462222, "ge2": 40, "liq": 32}, "after": {"hits": 1, "med": 4.654285683904304, "min": 1.0, "max": 125970.93155706106, "ge2": 40, "liq": 32}, "mode": "agent_bg_loop", "ts": "2026-08-12T09:38:11.270059+00:00"}
{"set": "B294", "decision": "REVERT", "edit": "later scale 0.0028->0.0026 runner chain", "before": {"hits": 1, "med": 4.654285683904304, "min": 1.0, "max": 125970.93155706106, "ge2": 40, "liq": 32}, "after": {"hits": 1, "med": 4.654248846134346, "min": 1.0, "max": 125956.34948520646, "ge2": 40, "liq": 32}, "mode": "agent_bg_loop", "ts": "2026-08-12T09:38:31.043757+00:00"}
{"set": "B295", "decision": "REVERT", "edit": "second scale 0.011/0.045->0.0105/0.043", "before": {"hits": 1, "med": 4.654285683904304, "min": 1.0, "max": 125970.93155706106, "ge2": 40, "liq": 32}, "after": {"hits": 1, "med": 4.654237635677188, "min": 1.0, "max": 125959.8109958168, "ge2": 40, "liq": 32}, "mode": "agent_bg_loop", "ts": "2026-08-12T09:38:50.705707+00:00"}
{"set": "B296", "decision": "KEEP", "edit": "post-scale trail 2.2016220230446413e-10->1.8713787195879451e-10", "before": {"hits": 1, "med": 4.654285683904304, "min": 1.0, "max": 125970.93155706106, "ge2": 40, "liq": 32}, "after": {"hits": 1, "med": 4.654285683937596, "min": 1.0, "max": 125970.93156763098, "ge2": 40, "liq": 32}, "mode": "agent_bg_loop", "ts": "2026-08-12T09:39:10.783722+00:00"}
{"set": "B297", "decision": "REVERT", "edit": "later scale 0.0028->0.0026 runner chain", "before": {"hits": 1, "med": 4.654285683937596, "min": 1.0, "max": 125970.93156763098, "ge2": 40, "liq": 32}, "after": {"hits": 1, "med": 4.654248846167637, "min": 1.0, "max": 125956.34949577528, "ge2": 40, "liq": 32}, "mode": "agent_bg_loop", "ts": "2026-08-12T09:39:30.414861+00:00"}
{"set": "B298", "decision": "REVERT", "edit": "second scale 0.011/0.045->0.0105/0.043", "before": {"hits": 1, "med": 4.654285683937596, "min": 1.0, "max": 125970.93156763098, "ge2": 40, "liq": 32}, "after": {"hits": 1, "med": 4.654237635710478, "min": 1.0, "max": 125959.81100638583, "ge2": 40, "liq": 32}, "mode": "agent_bg_loop", "ts": "2026-08-12T09:39:50.118458+00:00"}
{"set": "B299", "decision": "KEEP", "edit": "post-scale trail 1.8713787195879451e-10->1.5906719116497534e-10", "before": {"hits": 1, "med": 4.654285683937596, "min": 1.0, "max": 125970.93156763098, "ge2": 40, "liq": 32}, "after": {"hits": 1, "med": 4.6542856839658935, "min": 1.0, "max": 125970.93157661529, "ge2": 40, "liq": 32}, "mode": "agent_bg_loop", "ts": "2026-08-12T09:40:09.912805+00:00"}
{"set": "B300", "decision": "REVERT", "edit": "later scale 0.0028->0.0026 runner chain", "before": {"hits": 1, "med": 4.6542856839658935, "min": 1.0, "max": 125970.93157661529, "ge2": 40, "liq": 32}, "after": {"hits": 1, "med": 4.654248846195933, "min": 1.0, "max": 125956.3495047588, "ge2": 40, "liq": 32}, "mode": "agent_bg_loop", "ts": "2026-08-12T09:40:29.645762+00:00"}
{"set": "B301", "decision": "REVERT", "edit": "second scale 0.011/0.045->0.0105/0.043", "before": {"hits": 1, "med": 4.6542856839658935, "min": 1.0, "max": 125970.93157661529, "ge2": 40, "liq": 32}, "after": {"hits": 1, "med": 4.654237635738774, "min": 1.0, "max": 125959.81101536966, "ge2": 40, "liq": 32}, "mode": "agent_bg_loop", "ts": "2026-08-12T09:40:49.340564+00:00"}
{"set": "B302", "decision": "KEEP", "edit": "post-scale trail 1.5906719116497534e-10->1.3520711249022903e-10", "before": {"hits": 1, "med": 4.6542856839658935, "min": 1.0, "max": 125970.93157661529, "ge2": 40, "liq": 32}, "after": {"hits": 1, "med": 4.654285683989951, "min": 1.0, "max": 125970.93158425728, "ge2": 40, "liq": 32}, "mode": "agent_bg_loop", "ts": "2026-08-12T09:41:09.090995+00:00"}
{"set": "B303", "decision": "REVERT", "edit": "later scale 0.0028->0.0026 runner chain", "before": {"hits": 1, "med": 4.654285683989951, "min": 1.0, "max": 125970.93158425728, "ge2": 40, "liq": 32}, "after": {"hits": 1, "med": 4.654248846219988, "min": 1.0, "max": 125956.3495124, "ge2": 40, "liq": 32}, "mode": "agent_bg_loop", "ts": "2026-08-12T09:41:28.826496+00:00"}
{"set": "B304", "decision": "REVERT", "edit": "second scale 0.011/0.045->0.0105/0.043", "before": {"hits": 1, "med": 4.654285683989951, "min": 1.0, "max": 125970.93158425728, "ge2": 40, "liq": 32}, "after": {"hits": 1, "med": 4.654237635762828, "min": 1.0, "max": 125959.81102301108, "ge2": 40, "liq": 32}, "mode": "agent_bg_loop", "ts": "2026-08-12T09:41:48.504926+00:00"}
{"set": "B305", "decision": "KEEP", "edit": "post-scale trail 1.3520711249022903e-10->1.1492604561669468e-10", "before": {"hits": 1, "med": 4.654285683989951, "min": 1.0, "max": 125970.93158425728, "ge2": 40, "liq": 32}, "after": {"hits": 1, "med": 4.654285684010398, "min": 1.0, "max": 125970.93159074802, "ge2": 40, "liq": 32}, "mode": "agent_bg_loop", "ts": "2026-08-12T09:42:08.162404+00:00"}
{"set": "B306", "decision": "REVERT", "edit": "later scale 0.0028->0.0026 runner chain", "before": {"hits": 1, "med": 4.654285684010398, "min": 1.0, "max": 125970.93159074802, "ge2": 40, "liq": 32}, "after": {"hits": 1, "med": 4.654248846240436, "min": 1.0, "max": 125956.34951888995, "ge2": 40, "liq": 32}, "mode": "agent_bg_loop", "ts": "2026-08-12T09:42:27.807568+00:00"}
{"set": "B307", "decision": "REVERT", "edit": "second scale 0.011/0.045->0.0105/0.043", "before": {"hits": 1, "med": 4.654285684010398, "min": 1.0, "max": 125970.93159074802, "ge2": 40, "liq": 32}, "after": {"hits": 1, "med": 4.654237635783274, "min": 1.0, "max": 125959.81102950136, "ge2": 40, "liq": 32}, "mode": "agent_bg_loop", "ts": "2026-08-12T09:42:47.471587+00:00"}
{"set": "B308", "decision": "KEEP", "edit": "post-scale trail 1.1492604561669468e-10->9.768713877419047e-11", "before": {"hits": 1, "med": 4.654285684010398, "min": 1.0, "max": 125970.93159074802, "ge2": 40, "liq": 32}, "after": {"hits": 1, "med": 4.654285684027776, "min": 1.0, "max": 125970.93159626708, "ge2": 40, "liq": 32}, "mode": "agent_bg_loop", "ts": "2026-08-12T09:43:07.338177+00:00"}
{"set": "B309", "decision": "REVERT", "edit": "later scale 0.0028->0.0026 runner chain", "before": {"hits": 1, "med": 4.654285684027776, "min": 1.0, "max": 125970.93159626708, "ge2": 40, "liq": 32}, "after": {"hits": 1, "med": 4.654248846257811, "min": 1.0, "max": 125956.34952440858, "ge2": 40, "liq": 32}, "mode": "agent_bg_loop", "ts": "2026-08-12T09:43:27.187946+00:00"}
{"set": "B310", "decision": "REVERT", "edit": "second scale 0.011/0.045->0.0105/0.043", "before": {"hits": 1, "med": 4.654285684027776, "min": 1.0, "max": 125970.93159626708, "ge2": 40, "liq": 32}, "after": {"hits": 1, "med": 4.654237635800651, "min": 1.0, "max": 125959.81103502, "ge2": 40, "liq": 32}, "mode": "agent_bg_loop", "ts": "2026-08-12T09:43:46.856436+00:00"}
{"set": "B311", "decision": "KEEP", "edit": "post-scale trail 9.768713877419047e-11->8.30340679580619e-11", "before": {"hits": 1, "med": 4.654285684027776, "min": 1.0, "max": 125970.93159626708, "ge2": 40, "liq": 32}, "after": {"hits": 1, "med": 4.654285684042543, "min": 1.0, "max": 125970.93160095863, "ge2": 40, "liq": 32}, "mode": "agent_bg_loop", "ts": "2026-08-12T09:44:07.064761+00:00"}
{"set": "B312", "decision": "REVERT", "edit": "later scale 0.0028->0.0026 runner chain", "before": {"hits": 1, "med": 4.654285684042543, "min": 1.0, "max": 125970.93160095863, "ge2": 40, "liq": 32}, "after": {"hits": 1, "med": 4.654248846272578, "min": 1.0, "max": 125956.34952909958, "ge2": 40, "liq": 32}, "mode": "agent_bg_loop", "ts": "2026-08-12T09:44:27.013371+00:00"}
{"set": "B313", "decision": "REVERT", "edit": "second scale 0.011/0.045->0.0105/0.043", "before": {"hits": 1, "med": 4.654285684042543, "min": 1.0, "max": 125970.93160095863, "ge2": 40, "liq": 32}, "after": {"hits": 1, "med": 4.654237635815417, "min": 1.0, "max": 125959.81103971126, "ge2": 40, "liq": 32}, "mode": "agent_bg_loop", "ts": "2026-08-12T09:44:47.123261+00:00"}
{"set": "B314", "decision": "KEEP", "edit": "post-scale trail 8.30340679580619e-11->7.057895776435262e-11", "before": {"hits": 1, "med": 4.654285684042543, "min": 1.0, "max": 125970.93160095863, "ge2": 40, "liq": 32}, "after": {"hits": 1, "med": 4.654285684055108, "min": 1.0, "max": 125970.93160494484, "ge2": 40, "liq": 32}, "mode": "agent_bg_loop", "ts": "2026-08-12T09:45:06.737705+00:00"}
{"set": "B315", "decision": "REVERT", "edit": "later scale 0.0028->0.0026 runner chain", "before": {"hits": 1, "med": 4.654285684055108, "min": 1.0, "max": 125970.93160494484, "ge2": 40, "liq": 32}, "after": {"hits": 1, "med": 4.654248846285143, "min": 1.0, "max": 125956.34953308543, "ge2": 40, "liq": 32}, "mode": "agent_bg_loop", "ts": "2026-08-12T09:45:26.414646+00:00"}
{"set": "B316", "decision": "REVERT", "edit": "second scale 0.011/0.045->0.0105/0.043", "before": {"hits": 1, "med": 4.654285684055108, "min": 1.0, "max": 125970.93160494484, "ge2": 40, "liq": 32}, "after": {"hits": 1, "med": 4.654237635827982, "min": 1.0, "max": 125959.8110436972, "ge2": 40, "liq": 32}, "mode": "agent_bg_loop", "ts": "2026-08-12T09:45:46.096596+00:00"}
{"set": "B317", "decision": "KEEP", "edit": "post-scale trail 7.057895776435262e-11->5.999211409969973e-11", "before": {"hits": 1, "med": 4.654285684055108, "min": 1.0, "max": 125970.93160494484, "ge2": 40, "liq": 32}, "after": {"hits": 1, "med": 4.65428568406578, "min": 1.0, "max": 125970.9316083339, "ge2": 40, "liq": 32}, "mode": "agent_bg_loop", "ts": "2026-08-12T09:46:05.717687+00:00"}
{"set": "B318", "decision": "REVERT", "edit": "later scale 0.0028->0.0026 runner chain", "before": {"hits": 1, "med": 4.65428568406578, "min": 1.0, "max": 125970.9316083339, "ge2": 40, "liq": 32}, "after": {"hits": 1, "med": 4.654248846295814, "min": 1.0, "max": 125956.34953647428, "ge2": 40, "liq": 32}, "mode": "agent_bg_loop", "ts": "2026-08-12T09:46:25.440802+00:00"}
{"set": "B319", "decision": "REVERT", "edit": "second scale 0.011/0.045->0.0105/0.043", "before": {"hits": 1, "med": 4.65428568406578, "min": 1.0, "max": 125970.9316083339, "ge2": 40, "liq": 32}, "after": {"hits": 1, "med": 4.654237635838652, "min": 1.0, "max": 125959.81104708604, "ge2": 40, "liq": 32}, "mode": "agent_bg_loop", "ts": "2026-08-12T09:46:45.159971+00:00"}
{"set": "B320", "decision": "KEEP", "edit": "post-scale trail 5.999211409969973e-11->5.0993296984744767e-11", "before": {"hits": 1, "med": 4.65428568406578, "min": 1.0, "max": 125970.9316083339, "ge2": 40, "liq": 32}, "after": {"hits": 1, "med": 4.654285684074845, "min": 1.0, "max": 125970.93161121402, "ge2": 40, "liq": 32}, "mode": "agent_bg_loop", "ts": "2026-08-12T09:47:04.845692+00:00"}
{"set": "B321", "decision": "REVERT", "edit": "later scale 0.0028->0.0026 runner chain", "before": {"hits": 1, "med": 4.654285684074845, "min": 1.0, "max": 125970.93161121402, "ge2": 40, "liq": 32}, "after": {"hits": 1, "med": 4.654248846304879, "min": 1.0, "max": 125956.34953935396, "ge2": 40, "liq": 32}, "mode": "agent_bg_loop", "ts": "2026-08-12T09:47:24.545602+00:00"}
{"set": "B322", "decision": "REVERT", "edit": "second scale 0.011/0.045->0.0105/0.043", "before": {"hits": 1, "med": 4.654285684074845, "min": 1.0, "max": 125970.93161121402, "ge2": 40, "liq": 32}, "after": {"hits": 1, "med": 4.654237635847717, "min": 1.0, "max": 125959.81104996597, "ge2": 40, "liq": 32}, "mode": "agent_bg_loop", "ts": "2026-08-12T09:47:44.287202+00:00"}
{"set": "B323", "decision": "KEEP", "edit": "post-scale trail 5.0993296984744767e-11->4.334430243703305e-11", "before": {"hits": 1, "med": 4.654285684074845, "min": 1.0, "max": 125970.93161121402, "ge2": 40, "liq": 32}, "after": {"hits": 1, "med": 4.654285684082563, "min": 1.0, "max": 125970.93161366128, "ge2": 40, "liq": 32}, "mode": "agent_bg_loop", "ts": "2026-08-12T09:48:04.099442+00:00"}
{"set": "B324", "decision": "REVERT", "edit": "later scale 0.0028->0.0026 runner chain", "before": {"hits": 1, "med": 4.654285684082563, "min": 1.0, "max": 125970.93161366128, "ge2": 40, "liq": 32}, "after": {"hits": 1, "med": 4.654248846312596, "min": 1.0, "max": 125956.34954180104, "ge2": 40, "liq": 32}, "mode": "agent_bg_loop", "ts": "2026-08-12T09:48:23.958926+00:00"}
{"set": "B325", "decision": "REVERT", "edit": "second scale 0.011/0.045->0.0105/0.043", "before": {"hits": 1, "med": 4.654285684082563, "min": 1.0, "max": 125970.93161366128, "ge2": 40, "liq": 32}, "after": {"hits": 1, "med": 4.654237635855434, "min": 1.0, "max": 125959.811052413, "ge2": 40, "liq": 32}, "mode": "agent_bg_loop", "ts": "2026-08-12T09:48:43.819641+00:00"}
{"set": "B326", "decision": "KEEP", "edit": "post-scale trail 4.334430243703305e-11->3.684265707147809e-11", "before": {"hits": 1, "med": 4.654285684082563, "min": 1.0, "max": 125970.93161366128, "ge2": 40, "liq": 32}, "after": {"hits": 1, "med": 4.654285684089112, "min": 1.0, "max": 125970.93161574326, "ge2": 40, "liq": 32}, "mode": "agent_bg_loop", "ts": "2026-08-12T09:49:03.799285+00:00"}
{"set": "B327", "decision": "REVERT", "edit": "later scale 0.0028->0.0026 runner chain", "before": {"hits": 1, "med": 4.654285684089112, "min": 1.0, "max": 125970.93161574326, "ge2": 40, "liq": 32}, "after": {"hits": 1, "med": 4.654248846319145, "min": 1.0, "max": 125956.34954388274, "ge2": 40, "liq": 32}, "mode": "agent_bg_loop", "ts": "2026-08-12T09:49:23.476370+00:00"}
{"set": "B328", "decision": "REVERT", "edit": "second scale 0.011/0.045->0.0105/0.043", "before": {"hits": 1, "med": 4.654285684089112, "min": 1.0, "max": 125970.93161574326, "ge2": 40, "liq": 32}, "after": {"hits": 1, "med": 4.654237635861983, "min": 1.0, "max": 125959.8110544949, "ge2": 40, "liq": 32}, "mode": "agent_bg_loop", "ts": "2026-08-12T09:49:43.174587+00:00"}
{"set": "B329", "decision": "KEEP", "edit": "post-scale trail 3.684265707147809e-11->3.1316258510756376e-11", "before": {"hits": 1, "med": 4.654285684089112, "min": 1.0, "max": 125970.93161574326, "ge2": 40, "liq": 32}, "after": {"hits": 1, "med": 4.654285684094685, "min": 1.0, "max": 125970.93161751368, "ge2": 40, "liq": 32}, "mode": "agent_bg_loop", "ts": "2026-08-12T09:50:02.870269+00:00"}
{"set": "B330", "decision": "REVERT", "edit": "later scale 0.0028->0.0026 runner chain", "before": {"hits": 1, "med": 4.654285684094685, "min": 1.0, "max": 125970.93161751368, "ge2": 40, "liq": 32}, "after": {"hits": 1, "med": 4.654248846324717, "min": 1.0, "max": 125956.34954565312, "ge2": 40, "liq": 32}, "mode": "agent_bg_loop", "ts": "2026-08-12T09:50:22.600785+00:00"}
{"set": "B331", "decision": "REVERT", "edit": "second scale 0.011/0.045->0.0105/0.043", "before": {"hits": 1, "med": 4.654285684094685, "min": 1.0, "max": 125970.93161751368, "ge2": 40, "liq": 32}, "after": {"hits": 1, "med": 4.654237635867555, "min": 1.0, "max": 125959.81105626514, "ge2": 40, "liq": 32}, "mode": "agent_bg_loop", "ts": "2026-08-12T09:50:42.313458+00:00"}
{"set": "B332", "decision": "KEEP", "edit": "post-scale trail 3.1316258510756376e-11->2.6618819734142918e-11", "before": {"hits": 1, "med": 4.654285684094685, "min": 1.0, "max": 125970.93161751368, "ge2": 40, "liq": 32}, "after": {"hits": 1, "med": 4.654285684099421, "min": 1.0, "max": 125970.93161901608, "ge2": 40, "liq": 32}, "mode": "agent_bg_loop", "ts": "2026-08-12T09:51:01.974396+00:00"}
{"set": "B333", "decision": "REVERT", "edit": "later scale 0.0028->0.0026 runner chain", "before": {"hits": 1, "med": 4.654285684099421, "min": 1.0, "max": 125970.93161901608, "ge2": 40, "liq": 32}, "after": {"hits": 1, "med": 4.654248846329455, "min": 1.0, "max": 125956.34954715516, "ge2": 40, "liq": 32}, "mode": "agent_bg_loop", "ts": "2026-08-12T09:51:21.656016+00:00"}
{"set": "B334", "decision": "REVERT", "edit": "second scale 0.011/0.045->0.0105/0.043", "before": {"hits": 1, "med": 4.654285684099421, "min": 1.0, "max": 125970.93161901608, "ge2": 40, "liq": 32}, "after": {"hits": 1, "med": 4.654237635872291, "min": 1.0, "max": 125959.8110577674, "ge2": 40, "liq": 32}, "mode": "agent_bg_loop", "ts": "2026-08-12T09:51:41.364477+00:00"}
{"set": "B335", "decision": "KEEP", "edit": "post-scale trail 2.6618819734142918e-11->2.262599677402148e-11", "before": {"hits": 1, "med": 4.654285684099421, "min": 1.0, "max": 125970.93161901608, "ge2": 40, "liq": 32}, "after": {"hits": 1, "med": 4.654285684103448, "min": 1.0, "max": 125970.93162029574, "ge2": 40, "liq": 32}, "mode": "agent_bg_loop", "ts": "2026-08-12T09:52:01.063352+00:00"}
{"set": "B336", "decision": "REVERT", "edit": "later scale 0.0028->0.0026 runner chain", "before": {"hits": 1, "med": 4.654285684103448, "min": 1.0, "max": 125970.93162029574, "ge2": 40, "liq": 32}, "after": {"hits": 1, "med": 4.654248846333481, "min": 1.0, "max": 125956.34954843488, "ge2": 40, "liq": 32}, "mode": "agent_bg_loop", "ts": "2026-08-12T09:52:20.854128+00:00"}
{"set": "B337", "decision": "REVERT", "edit": "second scale 0.011/0.045->0.0105/0.043", "before": {"hits": 1, "med": 4.654285684103448, "min": 1.0, "max": 125970.93162029574, "ge2": 40, "liq": 32}, "after": {"hits": 1, "med": 4.654237635876317, "min": 1.0, "max": 125959.81105904702, "ge2": 40, "liq": 32}, "mode": "agent_bg_loop", "ts": "2026-08-12T09:52:40.596265+00:00"}
{"set": "B338", "decision": "KEEP", "edit": "post-scale trail 2.262599677402148e-11->1.923209725791826e-11", "before": {"hits": 1, "med": 4.654285684103448, "min": 1.0, "max": 125970.93162029574, "ge2": 40, "liq": 32}, "after": {"hits": 1, "med": 4.65428568410686, "min": 1.0, "max": 125970.9316213823, "ge2": 40, "liq": 32}, "mode": "agent_bg_loop", "ts": "2026-08-12T09:53:00.396474+00:00"}
{"set": "B339", "decision": "REVERT", "edit": "later scale 0.0028->0.0026 runner chain", "before": {"hits": 1, "med": 4.65428568410686, "min": 1.0, "max": 125970.9316213823, "ge2": 40, "liq": 32}, "after": {"hits": 1, "med": 4.654248846336892, "min": 1.0, "max": 125956.34954952124, "ge2": 40, "liq": 32}, "mode": "agent_bg_loop", "ts": "2026-08-12T09:53:20.159125+00:00"}
{"set": "B340", "decision": "REVERT", "edit": "second scale 0.011/0.045->0.0105/0.043", "before": {"hits": 1, "med": 4.65428568410686, "min": 1.0, "max": 125970.9316213823, "ge2": 40, "liq": 32}, "after": {"hits": 1, "med": 4.6542376358797295, "min": 1.0, "max": 125959.81106013343, "ge2": 40, "liq": 32}, "mode": "agent_bg_loop", "ts": "2026-08-12T09:53:40.072713+00:00"}
{"set": "B341", "decision": "KEEP", "edit": "post-scale trail 1.923209725791826e-11->1.6347282669230518e-11", "before": {"hits": 1, "med": 4.65428568410686, "min": 1.0, "max": 125970.9316213823, "ge2": 40, "liq": 32}, "after": {"hits": 1, "med": 4.654285684109772, "min": 1.0, "max": 125970.93162230607, "ge2": 40, "liq": 32}, "mode": "agent_bg_loop", "ts": "2026-08-12T09:54:00.191213+00:00"}
{"set": "B342", "decision": "REVERT", "edit": "later scale 0.0028->0.0026 runner chain", "before": {"hits": 1, "med": 4.654285684109772, "min": 1.0, "max": 125970.93162230607, "ge2": 40, "liq": 32}, "after": {"hits": 1, "med": 4.654248846339804, "min": 1.0, "max": 125956.34955044498, "ge2": 40, "liq": 32}, "mode": "agent_bg_loop", "ts": "2026-08-12T09:54:19.856371+00:00"}
{"set": "B343", "decision": "REVERT", "edit": "second scale 0.011/0.045->0.0105/0.043", "before": {"hits": 1, "med": 4.654285684109772, "min": 1.0, "max": 125970.93162230607, "ge2": 40, "liq": 32}, "after": {"hits": 1, "med": 4.654237635882641, "min": 1.0, "max": 125959.81106105723, "ge2": 40, "liq": 32}, "mode": "agent_bg_loop", "ts": "2026-08-12T09:54:39.537379+00:00"}
{"set": "B344", "decision": "KEEP", "edit": "post-scale trail 1.6347282669230518e-11->1.389519026884594e-11", "before": {"hits": 1, "med": 4.654285684109772, "min": 1.0, "max": 125970.93162230607, "ge2": 40, "liq": 32}, "after": {"hits": 1, "med": 4.654285684112241, "min": 1.0, "max": 125970.93162308924, "ge2": 40, "liq": 32}, "mode": "agent_bg_loop", "ts": "2026-08-12T09:54:59.319776+00:00"}
{"set": "B345", "decision": "REVERT", "edit": "later scale 0.0028->0.0026 runner chain", "before": {"hits": 1, "med": 4.654285684112241, "min": 1.0, "max": 125970.93162308924, "ge2": 40, "liq": 32}, "after": {"hits": 1, "med": 4.654248846342272, "min": 1.0, "max": 125956.34955122802, "ge2": 40, "liq": 32}, "mode": "agent_bg_loop", "ts": "2026-08-12T09:55:19.066039+00:00"}
{"set": "B346", "decision": "REVERT", "edit": "second scale 0.011/0.045->0.0105/0.043", "before": {"hits": 1, "med": 4.654285684112241, "min": 1.0, "max": 125970.93162308924, "ge2": 40, "liq": 32}, "after": {"hits": 1, "med": 4.654237635885109, "min": 1.0, "max": 125959.81106184032, "ge2": 40, "liq": 32}, "mode": "agent_bg_loop", "ts": "2026-08-12T09:55:38.766713+00:00"}
