{"set": "B001", "decision": "REVERT", "edit": "lev_cap mult 1.5->1.35", "before": {"hits": 1, "med": 4.469086527928238, "min": 1.0, "max": 127638.04346750824, "ge2": 42, "liq": 35, "liqw": 19, "surv": 0.2542372881355932}, "after": {"hits": 1, "med": 4.469086527928238, "min": 1.0, "max": 115038.89482909416, "ge2": 42, "liq": 36, "liqw": 19, "surv": 0.2711864406779661}, "reason": "REVERT hits 1->1 med 4.4691->4.4691 liq 35->36"}
{"set": "B002", "decision": "KEEP", "edit": "cooldown cap 180->220", "reason": "KEEP med 4.4691->4.4775 liq 35->32", "before": {"hits": 1, "med": 4.469086527928238, "min": 1.0, "ge2": 42, "liq": 35, "liqw": 19}, "after": {"hits": 1, "med": 4.477483271149063, "min": 1.0, "ge2": 40, "liq": 32, "liqw": 18}}
{"set": "B003", "decision": "REVERT", "edit": "win_size_max 5->4.5", "reason": "REVERT med 4.4775->4.4775 liq 32->32 max-only", "before": {"hits": 1, "med": 4.477483271149063, "min": 1.0, "ge2": 40, "liq": 32, "liqw": 18, "max": 127638.04346750824}, "after": {"hits": 1, "med": 4.477483271149063, "min": 1.0, "ge2": 40, "liq": 32, "liqw": 18, "max": 104309.64194472611}}
{"set": "B004", "decision": "REVERT", "edit": "cooldown 220->260", "before": {"hits": 1, "med": 4.477483271149063, "ge2": 40, "liq": 32, "liqw": 18}, "after": {"hits": 1, "med": 4.469086527928238, "ge2": 39, "liq": 33, "liqw": 18}, "reason": "REVERT med 4.4775->4.4691 liq 32->33"}
{"set": "B005", "decision": "REVERT", "edit": "risk_cap 0.0024->0.0023", "before": {"hits": 1, "med": 4.477483271149063, "min": 1.0, "ge2": 40, "liq": 32, "liqw": 18, "max": 127638.04346750824}, "after": {"hits": 1, "med": 4.54189986112849, "min": 1.0, "ge2": 40, "liq": 36, "liqw": 20, "max": 140689.18849172007}, "reason": "REVERT med 4.4775->4.5419 liq 32->36"}
{"set": "B006", "decision": "REVERT", "edit": "win_size_mult 1.75->1.72", "before": {"hits": 1, "med": 4.477483271149063, "ge2": 40, "liq": 32, "liqw": 18}, "after": {"hits": 1, "med": 4.469086527928238, "ge2": 40, "liq": 34, "liqw": 19}, "reason": "REVERT med 4.4775->4.4691 liq 32->34"}
{"set": "B007", "decision": "REVERT", "edit": "reentry cap 150", "before": {"hits": 1, "med": 4.477483271149063, "min": 1.0, "ge2": 40, "liq": 32, "liqw": 18}, "after": {"hits": 1, "med": 4.601488880639256, "min": 1.0, "ge2": 40, "liq": 33, "liqw": 18}, "reason": "REVERT med 4.4775->4.6015 liq 32->33"}
{"set": "B008", "decision": "REVERT", "edit": "cooldown 220->230", "before": {"med": 4.477483271149063, "liq": 32, "liqw": 18, "ge2": 40}, "after": {"med": 4.469086527928238, "liq": 28, "liqw": 17, "ge2": 40}}
{"set": "B009", "decision": "KEEP", "edit": "trail 5e-6->3e-6", "before": {"hits": 1, "med": 4.477483271149063, "ge2": 40, "liq": 32, "liqw": 18}, "after": {"hits": 1, "med": 4.477491509990744, "ge2": 40, "liq": 32, "liqw": 18}, "reason": "KEEP med 4.4775->4.4775 liq 32->32"}
{"set": "B010", "decision": "KEEP", "edit": "later 0.025->0.024", "before": {"med": 4.477491509990744, "ge2": 40, "liq": 32, "liqw": 18}, "after": {"med": 4.482233601471251, "ge2": 40, "liq": 32, "liqw": 18}, "reason": "KEEP med 4.4775->4.4822 liq 32->32"}
{"set": "B011", "decision": "KEEP", "edit": "later 0.024->0.023", "before": {"med": 4.482233601471251, "ge2": 40, "liq": 32, "liqw": 18}, "after": {"med": 4.486991908590096, "ge2": 40, "liq": 32, "liqw": 18}}
{"set": "B012", "decision": "KEEP", "edit": "trail 3e-6->2e-6", "before": {"med": 4.486991908590096, "liq": 32}, "after": {"med": 4.4869960348172295, "liq": 32}}
{"set": "B013", "decision": "KEEP", "edit": "later 0.023->0.022", "before": {"med": 4.4869960348172295, "liq": 32}, "after": {"med": 4.4917706078209365, "liq": 32}}
{"set": "B014", "decision": "KEEP", "edit": "later 0.022->0.021", "before": {"med": 4.4917706078209365, "min": 1.0, "ge2": 40, "liq": 32, "liqw": 18, "hits": 1}, "after": {"med": 4.496561490175038, "min": 1.0, "ge2": 40, "liq": 32, "liqw": 18, "hits": 1}}
{"set": "B015", "decision": "KEEP", "edit": "trail 2e-6->1e-6", "before": {"med": 4.496561490175038, "liq": 32}, "after": {"med": 4.4965656232648215, "liq": 32}}
{"set": "B016", "decision": "KEEP", "edit": "later 0.021->0.020", "before": {"med": 4.4965656232648215, "liq": 32, "liqw": 18, "ge2": 40, "hits": 1}, "after": {"med": 4.501372865345847, "liq": 32, "liqw": 18, "ge2": 40, "hits": 1}}
{"set": "B017", "decision": "REVERT", "edit": "slope 200->205", "before": {"med": 4.501372865345847, "liq": 32, "liqw": 18, "ge2": 40}, "after": {"med": 4.501372865345847, "liq": 32, "liqw": 18, "ge2": 40}}
{"set": "B018", "decision": "KEEP", "edit": "later 0.020->0.019", "before": {"med": 4.501372865345847, "liq": 32}, "after": {"med": 4.506196510689757, "liq": 32}}
{"set": "B019", "decision": "REVERT", "edit": "cooldown 220->225", "before": {"med": 4.506196510689757, "liq": 32}, "after": {"med": 4.467910859479397, "liq": 29}}
{"set": "B020", "decision": "KEEP", "edit": "later 0.019->0.018", "before": {"med": 4.506196510689757, "liq": 32}, "after": {"med": 4.5110366063180365, "liq": 32}}
{"set": "B021", "decision": "KEEP", "edit": "trail 1e-6->5e-7", "before": {"med": 4.5110366063180365, "liq": 32}, "after": {"med": 4.511038678063511, "liq": 32}}
{"set": "B022", "decision": "KEEP", "edit": "later 0.018->0.017", "before": {"med": 4.511038678063511, "liq": 32, "liqw": 18, "ge2": 40}, "after": {"med": 4.515895272792338, "liq": 32, "liqw": 18, "ge2": 40}}
{"set": "B023", "decision": "REVERT", "edit": "later 0.017->0.016 (no-op eval)", "reason": "edit not applied; med flat"}
{"set": "B024", "decision": "KEEP", "edit": "later 0.017->0.016", "before": {"med": 4.515895272792338, "liq": 32}, "after": {"med": 4.520768411995257, "liq": 32}}
{"set": "B025", "decision": "REVERT", "edit": "win_size_mult 1.75->1.72", "edit_name": "wsm-0.03", "reason": "liq worse", "before": {"hits": 1, "med": 4.520768411995257, "ge2": 40, "liq": 32, "liqw": 18}, "after": {"hits": 1, "med": 4.467301071167151, "ge2": 40, "liq": 34, "liqw": 19}, "ts": "2026-08-12T07:29:33.736414+00:00"}
{"set": "B026", "decision": "REVERT", "edit": "lev_cap 1.5->1.45", "edit_name": "lev-0.05", "reason": "liq worse", "before": {"hits": 1, "med": 4.520768411995257, "ge2": 40, "liq": 32, "liqw": 18}, "after": {"hits": 1, "med": 4.520768411995257, "ge2": 40, "liq": 33, "liqw": 18}, "ts": "2026-08-12T07:30:13.372049+00:00"}
{"set": "B027", "decision": "REVERT", "edit": "reentry_cap 120", "edit_name": "reentry120", "reason": "liq worse", "before": {"hits": 1, "med": 4.520768411995257, "ge2": 40, "liq": 32, "liqw": 18}, "after": {"hits": 1, "med": 4.467301071167151, "ge2": 40, "liq": 34, "liqw": 19}, "ts": "2026-08-12T07:30:52.376335+00:00"}
{"set": "B028", "decision": "KEEP", "edit": "later_scale 0.016->0.015", "edit_name": "later-0.001", "reason": "median up", "before": {"hits": 1, "med": 4.520768411995257, "ge2": 40, "liq": 32, "liqw": 18}, "after": {"hits": 1, "med": 4.525658142830981, "ge2": 40, "liq": 32, "liqw": 18}, "ts": "2026-08-12T07:31:31.422444+00:00"}
{"set": "B029", "decision": "KEEP", "edit": "trail_mult 5e-07->2.5e-07", "edit_name": "trail*0.5", "reason": "median up", "before": {"hits": 1, "med": 4.525658142830981, "ge2": 40, "liq": 32, "liqw": 18}, "after": {"hits": 1, "med": 4.525659181336619, "ge2": 40, "liq": 32, "liqw": 18}, "ts": "2026-08-12T07:32:14.148229+00:00"}
{"set": "B030", "decision": "REVERT", "edit": "slope_diff 200->205", "edit_name": "slope+5", "reason": "no primary improve", "before": {"hits": 1, "med": 4.525659181336619, "ge2": 40, "liq": 32, "liqw": 18}, "after": {"hits": 1, "med": 4.525659181336619, "ge2": 40, "liq": 32, "liqw": 18}, "ts": "2026-08-12T07:32:52.281316+00:00"}
{"set": "B031", "decision": "REVERT", "edit": "slope_diff 200->195", "edit_name": "slope-5", "reason": "no primary improve", "before": {"hits": 1, "med": 4.525659181336619, "ge2": 40, "liq": 32, "liqw": 18}, "after": {"hits": 1, "med": 4.525659181336619, "ge2": 40, "liq": 32, "liqw": 18}, "ts": "2026-08-12T07:33:31.756341+00:00"}
{"set": "B032", "decision": "KEEP", "edit": "risk_cap 0.0024->0.00235", "edit_name": "risk-", "reason": "median up", "before": {"hits": 1, "med": 4.525659181336619, "ge2": 40, "liq": 32, "liqw": 18}, "after": {"hits": 1, "med": 4.53112737769097, "ge2": 40, "liq": 32, "liqw": 18}, "ts": "2026-08-12T07:34:10.954304+00:00"}
{"set": "B033", "decision": "REVERT", "edit": "risk_cap 0.00235->0.0024", "edit_name": "risk+", "reason": "no primary improve", "before": {"hits": 1, "med": 4.53112737769097, "ge2": 40, "liq": 32, "liqw": 18}, "after": {"hits": 1, "med": 4.525659181336619, "ge2": 40, "liq": 32, "liqw": 18}, "ts": "2026-08-12T07:34:51.135374+00:00"}
{"set": "B034", "decision": "REVERT", "edit": "cooldown_cap 220->215", "edit_name": "cd-5", "reason": "liq worse", "before": {"hits": 1, "med": 4.53112737769097, "ge2": 40, "liq": 32, "liqw": 18}, "after": {"hits": 1, "med": 4.53112737769097, "ge2": 40, "liq": 39, "liqw": 19}, "ts": "2026-08-12T07:35:30.442232+00:00"}
{"set": "B035", "decision": "KEEP", "edit": "later_scale 0.015->0.016", "edit_name": "later+0.001", "reason": "median up", "before": {"hits": 1, "med": 4.53112737769097, "ge2": 40, "liq": 32, "liqw": 18}, "after": {"hits": 1, "med": 4.5313373881293755, "ge2": 40, "liq": 32, "liqw": 18}, "ts": "2026-08-12T07:36:10.816331+00:00"}
{"set": "B036", "decision": "REVERT", "edit": "cooldown_cap 220->230", "edit_name": "cd+10", "reason": "no primary improve", "before": {"hits": 1, "med": 4.5313373881293755, "ge2": 40, "liq": 32, "liqw": 18}, "after": {"hits": 1, "med": 3.430107673174057, "ge2": 40, "liq": 28, "liqw": 17}, "ts": "2026-08-12T07:36:49.295818+00:00"}
{"set": "B037", "decision": "REVERT", "edit": "win_size_mult 1.75->1.72", "edit_name": "wsm-0.03", "reason": "liq worse", "before": {"hits": 1, "med": 4.5313373881293755, "ge2": 40, "liq": 32, "liqw": 18}, "after": {"hits": 1, "med": 4.4930614493248875, "ge2": 40, "liq": 34, "liqw": 19}, "ts": "2026-08-12T07:37:22.226700+00:00"}
{"set": "B038", "decision": "REVERT", "edit": "lev_cap 1.5->1.45", "edit_name": "lev-0.05", "reason": "liq worse", "before": {"hits": 1, "med": 4.5313373881293755, "ge2": 40, "liq": 32, "liqw": 18}, "after": {"hits": 1, "med": 4.5313373881293755, "ge2": 40, "liq": 33, "liqw": 18}, "ts": "2026-08-12T07:37:52.403440+00:00"}
{"set": "B039", "decision": "REVERT", "edit": "reentry_cap 120", "edit_name": "reentry120", "reason": "liq worse", "before": {"hits": 1, "med": 4.5313373881293755, "ge2": 40, "liq": 32, "liqw": 18}, "after": {"hits": 1, "med": 4.314172633580571, "ge2": 40, "liq": 34, "liqw": 19}, "ts": "2026-08-12T07:38:25.077316+00:00"}
{"set": "B040", "decision": "REVERT", "edit": "later_scale 0.016->0.015", "edit_name": "later-0.001", "reason": "no primary improve", "before": {"hits": 1, "med": 4.5313373881293755, "ge2": 40, "liq": 32, "liqw": 18}, "after": {"hits": 1, "med": 4.53112737769097, "ge2": 40, "liq": 32, "liqw": 18}, "ts": "2026-08-12T07:38:59.243728+00:00"}
{"set": "B041", "decision": "KEEP", "edit": "trail_mult 2.5e-07->1.25e-07", "edit_name": "trail*0.5", "reason": "median up", "before": {"hits": 1, "med": 4.5313373881293755, "ge2": 40, "liq": 32, "liqw": 18}, "after": {"hits": 1, "med": 4.531337614554228, "ge2": 40, "liq": 32, "liqw": 18}, "ts": "2026-08-12T07:39:32.407356+00:00"}
{"set": "B042", "decision": "REVERT", "edit": "slope_diff 200->205", "edit_name": "slope+5", "reason": "no primary improve", "before": {"hits": 1, "med": 4.531337614554228, "ge2": 40, "liq": 32, "liqw": 18}, "after": {"hits": 1, "med": 4.531337614554228, "ge2": 40, "liq": 32, "liqw": 18}, "ts": "2026-08-12T07:40:03.115851+00:00"}
{"set": "B043", "decision": "REVERT", "edit": "slope_diff 200->195", "edit_name": "slope-5", "reason": "no primary improve", "before": {"hits": 1, "med": 4.531337614554228, "ge2": 40, "liq": 32, "liqw": 18}, "after": {"hits": 1, "med": 4.531337614554228, "ge2": 40, "liq": 32, "liqw": 18}, "ts": "2026-08-12T07:40:36.327234+00:00"}
{"set": "B044", "decision": "REVERT", "edit": "risk_cap 0.00235->0.0023", "edit_name": "risk-", "reason": "liq worse", "before": {"hits": 1, "med": 4.531337614554228, "ge2": 40, "liq": 32, "liqw": 18}, "after": {"hits": 1, "med": 4.585719966770176, "ge2": 40, "liq": 36, "liqw": 20}, "ts": "2026-08-12T07:41:11.535853+00:00"}
{"set": "B045", "decision": "REVERT", "edit": "risk_cap 0.00235->0.0024", "edit_name": "risk+", "reason": "no primary improve", "before": {"hits": 1, "med": 4.531337614554228, "ge2": 40, "liq": 32, "liqw": 18}, "after": {"hits": 1, "med": 4.520769968431859, "ge2": 40, "liq": 32, "liqw": 18}, "ts": "2026-08-12T07:41:44.111448+00:00"}
{"set": "B046", "decision": "REVERT", "edit": "cooldown_cap 220->215", "edit_name": "cd-5", "reason": "liq worse", "before": {"hits": 1, "med": 4.531337614554228, "ge2": 40, "liq": 32, "liqw": 18}, "after": {"hits": 1, "med": 4.531337614554228, "ge2": 40, "liq": 39, "liqw": 19}, "ts": "2026-08-12T07:42:11.300515+00:00"}
{"set": "B047", "decision": "KEEP", "edit": "later_scale 0.016->0.017", "edit_name": "later+0.001", "reason": "median up", "before": {"hits": 1, "med": 4.531337614554228, "ge2": 40, "liq": 32, "liqw": 18}, "after": {"hits": 1, "med": 4.531546136317939, "ge2": 40, "liq": 32, "liqw": 18}, "ts": "2026-08-12T07:42:38.475937+00:00"}
{"set": "B048", "decision": "REVERT", "edit": "cooldown_cap 220->230", "edit_name": "cd+10", "reason": "no primary improve", "before": {"hits": 1, "med": 4.531546136317939, "ge2": 40, "liq": 32, "liqw": 18}, "after": {"hits": 1, "med": 3.4296266249358016, "ge2": 40, "liq": 28, "liqw": 17}, "ts": "2026-08-12T07:43:11.355116+00:00"}
{"set": "B049", "decision": "REVERT", "edit": "win_size_mult 1.75->1.72", "edit_name": "wsm-0.03", "reason": "liq worse", "before": {"hits": 1, "med": 4.531546136317939, "ge2": 40, "liq": 32, "liqw": 18}, "after": {"hits": 1, "med": 4.488245234117162, "ge2": 40, "liq": 34, "liqw": 19}, "ts": "2026-08-12T07:43:42.672857+00:00"}
{"set": "B050", "decision": "REVERT", "edit": "lev_cap 1.5->1.45", "edit_name": "lev-0.05", "reason": "liq worse", "before": {"hits": 1, "med": 4.531546136317939, "ge2": 40, "liq": 32, "liqw": 18}, "after": {"hits": 1, "med": 4.531546136317939, "ge2": 40, "liq": 33, "liqw": 18}, "ts": "2026-08-12T07:44:15.406753+00:00"}
{"set": "B051", "decision": "REVERT", "edit": "reentry_cap 120", "edit_name": "reentry120", "reason": "liq worse", "before": {"hits": 1, "med": 4.531546136317939, "ge2": 40, "liq": 32, "liqw": 18}, "after": {"hits": 1, "med": 4.315851125844191, "ge2": 40, "liq": 34, "liqw": 19}, "ts": "2026-08-12T07:44:47.730848+00:00"}
{"set": "B052", "decision": "REVERT", "edit": "later_scale 0.017->0.016", "edit_name": "later-0.001", "reason": "no primary improve", "before": {"hits": 1, "med": 4.531546136317939, "ge2": 40, "liq": 32, "liqw": 18}, "after": {"hits": 1, "med": 4.531337614554228, "ge2": 40, "liq": 32, "liqw": 18}, "ts": "2026-08-12T07:45:18.139408+00:00"}
{"set": "B053", "decision": "KEEP", "edit": "trail_mult 1.25e-07->6.25e-08", "edit_name": "trail*0.5", "reason": "median up", "before": {"hits": 1, "med": 4.531546136317939, "ge2": 40, "liq": 32, "liqw": 18}, "after": {"hits": 1, "med": 4.531546249530377, "ge2": 40, "liq": 32, "liqw": 18}, "ts": "2026-08-12T07:45:50.190167+00:00"}
{"set": "B054", "decision": "REVERT", "edit": "slope_diff 200->205", "edit_name": "slope+5", "reason": "no primary improve", "before": {"hits": 1, "med": 4.531546249530377, "ge2": 40, "liq": 32, "liqw": 18}, "after": {"hits": 1, "med": 4.531546249530377, "ge2": 40, "liq": 32, "liqw": 18}, "ts": "2026-08-12T07:46:21.944507+00:00"}
{"set": "B055", "decision": "REVERT", "edit": "slope_diff 200->195", "edit_name": "slope-5", "reason": "no primary improve", "before": {"hits": 1, "med": 4.531546249530377, "ge2": 40, "liq": 32, "liqw": 18}, "after": {"hits": 1, "med": 4.531546249530377, "ge2": 40, "liq": 32, "liqw": 18}, "ts": "2026-08-12T07:46:49.049351+00:00"}
{"set": "B056", "decision": "REVERT", "edit": "risk_cap 0.00235->0.0023", "edit_name": "risk-", "reason": "liq worse", "before": {"hits": 1, "med": 4.531546249530377, "ge2": 40, "liq": 32, "liqw": 18}, "after": {"hits": 1, "med": 4.580787311507788, "ge2": 40, "liq": 36, "liqw": 20}, "ts": "2026-08-12T07:47:17.956622+00:00"}
{"set": "B057", "decision": "REVERT", "edit": "risk_cap 0.00235->0.0024", "edit_name": "risk+", "reason": "no primary improve", "before": {"hits": 1, "med": 4.531546249530377, "ge2": 40, "liq": 32, "liqw": 18}, "after": {"hits": 1, "med": 4.515897087099335, "ge2": 40, "liq": 32, "liqw": 18}, "ts": "2026-08-12T07:47:48.237645+00:00"}
{"set": "B058", "decision": "REVERT", "edit": "cooldown_cap 220->215", "edit_name": "cd-5", "reason": "liq worse", "before": {"hits": 1, "med": 4.531546249530377, "ge2": 40, "liq": 32, "liqw": 18}, "after": {"hits": 1, "med": 4.531546249530377, "ge2": 40, "liq": 39, "liqw": 19}, "ts": "2026-08-12T07:48:17.806506+00:00"}
{"set": "B059", "decision": "KEEP", "edit": "later_scale 0.017->0.018", "edit_name": "later+0.001", "reason": "median up", "before": {"hits": 1, "med": 4.531546249530377, "ge2": 40, "liq": 32, "liqw": 18}, "after": {"hits": 1, "med": 4.531753291673639, "ge2": 40, "liq": 32, "liqw": 18}, "ts": "2026-08-12T07:48:48.131095+00:00"}
{"set": "B060", "decision": "REVERT", "edit": "cooldown_cap 220->230", "edit_name": "cd+10", "reason": "no primary improve", "before": {"hits": 1, "med": 4.531753291673639, "ge2": 40, "liq": 32, "liqw": 18}, "after": {"hits": 1, "med": 3.429140980133985, "ge2": 40, "liq": 28, "liqw": 17}, "ts": "2026-08-12T07:49:09.824835+00:00"}
{"set": "B061", "decision": "REVERT", "edit": "win_size_mult 1.75->1.72", "edit_name": "wsm-0.03", "reason": "liq worse", "before": {"hits": 1, "med": 4.531753291673639, "ge2": 40, "liq": 32, "liqw": 18}, "after": {"hits": 1, "med": 4.483445077031924, "ge2": 40, "liq": 34, "liqw": 19}, "ts": "2026-08-12T07:49:32.081085+00:00"}
{"set": "B062", "decision": "REVERT", "edit": "lev_cap 1.5->1.45", "edit_name": "lev-0.05", "reason": "liq worse", "before": {"hits": 1, "med": 4.531753291673639, "ge2": 40, "liq": 32, "liqw": 18}, "after": {"hits": 1, "med": 4.531753291673639, "ge2": 40, "liq": 33, "liqw": 18}, "ts": "2026-08-12T07:49:55.760278+00:00"}
{"set": "B063", "decision": "REVERT", "edit": "reentry_cap 120", "edit_name": "reentry120", "reason": "liq worse", "before": {"hits": 1, "med": 4.531753291673639, "ge2": 40, "liq": 32, "liqw": 18}, "after": {"hits": 1, "med": 4.3174987841523595, "ge2": 40, "liq": 34, "liqw": 19}, "ts": "2026-08-12T07:50:21.650247+00:00"}
{"set": "B064", "decision": "REVERT", "edit": "later_scale 0.018->0.017", "edit_name": "later-0.001", "reason": "no primary improve", "before": {"hits": 1, "med": 4.531753291673639, "ge2": 40, "liq": 32, "liqw": 18}, "after": {"hits": 1, "med": 4.531546249530377, "ge2": 40, "liq": 32, "liqw": 18}, "ts": "2026-08-12T07:50:48.443001+00:00"}
{"set": "B065", "decision": "KEEP", "edit": "trail_mult 6.25e-08->3.125e-08", "edit_name": "trail*0.5", "reason": "median up", "before": {"hits": 1, "med": 4.531753291673639, "ge2": 40, "liq": 32, "liqw": 18}, "after": {"hits": 1, "med": 4.53175334827985, "ge2": 40, "liq": 32, "liqw": 18}, "ts": "2026-08-12T07:51:18.034397+00:00"}
{"set": "B066", "decision": "REVERT", "edit": "slope_diff 200->205", "edit_name": "slope+5", "reason": "no primary improve", "before": {"hits": 1, "med": 4.53175334827985, "ge2": 40, "liq": 32, "liqw": 18}, "after": {"hits": 1, "med": 4.53175334827985, "ge2": 40, "liq": 32, "liqw": 18}, "ts": "2026-08-12T07:51:43.339910+00:00"}
{"set": "B067", "decision": "REVERT", "edit": "slope_diff 200->195", "edit_name": "slope-5", "reason": "no primary improve", "before": {"hits": 1, "med": 4.53175334827985, "ge2": 40, "liq": 32, "liqw": 18}, "after": {"hits": 1, "med": 4.53175334827985, "ge2": 40, "liq": 32, "liqw": 18}, "ts": "2026-08-12T07:52:09.390435+00:00"}
{"set": "B068", "decision": "REVERT", "edit": "risk_cap 0.00235->0.0023", "edit_name": "risk-", "reason": "liq worse", "before": {"hits": 1, "med": 4.53175334827985, "ge2": 40, "liq": 32, "liqw": 18}, "after": {"hits": 1, "med": 4.5758712089751965, "ge2": 40, "liq": 36, "liqw": 20}, "ts": "2026-08-12T07:52:34.754179+00:00"}
{"set": "B069", "decision": "REVERT", "edit": "risk_cap 0.00235->0.0024", "edit_name": "risk+", "reason": "no primary improve", "before": {"hits": 1, "med": 4.53175334827985, "ge2": 40, "liq": 32, "liqw": 18}, "after": {"hits": 1, "med": 4.511040620325232, "ge2": 40, "liq": 32, "liqw": 18}, "ts": "2026-08-12T07:53:00.294356+00:00"}
{"set": "B070", "decision": "REVERT", "edit": "cooldown_cap 220->215", "edit_name": "cd-5", "reason": "liq worse", "before": {"hits": 1, "med": 4.53175334827985, "ge2": 40, "liq": 32, "liqw": 18}, "after": {"hits": 1, "med": 4.53175334827985, "ge2": 40, "liq": 39, "liqw": 19}, "ts": "2026-08-12T07:53:21.284313+00:00"}
{"set": "B071", "decision": "KEEP", "edit": "later_scale 0.018->0.019", "edit_name": "later+0.001", "reason": "median up", "before": {"hits": 1, "med": 4.53175334827985, "ge2": 40, "liq": 32, "liqw": 18}, "after": {"hits": 1, "med": 4.531958919810974, "ge2": 40, "liq": 32, "liqw": 18}, "ts": "2026-08-12T07:53:41.343621+00:00"}
{"set": "B072", "decision": "REVERT", "edit": "cooldown_cap 220->230", "edit_name": "cd+10", "reason": "no primary improve", "before": {"hits": 1, "med": 4.531958919810974, "ge2": 40, "liq": 32, "liqw": 18}, "after": {"hits": 1, "med": 3.428650858128437, "ge2": 40, "liq": 28, "liqw": 17}, "ts": "2026-08-12T07:54:08.672781+00:00"}
{"set": "B073", "decision": "REVERT", "edit": "win_size_mult 1.75->1.72", "edit_name": "wsm-0.03", "reason": "liq worse", "before": {"hits": 1, "med": 4.531958919810974, "ge2": 40, "liq": 32, "liqw": 18}, "after": {"hits": 1, "med": 4.478661061446209, "ge2": 40, "liq": 34, "liqw": 19}, "ts": "2026-08-12T07:54:36.142988+00:00"}
