{"set": "B1259", "decision": "REVERT", "edit": "post-scale trail 6.1653697404852474e-12->5.2405642794124606e-12", "before": {"hits": 1, "med": 4.654285684120027, "min": 1.0, "max": 125970.93162556336, "ge2": 40, "liq": 32}, "after": {"hits": 1, "med": 4.654285684120957, "min": 1.0, "max": 125970.9316258614, "ge2": 40, "liq": 32}, "mode": "agent_bg_loop", "ts": "2026-08-12T14:59:48.969986+00:00"}
{"set": "B1260", "decision": "REVERT", "edit": "later scale 0.0028->0.0026 runner chain", "before": {"hits": 1, "med": 4.654285684120027, "min": 1.0, "max": 125970.93162556336, "ge2": 40, "liq": 32}, "after": {"hits": 1, "med": 4.654248846350058, "min": 1.0, "max": 125956.34955370188, "ge2": 40, "liq": 32}, "mode": "agent_bg_loop", "ts": "2026-08-12T15:00:09.103406+00:00"}
{"set": "B1261", "decision": "REVERT", "edit": "second scale 0.011/0.045->0.0105/0.043", "before": {"hits": 1, "med": 4.654285684120027, "min": 1.0, "max": 125970.93162556336, "ge2": 40, "liq": 32}, "after": {"hits": 1, "med": 4.654237635892896, "min": 1.0, "max": 125959.81106431429, "ge2": 40, "liq": 32}, "mode": "agent_bg_loop", "ts": "2026-08-12T15:00:29.262141+00:00"}
{"set": "B1262", "decision": "REVERT", "edit": "post-scale trail 6.1653697404852474e-12->5.2405642794124606e-12", "before": {"hits": 1, "med": 4.654285684120027, "min": 1.0, "max": 125970.93162556336, "ge2": 40, "liq": 32}, "after": {"hits": 1, "med": 4.654285684120957, "min": 1.0, "max": 125970.9316258614, "ge2": 40, "liq": 32}, "mode": "agent_bg_loop", "ts": "2026-08-12T15:00:49.416924+00:00"}
{"set": "B1263", "decision": "REVERT", "edit": "later scale 0.0028->0.0026 runner chain", "before": {"hits": 1, "med": 4.654285684120027, "min": 1.0, "max": 125970.93162556336, "ge2": 40, "liq": 32}, "after": {"hits": 1, "med": 4.654248846350058, "min": 1.0, "max": 125956.34955370188, "ge2": 40, "liq": 32}, "mode": "agent_bg_loop", "ts": "2026-08-12T15:01:09.459731+00:00"}
{"set": "B1264", "decision": "REVERT", "edit": "second scale 0.011/0.045->0.0105/0.043", "before": {"hits": 1, "med": 4.654285684120027, "min": 1.0, "max": 125970.93162556336, "ge2": 40, "liq": 32}, "after": {"hits": 1, "med": 4.654237635892896, "min": 1.0, "max": 125959.81106431429, "ge2": 40, "liq": 32}, "mode": "agent_bg_loop", "ts": "2026-08-12T15:01:29.576489+00:00"}
{"set": "B1265", "decision": "REVERT", "edit": "post-scale trail 6.1653697404852474e-12->5.2405642794124606e-12", "before": {"hits": 1, "med": 4.654285684120027, "min": 1.0, "max": 125970.93162556336, "ge2": 40, "liq": 32}, "after": {"hits": 1, "med": 4.654285684120957, "min": 1.0, "max": 125970.9316258614, "ge2": 40, "liq": 32}, "mode": "agent_bg_loop", "ts": "2026-08-12T15:01:49.649572+00:00"}
{"set": "B1266", "decision": "REVERT", "edit": "later scale 0.0028->0.0026 runner chain", "before": {"hits": 1, "med": 4.654285684120027, "min": 1.0, "max": 125970.93162556336, "ge2": 40, "liq": 32}, "after": {"hits": 1, "med": 4.654248846350058, "min": 1.0, "max": 125956.34955370188, "ge2": 40, "liq": 32}, "mode": "agent_bg_loop", "ts": "2026-08-12T15:02:09.653952+00:00"}
{"set": "B1267", "decision": "REVERT", "edit": "second scale 0.011/0.045->0.0105/0.043", "before": {"hits": 1, "med": 4.654285684120027, "min": 1.0, "max": 125970.93162556336, "ge2": 40, "liq": 32}, "after": {"hits": 1, "med": 4.654237635892896, "min": 1.0, "max": 125959.81106431429, "ge2": 40, "liq": 32}, "mode": "agent_bg_loop", "ts": "2026-08-12T15:02:29.690447+00:00"}
{"set": "B1268", "decision": "REVERT", "edit": "post-scale trail 6.1653697404852474e-12->5.2405642794124606e-12", "before": {"hits": 1, "med": 4.654285684120027, "min": 1.0, "max": 125970.93162556336, "ge2": 40, "liq": 32}, "after": {"hits": 1, "med": 4.654285684120957, "min": 1.0, "max": 125970.9316258614, "ge2": 40, "liq": 32}, "mode": "agent_bg_loop", "ts": "2026-08-12T15:02:49.779447+00:00"}
{"set": "B1269", "decision": "REVERT", "edit": "later scale 0.0028->0.0026 runner chain", "before": {"hits": 1, "med": 4.654285684120027, "min": 1.0, "max": 125970.93162556336, "ge2": 40, "liq": 32}, "after": {"hits": 1, "med": 4.654248846350058, "min": 1.0, "max": 125956.34955370188, "ge2": 40, "liq": 32}, "mode": "agent_bg_loop", "ts": "2026-08-12T15:03:09.906002+00:00"}
{"set": "B1270", "decision": "REVERT", "edit": "second scale 0.011/0.045->0.0105/0.043", "before": {"hits": 1, "med": 4.654285684120027, "min": 1.0, "max": 125970.93162556336, "ge2": 40, "liq": 32}, "after": {"hits": 1, "med": 4.654237635892896, "min": 1.0, "max": 125959.81106431429, "ge2": 40, "liq": 32}, "mode": "agent_bg_loop", "ts": "2026-08-12T15:03:29.989926+00:00"}
{"set": "B1271", "decision": "REVERT", "edit": "post-scale trail 6.1653697404852474e-12->5.2405642794124606e-12", "before": {"hits": 1, "med": 4.654285684120027, "min": 1.0, "max": 125970.93162556336, "ge2": 40, "liq": 32}, "after": {"hits": 1, "med": 4.654285684120957, "min": 1.0, "max": 125970.9316258614, "ge2": 40, "liq": 32}, "mode": "agent_bg_loop", "ts": "2026-08-12T15:03:49.877190+00:00"}
{"set": "B1272", "decision": "REVERT", "edit": "later scale 0.0028->0.0026 runner chain", "before": {"hits": 1, "med": 4.654285684120027, "min": 1.0, "max": 125970.93162556336, "ge2": 40, "liq": 32}, "after": {"hits": 1, "med": 4.654248846350058, "min": 1.0, "max": 125956.34955370188, "ge2": 40, "liq": 32}, "mode": "agent_bg_loop", "ts": "2026-08-12T15:04:10.317868+00:00"}
{"set": "B1273", "decision": "REVERT", "edit": "second scale 0.011/0.045->0.0105/0.043", "before": {"hits": 1, "med": 4.654285684120027, "min": 1.0, "max": 125970.93162556336, "ge2": 40, "liq": 32}, "after": {"hits": 1, "med": 4.654237635892896, "min": 1.0, "max": 125959.81106431429, "ge2": 40, "liq": 32}, "mode": "agent_bg_loop", "ts": "2026-08-12T15:04:30.269363+00:00"}
{"set": "B1274", "decision": "REVERT", "edit": "post-scale trail 6.1653697404852474e-12->5.2405642794124606e-12", "before": {"hits": 1, "med": 4.654285684120027, "min": 1.0, "max": 125970.93162556336, "ge2": 40, "liq": 32}, "after": {"hits": 1, "med": 4.654285684120957, "min": 1.0, "max": 125970.9316258614, "ge2": 40, "liq": 32}, "mode": "agent_bg_loop", "ts": "2026-08-12T15:04:50.356427+00:00"}
{"set": "B1275", "decision": "REVERT", "edit": "later scale 0.0028->0.0026 runner chain", "before": {"hits": 1, "med": 4.654285684120027, "min": 1.0, "max": 125970.93162556336, "ge2": 40, "liq": 32}, "after": {"hits": 1, "med": 4.654248846350058, "min": 1.0, "max": 125956.34955370188, "ge2": 40, "liq": 32}, "mode": "agent_bg_loop", "ts": "2026-08-12T15:05:10.508807+00:00"}
{"set": "B1276", "decision": "REVERT", "edit": "second scale 0.011/0.045->0.0105/0.043", "before": {"hits": 1, "med": 4.654285684120027, "min": 1.0, "max": 125970.93162556336, "ge2": 40, "liq": 32}, "after": {"hits": 1, "med": 4.654237635892896, "min": 1.0, "max": 125959.81106431429, "ge2": 40, "liq": 32}, "mode": "agent_bg_loop", "ts": "2026-08-12T15:05:30.540075+00:00"}
{"set": "B1277", "decision": "REVERT", "edit": "post-scale trail 6.1653697404852474e-12->5.2405642794124606e-12", "before": {"hits": 1, "med": 4.654285684120027, "min": 1.0, "max": 125970.93162556336, "ge2": 40, "liq": 32}, "after": {"hits": 1, "med": 4.654285684120957, "min": 1.0, "max": 125970.9316258614, "ge2": 40, "liq": 32}, "mode": "agent_bg_loop", "ts": "2026-08-12T15:05:50.617924+00:00"}
{"set": "B1278", "decision": "REVERT", "edit": "later scale 0.0028->0.0026 runner chain", "before": {"hits": 1, "med": 4.654285684120027, "min": 1.0, "max": 125970.93162556336, "ge2": 40, "liq": 32}, "after": {"hits": 1, "med": 4.654248846350058, "min": 1.0, "max": 125956.34955370188, "ge2": 40, "liq": 32}, "mode": "agent_bg_loop", "ts": "2026-08-12T15:06:11.123886+00:00"}
{"set": "B1279", "decision": "REVERT", "edit": "second scale 0.011/0.045->0.0105/0.043", "before": {"hits": 1, "med": 4.654285684120027, "min": 1.0, "max": 125970.93162556336, "ge2": 40, "liq": 32}, "after": {"hits": 1, "med": 4.654237635892896, "min": 1.0, "max": 125959.81106431429, "ge2": 40, "liq": 32}, "mode": "agent_bg_loop", "ts": "2026-08-12T15:06:31.356626+00:00"}
{"set": "B1280", "decision": "REVERT", "edit": "post-scale trail 6.1653697404852474e-12->5.2405642794124606e-12", "before": {"hits": 1, "med": 4.654285684120027, "min": 1.0, "max": 125970.93162556336, "ge2": 40, "liq": 32}, "after": {"hits": 1, "med": 4.654285684120957, "min": 1.0, "max": 125970.9316258614, "ge2": 40, "liq": 32}, "mode": "agent_bg_loop", "ts": "2026-08-12T15:06:51.992044+00:00"}
{"set": "B1281", "decision": "REVERT", "edit": "later scale 0.0028->0.0026 runner chain", "before": {"hits": 1, "med": 4.654285684120027, "min": 1.0, "max": 125970.93162556336, "ge2": 40, "liq": 32}, "after": {"hits": 1, "med": 4.654248846350058, "min": 1.0, "max": 125956.34955370188, "ge2": 40, "liq": 32}, "mode": "agent_bg_loop", "ts": "2026-08-12T15:07:12.021655+00:00"}
{"set": "B1282", "decision": "REVERT", "edit": "second scale 0.011/0.045->0.0105/0.043", "before": {"hits": 1, "med": 4.654285684120027, "min": 1.0, "max": 125970.93162556336, "ge2": 40, "liq": 32}, "after": {"hits": 1, "med": 4.654237635892896, "min": 1.0, "max": 125959.81106431429, "ge2": 40, "liq": 32}, "mode": "agent_bg_loop", "ts": "2026-08-12T15:07:32.082561+00:00"}
{"set": "B1283", "decision": "REVERT", "edit": "post-scale trail 6.1653697404852474e-12->5.2405642794124606e-12", "before": {"hits": 1, "med": 4.654285684120027, "min": 1.0, "max": 125970.93162556336, "ge2": 40, "liq": 32}, "after": {"hits": 1, "med": 4.654285684120957, "min": 1.0, "max": 125970.9316258614, "ge2": 40, "liq": 32}, "mode": "agent_bg_loop", "ts": "2026-08-12T15:07:52.070121+00:00"}
{"set": "B1284", "decision": "REVERT", "edit": "later scale 0.0028->0.0026 runner chain", "before": {"hits": 1, "med": 4.654285684120027, "min": 1.0, "max": 125970.93162556336, "ge2": 40, "liq": 32}, "after": {"hits": 1, "med": 4.654248846350058, "min": 1.0, "max": 125956.34955370188, "ge2": 40, "liq": 32}, "mode": "agent_bg_loop", "ts": "2026-08-12T15:08:12.494806+00:00"}
{"set": "B1285", "decision": "REVERT", "edit": "second scale 0.011/0.045->0.0105/0.043", "before": {"hits": 1, "med": 4.654285684120027, "min": 1.0, "max": 125970.93162556336, "ge2": 40, "liq": 32}, "after": {"hits": 1, "med": 4.654237635892896, "min": 1.0, "max": 125959.81106431429, "ge2": 40, "liq": 32}, "mode": "agent_bg_loop", "ts": "2026-08-12T15:08:35.100080+00:00"}
{"set": "B1286", "decision": "REVERT", "edit": "post-scale trail 6.1653697404852474e-12->5.2405642794124606e-12", "before": {"hits": 1, "med": 4.654285684120027, "min": 1.0, "max": 125970.93162556336, "ge2": 40, "liq": 32}, "after": {"hits": 1, "med": 4.654285684120957, "min": 1.0, "max": 125970.9316258614, "ge2": 40, "liq": 32}, "mode": "agent_bg_loop", "ts": "2026-08-12T15:08:57.221092+00:00"}
{"set": "B1287", "decision": "REVERT", "edit": "later scale 0.0028->0.0026 runner chain", "before": {"hits": 1, "med": 4.654285684120027, "min": 1.0, "max": 125970.93162556336, "ge2": 40, "liq": 32}, "after": {"hits": 1, "med": 4.654248846350058, "min": 1.0, "max": 125956.34955370188, "ge2": 40, "liq": 32}, "mode": "agent_bg_loop", "ts": "2026-08-12T15:09:18.214238+00:00"}
{"set": "B1288", "decision": "REVERT", "edit": "second scale 0.011/0.045->0.0105/0.043", "before": {"hits": 1, "med": 4.654285684120027, "min": 1.0, "max": 125970.93162556336, "ge2": 40, "liq": 32}, "after": {"hits": 1, "med": 4.654237635892896, "min": 1.0, "max": 125959.81106431429, "ge2": 40, "liq": 32}, "mode": "agent_bg_loop", "ts": "2026-08-12T15:09:38.215746+00:00"}
{"set": "B1289", "decision": "REVERT", "edit": "post-scale trail 6.1653697404852474e-12->5.2405642794124606e-12", "before": {"hits": 1, "med": 4.654285684120027, "min": 1.0, "max": 125970.93162556336, "ge2": 40, "liq": 32}, "after": {"hits": 1, "med": 4.654285684120957, "min": 1.0, "max": 125970.9316258614, "ge2": 40, "liq": 32}, "mode": "agent_bg_loop", "ts": "2026-08-12T15:09:58.275046+00:00"}
{"set": "B1290", "decision": "REVERT", "edit": "later scale 0.0028->0.0026 runner chain", "before": {"hits": 1, "med": 4.654285684120027, "min": 1.0, "max": 125970.93162556336, "ge2": 40, "liq": 32}, "after": {"hits": 1, "med": 4.654248846350058, "min": 1.0, "max": 125956.34955370188, "ge2": 40, "liq": 32}, "mode": "agent_bg_loop", "ts": "2026-08-12T15:10:18.405492+00:00"}
{"set": "B1291", "decision": "REVERT", "edit": "second scale 0.011/0.045->0.0105/0.043", "before": {"hits": 1, "med": 4.654285684120027, "min": 1.0, "max": 125970.93162556336, "ge2": 40, "liq": 32}, "after": {"hits": 1, "med": 4.654237635892896, "min": 1.0, "max": 125959.81106431429, "ge2": 40, "liq": 32}, "mode": "agent_bg_loop", "ts": "2026-08-12T15:10:38.492633+00:00"}
{"set": "B1292", "decision": "REVERT", "edit": "post-scale trail 6.1653697404852474e-12->5.2405642794124606e-12", "before": {"hits": 1, "med": 4.654285684120027, "min": 1.0, "max": 125970.93162556336, "ge2": 40, "liq": 32}, "after": {"hits": 1, "med": 4.654285684120957, "min": 1.0, "max": 125970.9316258614, "ge2": 40, "liq": 32}, "mode": "agent_bg_loop", "ts": "2026-08-12T15:10:58.516225+00:00"}
{"set": "B1293", "decision": "REVERT", "edit": "later scale 0.0028->0.0026 runner chain", "before": {"hits": 1, "med": 4.654285684120027, "min": 1.0, "max": 125970.93162556336, "ge2": 40, "liq": 32}, "after": {"hits": 1, "med": 4.654248846350058, "min": 1.0, "max": 125956.34955370188, "ge2": 40, "liq": 32}, "mode": "agent_bg_loop", "ts": "2026-08-12T15:11:18.591310+00:00"}
{"set": "B1294", "decision": "REVERT", "edit": "second scale 0.011/0.045->0.0105/0.043", "before": {"hits": 1, "med": 4.654285684120027, "min": 1.0, "max": 125970.93162556336, "ge2": 40, "liq": 32}, "after": {"hits": 1, "med": 4.654237635892896, "min": 1.0, "max": 125959.81106431429, "ge2": 40, "liq": 32}, "mode": "agent_bg_loop", "ts": "2026-08-12T15:11:38.764785+00:00"}
{"set": "B1295", "decision": "REVERT", "edit": "post-scale trail 6.1653697404852474e-12->5.2405642794124606e-12", "before": {"hits": 1, "med": 4.654285684120027, "min": 1.0, "max": 125970.93162556336, "ge2": 40, "liq": 32}, "after": {"hits": 1, "med": 4.654285684120957, "min": 1.0, "max": 125970.9316258614, "ge2": 40, "liq": 32}, "mode": "agent_bg_loop", "ts": "2026-08-12T15:11:58.957400+00:00"}
{"set": "B1296", "decision": "REVERT", "edit": "later scale 0.0028->0.0026 runner chain", "before": {"hits": 1, "med": 4.654285684120027, "min": 1.0, "max": 125970.93162556336, "ge2": 40, "liq": 32}, "after": {"hits": 1, "med": 4.654248846350058, "min": 1.0, "max": 125956.34955370188, "ge2": 40, "liq": 32}, "mode": "agent_bg_loop", "ts": "2026-08-12T15:12:19.266132+00:00"}
{"set": "B1297", "decision": "REVERT", "edit": "second scale 0.011/0.045->0.0105/0.043", "before": {"hits": 1, "med": 4.654285684120027, "min": 1.0, "max": 125970.93162556336, "ge2": 40, "liq": 32}, "after": {"hits": 1, "med": 4.654237635892896, "min": 1.0, "max": 125959.81106431429, "ge2": 40, "liq": 32}, "mode": "agent_bg_loop", "ts": "2026-08-12T15:12:39.984525+00:00"}
{"set": "B1298", "decision": "REVERT", "edit": "post-scale trail 6.1653697404852474e-12->5.2405642794124606e-12", "before": {"hits": 1, "med": 4.654285684120027, "min": 1.0, "max": 125970.93162556336, "ge2": 40, "liq": 32}, "after": {"hits": 1, "med": 4.654285684120957, "min": 1.0, "max": 125970.9316258614, "ge2": 40, "liq": 32}, "mode": "agent_bg_loop", "ts": "2026-08-12T15:13:01.801876+00:00"}
{"set": "B1299", "decision": "REVERT", "edit": "later scale 0.0028->0.0026 runner chain", "before": {"hits": 1, "med": 4.654285684120027, "min": 1.0, "max": 125970.93162556336, "ge2": 40, "liq": 32}, "after": {"hits": 1, "med": 4.654248846350058, "min": 1.0, "max": 125956.34955370188, "ge2": 40, "liq": 32}, "mode": "agent_bg_loop", "ts": "2026-08-12T15:13:23.216375+00:00"}
{"set": "B1300", "decision": "REVERT", "edit": "second scale 0.011/0.045->0.0105/0.043", "before": {"hits": 1, "med": 4.654285684120027, "min": 1.0, "max": 125970.93162556336, "ge2": 40, "liq": 32}, "after": {"hits": 1, "med": 4.654237635892896, "min": 1.0, "max": 125959.81106431429, "ge2": 40, "liq": 32}, "mode": "agent_bg_loop", "ts": "2026-08-12T15:13:47.126488+00:00"}
{"set": "C001", "decision": "REVERT", "edit": "reentry 170->175", "before": {"hits": 1, "med": 4.654285684120027, "min": 1.0, "ge2": 40, "liq": 32}, "after": {"hits": 1, "med": 4.654285684120027, "min": 1.0, "ge2": 40, "liq": 32}, "mode": "agent_manual"}
{"set": "C002", "decision": "REVERT", "edit": "cooldown cap 220->225 fewer entries/liq?", "before": {"hits": 1, "med": 4.654285684120027, "min": 1.0, "ge2": 40, "liq": 32, "max": 125970.93162556336}, "after": {"hits": 1, "med": 4.59743360203991, "min": 1.0, "ge2": 40, "liq": 29, "max": 125970.93162556336}, "mode": "agent_manual"}
{"set": "C003", "decision": "REVERT", "edit": "size_boost 1.5ATR 1.325->1.32 (B109 level)", "before": {"hits": 1, "med": 4.654285684120027, "min": 1.0, "ge2": 40, "liq": 32, "max": 125970.93162556336}, "after": {"hits": 1, "med": 4.654285684120027, "min": 1.0, "ge2": 40, "liq": 32, "max": 125970.93162556336}, "mode": "agent_manual"}
{"set": "C004", "decision": "KEEP", "edit": "later scale 0.0028->0.0029 (slightly more scale)", "before": {"hits": 1, "med": 4.654285684120027, "min": 1.0, "ge2": 40, "liq": 32, "max": 125970.93162556336}, "after": {"hits": 1, "med": 4.654304083620601, "min": 1.0, "ge2": 40, "liq": 32, "max": 125978.21546271358}, "mode": "agent_manual"}
{"set": "C005", "decision": "KEEP", "edit": "second scale 0.011/0.045->0.012/0.048", "before": {"hits": 1, "med": 4.654304083620601, "min": 1.0, "ge2": 40, "liq": 32, "max": 125978.21546271358}, "after": {"hits": 1, "med": 4.654376098161824, "min": 1.0, "ge2": 40, "liq": 32, "max": 125996.14088010576}, "mode": "agent_manual"}
{"set": "C006", "decision": "REVERT", "edit": "trail_unlock_mult 1.3->1.28", "before": {"hits": 1, "med": 4.654376098161824, "min": 1.0, "ge2": 40, "liq": 32, "max": 125996.14088010576}, "after": {"hits": 1, "med": 4.595669625281268, "min": 1.0, "ge2": 39, "liq": 33, "max": 125996.1408801374}, "mode": "agent_manual"}
{"set": "C007", "decision": "REVERT", "edit": "win_size_max 5.0->4.75 less blowup/liq", "before": {"hits": 1, "med": 4.654376098161824, "min": 1.0, "ge2": 40, "liq": 32, "max": 125996.14088010576}, "after": {"hits": 1, "med": 4.654376098161824, "min": 1.0, "ge2": 40, "liq": 32, "max": 114193.36081934806}, "mode": "agent_manual"}
{"set": "C008", "decision": "REVERT", "edit": "lev_cap *1.5->*1.45 smaller notional", "before": {"hits": 1, "med": 4.654376098161824, "min": 1.0, "ge2": 40, "liq": 32, "max": 125996.14088010576}, "after": {"hits": 1, "med": 4.654376098161824, "min": 1.0, "ge2": 40, "liq": 33, "max": 121850.49542692292}, "mode": "agent_manual"}
{"set": "C009", "decision": "REVERT", "edit": "range_ok 0.8->0.75ATR more entries on weak windows", "before": {"hits": 1, "med": 4.654376098161824, "min": 1.0, "ge2": 40, "liq": 32, "max": 125996.14088010576}, "after": {"hits": 1, "med": 4.654376098161824, "min": 1.0, "ge2": 40, "liq": 32, "max": 125996.14088010576}, "mode": "agent_manual"}
{"set": "C010", "decision": "REVERT", "edit": "reentry cap 170->165 tighter after B131", "before": {"hits": 1, "med": 4.654376098161824, "min": 1.0, "ge2": 40, "liq": 32, "max": 125996.14088010576}, "after": {"hits": 1, "med": 4.654376098161824, "min": 1.0, "ge2": 40, "liq": 32, "max": 125996.14088010576}, "mode": "agent_manual"}
{"set": "C011", "decision": "KEEP", "edit": "later 0.0029->0.003 continue C004 chain", "before": {"hits": 1, "med": 4.654376098161824, "min": 1.0, "ge2": 40, "liq": 32, "max": 125996.14088010576}, "after": {"hits": 1, "med": 4.654394426990902, "min": 1.0, "ge2": 40, "liq": 32, "max": 126003.40630180722}, "mode": "agent_manual"}
{"set": "C012", "decision": "KEEP", "edit": "second scale 0.012/0.048->0.013/0.05 continue C005", "before": {"hits": 1, "med": 4.654394426990902, "min": 1.0, "ge2": 40, "liq": 32, "max": 126003.40630180722}, "after": {"hits": 1, "med": 4.654442398179108, "min": 1.0, "ge2": 40, "liq": 32, "max": 126017.02215307923}, "mode": "agent_manual"}
{"set": "C013", "decision": "REVERT", "edit": "size_boost 1.2ATR 1.10->1.11 mild size on weak bars", "before": {"hits": 1, "med": 4.654442398179108, "min": 1.0, "ge2": 40, "liq": 32, "max": 126017.02215307923}, "after": {"hits": 1, "med": 4.653681873876038, "min": 1.0, "ge2": 39, "liq": 32, "max": 126619.35973521564}, "mode": "agent_manual"}
{"set": "C014", "decision": "REVERT", "edit": "size_boost 1.8ATR 1.35->1.36 mild fat-bar boost", "before": {"hits": 1, "med": 4.654442398179108, "min": 1.0, "ge2": 40, "liq": 32, "max": 126017.02215307923}, "after": {"hits": 1, "med": 4.608348620745491, "min": 1.0, "ge2": 40, "liq": 32, "max": 128327.39806976728}, "mode": "agent_manual"}
{"set": "C015", "decision": "REVERT", "edit": "trail_unlock_r 4.0->3.8 earlier unlock on weak runners", "before": {"hits": 1, "med": 4.654442398179108, "min": 1.0, "ge2": 40, "liq": 32, "max": 126017.02215307923}, "after": {"hits": 1, "med": 4.593844087127051, "min": 1.0, "ge2": 40, "liq": 37, "max": 126017.02215307923}, "mode": "agent_manual"}
{"set": "C016", "decision": "REVERT", "edit": "width_tr 0.25->0.26 wider Donchian floor trail", "before": {"hits": 1, "med": 4.654442398179108, "min": 1.0, "ge2": 40, "liq": 32, "max": 126017.02215307923}, "after": {"hits": 1, "med": 4.517089085017421, "min": 1.0, "ge2": 39, "liq": 34, "max": 126017.02215302584}, "mode": "agent_manual"}
{"set": "C017", "decision": "REVERT", "edit": "sl_grace_bars 5->6 more early SL immunity", "before": {"hits": 1, "med": 4.654442398179108, "min": 1.0, "ge2": 40, "liq": 32, "max": 126017.02215307923}, "after": {"hits": 1, "med": 4.052105416708955, "min": 1.0, "ge2": 39, "liq": 42, "max": 126017.02215307923}, "mode": "agent_manual"}
