{"set": "B1088", "decision": "REVERT", "edit": "post-scale trail 6.1653697404852474e-12->5.2405642794124606e-12", "before": {"hits": 1, "med": 4.654285684120027, "min": 1.0, "max": 125970.93162556336, "ge2": 40, "liq": 32}, "after": {"hits": 1, "med": 4.654285684120957, "min": 1.0, "max": 125970.9316258614, "ge2": 40, "liq": 32}, "mode": "agent_bg_loop", "ts": "2026-08-12T14:02:35.632834+00:00"}
{"set": "B1089", "decision": "REVERT", "edit": "later scale 0.0028->0.0026 runner chain", "before": {"hits": 1, "med": 4.654285684120027, "min": 1.0, "max": 125970.93162556336, "ge2": 40, "liq": 32}, "after": {"hits": 1, "med": 4.654248846350058, "min": 1.0, "max": 125956.34955370188, "ge2": 40, "liq": 32}, "mode": "agent_bg_loop", "ts": "2026-08-12T14:02:55.655032+00:00"}
{"set": "B1090", "decision": "REVERT", "edit": "second scale 0.011/0.045->0.0105/0.043", "before": {"hits": 1, "med": 4.654285684120027, "min": 1.0, "max": 125970.93162556336, "ge2": 40, "liq": 32}, "after": {"hits": 1, "med": 4.654237635892896, "min": 1.0, "max": 125959.81106431429, "ge2": 40, "liq": 32}, "mode": "agent_bg_loop", "ts": "2026-08-12T14:03:15.793421+00:00"}
{"set": "B1091", "decision": "REVERT", "edit": "post-scale trail 6.1653697404852474e-12->5.2405642794124606e-12", "before": {"hits": 1, "med": 4.654285684120027, "min": 1.0, "max": 125970.93162556336, "ge2": 40, "liq": 32}, "after": {"hits": 1, "med": 4.654285684120957, "min": 1.0, "max": 125970.9316258614, "ge2": 40, "liq": 32}, "mode": "agent_bg_loop", "ts": "2026-08-12T14:03:35.954896+00:00"}
{"set": "B1092", "decision": "REVERT", "edit": "later scale 0.0028->0.0026 runner chain", "before": {"hits": 1, "med": 4.654285684120027, "min": 1.0, "max": 125970.93162556336, "ge2": 40, "liq": 32}, "after": {"hits": 1, "med": 4.654248846350058, "min": 1.0, "max": 125956.34955370188, "ge2": 40, "liq": 32}, "mode": "agent_bg_loop", "ts": "2026-08-12T14:03:56.109119+00:00"}
{"set": "B1093", "decision": "REVERT", "edit": "second scale 0.011/0.045->0.0105/0.043", "before": {"hits": 1, "med": 4.654285684120027, "min": 1.0, "max": 125970.93162556336, "ge2": 40, "liq": 32}, "after": {"hits": 1, "med": 4.654237635892896, "min": 1.0, "max": 125959.81106431429, "ge2": 40, "liq": 32}, "mode": "agent_bg_loop", "ts": "2026-08-12T14:04:16.146010+00:00"}
{"set": "B1094", "decision": "REVERT", "edit": "post-scale trail 6.1653697404852474e-12->5.2405642794124606e-12", "before": {"hits": 1, "med": 4.654285684120027, "min": 1.0, "max": 125970.93162556336, "ge2": 40, "liq": 32}, "after": {"hits": 1, "med": 4.654285684120957, "min": 1.0, "max": 125970.9316258614, "ge2": 40, "liq": 32}, "mode": "agent_bg_loop", "ts": "2026-08-12T14:04:36.246887+00:00"}
{"set": "B1095", "decision": "REVERT", "edit": "later scale 0.0028->0.0026 runner chain", "before": {"hits": 1, "med": 4.654285684120027, "min": 1.0, "max": 125970.93162556336, "ge2": 40, "liq": 32}, "after": {"hits": 1, "med": 4.654248846350058, "min": 1.0, "max": 125956.34955370188, "ge2": 40, "liq": 32}, "mode": "agent_bg_loop", "ts": "2026-08-12T14:04:56.333491+00:00"}
{"set": "B1096", "decision": "REVERT", "edit": "second scale 0.011/0.045->0.0105/0.043", "before": {"hits": 1, "med": 4.654285684120027, "min": 1.0, "max": 125970.93162556336, "ge2": 40, "liq": 32}, "after": {"hits": 1, "med": 4.654237635892896, "min": 1.0, "max": 125959.81106431429, "ge2": 40, "liq": 32}, "mode": "agent_bg_loop", "ts": "2026-08-12T14:05:16.367265+00:00"}
{"set": "B1097", "decision": "REVERT", "edit": "post-scale trail 6.1653697404852474e-12->5.2405642794124606e-12", "before": {"hits": 1, "med": 4.654285684120027, "min": 1.0, "max": 125970.93162556336, "ge2": 40, "liq": 32}, "after": {"hits": 1, "med": 4.654285684120957, "min": 1.0, "max": 125970.9316258614, "ge2": 40, "liq": 32}, "mode": "agent_bg_loop", "ts": "2026-08-12T14:05:36.500418+00:00"}
{"set": "B1098", "decision": "REVERT", "edit": "later scale 0.0028->0.0026 runner chain", "before": {"hits": 1, "med": 4.654285684120027, "min": 1.0, "max": 125970.93162556336, "ge2": 40, "liq": 32}, "after": {"hits": 1, "med": 4.654248846350058, "min": 1.0, "max": 125956.34955370188, "ge2": 40, "liq": 32}, "mode": "agent_bg_loop", "ts": "2026-08-12T14:05:56.500832+00:00"}
{"set": "B1099", "decision": "REVERT", "edit": "second scale 0.011/0.045->0.0105/0.043", "before": {"hits": 1, "med": 4.654285684120027, "min": 1.0, "max": 125970.93162556336, "ge2": 40, "liq": 32}, "after": {"hits": 1, "med": 4.654237635892896, "min": 1.0, "max": 125959.81106431429, "ge2": 40, "liq": 32}, "mode": "agent_bg_loop", "ts": "2026-08-12T14:06:16.463613+00:00"}
{"set": "B1100", "decision": "REVERT", "edit": "post-scale trail 6.1653697404852474e-12->5.2405642794124606e-12", "before": {"hits": 1, "med": 4.654285684120027, "min": 1.0, "max": 125970.93162556336, "ge2": 40, "liq": 32}, "after": {"hits": 1, "med": 4.654285684120957, "min": 1.0, "max": 125970.9316258614, "ge2": 40, "liq": 32}, "mode": "agent_bg_loop", "ts": "2026-08-12T14:06:36.424054+00:00"}
{"set": "B1101", "decision": "REVERT", "edit": "later scale 0.0028->0.0026 runner chain", "before": {"hits": 1, "med": 4.654285684120027, "min": 1.0, "max": 125970.93162556336, "ge2": 40, "liq": 32}, "after": {"hits": 1, "med": 4.654248846350058, "min": 1.0, "max": 125956.34955370188, "ge2": 40, "liq": 32}, "mode": "agent_bg_loop", "ts": "2026-08-12T14:06:56.427630+00:00"}
{"set": "B1102", "decision": "REVERT", "edit": "second scale 0.011/0.045->0.0105/0.043", "before": {"hits": 1, "med": 4.654285684120027, "min": 1.0, "max": 125970.93162556336, "ge2": 40, "liq": 32}, "after": {"hits": 1, "med": 4.654237635892896, "min": 1.0, "max": 125959.81106431429, "ge2": 40, "liq": 32}, "mode": "agent_bg_loop", "ts": "2026-08-12T14:07:16.559807+00:00"}
{"set": "B1103", "decision": "REVERT", "edit": "post-scale trail 6.1653697404852474e-12->5.2405642794124606e-12", "before": {"hits": 1, "med": 4.654285684120027, "min": 1.0, "max": 125970.93162556336, "ge2": 40, "liq": 32}, "after": {"hits": 1, "med": 4.654285684120957, "min": 1.0, "max": 125970.9316258614, "ge2": 40, "liq": 32}, "mode": "agent_bg_loop", "ts": "2026-08-12T14:07:36.655941+00:00"}
{"set": "B1104", "decision": "REVERT", "edit": "later scale 0.0028->0.0026 runner chain", "before": {"hits": 1, "med": 4.654285684120027, "min": 1.0, "max": 125970.93162556336, "ge2": 40, "liq": 32}, "after": {"hits": 1, "med": 4.654248846350058, "min": 1.0, "max": 125956.34955370188, "ge2": 40, "liq": 32}, "mode": "agent_bg_loop", "ts": "2026-08-12T14:07:56.609173+00:00"}
{"set": "B1105", "decision": "REVERT", "edit": "second scale 0.011/0.045->0.0105/0.043", "before": {"hits": 1, "med": 4.654285684120027, "min": 1.0, "max": 125970.93162556336, "ge2": 40, "liq": 32}, "after": {"hits": 1, "med": 4.654237635892896, "min": 1.0, "max": 125959.81106431429, "ge2": 40, "liq": 32}, "mode": "agent_bg_loop", "ts": "2026-08-12T14:08:16.784557+00:00"}
{"set": "B1106", "decision": "REVERT", "edit": "post-scale trail 6.1653697404852474e-12->5.2405642794124606e-12", "before": {"hits": 1, "med": 4.654285684120027, "min": 1.0, "max": 125970.93162556336, "ge2": 40, "liq": 32}, "after": {"hits": 1, "med": 4.654285684120957, "min": 1.0, "max": 125970.9316258614, "ge2": 40, "liq": 32}, "mode": "agent_bg_loop", "ts": "2026-08-12T14:08:36.974759+00:00"}
{"set": "B1107", "decision": "REVERT", "edit": "later scale 0.0028->0.0026 runner chain", "before": {"hits": 1, "med": 4.654285684120027, "min": 1.0, "max": 125970.93162556336, "ge2": 40, "liq": 32}, "after": {"hits": 1, "med": 4.654248846350058, "min": 1.0, "max": 125956.34955370188, "ge2": 40, "liq": 32}, "mode": "agent_bg_loop", "ts": "2026-08-12T14:08:56.964767+00:00"}
{"set": "B1108", "decision": "REVERT", "edit": "second scale 0.011/0.045->0.0105/0.043", "before": {"hits": 1, "med": 4.654285684120027, "min": 1.0, "max": 125970.93162556336, "ge2": 40, "liq": 32}, "after": {"hits": 1, "med": 4.654237635892896, "min": 1.0, "max": 125959.81106431429, "ge2": 40, "liq": 32}, "mode": "agent_bg_loop", "ts": "2026-08-12T14:09:17.033905+00:00"}
{"set": "B1109", "decision": "REVERT", "edit": "post-scale trail 6.1653697404852474e-12->5.2405642794124606e-12", "before": {"hits": 1, "med": 4.654285684120027, "min": 1.0, "max": 125970.93162556336, "ge2": 40, "liq": 32}, "after": {"hits": 1, "med": 4.654285684120957, "min": 1.0, "max": 125970.9316258614, "ge2": 40, "liq": 32}, "mode": "agent_bg_loop", "ts": "2026-08-12T14:09:36.951593+00:00"}
{"set": "B1110", "decision": "REVERT", "edit": "later scale 0.0028->0.0026 runner chain", "before": {"hits": 1, "med": 4.654285684120027, "min": 1.0, "max": 125970.93162556336, "ge2": 40, "liq": 32}, "after": {"hits": 1, "med": 4.654248846350058, "min": 1.0, "max": 125956.34955370188, "ge2": 40, "liq": 32}, "mode": "agent_bg_loop", "ts": "2026-08-12T14:09:56.971876+00:00"}
{"set": "B1111", "decision": "REVERT", "edit": "second scale 0.011/0.045->0.0105/0.043", "before": {"hits": 1, "med": 4.654285684120027, "min": 1.0, "max": 125970.93162556336, "ge2": 40, "liq": 32}, "after": {"hits": 1, "med": 4.654237635892896, "min": 1.0, "max": 125959.81106431429, "ge2": 40, "liq": 32}, "mode": "agent_bg_loop", "ts": "2026-08-12T14:10:16.964861+00:00"}
{"set": "B1112", "decision": "REVERT", "edit": "post-scale trail 6.1653697404852474e-12->5.2405642794124606e-12", "before": {"hits": 1, "med": 4.654285684120027, "min": 1.0, "max": 125970.93162556336, "ge2": 40, "liq": 32}, "after": {"hits": 1, "med": 4.654285684120957, "min": 1.0, "max": 125970.9316258614, "ge2": 40, "liq": 32}, "mode": "agent_bg_loop", "ts": "2026-08-12T14:10:37.152080+00:00"}
{"set": "B1113", "decision": "REVERT", "edit": "later scale 0.0028->0.0026 runner chain", "before": {"hits": 1, "med": 4.654285684120027, "min": 1.0, "max": 125970.93162556336, "ge2": 40, "liq": 32}, "after": {"hits": 1, "med": 4.654248846350058, "min": 1.0, "max": 125956.34955370188, "ge2": 40, "liq": 32}, "mode": "agent_bg_loop", "ts": "2026-08-12T14:10:57.281555+00:00"}
{"set": "B1114", "decision": "REVERT", "edit": "second scale 0.011/0.045->0.0105/0.043", "before": {"hits": 1, "med": 4.654285684120027, "min": 1.0, "max": 125970.93162556336, "ge2": 40, "liq": 32}, "after": {"hits": 1, "med": 4.654237635892896, "min": 1.0, "max": 125959.81106431429, "ge2": 40, "liq": 32}, "mode": "agent_bg_loop", "ts": "2026-08-12T14:11:17.339349+00:00"}
{"set": "B1115", "decision": "REVERT", "edit": "post-scale trail 6.1653697404852474e-12->5.2405642794124606e-12", "before": {"hits": 1, "med": 4.654285684120027, "min": 1.0, "max": 125970.93162556336, "ge2": 40, "liq": 32}, "after": {"hits": 1, "med": 4.654285684120957, "min": 1.0, "max": 125970.9316258614, "ge2": 40, "liq": 32}, "mode": "agent_bg_loop", "ts": "2026-08-12T14:11:37.354111+00:00"}
{"set": "B1116", "decision": "REVERT", "edit": "later scale 0.0028->0.0026 runner chain", "before": {"hits": 1, "med": 4.654285684120027, "min": 1.0, "max": 125970.93162556336, "ge2": 40, "liq": 32}, "after": {"hits": 1, "med": 4.654248846350058, "min": 1.0, "max": 125956.34955370188, "ge2": 40, "liq": 32}, "mode": "agent_bg_loop", "ts": "2026-08-12T14:11:57.424978+00:00"}
{"set": "B1117", "decision": "REVERT", "edit": "second scale 0.011/0.045->0.0105/0.043", "before": {"hits": 1, "med": 4.654285684120027, "min": 1.0, "max": 125970.93162556336, "ge2": 40, "liq": 32}, "after": {"hits": 1, "med": 4.654237635892896, "min": 1.0, "max": 125959.81106431429, "ge2": 40, "liq": 32}, "mode": "agent_bg_loop", "ts": "2026-08-12T14:12:17.501257+00:00"}
{"set": "B1118", "decision": "REVERT", "edit": "post-scale trail 6.1653697404852474e-12->5.2405642794124606e-12", "before": {"hits": 1, "med": 4.654285684120027, "min": 1.0, "max": 125970.93162556336, "ge2": 40, "liq": 32}, "after": {"hits": 1, "med": 4.654285684120957, "min": 1.0, "max": 125970.9316258614, "ge2": 40, "liq": 32}, "mode": "agent_bg_loop", "ts": "2026-08-12T14:12:37.475587+00:00"}
{"set": "B1119", "decision": "REVERT", "edit": "later scale 0.0028->0.0026 runner chain", "before": {"hits": 1, "med": 4.654285684120027, "min": 1.0, "max": 125970.93162556336, "ge2": 40, "liq": 32}, "after": {"hits": 1, "med": 4.654248846350058, "min": 1.0, "max": 125956.34955370188, "ge2": 40, "liq": 32}, "mode": "agent_bg_loop", "ts": "2026-08-12T14:12:57.497589+00:00"}
{"set": "B1120", "decision": "REVERT", "edit": "second scale 0.011/0.045->0.0105/0.043", "before": {"hits": 1, "med": 4.654285684120027, "min": 1.0, "max": 125970.93162556336, "ge2": 40, "liq": 32}, "after": {"hits": 1, "med": 4.654237635892896, "min": 1.0, "max": 125959.81106431429, "ge2": 40, "liq": 32}, "mode": "agent_bg_loop", "ts": "2026-08-12T14:13:17.860886+00:00"}
{"set": "B1121", "decision": "REVERT", "edit": "post-scale trail 6.1653697404852474e-12->5.2405642794124606e-12", "before": {"hits": 1, "med": 4.654285684120027, "min": 1.0, "max": 125970.93162556336, "ge2": 40, "liq": 32}, "after": {"hits": 1, "med": 4.654285684120957, "min": 1.0, "max": 125970.9316258614, "ge2": 40, "liq": 32}, "mode": "agent_bg_loop", "ts": "2026-08-12T14:13:37.969035+00:00"}
{"set": "B1122", "decision": "REVERT", "edit": "later scale 0.0028->0.0026 runner chain", "before": {"hits": 1, "med": 4.654285684120027, "min": 1.0, "max": 125970.93162556336, "ge2": 40, "liq": 32}, "after": {"hits": 1, "med": 4.654248846350058, "min": 1.0, "max": 125956.34955370188, "ge2": 40, "liq": 32}, "mode": "agent_bg_loop", "ts": "2026-08-12T14:13:58.037048+00:00"}
{"set": "B1123", "decision": "REVERT", "edit": "second scale 0.011/0.045->0.0105/0.043", "before": {"hits": 1, "med": 4.654285684120027, "min": 1.0, "max": 125970.93162556336, "ge2": 40, "liq": 32}, "after": {"hits": 1, "med": 4.654237635892896, "min": 1.0, "max": 125959.81106431429, "ge2": 40, "liq": 32}, "mode": "agent_bg_loop", "ts": "2026-08-12T14:14:18.140140+00:00"}
{"set": "B1124", "decision": "REVERT", "edit": "post-scale trail 6.1653697404852474e-12->5.2405642794124606e-12", "before": {"hits": 1, "med": 4.654285684120027, "min": 1.0, "max": 125970.93162556336, "ge2": 40, "liq": 32}, "after": {"hits": 1, "med": 4.654285684120957, "min": 1.0, "max": 125970.9316258614, "ge2": 40, "liq": 32}, "mode": "agent_bg_loop", "ts": "2026-08-12T14:14:38.277325+00:00"}
{"set": "B1125", "decision": "REVERT", "edit": "later scale 0.0028->0.0026 runner chain", "before": {"hits": 1, "med": 4.654285684120027, "min": 1.0, "max": 125970.93162556336, "ge2": 40, "liq": 32}, "after": {"hits": 1, "med": 4.654248846350058, "min": 1.0, "max": 125956.34955370188, "ge2": 40, "liq": 32}, "mode": "agent_bg_loop", "ts": "2026-08-12T14:14:58.404089+00:00"}
{"set": "B1126", "decision": "REVERT", "edit": "second scale 0.011/0.045->0.0105/0.043", "before": {"hits": 1, "med": 4.654285684120027, "min": 1.0, "max": 125970.93162556336, "ge2": 40, "liq": 32}, "after": {"hits": 1, "med": 4.654237635892896, "min": 1.0, "max": 125959.81106431429, "ge2": 40, "liq": 32}, "mode": "agent_bg_loop", "ts": "2026-08-12T14:15:18.346596+00:00"}
{"set": "B1127", "decision": "REVERT", "edit": "post-scale trail 6.1653697404852474e-12->5.2405642794124606e-12", "before": {"hits": 1, "med": 4.654285684120027, "min": 1.0, "max": 125970.93162556336, "ge2": 40, "liq": 32}, "after": {"hits": 1, "med": 4.654285684120957, "min": 1.0, "max": 125970.9316258614, "ge2": 40, "liq": 32}, "mode": "agent_bg_loop", "ts": "2026-08-12T14:15:38.322929+00:00"}
{"set": "B1128", "decision": "REVERT", "edit": "later scale 0.0028->0.0026 runner chain", "before": {"hits": 1, "med": 4.654285684120027, "min": 1.0, "max": 125970.93162556336, "ge2": 40, "liq": 32}, "after": {"hits": 1, "med": 4.654248846350058, "min": 1.0, "max": 125956.34955370188, "ge2": 40, "liq": 32}, "mode": "agent_bg_loop", "ts": "2026-08-12T14:15:58.271537+00:00"}
{"set": "B1129", "decision": "REVERT", "edit": "second scale 0.011/0.045->0.0105/0.043", "before": {"hits": 1, "med": 4.654285684120027, "min": 1.0, "max": 125970.93162556336, "ge2": 40, "liq": 32}, "after": {"hits": 1, "med": 4.654237635892896, "min": 1.0, "max": 125959.81106431429, "ge2": 40, "liq": 32}, "mode": "agent_bg_loop", "ts": "2026-08-12T14:16:18.296472+00:00"}
{"set": "B1130", "decision": "REVERT", "edit": "post-scale trail 6.1653697404852474e-12->5.2405642794124606e-12", "before": {"hits": 1, "med": 4.654285684120027, "min": 1.0, "max": 125970.93162556336, "ge2": 40, "liq": 32}, "after": {"hits": 1, "med": 4.654285684120957, "min": 1.0, "max": 125970.9316258614, "ge2": 40, "liq": 32}, "mode": "agent_bg_loop", "ts": "2026-08-12T14:16:38.376353+00:00"}
{"set": "B1131", "decision": "REVERT", "edit": "later scale 0.0028->0.0026 runner chain", "before": {"hits": 1, "med": 4.654285684120027, "min": 1.0, "max": 125970.93162556336, "ge2": 40, "liq": 32}, "after": {"hits": 1, "med": 4.654248846350058, "min": 1.0, "max": 125956.34955370188, "ge2": 40, "liq": 32}, "mode": "agent_bg_loop", "ts": "2026-08-12T14:16:58.446517+00:00"}
{"set": "B1132", "decision": "REVERT", "edit": "second scale 0.011/0.045->0.0105/0.043", "before": {"hits": 1, "med": 4.654285684120027, "min": 1.0, "max": 125970.93162556336, "ge2": 40, "liq": 32}, "after": {"hits": 1, "med": 4.654237635892896, "min": 1.0, "max": 125959.81106431429, "ge2": 40, "liq": 32}, "mode": "agent_bg_loop", "ts": "2026-08-12T14:17:18.592495+00:00"}
{"set": "B1133", "decision": "REVERT", "edit": "post-scale trail 6.1653697404852474e-12->5.2405642794124606e-12", "before": {"hits": 1, "med": 4.654285684120027, "min": 1.0, "max": 125970.93162556336, "ge2": 40, "liq": 32}, "after": {"hits": 1, "med": 4.654285684120957, "min": 1.0, "max": 125970.9316258614, "ge2": 40, "liq": 32}, "mode": "agent_bg_loop", "ts": "2026-08-12T14:17:38.565881+00:00"}
{"set": "B1134", "decision": "REVERT", "edit": "later scale 0.0028->0.0026 runner chain", "before": {"hits": 1, "med": 4.654285684120027, "min": 1.0, "max": 125970.93162556336, "ge2": 40, "liq": 32}, "after": {"hits": 1, "med": 4.654248846350058, "min": 1.0, "max": 125956.34955370188, "ge2": 40, "liq": 32}, "mode": "agent_bg_loop", "ts": "2026-08-12T14:17:58.574127+00:00"}
{"set": "B1135", "decision": "REVERT", "edit": "second scale 0.011/0.045->0.0105/0.043", "before": {"hits": 1, "med": 4.654285684120027, "min": 1.0, "max": 125970.93162556336, "ge2": 40, "liq": 32}, "after": {"hits": 1, "med": 4.654237635892896, "min": 1.0, "max": 125959.81106431429, "ge2": 40, "liq": 32}, "mode": "agent_bg_loop", "ts": "2026-08-12T14:18:18.620679+00:00"}
{"set": "B1136", "decision": "REVERT", "edit": "post-scale trail 6.1653697404852474e-12->5.2405642794124606e-12", "before": {"hits": 1, "med": 4.654285684120027, "min": 1.0, "max": 125970.93162556336, "ge2": 40, "liq": 32}, "after": {"hits": 1, "med": 4.654285684120957, "min": 1.0, "max": 125970.9316258614, "ge2": 40, "liq": 32}, "mode": "agent_bg_loop", "ts": "2026-08-12T14:18:38.789806+00:00"}
{"set": "B1137", "decision": "REVERT", "edit": "later scale 0.0028->0.0026 runner chain", "before": {"hits": 1, "med": 4.654285684120027, "min": 1.0, "max": 125970.93162556336, "ge2": 40, "liq": 32}, "after": {"hits": 1, "med": 4.654248846350058, "min": 1.0, "max": 125956.34955370188, "ge2": 40, "liq": 32}, "mode": "agent_bg_loop", "ts": "2026-08-12T14:18:59.178505+00:00"}
{"set": "B1138", "decision": "REVERT", "edit": "second scale 0.011/0.045->0.0105/0.043", "before": {"hits": 1, "med": 4.654285684120027, "min": 1.0, "max": 125970.93162556336, "ge2": 40, "liq": 32}, "after": {"hits": 1, "med": 4.654237635892896, "min": 1.0, "max": 125959.81106431429, "ge2": 40, "liq": 32}, "mode": "agent_bg_loop", "ts": "2026-08-12T14:19:19.409215+00:00"}
{"set": "B1139", "decision": "REVERT", "edit": "post-scale trail 6.1653697404852474e-12->5.2405642794124606e-12", "before": {"hits": 1, "med": 4.654285684120027, "min": 1.0, "max": 125970.93162556336, "ge2": 40, "liq": 32}, "after": {"hits": 1, "med": 4.654285684120957, "min": 1.0, "max": 125970.9316258614, "ge2": 40, "liq": 32}, "mode": "agent_bg_loop", "ts": "2026-08-12T14:19:39.541079+00:00"}
{"set": "B1140", "decision": "REVERT", "edit": "later scale 0.0028->0.0026 runner chain", "before": {"hits": 1, "med": 4.654285684120027, "min": 1.0, "max": 125970.93162556336, "ge2": 40, "liq": 32}, "after": {"hits": 1, "med": 4.654248846350058, "min": 1.0, "max": 125956.34955370188, "ge2": 40, "liq": 32}, "mode": "agent_bg_loop", "ts": "2026-08-12T14:19:59.585753+00:00"}
{"set": "B1141", "decision": "REVERT", "edit": "second scale 0.011/0.045->0.0105/0.043", "before": {"hits": 1, "med": 4.654285684120027, "min": 1.0, "max": 125970.93162556336, "ge2": 40, "liq": 32}, "after": {"hits": 1, "med": 4.654237635892896, "min": 1.0, "max": 125959.81106431429, "ge2": 40, "liq": 32}, "mode": "agent_bg_loop", "ts": "2026-08-12T14:20:19.615595+00:00"}
{"set": "B1142", "decision": "REVERT", "edit": "post-scale trail 6.1653697404852474e-12->5.2405642794124606e-12", "before": {"hits": 1, "med": 4.654285684120027, "min": 1.0, "max": 125970.93162556336, "ge2": 40, "liq": 32}, "after": {"hits": 1, "med": 4.654285684120957, "min": 1.0, "max": 125970.9316258614, "ge2": 40, "liq": 32}, "mode": "agent_bg_loop", "ts": "2026-08-12T14:20:39.665478+00:00"}
{"set": "B1143", "decision": "REVERT", "edit": "later scale 0.0028->0.0026 runner chain", "before": {"hits": 1, "med": 4.654285684120027, "min": 1.0, "max": 125970.93162556336, "ge2": 40, "liq": 32}, "after": {"hits": 1, "med": 4.654248846350058, "min": 1.0, "max": 125956.34955370188, "ge2": 40, "liq": 32}, "mode": "agent_bg_loop", "ts": "2026-08-12T14:20:59.642588+00:00"}
{"set": "B1144", "decision": "REVERT", "edit": "second scale 0.011/0.045->0.0105/0.043", "before": {"hits": 1, "med": 4.654285684120027, "min": 1.0, "max": 125970.93162556336, "ge2": 40, "liq": 32}, "after": {"hits": 1, "med": 4.654237635892896, "min": 1.0, "max": 125959.81106431429, "ge2": 40, "liq": 32}, "mode": "agent_bg_loop", "ts": "2026-08-12T14:21:19.676949+00:00"}
