{"set": "C084", "decision": "KEEP", "edit": "second 0.030/0.086->0.031/0.088", "before": {"hits": 1, "med": 4.655965489457864, "min": 1.0, "ge2": 40, "liq": 32, "max": 126522.56472000688}, "after": {"hits": 1, "med": 4.656012017298385, "min": 1.0, "ge2": 40, "liq": 32, "max": 126535.80981299632}, "mode": "agent_manual"}
{"set": "C085", "decision": "REVERT", "edit": "lev_cap 1.5->1.48", "before": {"hits": 1, "med": 4.656012017298385, "min": 1.0, "ge2": 40, "liq": 32, "max": 126535.80981299632}, "after": {"hits": 1, "med": 4.656012017298385, "min": 1.0, "ge2": 40, "liq": 32, "max": 124870.44350876604}, "mode": "agent_manual"}
{"set": "C086", "decision": "KEEP", "edit": "later 0.0068->0.0070", "before": {"hits": 1, "med": 4.656012017298385, "min": 1.0, "ge2": 40, "liq": 32, "max": 126535.80981299632}, "after": {"hits": 1, "med": 4.656046172349418, "min": 1.0, "ge2": 40, "liq": 32, "max": 126549.56915556142}, "mode": "agent_manual"}
{"set": "C087", "decision": "KEEP", "edit": "second 0.031/0.088->0.032/0.090", "before": {"hits": 1, "med": 4.656046172349418, "min": 1.0, "ge2": 40, "liq": 32, "max": 126549.56915556142}, "after": {"hits": 1, "med": 4.656092625288512, "min": 1.0, "ge2": 40, "liq": 32, "max": 126562.7949504275}, "mode": "agent_manual"}
{"set": "C088", "decision": "REVERT", "edit": "trail soft-cap 3.0->2.98", "before": {"hits": 1, "med": 4.656092625288512, "min": 1.0, "ge2": 40, "liq": 32, "max": 126562.7949504275}, "after": {"hits": 1, "med": 4.668883499549351, "min": 1.0, "ge2": 40, "liq": 33, "max": 127097.4097698621}, "mode": "agent_manual"}
{"set": "C089", "decision": "KEEP", "edit": "later 0.0070->0.0072", "before": {"hits": 1, "med": 4.656092625288512, "min": 1.0, "ge2": 40, "liq": 32, "max": 126562.7949504275}, "after": {"hits": 1, "med": 4.6561266574234255, "min": 1.0, "ge2": 40, "liq": 32, "max": 126576.51579482372}, "mode": "agent_manual"}
{"set": "C090", "decision": "KEEP", "edit": "second 0.032/0.090->0.033/0.092", "before": {"hits": 1, "med": 4.6561266574234255, "min": 1.0, "ge2": 40, "liq": 32, "max": 126576.51579482372}, "after": {"hits": 1, "med": 4.656173035566618, "min": 1.0, "ge2": 40, "liq": 32, "max": 126589.72231072176}, "mode": "agent_manual"}
{"set": "C091", "decision": "KEEP", "edit": "later 0.0072->0.0074", "before": {"hits": 1, "med": 4.656173035566618, "min": 1.0, "ge2": 40, "liq": 32, "max": 126589.72231072176}, "after": {"hits": 1, "med": 4.656206945054331, "min": 1.0, "ge2": 40, "liq": 32, "max": 126603.40472298348}, "mode": "agent_manual"}
{"set": "C092", "decision": "KEEP", "edit": "second 0.033/0.092->0.034/0.094", "before": {"hits": 1, "med": 4.656206945054331, "min": 1.0, "ge2": 40, "liq": 32, "max": 126603.40472298348}, "after": {"hits": 1, "med": 4.656253248507022, "min": 1.0, "ge2": 40, "liq": 32, "max": 126616.59197907372}, "mode": "agent_manual"}
{"set": "C093", "decision": "REVERT", "edit": "breakout_buffer +0.005ATR", "before": {"hits": 1, "med": 4.656253248507022, "min": 1.0, "ge2": 40, "liq": 32, "max": 126616.59197907372}, "after": {"hits": 1, "med": 4.656253248507022, "min": 1.0, "ge2": 40, "liq": 32, "max": 126616.59197907372}, "mode": "agent_manual"}
{"set": "C094", "decision": "KEEP", "edit": "later 0.0074->0.0076", "before": {"hits": 1, "med": 4.656253248507022, "min": 1.0, "ge2": 40, "liq": 32, "max": 126616.59197907372}, "after": {"hits": 1, "med": 4.65628703561601, "min": 1.0, "ge2": 40, "liq": 32, "max": 126630.23602518984}, "mode": "agent_manual"}
{"set": "C095", "decision": "KEEP", "edit": "second 0.034/0.094->0.035/0.096", "before": {"hits": 1, "med": 4.65628703561601, "min": 1.0, "ge2": 40, "liq": 32, "max": 126630.23602518984}, "after": {"hits": 1, "med": 4.656333264483472, "min": 1.0, "ge2": 40, "liq": 32, "max": 126643.40404063815}, "mode": "agent_manual"}
{"set": "C096", "decision": "REVERT", "edit": "size_boost low 1.10->1.09", "before": {"hits": 1, "med": 4.656333264483472, "min": 1.0, "ge2": 40, "liq": 32, "max": 126643.40404063815}, "after": {"hits": 1, "med": 4.620067597270493, "min": 1.0, "ge2": 40, "liq": 32, "max": 126032.81383720254}, "mode": "agent_manual"}
{"set": "C097", "decision": "KEEP", "edit": "later 0.0076->0.0078", "before": {"hits": 1, "med": 4.656333264483472, "min": 1.0, "ge2": 40, "liq": 32, "max": 126643.40404063815}, "after": {"hits": 1, "med": 4.656366929481785, "min": 1.0, "ge2": 40, "liq": 32, "max": 126657.00978655374}, "mode": "agent_manual"}
{"set": "C098", "decision": "KEEP", "edit": "second 0.035/0.096->0.036/0.098", "before": {"hits": 1, "med": 4.656366929481785, "min": 1.0, "ge2": 40, "liq": 32, "max": 126657.00978655374}, "after": {"hits": 1, "med": 4.656413083869161, "min": 1.0, "ge2": 40, "liq": 32, "max": 126670.15858053142}, "mode": "agent_manual"}
{"set": "C099", "decision": "REVERT", "edit": "cooldown cap 220->221", "before": {"hits": 1, "med": 4.656413083869161, "min": 1.0, "ge2": 40, "liq": 32, "max": 126670.15858053142}, "after": {"hits": 1, "med": 4.656413083869161, "min": 1.0, "ge2": 40, "liq": 32, "max": 126670.15858053142}, "mode": "agent_manual"}
{"set": "C100", "decision": "KEEP", "edit": "later 0.0078->0.0080", "before": {"hits": 1, "med": 4.656413083869161, "min": 1.0, "ge2": 40, "liq": 32, "max": 126670.15858053142}, "after": {"hits": 1, "med": 4.656446627024397, "min": 1.0, "ge2": 40, "liq": 32, "max": 126683.72609214444}, "mode": "agent_manual"}
{"set": "C101", "decision": "KEEP", "edit": "second 0.036/0.098->0.037/0.100", "before": {"hits": 1, "med": 4.656446627024397, "min": 1.0, "ge2": 40, "liq": 32, "max": 126683.72609214444}, "after": {"hits": 1, "med": 4.656492707036705, "min": 1.0, "ge2": 40, "liq": 32, "max": 126696.85568382782}, "mode": "agent_manual"}
{"set": "C102", "decision": "KEEP", "edit": "later 0.0080->0.0082", "before": {"hits": 1, "med": 4.656492707036705, "min": 1.0, "ge2": 40, "liq": 32, "max": 126696.85568382782}, "after": {"hits": 1, "med": 4.656526128616021, "min": 1.0, "ge2": 40, "liq": 32, "max": 126710.38502699132}, "mode": "agent_manual"}
{"set": "C103", "decision": "REVERT", "edit": "risk_cap 0.0024->0.00242", "before": {"hits": 1, "med": 4.656526128616021, "min": 1.0, "ge2": 40, "liq": 32, "max": 126710.38502699132}, "after": {"hits": 1, "med": 4.630779963462084, "min": 1.0, "ge2": 40, "liq": 32, "max": 124327.76153473096}, "mode": "agent_manual"}
{"set": "C104", "decision": "KEEP", "edit": "second 0.037/0.100->0.038/0.102", "before": {"hits": 1, "med": 4.656526128616021, "min": 1.0, "ge2": 40, "liq": 32, "max": 126710.38502699132}, "after": {"hits": 1, "med": 4.656572134358155, "min": 1.0, "ge2": 40, "liq": 32, "max": 126723.49543556172}, "mode": "agent_manual"}
{"set": "C105", "decision": "KEEP", "edit": "later 0.0082->0.0084", "before": {"hits": 1, "med": 4.656572134358155, "min": 1.0, "ge2": 40, "liq": 32, "max": 126723.49543556172}, "after": {"hits": 1, "med": 4.656605434628279, "min": 1.0, "ge2": 40, "liq": 32, "max": 126736.98667608286}, "mode": "agent_manual"}
{"set": "C106", "decision": "REVERT", "edit": "width_tr 0.25->0.255", "before": {"hits": 1, "med": 4.656605434628279, "min": 1.0, "ge2": 40, "liq": 32, "max": 126736.98667608286}, "after": {"hits": 1, "med": 4.534293145074542, "min": 1.0, "ge2": 39, "liq": 34, "max": 126736.98667605748}, "mode": "agent_manual"}
{"set": "C107", "decision": "KEEP", "edit": "second 0.038/0.102->0.039/0.104", "before": {"hits": 1, "med": 4.656605434628279, "min": 1.0, "ge2": 40, "liq": 32, "max": 126736.98667608286}, "after": {"hits": 1, "med": 4.656651366205, "min": 1.0, "ge2": 40, "liq": 32, "max": 126750.0779207268}, "mode": "agent_manual"}
{"set": "C108", "decision": "KEEP", "edit": "later 0.0084->0.0086", "before": {"hits": 1, "med": 4.656651366205, "min": 1.0, "ge2": 40, "liq": 32, "max": 126750.0779207268}, "after": {"hits": 1, "med": 4.656684545432213, "min": 1.0, "ge2": 40, "liq": 32, "max": 126763.53112436643}, "mode": "agent_manual"}
{"set": "C109", "decision": "REVERT", "edit": "reentry cap 170->169", "before": {"hits": 1, "med": 4.656684545432213, "min": 1.0, "ge2": 40, "liq": 32, "max": 126763.53112436643}, "after": {"hits": 1, "med": 4.656684545432213, "min": 1.0, "ge2": 40, "liq": 32, "max": 126763.53112436643}, "mode": "agent_manual"}
{"set": "C110", "decision": "KEEP", "edit": "second 0.039/0.104->0.040/0.106", "before": {"hits": 1, "med": 4.656684545432213, "min": 1.0, "ge2": 40, "liq": 32, "max": 126763.53112436643}, "after": {"hits": 1, "med": 4.65673040294816, "min": 1.0, "ge2": 40, "liq": 32, "max": 126776.60322427512}, "mode": "agent_manual"}
{"set": "C111", "decision": "KEEP", "edit": "later 0.0086->0.0088", "before": {"hits": 1, "med": 4.65673040294816, "min": 1.0, "ge2": 40, "liq": 32, "max": 126776.60322427512}, "after": {"hits": 1, "med": 4.6567634613983175, "min": 1.0, "ge2": 40, "liq": 32, "max": 126790.01845674928}, "mode": "agent_manual"}
{"set": "C112", "decision": "KEEP", "edit": "second 0.040/0.106->0.041/0.108", "before": {"hits": 1, "med": 4.6567634613983175, "min": 1.0, "ge2": 40, "liq": 32, "max": 126790.01845674928}, "after": {"hits": 1, "med": 4.6568092449580005, "min": 1.0, "ge2": 40, "liq": 32, "max": 126803.07143111908}, "mode": "agent_manual"}
{"set": "C113", "decision": "REVERT", "edit": "breakout_buffer +0.01ATR", "before": {"hits": 1, "med": 4.6568092449580005, "min": 1.0, "ge2": 40, "liq": 32, "max": 126803.07143111908}, "after": {"hits": 1, "med": 4.6568092449580005, "min": 1.0, "ge2": 40, "liq": 31, "max": 126803.07143111908}, "mode": "agent_manual"}
{"set": "C114", "decision": "KEEP", "edit": "later 0.0088->0.0090", "before": {"hits": 1, "med": 4.6568092449580005, "min": 1.0, "ge2": 40, "liq": 32, "max": 126803.07143111908}, "after": {"hits": 1, "med": 4.656842182896513, "min": 1.0, "ge2": 40, "liq": 32, "max": 126816.44875809595}, "mode": "agent_manual"}
{"set": "C115", "decision": "KEEP", "edit": "second 0.041/0.108->0.042/0.110", "before": {"hits": 1, "med": 4.656842182896513, "min": 1.0, "ge2": 40, "liq": 32, "max": 126816.44875809595}, "after": {"hits": 1, "med": 4.656887892604313, "min": 1.0, "ge2": 40, "liq": 32, "max": 126829.4826261276}, "mode": "agent_manual"}
{"set": "C116", "decision": "KEEP", "edit": "trail soft-cap 3.0->2.99", "before": {"hits": 1, "med": 4.656887892604313, "min": 1.0, "ge2": 40, "liq": 32, "max": 126829.4826261276}, "after": {"hits": 1, "med": 4.664422889653459, "min": 1.0, "ge2": 40, "liq": 32, "max": 127097.3532945174}, "mode": "agent_manual"}
{"set": "C117", "decision": "REVERT", "edit": "trail soft-cap 2.99->2.985", "before": {"hits": 1, "med": 4.664422889653459, "min": 1.0, "ge2": 40, "liq": 32, "max": 127097.3532945174}, "after": {"hits": 1, "med": 4.668190388178059, "min": 1.0, "ge2": 40, "liq": 33, "max": 127231.28862870904}, "mode": "agent_manual"}
{"set": "C118", "decision": "KEEP", "edit": "later 0.0090->0.0092", "before": {"hits": 1, "med": 4.664422889653459, "min": 1.0, "ge2": 40, "liq": 32, "max": 127097.3532945174}, "after": {"hits": 1, "med": 4.664455760445403, "min": 1.0, "ge2": 40, "liq": 32, "max": 127110.72095533162}, "mode": "agent_manual"}
{"set": "C119", "decision": "KEEP", "edit": "second 0.042/0.110->0.043/0.112", "before": {"hits": 1, "med": 4.664455760445403, "min": 1.0, "ge2": 40, "liq": 32, "max": 127110.72095533162}, "after": {"hits": 1, "med": 4.664501470246059, "min": 1.0, "ge2": 40, "liq": 32, "max": 127123.76322414572}, "mode": "agent_manual"}
{"set": "C120", "decision": "REVERT", "edit": "breakout_buffer +0.01ATR on C116 trail", "before": {"hits": 1, "med": 4.664501470246059, "min": 1.0, "ge2": 40, "liq": 32, "max": 127123.76322414572}, "after": {"hits": 1, "med": 4.664501470246059, "min": 1.0, "ge2": 40, "liq": 31, "max": 127123.76322414572}, "mode": "agent_manual"}
{"set": "C121", "decision": "KEEP", "edit": "later 0.0092->0.0094", "before": {"hits": 1, "med": 4.664501470246059, "min": 1.0, "ge2": 40, "liq": 32, "max": 127123.76322414572}, "after": {"hits": 1, "med": 4.664534220861738, "min": 1.0, "ge2": 40, "liq": 32, "max": 127137.0930308794}, "mode": "agent_manual"}
{"set": "C122", "decision": "KEEP", "edit": "second 0.043/0.112->0.044/0.114", "before": {"hits": 1, "med": 4.664534220861738, "min": 1.0, "ge2": 40, "liq": 32, "max": 127137.0930308794}, "after": {"hits": 1, "med": 4.664579856899747, "min": 1.0, "ge2": 40, "liq": 32, "max": 127150.1161914984}, "mode": "agent_manual"}
{"set": "C123", "decision": "KEEP", "edit": "trail soft-cap 2.99->2.988", "before": {"hits": 1, "med": 4.664579856899747, "min": 1.0, "ge2": 40, "liq": 32, "max": 127150.1161914984}, "after": {"hits": 1, "med": 4.666086907023231, "min": 1.0, "ge2": 40, "liq": 32, "max": 127203.7125658153}, "mode": "agent_manual"}
{"set": "C124", "decision": "REVERT", "edit": "trail soft-cap 2.988->2.986", "before": {"hits": 1, "med": 4.666086907023231, "min": 1.0, "ge2": 40, "liq": 32, "max": 127203.7125658153}, "after": {"hits": 1, "med": 4.667593957146612, "min": 1.0, "ge2": 40, "liq": 33, "max": 127257.308940134}, "mode": "agent_manual"}
{"set": "C125", "decision": "KEEP", "edit": "trail soft-cap 2.988->2.987", "before": {"hits": 1, "med": 4.666086907023231, "min": 1.0, "ge2": 40, "liq": 32, "max": 127203.7125658153}, "after": {"hits": 1, "med": 4.666840432084894, "min": 1.0, "ge2": 40, "liq": 32, "max": 127230.51075297466}, "mode": "agent_manual"}
{"set": "C126", "decision": "KEEP", "edit": "trail soft-cap 2.987->2.9865", "before": {"hits": 1, "med": 4.666840432084894, "min": 1.0, "ge2": 40, "liq": 32, "max": 127230.51075297466}, "after": {"hits": 1, "med": 4.667217194615727, "min": 1.0, "ge2": 40, "liq": 32, "max": 127243.90984655368}, "mode": "agent_manual"}
{"set": "C127", "decision": "REVERT", "edit": "trail soft-cap 2.9865->2.986", "before": {"hits": 1, "med": 4.667217194615727, "min": 1.0, "ge2": 40, "liq": 32, "max": 127243.90984655368}, "after": {"hits": 1, "med": 4.667593957146612, "min": 1.0, "ge2": 40, "liq": 33, "max": 127257.308940134}, "mode": "agent_manual"}
{"set": "C128", "decision": "KEEP", "edit": "later 0.0094->0.0096", "before": {"hits": 1, "med": 4.667217194615727, "min": 1.0, "ge2": 40, "liq": 32, "max": 127243.90984655368}, "after": {"hits": 1, "med": 4.6672498437689605, "min": 1.0, "ge2": 40, "liq": 32, "max": 127257.21166987425}, "mode": "agent_manual"}
{"set": "C129", "decision": "KEEP", "edit": "second 0.044/0.114->0.045/0.116", "before": {"hits": 1, "med": 4.6672498437689605, "min": 1.0, "ge2": 40, "liq": 32, "max": 127257.21166987425}, "after": {"hits": 1, "med": 4.667295431909312, "min": 1.0, "ge2": 40, "liq": 32, "max": 127270.22533414708}, "mode": "agent_manual"}
{"set": "C130", "decision": "KEEP", "edit": "later 0.0096->0.0098", "before": {"hits": 1, "med": 4.667295431909312, "min": 1.0, "ge2": 40, "liq": 32, "max": 127270.22533414708}, "after": {"hits": 1, "med": 4.66732796134727, "min": 1.0, "ge2": 40, "liq": 32, "max": 127283.48940684833}, "mode": "agent_manual"}
{"set": "C131", "decision": "KEEP", "edit": "second 0.045/0.116->0.046/0.118", "before": {"hits": 1, "med": 4.66732796134727, "min": 1.0, "ge2": 40, "liq": 32, "max": 127283.48940684833}, "after": {"hits": 1, "med": 4.667373475891607, "min": 1.0, "ge2": 40, "liq": 32, "max": 127296.4839873737}, "mode": "agent_manual"}
{"set": "C132", "decision": "KEEP", "edit": "later 0.0098->0.0100", "before": {"hits": 1, "med": 4.667373475891607, "min": 1.0, "ge2": 40, "liq": 32, "max": 127296.4839873737}, "after": {"hits": 1, "med": 4.667405885878093, "min": 1.0, "ge2": 40, "liq": 32, "max": 127309.71037507668}, "mode": "agent_manual"}
{"set": "C133", "decision": "REVERT", "edit": "trail soft-cap 2.9865->2.98625", "before": {"hits": 1, "med": 4.667405885878093, "min": 1.0, "ge2": 40, "liq": 32, "max": 127309.71037507668}, "after": {"hits": 1, "med": 4.667594274759617, "min": 1.0, "ge2": 40, "liq": 33, "max": 127316.41338634324}, "mode": "agent_manual"}
{"set": "C134", "decision": "KEEP", "edit": "second 0.046/0.118->0.047/0.120", "before": {"hits": 1, "med": 4.667405885878093, "min": 1.0, "ge2": 40, "liq": 32, "max": 127309.71037507668}, "after": {"hits": 1, "med": 4.667451326930399, "min": 1.0, "ge2": 40, "liq": 32, "max": 127322.68589113228}, "mode": "agent_manual"}
{"set": "C135", "decision": "KEEP", "edit": "later 0.0100->0.0102", "before": {"hits": 1, "med": 4.667451326930399, "min": 1.0, "ge2": 40, "liq": 32, "max": 127322.68589113228}, "after": {"hits": 1, "med": 4.667483617728796, "min": 1.0, "ge2": 40, "liq": 32, "max": 127335.87465941047}, "mode": "agent_manual"}
{"set": "C136", "decision": "KEEP", "edit": "second 0.047/0.120->0.048/0.122", "before": {"hits": 1, "med": 4.667483617728796, "min": 1.0, "ge2": 40, "liq": 32, "max": 127335.87465941047}, "after": {"hits": 1, "med": 4.667528985392923, "min": 1.0, "ge2": 40, "liq": 32, "max": 127348.83113027876}, "mode": "agent_manual"}
{"set": "C137", "decision": "KEEP", "edit": "later 0.0102->0.0104", "before": {"hits": 1, "med": 4.667528985392923, "min": 1.0, "ge2": 40, "liq": 32, "max": 127348.83113027876}, "after": {"hits": 1, "med": 4.667561157266175, "min": 1.0, "ge2": 40, "liq": 32, "max": 127361.98234465873}, "mode": "agent_manual"}
{"set": "C138", "decision": "REVERT", "edit": "body floor 0.45->0.44", "before": {"hits": 1, "med": 4.667561157266175, "min": 1.0, "ge2": 40, "liq": 32, "max": 127361.98234465873}, "after": {"hits": 1, "med": 4.667561157266175, "min": 1.0, "ge2": 40, "liq": 32, "max": 127361.98234465873}, "mode": "agent_manual"}
{"set": "C139", "decision": "KEEP", "edit": "second 0.048/0.122->0.049/0.124", "before": {"hits": 1, "med": 4.667561157266175, "min": 1.0, "ge2": 40, "liq": 32, "max": 127361.98234465873}, "after": {"hits": 1, "med": 4.667606451645852, "min": 1.0, "ge2": 40, "liq": 32, "max": 127374.91978962536}, "mode": "agent_manual"}
{"set": "C140", "decision": "KEEP", "edit": "later 0.0104->0.0106", "before": {"hits": 1, "med": 4.667606451645852, "min": 1.0, "ge2": 40, "liq": 32, "max": 127374.91978962536}, "after": {"hits": 1, "med": 4.667638504856469, "min": 1.0, "ge2": 40, "liq": 32, "max": 127388.0335155852}, "mode": "agent_manual"}
{"set": "C141", "decision": "KEEP", "edit": "second 0.049/0.124->0.050/0.126", "before": {"hits": 1, "med": 4.667638504856469, "min": 1.0, "ge2": 40, "liq": 32, "max": 127388.0335155852}, "after": {"hits": 1, "med": 4.6676837260553, "min": 1.0, "ge2": 40, "liq": 32, "max": 127400.95195394072}, "mode": "agent_manual"}
{"set": "C142", "decision": "KEEP", "edit": "later 0.0106->0.0108", "before": {"hits": 1, "med": 4.6676837260553, "min": 1.0, "ge2": 40, "liq": 32, "max": 127400.95195394072}, "after": {"hits": 1, "med": 4.667715660865363, "min": 1.0, "ge2": 40, "liq": 32, "max": 127414.02825691157}, "mode": "agent_manual"}
{"set": "C143", "decision": "REVERT", "edit": "range_ok 0.8->0.79", "before": {"hits": 1, "med": 4.667715660865363, "min": 1.0, "ge2": 40, "liq": 32, "max": 127414.02825691157}, "after": {"hits": 1, "med": 4.667715660865363, "min": 1.0, "ge2": 40, "liq": 32, "max": 127414.02825691157}, "mode": "agent_manual"}
{"set": "C144", "decision": "KEEP", "edit": "second 0.050/0.126->0.051/0.128", "before": {"hits": 1, "med": 4.667715660865363, "min": 1.0, "ge2": 40, "liq": 32, "max": 127414.02825691157}, "after": {"hits": 1, "med": 4.6677608089868246, "min": 1.0, "ge2": 40, "liq": 32, "max": 127426.92770794989}, "mode": "agent_manual"}
{"set": "C145", "decision": "KEEP", "edit": "later 0.0108->0.0110", "before": {"hits": 1, "med": 4.6677608089868246, "min": 1.0, "ge2": 40, "liq": 32, "max": 127426.92770794989}, "after": {"hits": 1, "med": 4.66779262565798, "min": 1.0, "ge2": 40, "liq": 32, "max": 127439.9666533139}, "mode": "agent_manual"}
{"set": "C146", "decision": "KEEP", "edit": "second 0.051/0.128->0.052/0.130", "before": {"hits": 1, "med": 4.66779262565798, "min": 1.0, "ge2": 40, "liq": 32, "max": 127439.9666533139}, "after": {"hits": 1, "med": 4.667837700805427, "min": 1.0, "ge2": 40, "liq": 32, "max": 127452.84713633294}, "mode": "agent_manual"}
{"set": "C147", "decision": "KEEP", "edit": "later 0.0110->0.0112", "before": {"hits": 1, "med": 4.667837700805427, "min": 1.0, "ge2": 40, "liq": 32, "max": 127452.84713633294}, "after": {"hits": 1, "med": 4.6678693995988905, "min": 1.0, "ge2": 40, "liq": 32, "max": 127465.84878942424}, "mode": "agent_manual"}
{"set": "C148", "decision": "REVERT", "edit": "cooldown cap 220->218", "before": {"hits": 1, "med": 4.6678693995988905, "min": 1.0, "ge2": 40, "liq": 32, "max": 127465.84878942424}, "after": {"hits": 1, "med": 4.6678693995988905, "min": 1.0, "ge2": 40, "liq": 39, "max": 127465.84878942424}, "mode": "agent_manual"}
{"set": "C149", "decision": "KEEP", "edit": "second 0.052/0.130->0.053/0.132", "before": {"hits": 1, "med": 4.6678693995988905, "min": 1.0, "ge2": 40, "liq": 32, "max": 127465.84878942424}, "after": {"hits": 1, "med": 4.6679144018755485, "min": 1.0, "ge2": 40, "liq": 32, "max": 127478.71032372564}, "mode": "agent_manual"}
{"set": "C150", "decision": "KEEP", "edit": "later 0.0112->0.0114", "before": {"hits": 1, "med": 4.6679144018755485, "min": 1.0, "ge2": 40, "liq": 32, "max": 127478.71032372564}, "after": {"hits": 1, "med": 4.667945983052104, "min": 1.0, "ge2": 40, "liq": 32, "max": 127491.67474983014}, "mode": "agent_manual"}
{"set": "C151", "decision": "KEEP", "edit": "second 0.053/0.132->0.054/0.134", "before": {"hits": 1, "med": 4.667945983052104, "min": 1.0, "ge2": 40, "liq": 32, "max": 127491.67474983014}, "after": {"hits": 1, "med": 4.6679909125610735, "min": 1.0, "ge2": 40, "liq": 32, "max": 127504.51735471922}, "mode": "agent_manual"}
{"set": "C152", "decision": "KEEP", "edit": "later 0.0114->0.0116", "before": {"hits": 1, "med": 4.6679909125610735, "min": 1.0, "ge2": 40, "liq": 32, "max": 127504.51735471922}, "after": {"hits": 1, "med": 4.6680223763810735, "min": 1.0, "ge2": 40, "liq": 32, "max": 127517.4446190734}, "mode": "agent_manual"}
