{"set": "B632", "decision": "REVERT", "edit": "post-scale trail 6.1653697404852474e-12->5.2405642794124606e-12", "before": {"hits": 1, "med": 4.654285684120027, "min": 1.0, "max": 125970.93162556336, "ge2": 40, "liq": 32}, "after": {"hits": 1, "med": 4.654285684120957, "min": 1.0, "max": 125970.9316258614, "ge2": 40, "liq": 32}, "mode": "agent_bg_loop", "ts": "2026-08-12T11:30:18.707193+00:00"}
{"set": "B633", "decision": "REVERT", "edit": "later scale 0.0028->0.0026 runner chain", "before": {"hits": 1, "med": 4.654285684120027, "min": 1.0, "max": 125970.93162556336, "ge2": 40, "liq": 32}, "after": {"hits": 1, "med": 4.654248846350058, "min": 1.0, "max": 125956.34955370188, "ge2": 40, "liq": 32}, "mode": "agent_bg_loop", "ts": "2026-08-12T11:30:38.673182+00:00"}
{"set": "B634", "decision": "REVERT", "edit": "second scale 0.011/0.045->0.0105/0.043", "before": {"hits": 1, "med": 4.654285684120027, "min": 1.0, "max": 125970.93162556336, "ge2": 40, "liq": 32}, "after": {"hits": 1, "med": 4.654237635892896, "min": 1.0, "max": 125959.81106431429, "ge2": 40, "liq": 32}, "mode": "agent_bg_loop", "ts": "2026-08-12T11:30:58.589506+00:00"}
{"set": "B635", "decision": "REVERT", "edit": "post-scale trail 6.1653697404852474e-12->5.2405642794124606e-12", "before": {"hits": 1, "med": 4.654285684120027, "min": 1.0, "max": 125970.93162556336, "ge2": 40, "liq": 32}, "after": {"hits": 1, "med": 4.654285684120957, "min": 1.0, "max": 125970.9316258614, "ge2": 40, "liq": 32}, "mode": "agent_bg_loop", "ts": "2026-08-12T11:31:18.515492+00:00"}
{"set": "B636", "decision": "REVERT", "edit": "later scale 0.0028->0.0026 runner chain", "before": {"hits": 1, "med": 4.654285684120027, "min": 1.0, "max": 125970.93162556336, "ge2": 40, "liq": 32}, "after": {"hits": 1, "med": 4.654248846350058, "min": 1.0, "max": 125956.34955370188, "ge2": 40, "liq": 32}, "mode": "agent_bg_loop", "ts": "2026-08-12T11:31:38.409376+00:00"}
{"set": "B637", "decision": "REVERT", "edit": "second scale 0.011/0.045->0.0105/0.043", "before": {"hits": 1, "med": 4.654285684120027, "min": 1.0, "max": 125970.93162556336, "ge2": 40, "liq": 32}, "after": {"hits": 1, "med": 4.654237635892896, "min": 1.0, "max": 125959.81106431429, "ge2": 40, "liq": 32}, "mode": "agent_bg_loop", "ts": "2026-08-12T11:31:58.343293+00:00"}
{"set": "B638", "decision": "REVERT", "edit": "post-scale trail 6.1653697404852474e-12->5.2405642794124606e-12", "before": {"hits": 1, "med": 4.654285684120027, "min": 1.0, "max": 125970.93162556336, "ge2": 40, "liq": 32}, "after": {"hits": 1, "med": 4.654285684120957, "min": 1.0, "max": 125970.9316258614, "ge2": 40, "liq": 32}, "mode": "agent_bg_loop", "ts": "2026-08-12T11:32:18.701789+00:00"}
{"set": "B639", "decision": "REVERT", "edit": "later scale 0.0028->0.0026 runner chain", "before": {"hits": 1, "med": 4.654285684120027, "min": 1.0, "max": 125970.93162556336, "ge2": 40, "liq": 32}, "after": {"hits": 1, "med": 4.654248846350058, "min": 1.0, "max": 125956.34955370188, "ge2": 40, "liq": 32}, "mode": "agent_bg_loop", "ts": "2026-08-12T11:32:38.618965+00:00"}
{"set": "B640", "decision": "REVERT", "edit": "second scale 0.011/0.045->0.0105/0.043", "before": {"hits": 1, "med": 4.654285684120027, "min": 1.0, "max": 125970.93162556336, "ge2": 40, "liq": 32}, "after": {"hits": 1, "med": 4.654237635892896, "min": 1.0, "max": 125959.81106431429, "ge2": 40, "liq": 32}, "mode": "agent_bg_loop", "ts": "2026-08-12T11:32:58.898257+00:00"}
{"set": "B641", "decision": "REVERT", "edit": "post-scale trail 6.1653697404852474e-12->5.2405642794124606e-12", "before": {"hits": 1, "med": 4.654285684120027, "min": 1.0, "max": 125970.93162556336, "ge2": 40, "liq": 32}, "after": {"hits": 1, "med": 4.654285684120957, "min": 1.0, "max": 125970.9316258614, "ge2": 40, "liq": 32}, "mode": "agent_bg_loop", "ts": "2026-08-12T11:33:18.734045+00:00"}
{"set": "B642", "decision": "REVERT", "edit": "later scale 0.0028->0.0026 runner chain", "before": {"hits": 1, "med": 4.654285684120027, "min": 1.0, "max": 125970.93162556336, "ge2": 40, "liq": 32}, "after": {"hits": 1, "med": 4.654248846350058, "min": 1.0, "max": 125956.34955370188, "ge2": 40, "liq": 32}, "mode": "agent_bg_loop", "ts": "2026-08-12T11:33:39.030060+00:00"}
{"set": "B643", "decision": "REVERT", "edit": "second scale 0.011/0.045->0.0105/0.043", "before": {"hits": 1, "med": 4.654285684120027, "min": 1.0, "max": 125970.93162556336, "ge2": 40, "liq": 32}, "after": {"hits": 1, "med": 4.654237635892896, "min": 1.0, "max": 125959.81106431429, "ge2": 40, "liq": 32}, "mode": "agent_bg_loop", "ts": "2026-08-12T11:33:59.029360+00:00"}
{"set": "B644", "decision": "REVERT", "edit": "post-scale trail 6.1653697404852474e-12->5.2405642794124606e-12", "before": {"hits": 1, "med": 4.654285684120027, "min": 1.0, "max": 125970.93162556336, "ge2": 40, "liq": 32}, "after": {"hits": 1, "med": 4.654285684120957, "min": 1.0, "max": 125970.9316258614, "ge2": 40, "liq": 32}, "mode": "agent_bg_loop", "ts": "2026-08-12T11:34:19.065553+00:00"}
{"set": "B645", "decision": "REVERT", "edit": "later scale 0.0028->0.0026 runner chain", "before": {"hits": 1, "med": 4.654285684120027, "min": 1.0, "max": 125970.93162556336, "ge2": 40, "liq": 32}, "after": {"hits": 1, "med": 4.654248846350058, "min": 1.0, "max": 125956.34955370188, "ge2": 40, "liq": 32}, "mode": "agent_bg_loop", "ts": "2026-08-12T11:34:39.002292+00:00"}
{"set": "B646", "decision": "REVERT", "edit": "second scale 0.011/0.045->0.0105/0.043", "before": {"hits": 1, "med": 4.654285684120027, "min": 1.0, "max": 125970.93162556336, "ge2": 40, "liq": 32}, "after": {"hits": 1, "med": 4.654237635892896, "min": 1.0, "max": 125959.81106431429, "ge2": 40, "liq": 32}, "mode": "agent_bg_loop", "ts": "2026-08-12T11:34:58.942845+00:00"}
{"set": "B647", "decision": "REVERT", "edit": "post-scale trail 6.1653697404852474e-12->5.2405642794124606e-12", "before": {"hits": 1, "med": 4.654285684120027, "min": 1.0, "max": 125970.93162556336, "ge2": 40, "liq": 32}, "after": {"hits": 1, "med": 4.654285684120957, "min": 1.0, "max": 125970.9316258614, "ge2": 40, "liq": 32}, "mode": "agent_bg_loop", "ts": "2026-08-12T11:35:18.926350+00:00"}
{"set": "B648", "decision": "REVERT", "edit": "later scale 0.0028->0.0026 runner chain", "before": {"hits": 1, "med": 4.654285684120027, "min": 1.0, "max": 125970.93162556336, "ge2": 40, "liq": 32}, "after": {"hits": 1, "med": 4.654248846350058, "min": 1.0, "max": 125956.34955370188, "ge2": 40, "liq": 32}, "mode": "agent_bg_loop", "ts": "2026-08-12T11:35:38.910677+00:00"}
{"set": "B649", "decision": "REVERT", "edit": "second scale 0.011/0.045->0.0105/0.043", "before": {"hits": 1, "med": 4.654285684120027, "min": 1.0, "max": 125970.93162556336, "ge2": 40, "liq": 32}, "after": {"hits": 1, "med": 4.654237635892896, "min": 1.0, "max": 125959.81106431429, "ge2": 40, "liq": 32}, "mode": "agent_bg_loop", "ts": "2026-08-12T11:35:58.856989+00:00"}
{"set": "B650", "decision": "REVERT", "edit": "post-scale trail 6.1653697404852474e-12->5.2405642794124606e-12", "before": {"hits": 1, "med": 4.654285684120027, "min": 1.0, "max": 125970.93162556336, "ge2": 40, "liq": 32}, "after": {"hits": 1, "med": 4.654285684120957, "min": 1.0, "max": 125970.9316258614, "ge2": 40, "liq": 32}, "mode": "agent_bg_loop", "ts": "2026-08-12T11:36:18.712186+00:00"}
{"set": "B651", "decision": "REVERT", "edit": "later scale 0.0028->0.0026 runner chain", "before": {"hits": 1, "med": 4.654285684120027, "min": 1.0, "max": 125970.93162556336, "ge2": 40, "liq": 32}, "after": {"hits": 1, "med": 4.654248846350058, "min": 1.0, "max": 125956.34955370188, "ge2": 40, "liq": 32}, "mode": "agent_bg_loop", "ts": "2026-08-12T11:36:38.639307+00:00"}
{"set": "B652", "decision": "REVERT", "edit": "second scale 0.011/0.045->0.0105/0.043", "before": {"hits": 1, "med": 4.654285684120027, "min": 1.0, "max": 125970.93162556336, "ge2": 40, "liq": 32}, "after": {"hits": 1, "med": 4.654237635892896, "min": 1.0, "max": 125959.81106431429, "ge2": 40, "liq": 32}, "mode": "agent_bg_loop", "ts": "2026-08-12T11:36:58.502568+00:00"}
{"set": "B653", "decision": "REVERT", "edit": "post-scale trail 6.1653697404852474e-12->5.2405642794124606e-12", "before": {"hits": 1, "med": 4.654285684120027, "min": 1.0, "max": 125970.93162556336, "ge2": 40, "liq": 32}, "after": {"hits": 1, "med": 4.654285684120957, "min": 1.0, "max": 125970.9316258614, "ge2": 40, "liq": 32}, "mode": "agent_bg_loop", "ts": "2026-08-12T11:37:18.400589+00:00"}
{"set": "B654", "decision": "REVERT", "edit": "later scale 0.0028->0.0026 runner chain", "before": {"hits": 1, "med": 4.654285684120027, "min": 1.0, "max": 125970.93162556336, "ge2": 40, "liq": 32}, "after": {"hits": 1, "med": 4.654248846350058, "min": 1.0, "max": 125956.34955370188, "ge2": 40, "liq": 32}, "mode": "agent_bg_loop", "ts": "2026-08-12T11:37:38.316469+00:00"}
{"set": "B655", "decision": "REVERT", "edit": "second scale 0.011/0.045->0.0105/0.043", "before": {"hits": 1, "med": 4.654285684120027, "min": 1.0, "max": 125970.93162556336, "ge2": 40, "liq": 32}, "after": {"hits": 1, "med": 4.654237635892896, "min": 1.0, "max": 125959.81106431429, "ge2": 40, "liq": 32}, "mode": "agent_bg_loop", "ts": "2026-08-12T11:37:58.594644+00:00"}
{"set": "B656", "decision": "REVERT", "edit": "post-scale trail 6.1653697404852474e-12->5.2405642794124606e-12", "before": {"hits": 1, "med": 4.654285684120027, "min": 1.0, "max": 125970.93162556336, "ge2": 40, "liq": 32}, "after": {"hits": 1, "med": 4.654285684120957, "min": 1.0, "max": 125970.9316258614, "ge2": 40, "liq": 32}, "mode": "agent_bg_loop", "ts": "2026-08-12T11:38:18.705199+00:00"}
{"set": "B657", "decision": "REVERT", "edit": "later scale 0.0028->0.0026 runner chain", "before": {"hits": 1, "med": 4.654285684120027, "min": 1.0, "max": 125970.93162556336, "ge2": 40, "liq": 32}, "after": {"hits": 1, "med": 4.654248846350058, "min": 1.0, "max": 125956.34955370188, "ge2": 40, "liq": 32}, "mode": "agent_bg_loop", "ts": "2026-08-12T11:38:38.818262+00:00"}
{"set": "B658", "decision": "REVERT", "edit": "second scale 0.011/0.045->0.0105/0.043", "before": {"hits": 1, "med": 4.654285684120027, "min": 1.0, "max": 125970.93162556336, "ge2": 40, "liq": 32}, "after": {"hits": 1, "med": 4.654237635892896, "min": 1.0, "max": 125959.81106431429, "ge2": 40, "liq": 32}, "mode": "agent_bg_loop", "ts": "2026-08-12T11:38:58.781975+00:00"}
{"set": "B659", "decision": "REVERT", "edit": "post-scale trail 6.1653697404852474e-12->5.2405642794124606e-12", "before": {"hits": 1, "med": 4.654285684120027, "min": 1.0, "max": 125970.93162556336, "ge2": 40, "liq": 32}, "after": {"hits": 1, "med": 4.654285684120957, "min": 1.0, "max": 125970.9316258614, "ge2": 40, "liq": 32}, "mode": "agent_bg_loop", "ts": "2026-08-12T11:39:18.939412+00:00"}
{"set": "B660", "decision": "REVERT", "edit": "later scale 0.0028->0.0026 runner chain", "before": {"hits": 1, "med": 4.654285684120027, "min": 1.0, "max": 125970.93162556336, "ge2": 40, "liq": 32}, "after": {"hits": 1, "med": 4.654248846350058, "min": 1.0, "max": 125956.34955370188, "ge2": 40, "liq": 32}, "mode": "agent_bg_loop", "ts": "2026-08-12T11:39:38.953859+00:00"}
{"set": "B661", "decision": "REVERT", "edit": "second scale 0.011/0.045->0.0105/0.043", "before": {"hits": 1, "med": 4.654285684120027, "min": 1.0, "max": 125970.93162556336, "ge2": 40, "liq": 32}, "after": {"hits": 1, "med": 4.654237635892896, "min": 1.0, "max": 125959.81106431429, "ge2": 40, "liq": 32}, "mode": "agent_bg_loop", "ts": "2026-08-12T11:39:58.986095+00:00"}
{"set": "B662", "decision": "REVERT", "edit": "post-scale trail 6.1653697404852474e-12->5.2405642794124606e-12", "before": {"hits": 1, "med": 4.654285684120027, "min": 1.0, "max": 125970.93162556336, "ge2": 40, "liq": 32}, "after": {"hits": 1, "med": 4.654285684120957, "min": 1.0, "max": 125970.9316258614, "ge2": 40, "liq": 32}, "mode": "agent_bg_loop", "ts": "2026-08-12T11:40:18.963055+00:00"}
{"set": "B663", "decision": "REVERT", "edit": "later scale 0.0028->0.0026 runner chain", "before": {"hits": 1, "med": 4.654285684120027, "min": 1.0, "max": 125970.93162556336, "ge2": 40, "liq": 32}, "after": {"hits": 1, "med": 4.654248846350058, "min": 1.0, "max": 125956.34955370188, "ge2": 40, "liq": 32}, "mode": "agent_bg_loop", "ts": "2026-08-12T11:40:38.976727+00:00"}
{"set": "B664", "decision": "REVERT", "edit": "second scale 0.011/0.045->0.0105/0.043", "before": {"hits": 1, "med": 4.654285684120027, "min": 1.0, "max": 125970.93162556336, "ge2": 40, "liq": 32}, "after": {"hits": 1, "med": 4.654237635892896, "min": 1.0, "max": 125959.81106431429, "ge2": 40, "liq": 32}, "mode": "agent_bg_loop", "ts": "2026-08-12T11:40:58.846989+00:00"}
{"set": "B665", "decision": "REVERT", "edit": "post-scale trail 6.1653697404852474e-12->5.2405642794124606e-12", "before": {"hits": 1, "med": 4.654285684120027, "min": 1.0, "max": 125970.93162556336, "ge2": 40, "liq": 32}, "after": {"hits": 1, "med": 4.654285684120957, "min": 1.0, "max": 125970.9316258614, "ge2": 40, "liq": 32}, "mode": "agent_bg_loop", "ts": "2026-08-12T11:41:18.806878+00:00"}
{"set": "B666", "decision": "REVERT", "edit": "later scale 0.0028->0.0026 runner chain", "before": {"hits": 1, "med": 4.654285684120027, "min": 1.0, "max": 125970.93162556336, "ge2": 40, "liq": 32}, "after": {"hits": 1, "med": 4.654248846350058, "min": 1.0, "max": 125956.34955370188, "ge2": 40, "liq": 32}, "mode": "agent_bg_loop", "ts": "2026-08-12T11:41:38.811689+00:00"}
{"set": "B667", "decision": "REVERT", "edit": "second scale 0.011/0.045->0.0105/0.043", "before": {"hits": 1, "med": 4.654285684120027, "min": 1.0, "max": 125970.93162556336, "ge2": 40, "liq": 32}, "after": {"hits": 1, "med": 4.654237635892896, "min": 1.0, "max": 125959.81106431429, "ge2": 40, "liq": 32}, "mode": "agent_bg_loop", "ts": "2026-08-12T11:41:58.815390+00:00"}
{"set": "B668", "decision": "REVERT", "edit": "post-scale trail 6.1653697404852474e-12->5.2405642794124606e-12", "before": {"hits": 1, "med": 4.654285684120027, "min": 1.0, "max": 125970.93162556336, "ge2": 40, "liq": 32}, "after": {"hits": 1, "med": 4.654285684120957, "min": 1.0, "max": 125970.9316258614, "ge2": 40, "liq": 32}, "mode": "agent_bg_loop", "ts": "2026-08-12T11:42:18.892166+00:00"}
{"set": "B669", "decision": "REVERT", "edit": "later scale 0.0028->0.0026 runner chain", "before": {"hits": 1, "med": 4.654285684120027, "min": 1.0, "max": 125970.93162556336, "ge2": 40, "liq": 32}, "after": {"hits": 1, "med": 4.654248846350058, "min": 1.0, "max": 125956.34955370188, "ge2": 40, "liq": 32}, "mode": "agent_bg_loop", "ts": "2026-08-12T11:42:38.770723+00:00"}
{"set": "B670", "decision": "REVERT", "edit": "second scale 0.011/0.045->0.0105/0.043", "before": {"hits": 1, "med": 4.654285684120027, "min": 1.0, "max": 125970.93162556336, "ge2": 40, "liq": 32}, "after": {"hits": 1, "med": 4.654237635892896, "min": 1.0, "max": 125959.81106431429, "ge2": 40, "liq": 32}, "mode": "agent_bg_loop", "ts": "2026-08-12T11:42:58.845985+00:00"}
{"set": "B671", "decision": "REVERT", "edit": "post-scale trail 6.1653697404852474e-12->5.2405642794124606e-12", "before": {"hits": 1, "med": 4.654285684120027, "min": 1.0, "max": 125970.93162556336, "ge2": 40, "liq": 32}, "after": {"hits": 1, "med": 4.654285684120957, "min": 1.0, "max": 125970.9316258614, "ge2": 40, "liq": 32}, "mode": "agent_bg_loop", "ts": "2026-08-12T11:43:18.869820+00:00"}
{"set": "B672", "decision": "REVERT", "edit": "later scale 0.0028->0.0026 runner chain", "before": {"hits": 1, "med": 4.654285684120027, "min": 1.0, "max": 125970.93162556336, "ge2": 40, "liq": 32}, "after": {"hits": 1, "med": 4.654248846350058, "min": 1.0, "max": 125956.34955370188, "ge2": 40, "liq": 32}, "mode": "agent_bg_loop", "ts": "2026-08-12T11:43:38.954324+00:00"}
{"set": "B673", "decision": "REVERT", "edit": "second scale 0.011/0.045->0.0105/0.043", "before": {"hits": 1, "med": 4.654285684120027, "min": 1.0, "max": 125970.93162556336, "ge2": 40, "liq": 32}, "after": {"hits": 1, "med": 4.654237635892896, "min": 1.0, "max": 125959.81106431429, "ge2": 40, "liq": 32}, "mode": "agent_bg_loop", "ts": "2026-08-12T11:43:59.204214+00:00"}
{"set": "B674", "decision": "REVERT", "edit": "post-scale trail 6.1653697404852474e-12->5.2405642794124606e-12", "before": {"hits": 1, "med": 4.654285684120027, "min": 1.0, "max": 125970.93162556336, "ge2": 40, "liq": 32}, "after": {"hits": 1, "med": 4.654285684120957, "min": 1.0, "max": 125970.9316258614, "ge2": 40, "liq": 32}, "mode": "agent_bg_loop", "ts": "2026-08-12T11:44:20.136462+00:00"}
{"set": "B675", "decision": "REVERT", "edit": "later scale 0.0028->0.0026 runner chain", "before": {"hits": 1, "med": 4.654285684120027, "min": 1.0, "max": 125970.93162556336, "ge2": 40, "liq": 32}, "after": {"hits": 1, "med": 4.654248846350058, "min": 1.0, "max": 125956.34955370188, "ge2": 40, "liq": 32}, "mode": "agent_bg_loop", "ts": "2026-08-12T11:44:41.480093+00:00"}
{"set": "B676", "decision": "REVERT", "edit": "second scale 0.011/0.045->0.0105/0.043", "before": {"hits": 1, "med": 4.654285684120027, "min": 1.0, "max": 125970.93162556336, "ge2": 40, "liq": 32}, "after": {"hits": 1, "med": 4.654237635892896, "min": 1.0, "max": 125959.81106431429, "ge2": 40, "liq": 32}, "mode": "agent_bg_loop", "ts": "2026-08-12T11:45:01.756608+00:00"}
{"set": "B677", "decision": "REVERT", "edit": "post-scale trail 6.1653697404852474e-12->5.2405642794124606e-12", "before": {"hits": 1, "med": 4.654285684120027, "min": 1.0, "max": 125970.93162556336, "ge2": 40, "liq": 32}, "after": {"hits": 1, "med": 4.654285684120957, "min": 1.0, "max": 125970.9316258614, "ge2": 40, "liq": 32}, "mode": "agent_bg_loop", "ts": "2026-08-12T11:45:21.789868+00:00"}
{"set": "B678", "decision": "REVERT", "edit": "later scale 0.0028->0.0026 runner chain", "before": {"hits": 1, "med": 4.654285684120027, "min": 1.0, "max": 125970.93162556336, "ge2": 40, "liq": 32}, "after": {"hits": 1, "med": 4.654248846350058, "min": 1.0, "max": 125956.34955370188, "ge2": 40, "liq": 32}, "mode": "agent_bg_loop", "ts": "2026-08-12T11:45:41.847563+00:00"}
{"set": "B679", "decision": "REVERT", "edit": "second scale 0.011/0.045->0.0105/0.043", "before": {"hits": 1, "med": 4.654285684120027, "min": 1.0, "max": 125970.93162556336, "ge2": 40, "liq": 32}, "after": {"hits": 1, "med": 4.654237635892896, "min": 1.0, "max": 125959.81106431429, "ge2": 40, "liq": 32}, "mode": "agent_bg_loop", "ts": "2026-08-12T11:46:01.858446+00:00"}
{"set": "B680", "decision": "REVERT", "edit": "post-scale trail 6.1653697404852474e-12->5.2405642794124606e-12", "before": {"hits": 1, "med": 4.654285684120027, "min": 1.0, "max": 125970.93162556336, "ge2": 40, "liq": 32}, "after": {"hits": 1, "med": 4.654285684120957, "min": 1.0, "max": 125970.9316258614, "ge2": 40, "liq": 32}, "mode": "agent_bg_loop", "ts": "2026-08-12T11:46:21.831779+00:00"}
{"set": "B681", "decision": "REVERT", "edit": "later scale 0.0028->0.0026 runner chain", "before": {"hits": 1, "med": 4.654285684120027, "min": 1.0, "max": 125970.93162556336, "ge2": 40, "liq": 32}, "after": {"hits": 1, "med": 4.654248846350058, "min": 1.0, "max": 125956.34955370188, "ge2": 40, "liq": 32}, "mode": "agent_bg_loop", "ts": "2026-08-12T11:46:41.757440+00:00"}
{"set": "B682", "decision": "REVERT", "edit": "second scale 0.011/0.045->0.0105/0.043", "before": {"hits": 1, "med": 4.654285684120027, "min": 1.0, "max": 125970.93162556336, "ge2": 40, "liq": 32}, "after": {"hits": 1, "med": 4.654237635892896, "min": 1.0, "max": 125959.81106431429, "ge2": 40, "liq": 32}, "mode": "agent_bg_loop", "ts": "2026-08-12T11:47:01.873154+00:00"}
{"set": "B683", "decision": "REVERT", "edit": "post-scale trail 6.1653697404852474e-12->5.2405642794124606e-12", "before": {"hits": 1, "med": 4.654285684120027, "min": 1.0, "max": 125970.93162556336, "ge2": 40, "liq": 32}, "after": {"hits": 1, "med": 4.654285684120957, "min": 1.0, "max": 125970.9316258614, "ge2": 40, "liq": 32}, "mode": "agent_bg_loop", "ts": "2026-08-12T11:47:21.793595+00:00"}
{"set": "B684", "decision": "REVERT", "edit": "later scale 0.0028->0.0026 runner chain", "before": {"hits": 1, "med": 4.654285684120027, "min": 1.0, "max": 125970.93162556336, "ge2": 40, "liq": 32}, "after": {"hits": 1, "med": 4.654248846350058, "min": 1.0, "max": 125956.34955370188, "ge2": 40, "liq": 32}, "mode": "agent_bg_loop", "ts": "2026-08-12T11:47:41.804938+00:00"}
{"set": "B685", "decision": "REVERT", "edit": "second scale 0.011/0.045->0.0105/0.043", "before": {"hits": 1, "med": 4.654285684120027, "min": 1.0, "max": 125970.93162556336, "ge2": 40, "liq": 32}, "after": {"hits": 1, "med": 4.654237635892896, "min": 1.0, "max": 125959.81106431429, "ge2": 40, "liq": 32}, "mode": "agent_bg_loop", "ts": "2026-08-12T11:48:01.860499+00:00"}
{"set": "B686", "decision": "REVERT", "edit": "post-scale trail 6.1653697404852474e-12->5.2405642794124606e-12", "before": {"hits": 1, "med": 4.654285684120027, "min": 1.0, "max": 125970.93162556336, "ge2": 40, "liq": 32}, "after": {"hits": 1, "med": 4.654285684120957, "min": 1.0, "max": 125970.9316258614, "ge2": 40, "liq": 32}, "mode": "agent_bg_loop", "ts": "2026-08-12T11:48:21.990749+00:00"}
{"set": "B687", "decision": "REVERT", "edit": "later scale 0.0028->0.0026 runner chain", "before": {"hits": 1, "med": 4.654285684120027, "min": 1.0, "max": 125970.93162556336, "ge2": 40, "liq": 32}, "after": {"hits": 1, "med": 4.654248846350058, "min": 1.0, "max": 125956.34955370188, "ge2": 40, "liq": 32}, "mode": "agent_bg_loop", "ts": "2026-08-12T11:48:42.248427+00:00"}
{"set": "B688", "decision": "REVERT", "edit": "second scale 0.011/0.045->0.0105/0.043", "before": {"hits": 1, "med": 4.654285684120027, "min": 1.0, "max": 125970.93162556336, "ge2": 40, "liq": 32}, "after": {"hits": 1, "med": 4.654237635892896, "min": 1.0, "max": 125959.81106431429, "ge2": 40, "liq": 32}, "mode": "agent_bg_loop", "ts": "2026-08-12T11:49:02.699395+00:00"}
