{"set": "B074", "decision": "REVERT", "edit": "lev_cap 1.5->1.45", "edit_name": "lev-0.05", "reason": "liq worse", "before": {"hits": 1, "med": 4.531958919810974, "ge2": 40, "liq": 32, "liqw": 18}, "after": {"hits": 1, "med": 4.531958919810974, "ge2": 40, "liq": 33, "liqw": 18}, "ts": "2026-08-12T07:55:05.215901+00:00"}
{"set": "B075", "decision": "REVERT", "edit": "reentry_cap 120", "edit_name": "reentry120", "reason": "liq worse", "before": {"hits": 1, "med": 4.531958919810974, "ge2": 40, "liq": 32, "liqw": 18}, "after": {"hits": 1, "med": 4.467301071167151, "ge2": 40, "liq": 34, "liqw": 19}, "ts": "2026-08-12T07:55:38.527444+00:00"}
{"set": "B076", "decision": "REVERT", "edit": "later_scale 0.019->0.018", "edit_name": "later-0.001", "reason": "no primary improve", "before": {"hits": 1, "med": 4.531958919810974, "ge2": 40, "liq": 32, "liqw": 18}, "after": {"hits": 1, "med": 4.53175334827985, "ge2": 40, "liq": 32, "liqw": 18}, "ts": "2026-08-12T07:56:08.997400+00:00"}
{"set": "B074", "decision": "KEEP", "edit": "later 0.016->0.015 (agent manual)", "reason": "KEEP med 4.5208->4.5318 liq 32->32", "before": {"med": 4.520768411995257, "liq": 32, "liqw": 18, "ge2": 40, "hits": 1}, "after": {"med": 4.53175334827985, "liq": 32, "liqw": 18, "ge2": 40, "hits": 1}, "mode": "agent_manual"}
{"set": "B077", "decision": "KEEP", "edit": "trail_mult 3.125e-08->1.5625e-08", "edit_name": "trail*0.5", "reason": "median up", "before": {"hits": 1, "med": 4.531958919810974, "ge2": 40, "liq": 32, "liqw": 18}, "after": {"hits": 1, "med": 4.531958948114079, "ge2": 40, "liq": 32, "liqw": 18}, "ts": "2026-08-12T07:56:39.241703+00:00"}
{"set": "B078", "decision": "KEEP", "edit": "slope_diff 200->205", "edit_name": "slope+5", "reason": "median up", "before": {"hits": 1, "med": 4.506200586012352, "ge2": 40, "liq": 32, "liqw": 18}, "after": {"hits": 1, "med": 4.525658142830981, "ge2": 40, "liq": 32, "liqw": 18}, "ts": "2026-08-12T07:57:08.773982+00:00"}
{"set": "B079", "decision": "REVERT", "edit": "slope_diff 205->200", "edit_name": "slope-5", "reason": "no primary improve", "before": {"hits": 1, "med": 4.525658142830981, "ge2": 40, "liq": 32, "liqw": 18}, "after": {"hits": 1, "med": 4.525658142830981, "ge2": 40, "liq": 32, "liqw": 18}, "ts": "2026-08-12T07:57:40.789324+00:00"}
{"set": "B080", "decision": "KEEP", "edit": "risk_cap 0.0024->0.00235", "edit_name": "risk-", "reason": "median up", "before": {"hits": 1, "med": 4.525658142830981, "ge2": 40, "liq": 32, "liqw": 18}, "after": {"hits": 1, "med": 4.5311269248412565, "ge2": 40, "liq": 32, "liqw": 18}, "ts": "2026-08-12T07:58:19.539305+00:00"}
{"set": "B080", "decision": "KEEP", "edit": "later 0.015->0.014", "before": {"med": 4.525658142830981, "liq": 32, "liqw": 18, "ge2": 40, "hits": 1}, "after": {"med": 4.530564512501695, "liq": 32, "liqw": 18, "ge2": 40, "hits": 1}, "mode": "agent_manual"}
{"set": "B081", "decision": "KEEP", "edit": "trail 5e-7->2.5e-7", "before": {"med": 4.530564512501695, "liq": 32}, "after": {"med": 4.530565551892332, "liq": 32}, "mode": "agent_manual"}
{"set": "B082", "decision": "KEEP", "edit": "later 0.014->0.013", "before": {"med": 4.530564512501695, "liq": 32}, "after": {"med": 4.535488608531284, "liq": 32}, "mode": "agent_manual"}
{"set": "B083", "decision": "KEEP", "edit": "later 0.013->0.012", "before": {"med": 4.535488608531284, "liq": 32}, "after": {"med": 4.540428398539186, "liq": 32}, "mode": "agent_manual"}
{"set": "B084", "decision": "KEEP", "edit": "later 0.012->0.011", "before": {"med": 4.540428398539186, "liq": 32}, "after": {"med": 4.5453849692417245, "liq": 32}, "mode": "agent_manual"}
{"set": "B085", "decision": "KEEP", "edit": "later 0.011->0.010", "before": {"med": 4.5453849692417245, "liq": 32, "hits": 1}, "after": {"med": 4.550358368003367, "liq": 32, "hits": 1}, "mode": "agent_manual"}
{"set": "B086", "decision": "REVERT", "edit": "trail 2.5e-7->1.25e-7", "before": {"med": 4.550358368003367, "liq": 32, "hits": 1}, "after": {"med": 4.550358368003367, "liq": 32, "hits": 1}, "mode": "agent_manual"}
{"set": "B087", "decision": "KEEP", "edit": "later 0.010->0.009", "before": {"med": 4.550358368003367, "liq": 32, "hits": 1}, "after": {"med": 4.555348642226148, "liq": 32, "hits": 1}, "mode": "agent_manual"}
{"set": "B088", "decision": "KEEP", "edit": "later 0.009->0.008", "before": {"med": 4.555348642226148, "min": 1.0, "liq": 32, "hits": 1}, "after": {"med": 4.560355839348428, "min": 1.0, "liq": 32, "hits": 1}, "mode": "agent_manual"}
{"set": "B089", "decision": "REVERT", "edit": "win_size_mult 1.75->1.80", "before": {"med": 4.560355839348428, "min": 1.0, "liq": 32, "hits": 1}, "after": {"med": 4.372731566921374, "min": 1.0, "liq": 30, "hits": 1}, "mode": "agent_manual"}
{"set": "B090", "decision": "REVERT", "edit": "cooldown cap 220->215", "before": {"med": 4.560355839348428, "min": 1.0, "ge2": 40, "liq": 32, "hits": 1}, "after": {"med": 4.560355839348428, "min": 1.0, "ge2": 40, "liq": 39, "hits": 1}, "mode": "agent_manual"}
{"set": "B091", "decision": "KEEP", "edit": "later 0.008->0.007", "before": {"med": 4.560355839348428, "min": 1.0, "ge2": 40, "liq": 32, "hits": 1}, "after": {"med": 4.5653800068436405, "min": 1.0, "ge2": 40, "liq": 32, "hits": 1}, "mode": "agent_manual"}
{"set": "B092", "decision": "KEEP", "edit": "second scale 0.02/0.08->0.018/0.075", "before": {"med": 4.5653800068436405, "min": 1.0, "ge2": 40, "liq": 32, "hits": 1}, "after": {"med": 4.567912276823382, "min": 1.0, "ge2": 40, "liq": 32, "hits": 1}, "mode": "agent_manual"}
{"set": "B093", "decision": "REVERT", "edit": "trail_unlock_mult 1.3->1.25", "before": {"med": 4.567912276823382, "min": 1.0, "ge2": 40, "liq": 32, "hits": 1}, "after": {"med": 3.3664254983614934, "min": 1.0, "ge2": 38, "liq": 30, "hits": 1}, "mode": "agent_manual"}
{"set": "B094", "decision": "KEEP", "edit": "later 0.007->0.006", "before": {"med": 4.567912276823382, "min": 1.0, "ge2": 40, "liq": 32, "hits": 1}, "after": {"med": 4.572961593789355, "min": 1.0, "ge2": 40, "liq": 32, "hits": 1}, "mode": "agent_manual"}
{"set": "B096", "decision": "REVERT", "edit": "ema_slope diff 200->210", "before": {"med": 4.572961593789355, "min": 1.0, "ge2": 40, "liq": 32, "hits": 1}, "after": {"med": 4.558125829715237, "min": 1.0, "ge2": 40, "liq": 32, "hits": 1}, "mode": "agent_manual"}
{"set": "B097", "decision": "REVERT", "edit": "risk_cap 0.0024->0.00245", "before": {"med": 4.572961593789355, "min": 1.0, "ge2": 40, "liq": 32, "hits": 1}, "after": {"med": 4.500813165146383, "min": 1.0, "ge2": 39, "liq": 32, "hits": 1}, "mode": "agent_manual"}
{"set": "B098", "decision": "KEEP", "edit": "later 0.006->0.0055", "before": {"med": 4.572961593789355, "min": 1.0, "ge2": 40, "liq": 32, "hits": 1}, "after": {"med": 4.575492654407406, "min": 1.0, "ge2": 40, "liq": 32, "hits": 1}, "mode": "agent_manual"}
{"set": "B099", "decision": "REVERT", "edit": "win_size_max 5.0->5.25", "before": {"med": 4.575492654407406, "min": 1.0, "ge2": 40, "liq": 32, "hits": 1}, "after": {"med": 4.575492654407406, "min": 1.0, "ge2": 40, "liq": 32, "hits": 1}, "mode": "agent_manual"}
{"set": "B101", "decision": "KEEP", "edit": "second scale 0.018/0.075->0.016/0.07", "before": {"med": 4.575492654407406, "min": 1.0, "ge2": 40, "liq": 32, "hits": 1}, "after": {"med": 4.578036748488184, "min": 1.0, "ge2": 40, "liq": 32, "hits": 1}, "mode": "agent_manual"}
{"set": "B102", "decision": "KEEP", "edit": "later 0.0055->0.005", "before": {"med": 4.578036748488184, "min": 1.0, "ge2": 40, "liq": 32, "hits": 1}, "after": {"med": 4.580576157904999, "min": 1.0, "ge2": 40, "liq": 32, "hits": 1}, "mode": "agent_manual", "sec": 18.7}
{"set": "B103", "decision": "KEEP", "edit": "later 0.005->0.0045", "before": {"med": 4.580576157904999, "min": 1.0, "ge2": 40, "liq": 32, "hits": 1}, "after": {"med": 4.583119852941831, "min": 1.0, "ge2": 40, "liq": 32, "hits": 1}, "mode": "agent_manual", "sec": 23.5}
{"set": "B104", "decision": "REVERT", "edit": "trail floor soft-cap 5.0->4.8", "before": {"med": 4.583119852941831, "min": 1.0, "ge2": 40, "liq": 32, "hits": 1}, "after": {"med": 4.583119852941831, "min": 1.0, "ge2": 40, "liq": 32, "hits": 1}, "mode": "agent_manual", "sec": 19.6}
{"set": "B106", "decision": "KEEP", "edit": "second scale 0.016/0.07->0.015/0.065", "before": {"med": 4.583119852941831, "min": 1.0, "ge2": 40, "liq": 32, "hits": 1}, "after": {"med": 4.583733273123718, "min": 1.0, "ge2": 40, "liq": 32, "hits": 1}, "mode": "agent_manual", "sec": 12.3}
{"set": "B107", "decision": "REVERT", "edit": "trail cap 3.0->2.95", "before": {"med": 4.583733273123718, "min": 1.0, "ge2": 40, "liq": 32, "hits": 1}, "after": {"med": 4.583733273123718, "min": 1.0, "ge2": 40, "liq": 33, "hits": 1}, "mode": "agent_manual"}
{"set": "B108", "decision": "REVERT", "edit": "later 0.0045->0.004", "before": {"med": 4.583733273123718, "min": 1.0, "ge2": 40, "liq": 32, "hits": 1}, "after": {"med": 4.583257538210547, "min": 1.0, "ge2": 40, "liq": 32, "hits": 1}, "mode": "agent_manual"}
{"set": "B109", "decision": "KEEP", "edit": "size_boost 1.30@1.5ATR->1.32", "before": {"med": 4.583733273123718, "min": 1.0, "ge2": 40, "liq": 32, "hits": 1}, "after": {"med": 4.584242137609181, "min": 1.0, "ge2": 40, "liq": 32, "hits": 1}, "mode": "agent_manual"}
{"set": "B110", "decision": "KEEP", "edit": "post-scale trail 2.5e-7->2.0e-7", "before": {"med": 4.584242137609181, "min": 1.0, "ge2": 40, "liq": 32, "hits": 1}, "after": {"med": 4.5842423473966, "min": 1.0, "ge2": 40, "liq": 32, "hits": 1}, "mode": "agent_manual"}
{"set": "B111", "decision": "KEEP", "edit": "later 0.0045->0.004", "before": {"hits": 1, "med": 4.5842423473966, "min": 1.0, "max": 126198.88265773632, "ge2": 40, "liq": 32}, "after": {"hits": 1, "med": 4.586791661038075, "min": 1.0, "max": 126163.19830747374, "ge2": 40, "liq": 32}, "mode": "agent_manual"}
{"set": "B115", "decision": "REVERT", "edit": "size_boost 1.8ATR 1.35->1.37", "before": {"hits": 1, "med": 4.588936747794679, "min": 1.0, "max": 126122.55257499684, "ge2": 40, "liq": 32}, "after": {"hits": 1, "med": 4.474983196393891, "min": 1.0, "max": 130771.04981190024, "ge2": 40, "liq": 32}, "mode": "agent_manual"}
{"set": "B112", "decision": "KEEP", "edit": "later 0.004->0.0038", "before": {"hits": 1, "med": 4.586791661038075, "min": 1.0, "max": 126163.19830747374, "ge2": 40, "liq": 32}, "after": {"hits": 1, "med": 4.587812589096729, "min": 1.0, "max": 126148.89154474516, "ge2": 40, "liq": 32}, "mode": "agent_manual"}
{"set": "B113", "decision": "KEEP", "edit": "second scale 0.015/0.065->0.014/0.06", "before": {"hits": 1, "med": 4.587812589096729, "min": 1.0, "max": 126148.89154474516, "ge2": 40, "liq": 32}, "after": {"hits": 1, "med": 4.588936537851123, "min": 1.0, "max": 126122.53655324408, "ge2": 40, "liq": 32}, "mode": "agent_manual"}
{"set": "B114", "decision": "KEEP", "edit": "post-scale trail 2e-7->1.5e-7", "before": {"hits": 1, "med": 4.588936537851123, "min": 1.0, "max": 126122.53655324408, "ge2": 40, "liq": 32}, "after": {"hits": 1, "med": 4.588936747794679, "min": 1.0, "max": 126122.55257499684, "ge2": 40, "liq": 32}, "mode": "agent_manual"}
{"set": "B116", "decision": "REVERT", "edit": "size_boost 1.2ATR 1.10->1.12", "before": {"hits": 1, "med": 4.588936747794679, "min": 1.0, "ge2": 40, "liq": 32}, "after": {"hits": 1, "med": 4.568180479297389, "min": 1.0, "ge2": 39, "liq": 32}, "mode": "agent_manual"}
{"set": "B117", "decision": "REVERT", "edit": "width_tr 0.25->0.24", "before": {"hits": 1, "med": 4.588936747794679, "min": 1.0, "ge2": 40, "liq": 32}, "after": {"hits": 1, "med": 4.427271749739255, "min": 1.0, "ge2": 38, "liq": 32}, "mode": "agent_manual"}
{"set": "B118", "decision": "REVERT", "edit": "range_ok 0.8->0.85ATR", "before": {"hits": 1, "med": 4.588936747794679, "min": 1.0, "ge2": 40, "liq": 32}, "after": {"hits": 1, "med": 4.464508993779386, "min": 1.0, "ge2": 39, "liq": 32}, "mode": "agent_manual"}
{"set": "B119", "decision": "KEEP", "edit": "later 0.0038->0.0035", "before": {"hits": 1, "med": 4.588936747794679, "min": 1.0, "ge2": 40, "liq": 32}, "after": {"hits": 1, "med": 4.5904702241767295, "min": 1.0, "ge2": 40, "liq": 32}, "mode": "agent_manual"}
{"set": "B120", "decision": "KEEP", "edit": "second scale 0.014/0.06->0.013/0.055", "before": {"hits": 1, "med": 4.5904702241767295, "min": 1.0, "ge2": 40, "liq": 32}, "after": {"hits": 1, "med": 4.591594773486699, "min": 1.0, "ge2": 40, "liq": 32}, "mode": "agent_manual"}
{"set": "B121", "decision": "KEEP", "edit": "post-scale trail 1.5e-7->1.2e-7", "before": {"hits": 1, "med": 4.591594773486699, "min": 1.0, "ge2": 40, "liq": 32}, "after": {"hits": 1, "med": 4.591594899502096, "min": 1.0, "ge2": 40, "liq": 32}, "mode": "agent_manual"}
{"set": "B122", "decision": "KEEP", "edit": "later 0.0035->0.0032", "before": {"hits": 1, "med": 4.591594899502096, "min": 1.0, "ge2": 40, "liq": 32}, "after": {"hits": 1, "med": 4.59313071758441, "min": 1.0, "ge2": 40, "liq": 32}, "mode": "agent_manual"}
{"set": "B123", "decision": "REVERT", "edit": "size_boost 1.5ATR 1.32->1.33", "before": {"hits": 1, "med": 4.59313071758441, "min": 1.0, "ge2": 40, "liq": 32}, "after": {"hits": 1, "med": 4.59313071758441, "min": 1.0, "ge2": 40, "liq": 32}, "mode": "agent_manual"}
{"set": "B124", "decision": "REVERT", "edit": "vol_ok 0.0015->0.00145", "before": {"hits": 1, "med": 4.59313071758441, "min": 1.0, "ge2": 40, "liq": 32}, "after": {"hits": 0, "med": 3.129440718359308, "min": 1.0, "ge2": 33, "liq": 27}, "mode": "agent_manual"}
{"set": "B125", "decision": "REVERT", "edit": "body_min floor 0.45->0.44", "before": {"hits": 1, "med": 4.59313071758441, "min": 1.0, "ge2": 40, "liq": 32}, "after": {"hits": 1, "med": 4.59313071758441, "min": 1.0, "ge2": 40, "liq": 32}, "mode": "agent_manual"}
{"set": "B126", "decision": "KEEP", "edit": "later 0.0032->0.003", "before": {"hits": 1, "med": 4.59313071758441, "min": 1.0, "ge2": 40, "liq": 32}, "after": {"hits": 1, "med": 4.594155456826716, "min": 1.0, "ge2": 40, "liq": 32}, "mode": "agent_manual"}
{"set": "B127", "decision": "KEEP", "edit": "second scale 0.013/0.055->0.012/0.05", "before": {"hits": 1, "med": 4.594155456826716, "min": 1.0, "ge2": 40, "liq": 32}, "after": {"hits": 1, "med": 4.595281133001498, "min": 1.0, "ge2": 40, "liq": 32}, "mode": "agent_manual"}
{"set": "B128", "decision": "KEEP", "edit": "later 0.003->0.0028", "before": {"hits": 1, "med": 4.595281133001498, "min": 1.0, "ge2": 40, "liq": 32}, "after": {"hits": 1, "med": 4.596307089072946, "min": 1.0, "ge2": 40, "liq": 32}, "mode": "agent_manual"}
{"set": "B129", "decision": "KEEP", "edit": "second scale 0.012/0.05->0.011/0.045", "before": {"hits": 1, "med": 4.596307089072946, "min": 1.0, "ge2": 40, "liq": 32}, "after": {"hits": 1, "med": 4.597433097564408, "min": 1.0, "ge2": 40, "liq": 32}, "mode": "agent_manual"}
{"set": "B130", "decision": "KEEP", "edit": "post-scale trail 1.2e-7->1.0e-7", "before": {"hits": 1, "med": 4.597433097564408, "min": 1.0, "ge2": 40, "liq": 32}, "after": {"hits": 1, "med": 4.597433181647992, "min": 1.0, "ge2": 40, "liq": 32}, "mode": "agent_manual"}
{"set": "B131", "decision": "KEEP", "edit": "reentry_bars cap 180->170", "before": {"hits": 1, "med": 4.597433181647992, "min": 1.0, "ge2": 40, "liq": 32}, "after": {"hits": 1, "med": 4.654285583318628, "min": 1.0, "ge2": 40, "liq": 32}, "mode": "agent_manual"}
{"set": "B132", "decision": "REVERT", "edit": "ROC120->ROC115", "before": {"hits": 1, "med": 4.654285583318628, "min": 1.0, "ge2": 40, "liq": 32}, "after": {"hits": 0, "med": 4.464196456912108, "min": 1.0, "ge2": 39, "liq": 33}, "mode": "agent_manual"}
{"set": "B133", "decision": "REVERT", "edit": "later 0.0028->0.0026", "before": {"hits": 1, "med": 4.654285583318628, "min": 1.0, "ge2": 40, "liq": 32}, "after": {"hits": 1, "med": 4.654248745554079, "min": 1.0, "ge2": 40, "liq": 32}, "mode": "agent_manual"}
{"set": "B134", "decision": "REVERT", "edit": "n_fast max(30,n//5)->max(28,n//5)", "before": {"hits": 1, "med": 4.654285583318628, "min": 1.0, "ge2": 40, "liq": 32}, "after": {"hits": 1, "med": 4.654285583318628, "min": 1.0, "ge2": 40, "liq": 32}, "mode": "agent_manual"}
{"set": "B135", "decision": "REVERT", "edit": "second scale 0.011/0.045->0.010/0.04", "before": {"hits": 1, "med": 4.654285583318628, "min": 1.0, "ge2": 40, "liq": 32}, "after": {"hits": 1, "med": 4.654165462769988, "min": 1.0, "ge2": 40, "liq": 32}, "mode": "agent_manual"}
{"set": "B136", "decision": "REVERT", "edit": "size_boost 1.5ATR 1.32->1.325", "before": {"hits": 1, "med": 4.654285583318628, "min": 1.0, "ge2": 40, "liq": 32}, "after": {"hits": 1, "med": 4.654285583318628, "min": 1.0, "ge2": 40, "liq": 32}, "mode": "agent_manual"}
{"set": "B137", "decision": "REVERT", "edit": "reentry cap 170->165", "before": {"hits": 1, "med": 4.654285583318628, "min": 1.0, "ge2": 40, "liq": 32}, "after": {"hits": 1, "med": 4.654285583318628, "min": 1.0, "ge2": 40, "liq": 32}, "mode": "agent_manual"}
{"set": "B138", "decision": "REVERT", "edit": "later 0.0028->0.0026", "before": {"hits": 1, "med": 4.654285583318628, "min": 1.0, "ge2": 40, "liq": 32}, "after": {"hits": 1, "med": 4.654248745554079, "min": 1.0, "ge2": 40, "liq": 32}, "mode": "agent_manual"}
{"set": "B139", "decision": "REVERT", "edit": "second scale 0.011/0.045->0.010/0.04", "before": {"hits": 1, "med": 4.654285583318628, "min": 1.0, "ge2": 40, "liq": 32}, "after": {"hits": 1, "med": 4.654165462769988, "min": 1.0, "ge2": 40, "liq": 32}, "mode": "agent_manual"}
{"set": "B140", "decision": "REVERT", "edit": "reentry cap 170->160", "before": {"hits": 1, "med": 4.654285583318628, "min": 1.0, "ge2": 40, "liq": 32}, "after": {"hits": 1, "med": 4.654285583318628, "min": 1.0, "ge2": 40, "liq": 33}, "mode": "agent_manual"}
{"set": "B141", "decision": "REVERT", "edit": "reentry cap 170->168", "before": {"hits": 1, "med": 4.654285583318628, "min": 1.0, "ge2": 40, "liq": 32}, "after": {"hits": 1, "med": 4.654285583318628, "min": 1.0, "ge2": 40, "liq": 32}, "mode": "agent_manual"}
{"set": "B142", "decision": "REVERT", "edit": "later 0.0028->0.0025", "before": {"hits": 1, "med": 4.654285583318628, "min": 1.0, "ge2": 40, "liq": 32}, "after": {"hits": 1, "med": 4.654230307271845, "min": 1.0, "ge2": 40, "liq": 32}, "mode": "agent_manual"}
{"set": "B143", "decision": "REVERT", "edit": "second scale 0.011/0.045->0.0105/0.042", "before": {"hits": 1, "med": 4.654285583318628, "min": 1.0, "ge2": 40, "liq": 32}, "after": {"hits": 1, "med": 4.654213510989444, "min": 1.0, "ge2": 40, "liq": 32}, "mode": "agent_manual"}
{"set": "B144", "decision": "REVERT", "edit": "cooldown 220->218", "before": {"hits": 1, "med": 4.654285583318628, "min": 1.0, "ge2": 40, "liq": 32}, "after": {"hits": 1, "med": 4.654285583318628, "min": 1.0, "ge2": 40, "liq": 39}, "mode": "agent_manual"}
{"set": "B145", "decision": "REVERT", "edit": "reentry cap 170->172 (wider)", "before": {"hits": 1, "med": 4.654285583318628, "min": 1.0, "ge2": 40, "liq": 32}, "after": {"hits": 1, "med": 4.654285583318628, "min": 1.0, "ge2": 40, "liq": 32}, "mode": "agent_manual"}
{"set": "B146", "decision": "KEEP", "edit": "post-scale trail 1e-7->9e-8", "before": {"hits": 1, "med": 4.654285583318628, "min": 1.0, "ge2": 40, "liq": 32}, "after": {"hits": 1, "med": 4.654285593399388, "min": 1.0, "ge2": 40, "liq": 32}, "mode": "agent_manual"}
{"set": "B147", "decision": "REVERT", "edit": "later 0.0028->0.0027", "before": {"hits": 1, "med": 4.654285593399388, "min": 1.0, "ge2": 40, "liq": 32}, "after": {"hits": 1, "med": 4.654267180980905, "min": 1.0, "ge2": 40, "liq": 32}, "mode": "agent_manual"}
{"set": "B148", "decision": "REVERT", "edit": "reentry cap 170->162", "before": {"hits": 1, "med": 4.654285593399388, "min": 1.0, "ge2": 40, "liq": 32}, "after": {"hits": 1, "med": 4.654285593399388, "min": 1.0, "ge2": 40, "liq": 32}, "mode": "agent_manual"}
{"set": "B149", "decision": "REVERT", "edit": "reentry cap 170->169", "before": {"hits": 1, "med": 4.654285593399388, "min": 1.0, "ge2": 40, "liq": 32}, "after": {"hits": 1, "med": 4.654285593399388, "min": 1.0, "ge2": 40, "liq": 32}, "mode": "agent_manual"}
{"set": "B150", "decision": "REVERT", "edit": "reentry cap 170->171", "before": {"hits": 1, "med": 4.654285593399388, "min": 1.0, "ge2": 40, "liq": 32}, "after": {"hits": 1, "med": 4.654285593399388, "min": 1.0, "ge2": 40, "liq": 32}, "mode": "agent_manual"}
{"set": "B151", "decision": "REVERT", "edit": "reentry cap 170->166", "before": {"hits": 1, "med": 4.654285593399388, "min": 1.0, "ge2": 40, "liq": 32}, "after": {"hits": 1, "med": 4.654285593399388, "min": 1.0, "ge2": 40, "liq": 32}, "mode": "agent_manual"}
{"set": "B152", "decision": "REVERT", "edit": "reentry cap 170->164", "before": {"hits": 1, "med": 4.654285593399388, "min": 1.0, "ge2": 40, "liq": 32}, "after": {"hits": 1, "med": 4.654285593399388, "min": 1.0, "ge2": 40, "liq": 32}, "mode": "agent_manual"}
{"set": "B153", "decision": "REVERT", "edit": "later scale 0.0028->0.0026 runner chain", "before": {"hits": 1, "med": 4.654285593399388, "min": 1.0, "max": 125970.90281680596, "ge2": 40, "liq": 32}, "after": {"hits": 1, "med": 4.654248755634296, "min": 1.0, "max": 125956.32074782783, "ge2": 40, "liq": 32}, "mode": "agent_bg_loop", "ts": "2026-08-12T08:46:52.538810+00:00"}
{"set": "B154", "decision": "REVERT", "edit": "later scale 0.0028->0.0026 runner chain", "before": {"hits": 1, "med": 4.654285593399388, "min": 1.0, "max": 125970.90281680596, "ge2": 40, "liq": 32}, "after": {"hits": 1, "med": 4.654248755634296, "min": 1.0, "max": 125956.32074782783, "ge2": 40, "liq": 32}, "mode": "agent_bg_loop", "ts": "2026-08-12T08:47:19.252446+00:00"}
{"set": "B155", "decision": "REVERT", "edit": "later scale 0.0028->0.0026 runner chain", "before": {"hits": 1, "med": 4.654285593399388, "min": 1.0, "max": 125970.90281680596, "ge2": 40, "liq": 32}, "after": {"hits": 1, "med": 4.654248755634296, "min": 1.0, "max": 125956.32074782783, "ge2": 40, "liq": 32}, "mode": "agent_bg_loop", "ts": "2026-08-12T08:47:46.990230+00:00"}
