{"set": "B746", "decision": "REVERT", "edit": "post-scale trail 6.1653697404852474e-12->5.2405642794124606e-12", "before": {"hits": 1, "med": 4.654285684120027, "min": 1.0, "max": 125970.93162556336, "ge2": 40, "liq": 32}, "after": {"hits": 1, "med": 4.654285684120957, "min": 1.0, "max": 125970.9316258614, "ge2": 40, "liq": 32}, "mode": "agent_bg_loop", "ts": "2026-08-12T12:08:23.160016+00:00"}
{"set": "B747", "decision": "REVERT", "edit": "later scale 0.0028->0.0026 runner chain", "before": {"hits": 1, "med": 4.654285684120027, "min": 1.0, "max": 125970.93162556336, "ge2": 40, "liq": 32}, "after": {"hits": 1, "med": 4.654248846350058, "min": 1.0, "max": 125956.34955370188, "ge2": 40, "liq": 32}, "mode": "agent_bg_loop", "ts": "2026-08-12T12:08:43.113700+00:00"}
{"set": "B748", "decision": "REVERT", "edit": "second scale 0.011/0.045->0.0105/0.043", "before": {"hits": 1, "med": 4.654285684120027, "min": 1.0, "max": 125970.93162556336, "ge2": 40, "liq": 32}, "after": {"hits": 1, "med": 4.654237635892896, "min": 1.0, "max": 125959.81106431429, "ge2": 40, "liq": 32}, "mode": "agent_bg_loop", "ts": "2026-08-12T12:09:03.338216+00:00"}
{"set": "B749", "decision": "REVERT", "edit": "post-scale trail 6.1653697404852474e-12->5.2405642794124606e-12", "before": {"hits": 1, "med": 4.654285684120027, "min": 1.0, "max": 125970.93162556336, "ge2": 40, "liq": 32}, "after": {"hits": 1, "med": 4.654285684120957, "min": 1.0, "max": 125970.9316258614, "ge2": 40, "liq": 32}, "mode": "agent_bg_loop", "ts": "2026-08-12T12:09:23.302934+00:00"}
{"set": "B750", "decision": "REVERT", "edit": "later scale 0.0028->0.0026 runner chain", "before": {"hits": 1, "med": 4.654285684120027, "min": 1.0, "max": 125970.93162556336, "ge2": 40, "liq": 32}, "after": {"hits": 1, "med": 4.654248846350058, "min": 1.0, "max": 125956.34955370188, "ge2": 40, "liq": 32}, "mode": "agent_bg_loop", "ts": "2026-08-12T12:09:43.339200+00:00"}
{"set": "B751", "decision": "REVERT", "edit": "second scale 0.011/0.045->0.0105/0.043", "before": {"hits": 1, "med": 4.654285684120027, "min": 1.0, "max": 125970.93162556336, "ge2": 40, "liq": 32}, "after": {"hits": 1, "med": 4.654237635892896, "min": 1.0, "max": 125959.81106431429, "ge2": 40, "liq": 32}, "mode": "agent_bg_loop", "ts": "2026-08-12T12:10:03.361470+00:00"}
{"set": "B752", "decision": "REVERT", "edit": "post-scale trail 6.1653697404852474e-12->5.2405642794124606e-12", "before": {"hits": 1, "med": 4.654285684120027, "min": 1.0, "max": 125970.93162556336, "ge2": 40, "liq": 32}, "after": {"hits": 1, "med": 4.654285684120957, "min": 1.0, "max": 125970.9316258614, "ge2": 40, "liq": 32}, "mode": "agent_bg_loop", "ts": "2026-08-12T12:10:23.363461+00:00"}
{"set": "B753", "decision": "REVERT", "edit": "later scale 0.0028->0.0026 runner chain", "before": {"hits": 1, "med": 4.654285684120027, "min": 1.0, "max": 125970.93162556336, "ge2": 40, "liq": 32}, "after": {"hits": 1, "med": 4.654248846350058, "min": 1.0, "max": 125956.34955370188, "ge2": 40, "liq": 32}, "mode": "agent_bg_loop", "ts": "2026-08-12T12:10:43.364217+00:00"}
{"set": "B754", "decision": "REVERT", "edit": "second scale 0.011/0.045->0.0105/0.043", "before": {"hits": 1, "med": 4.654285684120027, "min": 1.0, "max": 125970.93162556336, "ge2": 40, "liq": 32}, "after": {"hits": 1, "med": 4.654237635892896, "min": 1.0, "max": 125959.81106431429, "ge2": 40, "liq": 32}, "mode": "agent_bg_loop", "ts": "2026-08-12T12:11:03.333370+00:00"}
{"set": "B755", "decision": "REVERT", "edit": "post-scale trail 6.1653697404852474e-12->5.2405642794124606e-12", "before": {"hits": 1, "med": 4.654285684120027, "min": 1.0, "max": 125970.93162556336, "ge2": 40, "liq": 32}, "after": {"hits": 1, "med": 4.654285684120957, "min": 1.0, "max": 125970.9316258614, "ge2": 40, "liq": 32}, "mode": "agent_bg_loop", "ts": "2026-08-12T12:11:23.334856+00:00"}
{"set": "B756", "decision": "REVERT", "edit": "later scale 0.0028->0.0026 runner chain", "before": {"hits": 1, "med": 4.654285684120027, "min": 1.0, "max": 125970.93162556336, "ge2": 40, "liq": 32}, "after": {"hits": 1, "med": 4.654248846350058, "min": 1.0, "max": 125956.34955370188, "ge2": 40, "liq": 32}, "mode": "agent_bg_loop", "ts": "2026-08-12T12:11:43.202936+00:00"}
{"set": "B757", "decision": "REVERT", "edit": "second scale 0.011/0.045->0.0105/0.043", "before": {"hits": 1, "med": 4.654285684120027, "min": 1.0, "max": 125970.93162556336, "ge2": 40, "liq": 32}, "after": {"hits": 1, "med": 4.654237635892896, "min": 1.0, "max": 125959.81106431429, "ge2": 40, "liq": 32}, "mode": "agent_bg_loop", "ts": "2026-08-12T12:12:03.104537+00:00"}
{"set": "B758", "decision": "REVERT", "edit": "post-scale trail 6.1653697404852474e-12->5.2405642794124606e-12", "before": {"hits": 1, "med": 4.654285684120027, "min": 1.0, "max": 125970.93162556336, "ge2": 40, "liq": 32}, "after": {"hits": 1, "med": 4.654285684120957, "min": 1.0, "max": 125970.9316258614, "ge2": 40, "liq": 32}, "mode": "agent_bg_loop", "ts": "2026-08-12T12:12:23.168461+00:00"}
{"set": "B759", "decision": "REVERT", "edit": "later scale 0.0028->0.0026 runner chain", "before": {"hits": 1, "med": 4.654285684120027, "min": 1.0, "max": 125970.93162556336, "ge2": 40, "liq": 32}, "after": {"hits": 1, "med": 4.654248846350058, "min": 1.0, "max": 125956.34955370188, "ge2": 40, "liq": 32}, "mode": "agent_bg_loop", "ts": "2026-08-12T12:12:43.101320+00:00"}
{"set": "B760", "decision": "REVERT", "edit": "second scale 0.011/0.045->0.0105/0.043", "before": {"hits": 1, "med": 4.654285684120027, "min": 1.0, "max": 125970.93162556336, "ge2": 40, "liq": 32}, "after": {"hits": 1, "med": 4.654237635892896, "min": 1.0, "max": 125959.81106431429, "ge2": 40, "liq": 32}, "mode": "agent_bg_loop", "ts": "2026-08-12T12:13:03.301773+00:00"}
{"set": "B761", "decision": "REVERT", "edit": "post-scale trail 6.1653697404852474e-12->5.2405642794124606e-12", "before": {"hits": 1, "med": 4.654285684120027, "min": 1.0, "max": 125970.93162556336, "ge2": 40, "liq": 32}, "after": {"hits": 1, "med": 4.654285684120957, "min": 1.0, "max": 125970.9316258614, "ge2": 40, "liq": 32}, "mode": "agent_bg_loop", "ts": "2026-08-12T12:13:23.247716+00:00"}
{"set": "B762", "decision": "REVERT", "edit": "later scale 0.0028->0.0026 runner chain", "before": {"hits": 1, "med": 4.654285684120027, "min": 1.0, "max": 125970.93162556336, "ge2": 40, "liq": 32}, "after": {"hits": 1, "med": 4.654248846350058, "min": 1.0, "max": 125956.34955370188, "ge2": 40, "liq": 32}, "mode": "agent_bg_loop", "ts": "2026-08-12T12:13:43.331872+00:00"}
{"set": "B763", "decision": "REVERT", "edit": "second scale 0.011/0.045->0.0105/0.043", "before": {"hits": 1, "med": 4.654285684120027, "min": 1.0, "max": 125970.93162556336, "ge2": 40, "liq": 32}, "after": {"hits": 1, "med": 4.654237635892896, "min": 1.0, "max": 125959.81106431429, "ge2": 40, "liq": 32}, "mode": "agent_bg_loop", "ts": "2026-08-12T12:14:03.725154+00:00"}
{"set": "B764", "decision": "REVERT", "edit": "post-scale trail 6.1653697404852474e-12->5.2405642794124606e-12", "before": {"hits": 1, "med": 4.654285684120027, "min": 1.0, "max": 125970.93162556336, "ge2": 40, "liq": 32}, "after": {"hits": 1, "med": 4.654285684120957, "min": 1.0, "max": 125970.9316258614, "ge2": 40, "liq": 32}, "mode": "agent_bg_loop", "ts": "2026-08-12T12:14:23.690114+00:00"}
{"set": "B765", "decision": "REVERT", "edit": "later scale 0.0028->0.0026 runner chain", "before": {"hits": 1, "med": 4.654285684120027, "min": 1.0, "max": 125970.93162556336, "ge2": 40, "liq": 32}, "after": {"hits": 1, "med": 4.654248846350058, "min": 1.0, "max": 125956.34955370188, "ge2": 40, "liq": 32}, "mode": "agent_bg_loop", "ts": "2026-08-12T12:14:43.627942+00:00"}
{"set": "B766", "decision": "REVERT", "edit": "second scale 0.011/0.045->0.0105/0.043", "before": {"hits": 1, "med": 4.654285684120027, "min": 1.0, "max": 125970.93162556336, "ge2": 40, "liq": 32}, "after": {"hits": 1, "med": 4.654237635892896, "min": 1.0, "max": 125959.81106431429, "ge2": 40, "liq": 32}, "mode": "agent_bg_loop", "ts": "2026-08-12T12:15:03.556609+00:00"}
{"set": "B767", "decision": "REVERT", "edit": "post-scale trail 6.1653697404852474e-12->5.2405642794124606e-12", "before": {"hits": 1, "med": 4.654285684120027, "min": 1.0, "max": 125970.93162556336, "ge2": 40, "liq": 32}, "after": {"hits": 1, "med": 4.654285684120957, "min": 1.0, "max": 125970.9316258614, "ge2": 40, "liq": 32}, "mode": "agent_bg_loop", "ts": "2026-08-12T12:15:23.455433+00:00"}
{"set": "B768", "decision": "REVERT", "edit": "later scale 0.0028->0.0026 runner chain", "before": {"hits": 1, "med": 4.654285684120027, "min": 1.0, "max": 125970.93162556336, "ge2": 40, "liq": 32}, "after": {"hits": 1, "med": 4.654248846350058, "min": 1.0, "max": 125956.34955370188, "ge2": 40, "liq": 32}, "mode": "agent_bg_loop", "ts": "2026-08-12T12:15:43.337584+00:00"}
{"set": "B769", "decision": "REVERT", "edit": "second scale 0.011/0.045->0.0105/0.043", "before": {"hits": 1, "med": 4.654285684120027, "min": 1.0, "max": 125970.93162556336, "ge2": 40, "liq": 32}, "after": {"hits": 1, "med": 4.654237635892896, "min": 1.0, "max": 125959.81106431429, "ge2": 40, "liq": 32}, "mode": "agent_bg_loop", "ts": "2026-08-12T12:16:03.224381+00:00"}
{"set": "B770", "decision": "REVERT", "edit": "post-scale trail 6.1653697404852474e-12->5.2405642794124606e-12", "before": {"hits": 1, "med": 4.654285684120027, "min": 1.0, "max": 125970.93162556336, "ge2": 40, "liq": 32}, "after": {"hits": 1, "med": 4.654285684120957, "min": 1.0, "max": 125970.9316258614, "ge2": 40, "liq": 32}, "mode": "agent_bg_loop", "ts": "2026-08-12T12:16:23.097439+00:00"}
{"set": "B771", "decision": "REVERT", "edit": "later scale 0.0028->0.0026 runner chain", "before": {"hits": 1, "med": 4.654285684120027, "min": 1.0, "max": 125970.93162556336, "ge2": 40, "liq": 32}, "after": {"hits": 1, "med": 4.654248846350058, "min": 1.0, "max": 125956.34955370188, "ge2": 40, "liq": 32}, "mode": "agent_bg_loop", "ts": "2026-08-12T12:16:42.999918+00:00"}
{"set": "B772", "decision": "REVERT", "edit": "second scale 0.011/0.045->0.0105/0.043", "before": {"hits": 1, "med": 4.654285684120027, "min": 1.0, "max": 125970.93162556336, "ge2": 40, "liq": 32}, "after": {"hits": 1, "med": 4.654237635892896, "min": 1.0, "max": 125959.81106431429, "ge2": 40, "liq": 32}, "mode": "agent_bg_loop", "ts": "2026-08-12T12:17:02.993387+00:00"}
{"set": "B773", "decision": "REVERT", "edit": "post-scale trail 6.1653697404852474e-12->5.2405642794124606e-12", "before": {"hits": 1, "med": 4.654285684120027, "min": 1.0, "max": 125970.93162556336, "ge2": 40, "liq": 32}, "after": {"hits": 1, "med": 4.654285684120957, "min": 1.0, "max": 125970.9316258614, "ge2": 40, "liq": 32}, "mode": "agent_bg_loop", "ts": "2026-08-12T12:17:22.972163+00:00"}
{"set": "B774", "decision": "REVERT", "edit": "later scale 0.0028->0.0026 runner chain", "before": {"hits": 1, "med": 4.654285684120027, "min": 1.0, "max": 125970.93162556336, "ge2": 40, "liq": 32}, "after": {"hits": 1, "med": 4.654248846350058, "min": 1.0, "max": 125956.34955370188, "ge2": 40, "liq": 32}, "mode": "agent_bg_loop", "ts": "2026-08-12T12:17:42.888785+00:00"}
{"set": "B775", "decision": "REVERT", "edit": "second scale 0.011/0.045->0.0105/0.043", "before": {"hits": 1, "med": 4.654285684120027, "min": 1.0, "max": 125970.93162556336, "ge2": 40, "liq": 32}, "after": {"hits": 1, "med": 4.654237635892896, "min": 1.0, "max": 125959.81106431429, "ge2": 40, "liq": 32}, "mode": "agent_bg_loop", "ts": "2026-08-12T12:18:02.969166+00:00"}
{"set": "B776", "decision": "REVERT", "edit": "post-scale trail 6.1653697404852474e-12->5.2405642794124606e-12", "before": {"hits": 1, "med": 4.654285684120027, "min": 1.0, "max": 125970.93162556336, "ge2": 40, "liq": 32}, "after": {"hits": 1, "med": 4.654285684120957, "min": 1.0, "max": 125970.9316258614, "ge2": 40, "liq": 32}, "mode": "agent_bg_loop", "ts": "2026-08-12T12:18:22.967671+00:00"}
{"set": "B777", "decision": "REVERT", "edit": "later scale 0.0028->0.0026 runner chain", "before": {"hits": 1, "med": 4.654285684120027, "min": 1.0, "max": 125970.93162556336, "ge2": 40, "liq": 32}, "after": {"hits": 1, "med": 4.654248846350058, "min": 1.0, "max": 125956.34955370188, "ge2": 40, "liq": 32}, "mode": "agent_bg_loop", "ts": "2026-08-12T12:18:43.080249+00:00"}
{"set": "B778", "decision": "REVERT", "edit": "second scale 0.011/0.045->0.0105/0.043", "before": {"hits": 1, "med": 4.654285684120027, "min": 1.0, "max": 125970.93162556336, "ge2": 40, "liq": 32}, "after": {"hits": 1, "med": 4.654237635892896, "min": 1.0, "max": 125959.81106431429, "ge2": 40, "liq": 32}, "mode": "agent_bg_loop", "ts": "2026-08-12T12:19:03.315168+00:00"}
{"set": "B779", "decision": "REVERT", "edit": "post-scale trail 6.1653697404852474e-12->5.2405642794124606e-12", "before": {"hits": 1, "med": 4.654285684120027, "min": 1.0, "max": 125970.93162556336, "ge2": 40, "liq": 32}, "after": {"hits": 1, "med": 4.654285684120957, "min": 1.0, "max": 125970.9316258614, "ge2": 40, "liq": 32}, "mode": "agent_bg_loop", "ts": "2026-08-12T12:19:23.219939+00:00"}
{"set": "B780", "decision": "REVERT", "edit": "later scale 0.0028->0.0026 runner chain", "before": {"hits": 1, "med": 4.654285684120027, "min": 1.0, "max": 125970.93162556336, "ge2": 40, "liq": 32}, "after": {"hits": 1, "med": 4.654248846350058, "min": 1.0, "max": 125956.34955370188, "ge2": 40, "liq": 32}, "mode": "agent_bg_loop", "ts": "2026-08-12T12:19:43.220346+00:00"}
{"set": "B781", "decision": "REVERT", "edit": "second scale 0.011/0.045->0.0105/0.043", "before": {"hits": 1, "med": 4.654285684120027, "min": 1.0, "max": 125970.93162556336, "ge2": 40, "liq": 32}, "after": {"hits": 1, "med": 4.654237635892896, "min": 1.0, "max": 125959.81106431429, "ge2": 40, "liq": 32}, "mode": "agent_bg_loop", "ts": "2026-08-12T12:20:03.356763+00:00"}
{"set": "B782", "decision": "REVERT", "edit": "post-scale trail 6.1653697404852474e-12->5.2405642794124606e-12", "before": {"hits": 1, "med": 4.654285684120027, "min": 1.0, "max": 125970.93162556336, "ge2": 40, "liq": 32}, "after": {"hits": 1, "med": 4.654285684120957, "min": 1.0, "max": 125970.9316258614, "ge2": 40, "liq": 32}, "mode": "agent_bg_loop", "ts": "2026-08-12T12:20:23.339337+00:00"}
{"set": "B783", "decision": "REVERT", "edit": "later scale 0.0028->0.0026 runner chain", "before": {"hits": 1, "med": 4.654285684120027, "min": 1.0, "max": 125970.93162556336, "ge2": 40, "liq": 32}, "after": {"hits": 1, "med": 4.654248846350058, "min": 1.0, "max": 125956.34955370188, "ge2": 40, "liq": 32}, "mode": "agent_bg_loop", "ts": "2026-08-12T12:20:44.051978+00:00"}
{"set": "B784", "decision": "REVERT", "edit": "second scale 0.011/0.045->0.0105/0.043", "before": {"hits": 1, "med": 4.654285684120027, "min": 1.0, "max": 125970.93162556336, "ge2": 40, "liq": 32}, "after": {"hits": 1, "med": 4.654237635892896, "min": 1.0, "max": 125959.81106431429, "ge2": 40, "liq": 32}, "mode": "agent_bg_loop", "ts": "2026-08-12T12:21:03.923215+00:00"}
{"set": "B785", "decision": "REVERT", "edit": "post-scale trail 6.1653697404852474e-12->5.2405642794124606e-12", "before": {"hits": 1, "med": 4.654285684120027, "min": 1.0, "max": 125970.93162556336, "ge2": 40, "liq": 32}, "after": {"hits": 1, "med": 4.654285684120957, "min": 1.0, "max": 125970.9316258614, "ge2": 40, "liq": 32}, "mode": "agent_bg_loop", "ts": "2026-08-12T12:21:23.817331+00:00"}
{"set": "B786", "decision": "REVERT", "edit": "later scale 0.0028->0.0026 runner chain", "before": {"hits": 1, "med": 4.654285684120027, "min": 1.0, "max": 125970.93162556336, "ge2": 40, "liq": 32}, "after": {"hits": 1, "med": 4.654248846350058, "min": 1.0, "max": 125956.34955370188, "ge2": 40, "liq": 32}, "mode": "agent_bg_loop", "ts": "2026-08-12T12:21:43.695750+00:00"}
{"set": "B787", "decision": "REVERT", "edit": "second scale 0.011/0.045->0.0105/0.043", "before": {"hits": 1, "med": 4.654285684120027, "min": 1.0, "max": 125970.93162556336, "ge2": 40, "liq": 32}, "after": {"hits": 1, "med": 4.654237635892896, "min": 1.0, "max": 125959.81106431429, "ge2": 40, "liq": 32}, "mode": "agent_bg_loop", "ts": "2026-08-12T12:22:03.567266+00:00"}
{"set": "B788", "decision": "REVERT", "edit": "post-scale trail 6.1653697404852474e-12->5.2405642794124606e-12", "before": {"hits": 1, "med": 4.654285684120027, "min": 1.0, "max": 125970.93162556336, "ge2": 40, "liq": 32}, "after": {"hits": 1, "med": 4.654285684120957, "min": 1.0, "max": 125970.9316258614, "ge2": 40, "liq": 32}, "mode": "agent_bg_loop", "ts": "2026-08-12T12:22:23.602202+00:00"}
{"set": "B789", "decision": "REVERT", "edit": "later scale 0.0028->0.0026 runner chain", "before": {"hits": 1, "med": 4.654285684120027, "min": 1.0, "max": 125970.93162556336, "ge2": 40, "liq": 32}, "after": {"hits": 1, "med": 4.654248846350058, "min": 1.0, "max": 125956.34955370188, "ge2": 40, "liq": 32}, "mode": "agent_bg_loop", "ts": "2026-08-12T12:22:43.625326+00:00"}
{"set": "B790", "decision": "REVERT", "edit": "second scale 0.011/0.045->0.0105/0.043", "before": {"hits": 1, "med": 4.654285684120027, "min": 1.0, "max": 125970.93162556336, "ge2": 40, "liq": 32}, "after": {"hits": 1, "med": 4.654237635892896, "min": 1.0, "max": 125959.81106431429, "ge2": 40, "liq": 32}, "mode": "agent_bg_loop", "ts": "2026-08-12T12:23:03.791557+00:00"}
{"set": "B791", "decision": "REVERT", "edit": "post-scale trail 6.1653697404852474e-12->5.2405642794124606e-12", "before": {"hits": 1, "med": 4.654285684120027, "min": 1.0, "max": 125970.93162556336, "ge2": 40, "liq": 32}, "after": {"hits": 1, "med": 4.654285684120957, "min": 1.0, "max": 125970.9316258614, "ge2": 40, "liq": 32}, "mode": "agent_bg_loop", "ts": "2026-08-12T12:23:23.701402+00:00"}
{"set": "B792", "decision": "REVERT", "edit": "later scale 0.0028->0.0026 runner chain", "before": {"hits": 1, "med": 4.654285684120027, "min": 1.0, "max": 125970.93162556336, "ge2": 40, "liq": 32}, "after": {"hits": 1, "med": 4.654248846350058, "min": 1.0, "max": 125956.34955370188, "ge2": 40, "liq": 32}, "mode": "agent_bg_loop", "ts": "2026-08-12T12:23:43.648416+00:00"}
{"set": "B793", "decision": "REVERT", "edit": "second scale 0.011/0.045->0.0105/0.043", "before": {"hits": 1, "med": 4.654285684120027, "min": 1.0, "max": 125970.93162556336, "ge2": 40, "liq": 32}, "after": {"hits": 1, "med": 4.654237635892896, "min": 1.0, "max": 125959.81106431429, "ge2": 40, "liq": 32}, "mode": "agent_bg_loop", "ts": "2026-08-12T12:24:03.805901+00:00"}
{"set": "B794", "decision": "REVERT", "edit": "post-scale trail 6.1653697404852474e-12->5.2405642794124606e-12", "before": {"hits": 1, "med": 4.654285684120027, "min": 1.0, "max": 125970.93162556336, "ge2": 40, "liq": 32}, "after": {"hits": 1, "med": 4.654285684120957, "min": 1.0, "max": 125970.9316258614, "ge2": 40, "liq": 32}, "mode": "agent_bg_loop", "ts": "2026-08-12T12:24:23.859509+00:00"}
{"set": "B795", "decision": "REVERT", "edit": "later scale 0.0028->0.0026 runner chain", "before": {"hits": 1, "med": 4.654285684120027, "min": 1.0, "max": 125970.93162556336, "ge2": 40, "liq": 32}, "after": {"hits": 1, "med": 4.654248846350058, "min": 1.0, "max": 125956.34955370188, "ge2": 40, "liq": 32}, "mode": "agent_bg_loop", "ts": "2026-08-12T12:24:43.790471+00:00"}
{"set": "B796", "decision": "REVERT", "edit": "second scale 0.011/0.045->0.0105/0.043", "before": {"hits": 1, "med": 4.654285684120027, "min": 1.0, "max": 125970.93162556336, "ge2": 40, "liq": 32}, "after": {"hits": 1, "med": 4.654237635892896, "min": 1.0, "max": 125959.81106431429, "ge2": 40, "liq": 32}, "mode": "agent_bg_loop", "ts": "2026-08-12T12:25:03.772799+00:00"}
{"set": "B797", "decision": "REVERT", "edit": "post-scale trail 6.1653697404852474e-12->5.2405642794124606e-12", "before": {"hits": 1, "med": 4.654285684120027, "min": 1.0, "max": 125970.93162556336, "ge2": 40, "liq": 32}, "after": {"hits": 1, "med": 4.654285684120957, "min": 1.0, "max": 125970.9316258614, "ge2": 40, "liq": 32}, "mode": "agent_bg_loop", "ts": "2026-08-12T12:25:23.658592+00:00"}
{"set": "B798", "decision": "REVERT", "edit": "later scale 0.0028->0.0026 runner chain", "before": {"hits": 1, "med": 4.654285684120027, "min": 1.0, "max": 125970.93162556336, "ge2": 40, "liq": 32}, "after": {"hits": 1, "med": 4.654248846350058, "min": 1.0, "max": 125956.34955370188, "ge2": 40, "liq": 32}, "mode": "agent_bg_loop", "ts": "2026-08-12T12:25:43.546088+00:00"}
{"set": "B799", "decision": "REVERT", "edit": "second scale 0.011/0.045->0.0105/0.043", "before": {"hits": 1, "med": 4.654285684120027, "min": 1.0, "max": 125970.93162556336, "ge2": 40, "liq": 32}, "after": {"hits": 1, "med": 4.654237635892896, "min": 1.0, "max": 125959.81106431429, "ge2": 40, "liq": 32}, "mode": "agent_bg_loop", "ts": "2026-08-12T12:26:03.485543+00:00"}
{"set": "B800", "decision": "REVERT", "edit": "post-scale trail 6.1653697404852474e-12->5.2405642794124606e-12", "before": {"hits": 1, "med": 4.654285684120027, "min": 1.0, "max": 125970.93162556336, "ge2": 40, "liq": 32}, "after": {"hits": 1, "med": 4.654285684120957, "min": 1.0, "max": 125970.9316258614, "ge2": 40, "liq": 32}, "mode": "agent_bg_loop", "ts": "2026-08-12T12:26:23.451843+00:00"}
{"set": "B801", "decision": "REVERT", "edit": "later scale 0.0028->0.0026 runner chain", "before": {"hits": 1, "med": 4.654285684120027, "min": 1.0, "max": 125970.93162556336, "ge2": 40, "liq": 32}, "after": {"hits": 1, "med": 4.654248846350058, "min": 1.0, "max": 125956.34955370188, "ge2": 40, "liq": 32}, "mode": "agent_bg_loop", "ts": "2026-08-12T12:26:43.405253+00:00"}
{"set": "B802", "decision": "REVERT", "edit": "second scale 0.011/0.045->0.0105/0.043", "before": {"hits": 1, "med": 4.654285684120027, "min": 1.0, "max": 125970.93162556336, "ge2": 40, "liq": 32}, "after": {"hits": 1, "med": 4.654237635892896, "min": 1.0, "max": 125959.81106431429, "ge2": 40, "liq": 32}, "mode": "agent_bg_loop", "ts": "2026-08-12T12:27:03.396554+00:00"}
