{"set": 91, "diagnose": "loss full-size kills calm windows", "edit": "size_mult=0.5 after loss, 1.0 after win", "before": 1186.655, "after": 749.158, "survived": "50.8->59.3", "decision": "REVERT", "reason": "survival up but max peak down; goal metric worse"}
{"set": 92, "diagnose": "chop grind 20-50 trades wipe", "edit": "loss_cooldown_bars=240", "before": 1186.655, "after": 1186.655, "survived": "50.8->52.5", "mean_peak": "42.29->42.26", "decision": "REVERT", "reason": "same max, mean peak slightly worse"}
{"set": 93, "diagnose": "daily EMA200 too slow for mild dumps", "edit": "daily_ema_force_50", "before": 1186.655, "after": 10.718, "survived": "50.8->18.6", "decision": "REVERT"}
{"set": 94, "diagnose": "giveback after peak>=3", "edit": "freeze_entries_after_5x", "before": 1186.655, "after": 10.425, "survived": "50.8->59.3", "decision": "REVERT", "reason": "blocks compound path to 10k"}
{"set": 95, "diagnose": "need selective size-up on violent dumps", "edit": "size_boost=1.08 if ATR>SMA*1.6", "before": 1186.6551812482614, "after": 1467.7615774814622, "survived": "50.8->49.2", "mean_peak": "42.29->51.88", "median_peak": 1.0, "decision": "KEEP", "reason": "max peak 1187->1468 toward 10k; survival -1.6pp acceptable"}
{"set": 96, "diagnose": "1.08 helped; press boost", "edit": "size_boost=1.12 if ATR>SMA*1.6", "before": 1467.7615774814622, "after": 1625.0911961899455, "survived": "49.2->45.8", "mean_peak": "51.88->57.24", "decision": "KEEP", "reason": "max 1468->1625 mean up; surv -3.4pp not collapse"}
{"set": 97, "diagnose": "boost chain working", "edit": "size_boost=1.15", "before": 1625.0911961899455, "after": 1750.8746669208863, "survived": "45.8->45.8", "mean_peak": "57.24->61.53", "decision": "KEEP"}
{"set": 98, "diagnose": "continue boost press", "edit": "size_boost=1.18", "before": 1750.8746669208863, "after": 1883.593599214179, "survived": "45.8->45.8", "mean_peak": "61.53->66.05", "decision": "KEEP"}
{"set": 99, "diagnose": "boost chain continues", "edit": "size_boost=1.22", "before": 1883.593599214179, "after": 2071.7551656031155, "survived": "45.8->44.1", "mean_peak": "66.05->72.45", "decision": "KEEP"}
{"set": 100, "diagnose": "boost chain to close gap to 10k", "edit": "size_boost=1.25", "before": 2071.7551656031155, "after": 2221.594798010503, "survived": "44.1->44.1", "mean_peak": "72.45->77.55", "decision": "KEEP"}
